Name,Text
"Goldberg, Louis P.","Goldberg, Louis P.     socially helpful measures of the New Deal under President Roosevelt, and after the close of the Second World War, the Socialist Party was prac- tically dissolved, Mr. Goldberg continued his un éeasing efforts for social improvement, giving advice on how to cooperate with other organiza- tions, such as the American Labor Party.  In the last decade of his life, Goldberg be- came interested in the cause of the new state of Israel in its desperate struggle with its Arab meighbors. At this time, he was counsel for the ""Jewish Daily Forward"", to which Norman Thomas had submitted an aman” forth the clains"
"Goldberg, Louis P.","Goldberg, Louis P,     of the Arabs. While Goldberg in general had a very high opinion of Thomas as the leader of his party, he now took very decided issue with him in regard to the Israeli-Arab conflict. Ina letter of Feb. 26, 1957, he clearly states his plea for Israel, and before long, in his repligs Thomas seems, at least tacitly, to be convinced  that there are good reasons for concessions and leniency on both sides,  Among the miscellaneous papers, there are nu erous documents, such as party manifestos, com- mittee reports, minutes of meetings of. the New York State Committee oe Socialist Party and"
"Goldberg, Louis P.","of the New York City Central Committee, 1934-19% and press releases in 1936.  The correspondents include: Adolph A. Berle, Jr., Wm. E. Bohn, Julius Gerber, Wm. Green, Harry W. Laidler, Algernon Lee, Marx Lewis, George Meany, Leo Meltzer, Herbert M. Merrill, S. H, Moratt, Harry Rogoff, Norman Thomas, and  Archibald R, Watson,  623 items, added 3-1-71, enhance considera- bly the significance of the original collection of these papers.  Correspondence concerns the career of Louis P. Goldberg as a “eo writer, and"
"Goldberg, Louis P.","Goldberg, Louis P. 9 Socialist. Attempts to reconcile the Socialist Party and the Social Democratic Federation con- tinued from the split of 1937 until 1957, when the two groups finally reunited. Louis Gold- berg played a leading role in this unity move- ment. He was bitterly attacked in 1957 by certain members of the [Jewish Daily] Forward     Association, who opposed the merger. Charges were brought against Goldberg before the Grievance Committee of the Forward Association  by Nathan Chanin. Correspondents include Norman Thomas, August Claessens, Abraham Cahan,"
"Goldberg, Louis P.","Goldberg, .Louis P, 10 Algernon Lee, and Theodore Shapiro, Max Shactman, and David McReynolds. At the death of August Claessens, Louis Goldberg became na- tional chairman of the Social Democratic Fed- eration. He was also a member of the Work- men's Circle and interested in the Jewish Socialist Verband, At times the correspon- dence becomes the official files of the Social Democratic Federation.  In 1941, Louis Goldberg entered politics as  a city councilman, He ran successfully on"
"Goldberg, Louis P.","Goldberg, Louis P. 11 the American Labor Party and the Liberal Party tickets, holding office until 1956. In his papers are details of interest concerning af- fairs in New York City in that period.  Eleanor (Levenson) and Louis Goldberg made a trip to Israel in 1951, during which they wrote letters describing that country. A dis- cussion with Norman Thomas later arose over the problem of Israeli relations with the Arabs.  Official papers reflect the activity of Goldberg in the Socialist Party and in the"
"Goldberg, Louis P.","Goldberg, Louis P. _ 12 Social Democratic Federation. Minutes, press releases, and resolutions are the main compo- nents of this section, which again illustrates the split between the two wings of American Socialism.  Louis Goldberg was a prolific writer on social and political subjects. His papers in- clude addresses, lectures, and notes on law, socialism, social democracy, New York City af- fairs, politics, civil rights, and freedom. Three series of lectures were delivered at the Rand School of Social Science in 1926, 1934, 1935, and 1938. —_— to the New York"
"Goldberg, Louis P.","Goldberg, Louis P. 13 Law Review, The Call, The New Leader, the New York Law Journal, and the American Federation- ist of the AFL were written by Louis Goldberg, and he published the book, Lawless Judges, in defense of civil rights in 1935.  Printed material includes pamphlets, leaf- lets, and many clippings which pertain to the career of Louis Goldberg.  This collection, while essentially biogra- phical in nature, nevertheless gives valuable information on the Social Democratic Federa- tion, whose files are a section of the Social- ist Party of America é"" in this department,"
"Goldberg, Mattie K.","&e 6th 17:2:B (2-13-76, 3-14-86) Goldberg, Mattie Ke Papers, 1889-1977. 71 itemse Born Mattie Ke Lehmane Her family built the Kronheimer-Lehman house (1015 Minerva Avees Durhamyg NeCe )e Resident of bee is 9 Park, Durham, NeCe Married Julian Goldberge Papers representing aspects of family, social and civic Life of prominent Jewish family in Durham, NeCeyg including residence in Trinity Parke Includes personal and family correspondence; Sth and 20th century 1806-1808) p diaries of Mattie Goldberg (1906 19 rior to her marriage; sccognees (18 30-1934) centering on Harry We an and the Durham NcD 19981105 440248719 NDHYme SEE NEXT CRD"
"Goldberg, Mattie K.","> 173B (2-13-76, 3-14-86) Goldberg, Mattie Ke Papers, eee (Card 2) County Taxpayers League; a child's book of composition (1889); reminiscences of life in Trinity Park; and Kronheiner and Lehman family informatione Also includes one tape of Mrse Goldberg's remembrances of Durham society and life from 1900-1971 (inventory with reel)e Unprocessed collectione Cataloged from accession recordse  ¥habe  NcD 19981105 #40248719 NDHYme SEE NEXT CRD"
"Goldberg, Mattie K.","e 6th 17:B (2-13-76, 3-14-86) Goldberg, Mattie Ke Papers, eee (Card 3)  le Lehman, Harry We 2- Kronheimer familye 3e Lehman familye 4. Durham County Taxpayers Leaguee 5e Jews-- North Carolina--Social Life and customse 66 aoe erneee- Je Durham e  CN eCe )——-Historye Trinity Park (Durham, NeCe) Se Genre: Diariese 106 Genre: Scrapbookse  NeD 19981105 | #40248719 NDHYme"
"Goldberg, Mattie K.","Goldberg, Mattie K.  Papers, ca. 1889- ca. 1977. -- ca. 70 items. (.5 linear ft.)  Durham, Durham County, N.C.     Shelf location: 3-C  Family built Kronheimer-Lehman house, 1015 Minerva Ave. Resident of Trinity Park, Durham, NC. Born Mattie K. Lehman. Married Julian Goldberg. -- Papers representing aspects of family, social, and civic life of prominent Jewish family in Durham, N.C., including"
"Goldberg, Mattie K.","Goldberg, Mattie K. (card 2) Papers, ca. 1889- ca. 1977.     residence in Trinity Park. Includes personal and family correspondence; 19th and 20th century photo- graphs; diaries of Mattie Goldberg, 1906-1908, prior to her marriage; scrapbook, 1930-1934, centering on Harry W. Lehman and the Durham County Taxpayers League; a child's book of composition, 1889; reminiscences of life in Trinity Park; Kronheimer and Lehman families; etc.  Gift, 1986  Accessioned © 12-9-86"
"Goldblatt, David","e 6th 13:D (89-005) Goldblatt, Davide Photographs, 1960-1969. 258 itemse South African documentary photographere Black and white photographs taken in South Africa chiefly of people, either by themselves or in groups, in a variety of settingse Approximately sixty are of minerse Unprocessed collectione Cataloged from accession recordse *hab Goldblatt, Davide 2- Documentary photography--South Africae 3e Miners-- South eae 4e South Africae  19981105 #40248730 NDHYme"
"Goldblatt, David","Goldblatt, David. Photographs, 1960s. 258 items. (1.8 lin. ft.)  Shelf Location: 4:E  Two hundred fifty-eight black and white photographs taken in South Africa chiefly of people, either by themselves or in groups, in a variety of settings. Approximately sixty are of miners.  Deposit: 02/02/89  Accessioned: 02/08/89  Acc. No.: 89-005"
Golden Belt Manufacturing Company,"e Box Top Secte 23, OC21:15 (1-15-82) Golden Belt Manufacturing Companye Records, 1914 and nede 3 itemse Form letter from the company (1914, June 25) and two pictures of the company’s plant, one an aerial view (perhaps from 1940's). Unprocessed collectione Cataloged ah accession recordse hab  le Golden Belt Manufacturing Companye  NcD 19981105 #40248871  NDHYme"
"Golden, William Sydney",". 2nd 51:D (14-8-82)  Golden, William Sydneye-  Papers, 1915-1920.  161 itemse  Pastor of the Presbyterian Church of Sanford, NeCe for a number of yearse Graduated from Union Theological Seminary in Richmond, Vae, May 1916-4  Primarily Letters te Golden from friends at Union Theological Seminary, Davidson College, and from his hometown of Talladega, Alaey congratulating him on his success and exchanging information about the church work they are doinge Some of the letters express sympathy on the death of his father in February 191 e Also includes ee =e preach at various church  NcD 19981116. ** 440329100 NDHYme SEE. NEXT CRD"
"Golden, William Sydney","e 2nd 51:D (11-8-82) Golden, Wiiliam Sydneye Papers, cee (Card 2) Unprocessed collectione Cataloged a accession recordse hab  1e Union Theological Seminary in Virginiae 2. Davidson Collegee Je Clergy--Correspondencee 4e Presbyterian Church--North Carolina-—— Sanforde  5«e Talladega (Alae)  NecD 19981116 #40329100 NDHYme"
"Goldsborough, Edmund Lee","Goldsborough, Edmund Lee Papers, 1901-1903 Shepherdstown, Jefferson Co., W. Va.  Section A 37 items & 1 vol. 8-1-70"
"Goldsborough, Edmund Lee","Goldsborough, Edmund Lee. Papers. Shepherds- town, Jefferson Co., W. Va.     Edmund Lee Goldsborough of Shepherdstown, W. Va., became a member of the staff of the United States Fish Commission in Washington, D. C, His family is represented by the papers of Edmund Jennings Lee and of the Bedinger-  Dandridge Family of Shepherdstown in this department, . Edmund Lee Goldsborough made two field trips,  one to Hawaii and another to Alaska, as a staff"
"Goldsborough, Edmund Lee","Goldsborough, Edmund Lee  member of the United States Fish Commission. David Starr Jordan, the great naturalist who was President of Stanford University, and Barton Warren Evermann, ichthyologist of the U. S. Fish Commission, collaborated in the writing of several books, one of which was The Aquatic Resources of the Hawaiian Islands. The first of the field trips taken by Lee Goldsborough was to Hawaii in 1901, snapshots of which show Jordan and Evermann with the  entomologist William Harris Ashmead and"
"Goldsborough, Edmund Lee","Goldsborough, Edmund Lee 3     scientists John N. Cobb and Albertus Hutchinson Baldwin, together with the artist Charles Bradford Hudson. A. H. Baldwin was well known for his scientific illustrations from 1890 unti 1904. Unfortunately the pictures of Hawaii are not accompanied by a journal:  Lee Goldsborough did keep a diary of his  trip to Alaska from July to October, 1903. During this period the U. S. Fish Commission became the U. S. Bureau of Fisheries, with  Barton Warren Evermann in charge of scientific"
"Goldsborough, Edmund Lee","_Goldsborough, Edmund Lee 4 inquiry. He was directing the field work in  which Lee Goldsborough was involved. A special Alaska Salmon Commission was set up, in additio to whose regular members were appointed spe- _cialists, among whom was Lee Goldsborough. The diary begins at Loring, Alaska, near Ketchikan, and describes field trips in southeastern  Alaska, Hatchieries established by the govern- ment were visited, surveys made of the region, fish counted, and specimens packed. Charles  Joseph Chamberlain, the botanist, took part in"
"Goldsborough, Edmund Lee","5     _Goldsborough, Edmund Lee __ the work, as did Albertus Hutchinson Baldwin, the illustrator. Lee Goldsborough lists six kinds of salmon: humpback, king, dog, coho, sockeye, and red. Their spawning habits are observed in the many streams of the region. The Alaskan diary concludes with a most interesting description of Metlakhtla in the  Annette Islands, where William Duncan of the Church Mission Society had been working with the Indians since 1857.  The Goldsborough Papers also contain a"
"Goldsborough, Edmund Lee","Goldsborough, Edmund Lee 6 picture of the Torpedo Boat Goldsborough built  by the United States Navy in 1899."
"Goldsborough, Louis Malesherbes","Goldsborough, Louis Malesherbes Papers, 1827-1877 Washington, D. C.  446 items and 1 vol.  71 items added, 5-31-44 (See also bound 1 item trans. from C. C. vol. cards) Jones Books, 9-1-44 items added, 4-29-58 item added, 6-1-68 item added, 6-26-73  Cab. 2  3 SEE SHELF LIST"
"Goldsborough, Louis Malesherbes","GOLDSBOROUGH, Louis Malesherbes. NOTE ON THE ARRANGEMENT OF THESE LETTERS.     The personal correspondence is arranged separately, marked ""Personal"", and placed in the first box. The official correspondence is likewise marked and occupies part of the first box, and all of the remaining two boxes."
"Goldsborough, Louis Malesherbes","Goldsborough, Louis M. Papers, 1827-77 Washington, D.Sc, Sa2pieces Sketch     (For biographical account of Goldsborough  see Appleton's Cyclopedia of American Bio-  graphy and Dictionamy of American Biography. ) amily and official correspondence of  Louis M. Goldsborough (1805-77), superinten- dent of the U. S. Naval Academy and rear admiral in the U. S. Navy. The personal correspondence contains two letters of William Wirt, whose daughter, Elizabeth Gamble Wirt, married Goldsborough. In 1831 there are"
"Goldsborough, Louis Malesherbes","Goldsborough, Louis M. Sketch 2 letters of courtship from ldsbéthugh to his future wife. The remainder of the per- sonal correspondence, with the exception of a few letters from Catherine Wirt relative \to the death of William Wirt and two lang diary-like letters, 1835, relaying gossip of Richmond families, is between Goldsborough and his wife relative generally to family matters. Several of Goldsborough's letters were written from Mexican waters and one in  particular gives a vivid and full descript#6n of the battle of Tuxpan in 1847. A later letter in 1860 —_ | navy gossip and a"
"Goldsborough, Louis Malesherbes","Goldsborough, Louis M, Sketch 3 discription of Paraguay. Goldsborough's  letters during the Civil War period refer to the Mason-Slidell Affair, Federal gun  © boats on the James River, the Confederate  ~ ironclad, Merrimac, and Secretary of War  »—E. M. Stanton's interference with the armies  \\. of Generals George B. McClellan and Irvin  > McDowell to the supposed dé¢sadvantage of Federal war efforts. Letters from Golds- borough while he was in command of the European Squadron, 1865-69, contain a des- cription of Castle Miramar in Trieste, Aus~  tria, and the mmpres gy arzotte who lived"
"Goldsborough, Louis Malesherbes","Goldsborough, Louis M, Sketch 4 there at the time, Among other persona  letters are several from members of the Robinson family, relatives of Elizabeth Gamble (Wirt) Goldsborough, and some of great interest from one Cynthia Jame describing war conditions in Williamsburg and Norfolk, Virginia,  The bulk of the collection consists of routine correspondence in connection with Goldsborough's naval career, including copies of calculations from the bureau of  Ordnance, Siialing instructions, reports of"
"Goldsborough, Louis Malesherbes","Goldsborough, Louis M, Sketch 5  itineraries of vessels, lists of foods, re- ports of engineers, copies of directions signed by Secretary of the Navy Gideon Welles, and letters of introduction. Official  Papers are most numerous while Goldsborough commanded the European Squadron. Included also is a large hand-drawn map, 1877, of     the Castle Hayne Vineyard Company Plantation of New Hanover County, North Carolina, show- ing many details including swamps, streams, and abandoned rice fields.* One letterbook,  1859-61, contains the official correspon- * Oversize Folder. é"
"Goldsborough, Louis Malesherbes","Goldsborough, Louis Malesherbes 6 dence of Goldsborough as captain of the U. 9. Frigate Congress off Rio de Janeiro, Montevideo, and Hampton Roads. The letters concern routine affairs of his ship, and many refer to courts- martial of seamen and marines.  This volume contains several letters to Murray Mason , and one, pp. 27-31, about the conduct of Mason and the condition of Mason's ship, the U. 5. S. John Adams. Pages 63-67, 83-87, and.180-186 contain reports of target practice and ammunition used; pp. 171-177 carry a report to the Bureau of Ordnance on"
"Goldsborough, Louis Malesherbes","Goldsborough, Louis Malesherbes ? various metnods of fighting with ships; pp. 137 141 consist of a report of experiments with Coston's night signals. The last letter, p. 217, to the Secretary of War, states that he has assumed command of the Atlantic Blockading Squadron and that the Minnesota is his flagship.  71 items added, 5-31-44: Routine correspon- dence. These letters give a good picture of Goldsborough's career, especially the letters of Sept. 18 and 29, 1841, in which his father Charles Washington Goldsborough, urged him to remain in the Navy as commander of the"
"Goldsborough, Louis Malesherbes","Goldsborough, Louis Malesherbes     Enterprise for at least a year. These letters run to the post war years during which Golds- borough, with the rank of Rear Admiral, served as flag officer of the European Squadron. [In this connection, letters dated Sept. 25, 1852, and July 10, 1853, from Goldsborough to his wife give an account of the former's belief that he will be made commander of the Levant on the death of George Parker Upshur, of his hope eventually to made head of Annapolis, and of his deep sense of the injustice with which promotions are made in the Navy.  Letters for the “oe are more rou-"
"Goldsborough, Louis Malesherbes","Goldsborough, Louis M, Sketch _—? tine than otherwise, but one (Mar. 20, 1861) from Elizabebh (Wirt) Goldsborough expresses her disappointment at the South's attitudes which she believes will lead to conflict, and two (May 9 and May 10, 1862) comment on Goldsborough's capture of Roanoke Island (N.C.) and of possible brushes withtthe Merrimac,  Several of the early letters are import- ant: one, dated Jan. 25, 1836, from Catherine G. Wirt to Elizabeth (Wirt) Goldsborough at  the time the latter Was with her husband in"
"Goldsborough, Louis Malesherbes","Goldsborough, Louis M, Sketch 10  Florida, warns of Indian Menaces, and gives  an account of s@cial activities in Richmond and Baltimore, mentioning the Warwicks, Gwath- meys, Sképwiths, and Cabells; two (July 14 and 24, 1839) from Louis! brother John Goldsborough describe the White Sulphur Springs and their patrons.     Among the correspondents are: Adams, Henry A,, William Faxon, Robert Bennet Forbes, Gus- tavus V. Fox, Chas. Washington Goldsborough, Louis M. Goldsborough, Edward C. Grafton, Edward Middleton, John S, Missroon, Austin Pendergrast Stephen P. Quackenbush, Joshua  R. Sands, ahd eon Welles,  (see next card)"
"Goldsborough, Louis Malesherbes","Goldsborough, Louis M, Sketch 11     One letter (dated Apr. 15, 1862) trans. from the C. C. Jones books 9-1-44, con- cerns an exchange of prisoners with Maj.-Gen. Benj. Huger.  Letter of March 15, 1862 is a report of the U.S. Marine Battalion at Port Royal, S.C. Letter of Sept. 22, 1862 has a brief mention of the Marine Corps."
"Goldsborough, Louis Malesherbes","’  Goldsborough, Louis M. Sketch 2 3 items added 4-29-58. Letter of A. Randal to Mr. Goldsborough about the illness of Mrs. Goldsborough's mother and family affairs, 1852; draft of a letter of 1861 by Goldsborough;and Sunday school classcbook for St. John Church, Washington, D. C., 1863-1863. In May of 1873, Mrs. Goldsborough wrote a brief eulogy of Salmon Portland Ghase as she remembered him in her home, that of Wm. Wirt, about 1827-1830.     Goldsborough was head of an investigating"
"Goldsborough, Louis Malesherbes","Goldsborough, Louis Malesherbes 13 commision of the U.S.Navy set up to try charges against Benjamin F. Isherwood, chief of the bureau of steam engineering. Three items concern the work of this body: (1) Copy of extracts from the reports of Isherwood of  25 Oct., 1867, and of 22 Oct., 1868: (2) a     letter of David D. Porter, 31 May, 1969, to Isaac Newton relieving him from attendance at sessions of (presumably} this commission.  (3) statement of the comparative weights of the U.S.S. Wyoming and the U.S.S. Monongahela. ©figines, in which Isherwood is involved."
"Goldsborough, Louis Malesherbes","Goldsborough, Louis Malesnerbes 14     1 item added, 6-1-65: A letter to Goldsborough from thomas Hayward about an umpaid account (April 17, 1848).  1 item added, 6-26-73: Letter of August 9, 1854, to Goldsborough from Thomas Oliver Sel fridge (1804-1902) in Boston, Massachusetts. Selfridge wrote about his son, Thomas Oliver  Selfridge (1836-1924), who had applied for sea service and was to sail on the Independence within a few days. Both father and son eventu-  ally became rear admirals in the U.S. Navy."
"Goldsborough, Louis Malesherbes","Goldsborough, Louis Malesherbes 15 Selfridge also referred to a copy of an address by Goldsborough which he had read, a ship  model, and the fact that he had been temporarily appointed a commandant,"
"Goldsborough, Louis Malesherbes","Goldsborough, Louis Malisherbes  Letter Book, 1859-1861  Washington, D. C. 217 pp. Boards 31 x 19 1-2 cn. 3-17-39  GUIDE"
"Goldsborough, Robert William","e 2:C (48-424, 59-135) Goldsborough, Robert Williame Letters, 1813-1858. 3 itemse cores * minister of Caroline  Comes? at by Goldsborough and one by aad Armisteade  Unprocessed collectione Cataloged from accession records. *hab  1e Episcopal Church--Marylande 2 Clergy--Correspondencee 3e Caroline County (Mde)—--Historye Ie Armistead,  Dille &  NceD 19981116 #40329067 . NDHYme"
"Gonzales, Ambrose Elliott","Gonzales, Ambrose Elliott Papers, 1908-1924  Columbia, Richland Co., S. C.  Section A 1 item  1 item added, 10-3-57 6-15-73  GUIDE"
"Gonzales, Ambrose Elliott","Gonzales, Ambrose Elliott. Papers, 1908. Columbia, S. C. 1 item, Sketch  The item constituting this collection is a letter of June 25, 1908 from Matthew C. Butler to Gonzales, correcting certain statements in General Smith D. Atkins' ""General Sherman's March Through South Carolina,"" which had been     published in Gonzales' paper, The State, four days earlier. Butler says that General Wade Hampton was not at or near Aiken, S. C., at the time referred to (Feb., 1865), that neither Hampton nor he went beyond Columbia with troops, and that whatever a due to any Confeder-"
"Gonzales, Ambrose Elliott","n 8 bros ott ate officer for operations near Aiken should go  to General Joseph Wheeler. This letter was transferred from the Misc.  File on 10-3-57. 1 item added, 6-15-73: Letter of Feb. 6,  1924, from A, E, Gonzales to his friend Wm.  Adger Law, Philadelphia banker and insurance executive, but a native of S. C. In responding to an obvious question about his memoirs, he mentions the books he has written in the past"
"Gonzales, Ambrose Elliott","Gonzales, Ambrose Elliott 3 two years and pledges to return to writing  his memoirs. He then tells of what the State has meant to him and about the experiences he has had since his stroke twelve years earlier  in trying to keep the newspaper and himself solvent,"
"Good, John Mason","Good, John Mason Papers, n. 4d. London, England  Josiah CC, Trent Collection in the 2 items History of Medicine--. Div.  4-8-60"
"Good, John Mason","Good, John Mason. Papers, n. dad. London, Eng- land. 2 items. Sketch.  John Mason Good (1%64-1827), English physi=  Cian and author, refers to his literary work to booksellers and publishers."
Good Templars,"Good Templars Papers, 1876-1879  See Good Templars, Independent Order of. Grand Lodge of North Carolina. Health Seat Lodge, No. 40"
"Good Templars, Independent Order of. Grand Lodge of North Carolina. Health Seat Lodge, No. 40","Food Templars, Independent Order of. Grand Lodge of North Carolina. Health Seat Lodge, No. 40  Papers, 1876-1879  Henderson, Vance County, North Carolina  Cab. 43 16 items and 2 vols.  11-5-33 Recatalogued, 3-24-65"
"Good Templars, Independent Order of. Grand Lodge of North Carolina. Health Seat Lodge, No. 40","Sood Templars, Independent Order of. Grand Lodge of North Carolina. Health Seat Lodge, No. 40. Papers, 1876-1879. Henderson, Vance County, North Carolina.     Health Seat Lodge, No. 40, was organized in 1876, according to the dates of the by-laws and the roll of the first initiates. Its admission to the Order was recorded in the Proceedings of the Sixth Annual Session of the Grand Lodge 1.0. of G.T., of the State of North Carolina . . . August 14th, 15th, and 16th, 1877, pp. 9-10. The lodge was located  at Henderson, that town_then being in Granville"
"Good Templars, Independent Order of. Grand Lodge of North Carolina. Health Seat Lodge, No. 40","Good Templars, Independent Order of. Grand Lodge of North Carolina. Health Seat Lodge, No. 40.     Co. In the Proceedings for 1880 the lodge was noted as having ""ceased to work"" (p. 18), and there was no entry for it in 1881.  The collection consists of the following items and volumes: twelve cards containing     ceremonial services; the commissions of I.W. Kittrell as lodge deputy in 1878 and 1879; a letter from the grand worthy secretary that accompanied one of the commissions; a blank copy of a credential for a representative to the state convention; a_Proposition Book with"
