Name,Text
"Almon, John","Almon, John 23  In two letters dated sometime in Jan., 1772, Calcraft noted Shelburne's visit to the Queen's house, Keene's appointment, and the false reports about Philip Francis.  In Feb. Lord Bute's people talked of Capt. Phipps as a candidate for Charles James Fox's     vacated post as a lord of the admiralty, and Almon speculated on the reasons for Fox's resignation (letter of Feb. 22). The proposed Royal Marriage Bill was one reason, and Almon wrote about it also. Almon's health was bad."
"Almon, John","Almon, John 24     In June, 1772, Calcraft inquired twice about the failure of Alexander Fordyce's bank in London. Almon's reply consists of notes on one of the Calcraft letters. Almon reported on the banking situation and commented particularly on the banking house of which Sir  Richard Glyn was a partner.  On July 3 Calcraft announced his intention to spend the winter in Italy because of ill health.  On July 17 he commented on the awkward"
"Almon, John","Almon, John 25     situation of H who would not resign before he left for Ireland at the first of Aug.  Two weeks later (Aug. 2) Calcraft discussed the intended resignation of Lord Hillsborough as colonial secretary.  Several days later (Aug. 5) he wrote about  his bad health and noted a prescription of Dr. Anthony Addington of London. Calcraft's opinion of the Duke of Grafton was in the same letter.  Calcraft died on August 23, 1772."
"Almon, John","Almon, John 26     Biographies of John Wilkes are useful for identifying the London politicians who are not listed in the Dictionary of National Biography. Biographical sketches of London's aldermen are in Alfred B. Beaven, The Aldermen S the City of London. . . (London, 1 1905-1913), 2 vols."
"Almon, John","Almon, John Papers, 1769-1772  London, England  1 Reel Negative  Copy of collection in the Manuscript Depart- ment as cataloged. through Dec., 1964  11-20-81"
"Almond, A. D.","Almond, A. D. Papers, 1865-1866 Charlottesville, Va. Section A 5 items  7-10-57"
"Almond, A. D.","Almond, A. D. Papers, 1865-1866. Charlottes- vil Vv 5 P Sketch  This collection contains five merchants' bills, four to A. D. Almond and one to A. T. Almond,  See the Paul Stratton Papers in this dept.  This collection was originally a part of the Don Preston Peters Collection."
"Alspaugh, John Wesley","Alspaugh, John Wesley  See Duke University Archives"
"Alston, Charles B.","Alston, Charles Be  Papers, 1899-1902.  46 itemse  Durham, NeCe citizene  Bills pertaining to businesses in Durham, North Carolinae Also includes a few receipts from businesses; a letter of December 14, 1901, from Ce We Tomas from We Duke, Sons and Coe Branch of the American Tobacco Company; an undated daily report of manufacture from the Wooden Case Department of that branch; and an unidentified photograph of a couple and an infante  Unprocessed collectione Cataloged from accession recorde  oe o  29 NOV 94 31526819 NDHYme SEE NEXT CRD"
"Alston, Charles B.","Alston, Charles Be Papers; eee (Card 2)  1e American Tobacco Companye 2. Business recordse Je Durham (NeCe )-- Commercee 4. Durham (NeCe )-—- Manufacturerse Se Tomas, Ce We  29 NOV 94 31526819 NDHYme"
"Aliston, J.W .","Alston, J. W.  Military orders, 1918 July 30-¢  1 iteme  Cataloged from Guidee  ist Lieutenant, United States Army? Second Battalion, Coe He  Orders signed by He Le Harries concerning operations in Martigues, Francee  bma  le United States-——-History-—-World War I, 2e United Statese Armye-— Correspondencee  26 NOV 96 36002026 NDHYme"
"Aliston, J.W .","Aliston, J.W.  Papers, 1918.  France,  Section A 1 item,  FEB 7 'S1  GUIDE"
"Aliston, J.W .","Alston, J. W. Papers, 1918. France, 1 item. Sketch.     World War I item, patrol order for Co. H, 2nd Battalion from Headauarters Second Battal- ion, France, July 30, 1918."
"Alston, William","ALSTON, William  Letters and papers. 1861-1885.  Henderson, N. C.  Section A 3 pieces"
"Alston, William","ALSTON, William Letters and Papers. Henderson, N.C. 1861-1885. 3 pieces     The collection cont&has one Civil War letter which is of interest and of value. The other  two pieces are itemized accounts from Alston's store."
Altrusa Club,"Altrusa Club of Durham. Records, 1933-1986. -- ca. 2,700 items. (6.0 lin. ft.) Durham, Durham County, North Carolina     Shelf location: 56-F  Women's club. -- Chiefly correspondence, minutes, news-  letters, financial records, and scrapbooks relating to  the social and philanthropic activities of this women's club.  Deposit, 1985. See ‘Inventory File Accessioned 4-3-87 ak. arriva"
Aluminum Company,"Aluminum Company of Canada, Limited Papers, 1915-1968  Montreal, Quebec, Canada  Eicture—Cobyr—tt,  ~—Drawer-6 See 4 items and 3 vols. 2-9-68 Shere"
Aluminum Company,"Aluminum Company of Canada, Limited. Papers, 1915-1968. Montreal, Canada.  The items in this collection are recently- published brochures by 4lcan Aluminium, Limit- ed, of which the Aluminum Company of Canada, Ltd. is the principal subsidiary.  The volumes consist of two albums of pictures copies from those in the files of     the Aluminum Co. of Canada, and a spiral- bound portion (pp. 124-196) of ""Rivers of Aluminum--The Story of the Aluminum Company of Canada."" A foreword and summary of this portion of the company's history were written"
Aluminum Company,"Aluminum Company of Canada, Limited 2 by T. L. Brock, Assistant to the President, and through whose efforts this collection was acquired.  The albums are entitled ""A Photographic Record of the Historic Visit of James Buchanan Duke to the Saguenay Region of Canada, June 1915,"" and ""Visit of James Buchanan Duke and     Fellow Directors of the Aluminum Company of America to Their Quebec Operations, July 1925. ""  All the material in this collection concerns Mr. James B. Duke's role in the development"
Aluminum Company,"Aluminum Yompany of Canada, Limited 3 of the hydro-electric resources of the Lake St. John and Saguenay River system of central Quebec. The company he formed for this pur- pose was the Quebec Development Company. Hither in Dec. 1924 or Jan. 1925 he and Arthur Vining Davis, President of Alcoa, agreed to a merger of their two companies. This new com-     pany was also called the Aluminum Company of Canada, Ltd.  The photographs of Mr. Duke and several of his prominent business associates that are in the albums are listed in the Picture  File. 2"
Aluminum Company,"Aluminum Company of Canada, Limited 4  Includes Paul Clark's ""James Buchanan Duke and the Saguenay Region of Canada"" (199 pp.), ca. 1968."
"Ambler, John","Ambler, John Papers, 17803-1864 Richmond, Virginia Section A 14 items  3-23-35 ll items-caddeds 1026-49 l item added, 5-27-68"
"Ambler, John","Ambler, John . Richmond, Va.     Business and personal letters.  Eleven items added Oct. 6, 1949. Business and personal papers including literary attempts in the form of a play and an essay on the im- portance of studying.  l item added, 5-27-68: A letter dated Vec. 29, 1808, from Chapman Johnson to Ambler concer ning the settlement of the Norton estate of which Mrs. Ambler was one of the heirs."
"Ambler, John","Ambler, John, fl. 1790s Papers, 1794-1798, n. d. Philadelphia, Philadelphia Co., Pa.  4 5  33-6 35 items 4-4-85  Flowers Fund"
"Ambler, John","Ambler, John, fl. 1790s. Papers. Philadelphia, Philadelphia Co., Pa.     The John and Eliza Ambler collection contains thirty-five items, chiefly letters, written be- tween 1794 and 1798. It gives a good view of the hardships faced by John and Eliza Ambler who emigrated to America from Halifax, Yorkshire,  England, in 1794. One letter is a copy of another letter in the collection and possibly kept with the letter writer's records. They are in poor condition. Several are fragmentary and"
"Ambler, John","Ambler, John, fl. 1790s 2  discolored. In addition to the thirty letters, there are six items of accounts and inventories dating from 1795 to 1797. They include in- complete store inventories. The collection also includes two journals kept by John on two over-  land journeys he took in Pennsylvania and Mary- land in 1794 and 1795.     The seven-page journal John wrote on his first overland journey is undated, but can be dated from a description of the trip he gave in a letter to Eliza on August 14, 1794."
"Ambler, John","Ambler, John, fl. 1790s 3     In the journal he kept in 1795, he refers to the trip he made a year earlier. The first trip lasted from approximately August to September, 1794. He traveled towards Pittsburgh on this journey ""towards the mountains."" He gave a de- scriptive account of the vegetation and crops he saw along the way. His route went through  Berkeley County, West Virginia, across Maryland and up the Monongahela River via Frederickstown to Pittsburgh. He returned down the river via Elizabeth, Pa., and on into Maryland via"
"Ambler, John","Ambler, John, fl. 1790s     Hagerstown, Middletown, Cumberland, etc. In Fredericktown, Pa., he saw an Englishman, whom he said was happily engaged in farming. He de- scribed Pittsburgh as being both in climate and appearance like England. Other towns he de- scribed were Elizabeth, Pa. and Middletown, Hagerstown, Hancock, and Fort Cumberland, Maryland.  The seventeen-page journal of the second overland trip (April 25 to June, 1795) is de- scriptive. He comments upon land prices, food"
"Ambler, John","Ambler, John, fl. 1790s 5 prices and the vegetation. This trip took him along the banks of the Schuylkill River to Norristown and Reading. Other towns and areas he described in Pennsylvania are Middletown, Lebanon, Harrisburg, the Nittany Valley, Bedford Greensburg, Fort Pitt and Pittsburgh. He commented that since the year before, land prices had increased around Fort Pitt. At Clarksburg (now in West Virginia) he bought one thousand acres of farm land. Ina letter, July 8, 1795, John mentions that he has just returned from a"
"Ambler, John","Ambler, John, fl. 1790s     journey of eighteen hundred miles.  The Amblers arrived in Baltimore, May 19, 1794, after a journey by ship of eight weeks and two days. At first the couple is enthusiastic about their new setting and encourage other members of their families to come. By September  19, 1794, they had moved to Philadelphia where John went into the printing and papermaking business and began a circulating library. In December 1794, Eliza writes discouragingly about their situation. They had lost money in"
"Ambler, John","Ambler, John, fl. 1790s i     Baltimore, and they had also been unable to get goods they had requested from England. Mean- while, friends and relatives in England were giving John and Eliza conflicting reports of what business prospects were like there.  After the death of their son on December 11, 1795, when they were in Clarksburg, the Amblers  began to seriously consider returning to England Eliza's parents had offered to make John a part- ner in their timber business. The remainder of the letters concern the Amblers' on again, off"
"Ambler, John","Ambler, John, fl. 1790s     again attempts to return to England.  In a fragmentary letter from New York (the date is not on the section of the letter in hand), from John Rhodes there is information about Mrs. Ambler wishing to leave America. Rhodes was apparently making some of the arrange ments. It is also indicated she is under the  care Of John H. Thompson. No mention is made of John and there is no indication of what has happened to him. However, in a letter (August 11, 1798) John is described as suffering from a"
"Ambler, John","Ambler, John, fl. 1790s ""total loss of spirits."""
"Ambler, Philip St. George","Ambler, Philip St. George  Papers, 1856-1879  Washington, Rappahannock Co., Va. Section A 6 items  7-12-56  GUIDE"
"Ambler, Philip St. George","Ambler, Philip St. George. Papers, 1856-1879. Washington, Va. 6 items. Sketch     This collection consists of 3 business letters, a legal letter, and 2 receipts. Con- way Robinson writes to Ambler on May 4, 1856. Robert C. Stanard writes to him the next day. A letter of Sept. 5, 1879, is to John Ambler.  This collection was originally a part of the Don Preston Peters Collection."
Ambler-Brown Family,"Ambler-Brown Family A m ble y  Papers, 1780-1865 CV Ene  Charles Town, Jefferson Co., Va.; and Fauquier Co., Va.  XVII-48 3 items (272 pages) ; 1 items added 5-14-58 6-15-56  =  (Entered in the National Union Catalog of  as Ambler family, 31 items)"
Ambler-Brown Family,"This collection contains 273 typescript pages. Of this number, 170 are devoted to Governor Thomas Brown's ""Account of the Line- age of the Brown Family,"" Lucy Johnson Ambler's diary (1863) accounts for 17 pages. Typescrint copies of 25 family letters and  4 family memorials account for the remaining 85 pages. See departmental correspondence with N. M. Merz (April, 1978) for information con- cerning the location of the original manuscript  from which some of these typescripts were made."
Ambler-Brown Family,"Ambler-Brown Family. Papers, 1780-1865. Charles Town, “. Va. XVII-BB “4 items. Sketch, These letters and papers, copies of copies, fall into three groups: the diary of Lucy Johns- ton Ambler, ""Morven"", Fauquier Co., Va., Feb., 186fiAug., 1863; letters of Betsy Ambler Carring ton to Ann Ambler Fisher and Mildred Smith Dud- ley, 1780-1823; and an account of the lineage of     the Brown family, written by Thomas Brown, Gov- ernor of Florida, in 1865. These papers sre not able for genealogy of families from Westmoreland Fauquier, and Jefferson counties in Va.; for much early history of Richmond, Williamsburg, Yorktown, and woe“ Va. and Washington,D.G"
Ambler-Brown Family,"Amoler-Brown Family ee 2 and for sidelights on famous personalities of the Revolution and early Republic.  The short, interesting diary of Mrs. Lucy Johnston Ambler gives a picture of Fauquier Co. in the Civil War, Comments are made on such battles as Fort Donaldson, Vicksburg, and Gettys burg, with Confederate prisoners, casualties, and Civilian morale noted. Reference is made to hardships and shortages (cattle, nails, etc.). Gloom after the return of the Confederate Army from Pa. is followed by fear of Union depreda= tions. The U.S. Army then begins a systematic  campaign of devastation 5 Fdjuier Co., many de-"
Ambler-Brown Family,"Ambler-Brown Family  tails of which are related. Resulting hardships to civilians and the attitude of the Negroes are recorded, as well as the casualties in the U.S. Army and draft riots in the North,  The letters of Mrs. Betsy (Ambler) Carrington, wife of Col. Edward Carrington to Mrs. Ann (Amb- ler) Fisher, who is ""Sister Nancy"", and to Mrs. Mildred (Smith) Dudley contain many references to Va. events and much history of the Ambler, Jacquelin, Marshall, Burwell, and Washington families. References are made to first settlers Edward Jacquelin and Richard Ambler, to Rebecca (Burwell) Ambler, and oe Ambler of"
Ambler-Brown Family,"Ambler-Brown Family w 4 of Yorktown, Va. The education of girls in col- Onial Va. (1750), social life and customs, and religious thought are reviewed, with comment on the religious confusion of the Revolutionary era and the closing of Protestant Episcopal churcheg In a letter in March, 1809, Mrs. Carrington describes the break-up of homes, interrupted ed-     ucation, hardships, loss of fortune, and fear among Civilians which the coming of British troops to tidewater Virginia caused. An excel- lent picture of refugee life and travels during the Revolution is given. Virginia hatred of the Earl of Dunmore is “oe” and he is contras"
Ambler-Brown Family,"Ambler-Brown Family 5 ed to the well-liked governor, Baron de Bote- tourt. Colonial Yorktown, a center of Virginia life, is described with special emphasis on the desolation caused by the British invasion. During the flight of the Jacquelin Ambler family from Yorktown, two daughters are left in Winchester, Va., in the winter of 1777. It is a rude and wild place, too cold for tidewater people. Later, however, in a letter dated 1810, Winchester in 1777 is again described. The fron tier town is marked by gaiety of social life amid a mixed population of Philadelphia Quakers"
Ambler-Brown Family,"Ambler-Brown Family 6 ana newly releasec young American officers from Canadian prisons.  The Ambler family returned to Yorktown to find an American garrison including young Capt. John Marshall. Mrs. Carrington details his cha acter, early life, and marriage to her sister, Mary Willis Ambler.     These letters of family history are written by Betsy (Ambler) Carrington to the youngest sister Mrs. Ann (Ambler) Fisher. Included is a letter from J.A.B. Fisher to his mother, Ann (Ambler) Fisher, from Yale College on May 1, 1815, in which the opinions of 6 Dwight are record-"
Ambler-Brown Family,"Ambpler-Brown Family ed.  The correspondence with Mrs. Dudley is mostly social gossip. The Ambler family moved to Rich- mond, where Jacquelin Ambler became a Va. offic- ial. Letters pass between Yorktown and Richmond, beginning about 1780.  The impact of Comte de Rochambeau and the French troops on Yorktown social life is describ ed by Mildred (Smith) Dudley. Williamsburg, with a ball at the governor's palace in 1780, is note ed by Betsy Ambler, who also describes Richmond at the time of the transfer of the Va. State  Government from oe The British ex-"
Ambler-Brown Family,"Ambler-Brown Family 8     cursion up the James River causes the retreat of Jefferson and the Virginia government in 1781 to Charlottesville.  In 1782 Mildred (Smith) Dudley writes of the Siege and resulting devastation at Yorktown, Va. which resulted in the surrender of Cornwaillis, Much material on Va. social life continues, in-  cluding data on the parentage of Lewis Warring- ton, later a naval hero of the War of 1812. Letters to Miss Frances Cairnes of Bristol, England, begin in 1792. The lack of Zpiscopal churches in Va. is noted, with references also to the services of the it John Buchanan at"
Ambler-Brown Family,"Ambler-Brown Family St. John's in Richmond.  Of particular note are letters of Nov.22,1799 and Nov.27,1799, which describe a trip through Va. to early Washington, D.C. A description of George and Martha Washington, their household, especially Eleanor Parke (Custis) Lewis, and Mt. Vernon are excellent. The comments on the be-     ginning of the city of Washington are also of in terest.  A copy of the eulogy of John Marshall on his wife, Mary Willis (Ambler) Marshall, in Dec., 1832, summarizes her character and their marri- age. <A copy of ""John — Romance"", by"
Ambler-Brown Family,"Ambler-Brown Family 10 Cassie Moncure Lyne, from an undated clipping, analyzes the character of George Washington, Thomas Jefferson, and John Marshall, and comment On the Federalist Party. The Richmond bar in thé days of young John Marshall is noted. From the Washington Post, June 3,1935, comes ""Half For- gotten Romances of American History, John Mar-        shall - Mary Ambler"", by Elizabeth Ellicott Poe, with details on the Ambler family and the early years of John Marshall.  The third division of the papers is "" An Ac- count of the Lineage of the Brown Family"", by"
Ambler-Brown Family,"Ambler-Brown Family il Thomas Brown,’ Tallahassee, Governor of Florida ,v copied by Rebecca Kearsley, March, 1899, and re- copied by Lucy J. Ambler, Dec., 1936.  Thos. Brown, writing in 1865 of his family history for his children, was born in Westmore- land Co., Va.,and moved to Tallahassee, Fla., in TR@%-R8; He writes at 9@ entirely memory, giving his own biography as well as Vai genealo- gy ana history. Beginning at Jamestown in 1608 with Edwin (or Edward) Brown, founder of his family, he relates stories of John Smith, Poco- hontas, and the Bolling family. He gives six  generations of Brown : i with social life"
Ambler-Brown Family,"Ambler-Brown Family and customs of eighteenth century Va.  Included are the Templeman family, with refer ences to Sam'l. Richard, and Margaret (Templeman) Brown. The story of the tontine agreement of Payne, Yates, and Templeman of Alexandria, Va., shows how John Yates came to the U.S. from Coun- ty Cumberland, England, in the 1800's to inherit a large property and how his family became the YategZOf Jefferson Co. whose home was ""Flowing Springs"", originally the estate of Richard Temp- leman.  The career of Wm. Brown (1737-1818) reveals  plantation life in “oo Co., with horse"
Ambler-Brown Family,"Ambler-Brown Family 13 racing and entertaining, the ruin of tobacco planters during the Revolution, sale of tobacco through factors, and the formation of salt works Margaret (Templeman) Brown , wife of Wm. Brown, pictured as plentation mistress and mother of. a large family. The Rev. Christopher Collins and his sister Angelica appear as teachers of the Brown children. Corbin Washington of Westmore- lana County is shown influencing his neighbors whose fortunes are wrecked by the Revolution to migrate to Charlestown, Berkeley Co., Va., where the Washington family held large land grants.  Young William, George, . hon James Brown, with"
Ambler-Brown Family,"Ambler-Brown Family 14 the Collins family, make the trek in the mid- 1790's. This migration roughly follows the Rappahannock River Valley up to Fauquier Co. at the foot of the Blue Ridge; then it proceeds to Millwood in Frederick (later Clark) Co., or goes northward over the mountains to Charlestown and Shepherdstown in Berkeley, (later Jefferson) Co. The father, Wm. Brown, remains at ""River View! on the Potomac, and his son Thos. describes the excellent management of his slaves, as well as  ""Reapings"" and corn shucking, two ancient Va. festivals no longer celebrated, 01d field schoo  are pictured. The “oe Jonathan and"
Ambler-Brown Family,"Ambler-Brown Family  Penelope, hold notable hunts on their plantation The Brown family travel back and forth to Charl- estown, where young Tom Brown arrives on""Exhib- ition Day"" in 1798, attends the Charlestown academy, and meets Lincoln Lear, the son of Tob- las Lear. He describes the ""Female Academy"" of Angelica Collins with its distinguished Board of     Trustees headed by George Steptoe Washington, Webb-and Brown (George) of Charlestown show the deep division between Federalists and Jeff-  ersonian Democrats. Tom Brown visits the Army Post at Harper's Ferry, where the ""standing army!"
Ambler-Brown Family,"Ambler-Brown Family Pi 16 of the U. 5. is located. Supplies are brought in by Webb of Webb and Brown. Major Cass, sec- ond in command, has a young son Lewis (later to become Sec, of State),with whom young Tom plays. Reference is made to John Adams' French War, 2s well as to the fight over the construction of the Constitution. The reaction at Charlestown     to the death of George Washington on Dec. 14, 1799 is profound, as the town, named for his brother Charles, is surrounded by Washington relatives. On Feb. 22, 1800, Harper's Ferry stages a funeral service for Washington at which the whole a ia"
Ambler-Brown Family,"Ambler-Brown Family     of the U.S. is reviewed, people participate from all over the Union, and hundreds of sleighs are in the procession.  Politics brings hot words and fights in the presidential election of 1800. Jefferson is ver popular in Charlestown. Aaron Burr 's bid for the Presidency, the Congressional balloting to  break the tie, and the great celebration in Charlestown at the news of Democratic victory are noted,  William Brown of Charlestown marries Sally Hammond, whose family and brother, Thos. Hammond"
Ambler-Brown Family,"Ambler-Brown Family 18 are discussed.  James Brown marries Eleanor Rutherford, dau- ghter of the famous Robert Rutherford. Life at his home, ""Flowing Springs"", is pictured with comments on his fine library and the cultivation of tomatoes from seeds sent from France by Thos Jefferson, The Rutherford family of the Shenan- doah Valley and the families of Robert Ruther- ford's daughters are listed.  The Episcopal Chruch near Charlestown, the Old Stone Church, and its minister, Mr. Heath, are mentioned,  About 1800 Thos, “6 goes to Alexandria,Va,"
Ambler-Brown Family,"Ambler-Brown Family  attends McLean's Academy, describes the Peyton family.of Shooter's Hill, lists many ""old import ing merchants"" , including Anthony Chas. Case- nove, lives through a yellow fever epidemic, 2nd visits Washington, D.C.about 1801. ""The Federal City"", as it was called, is detailed, particular ly Pa. Ave.,and the building of the Capitol. Thos, Brown visits the navy yard and meets Thos. Jefferson there. He lists boarding facilities and hotels. He is thwarted from sailing on the  U.S.5, Philadelphia, Of interest is the account of the sale of  George Washington's “eo by Geo. Washimgton"
Ambler-Brown Family,"Ambler-Brown Family el fices of clerks of the county courts and picture the tremendous amount of gambling prevalent. De tails of the popular lotteries of the day are re corded in the story of Thos. Brown's winning a $15,000 ticket. The large estates and profuse hospitality of northern Va. exemplified by Sam'1 Lewis of ""Bushfield"", are portrayed, as destituté     heirs go west to new counties or states. This movement is increased by devastation in the Va. tidewater during the War of 1812.  Va. troops under Gen. Alexander Parker are ordered to New Orleans. Thos. Brown enlists in"
Ambler-Brown Family,"Ambler-Brown Family 2 John Savage's Va. Cavalry Troop, King George's County. ,.He sees action against the British whog fleet, under Admiral Geo. Cockburn, blockades  the Chesapeake Bay and devastates the Potomac River estates. Gen. John P. Hungerford commands the Va. militia. While British move on Washing- ton, refugees stream westward. The Va. militia     also move toward Washington, witness its burning, and see James Monroe made Secretary of War. Com- modore John Porter commands the defense of the  Potomac River, Alexandria under British occupa-  tion is described, as is the British bombardment"
