Name,Text
"Jones, Iredell","e 6th 16:C Jones, Iredell. Papers, 1842-1906. 274 itemse Hitlsborough, NeCe native, son of Colonel Cadwallader Jones and Annie Isabella Iredell, daughter of NeCe governor James Iredelle Jones spent ‘his youth in Hillsborough, and on  family bes atoge mear Rock Hill, SeCe  In 1861 he enlisted in Company A, Washington Light Infantry and was wounded by a minie ball at the first Battle of Manassase He later became a Second Lieutenant in the First SeCe Artillery, and then an aide-de-campe Collection contains Jones's corre spondenc e and focuses on: the Civil Ware s@-:.- letters are from Jones to his parents, written while 25 JUN 98 39353019 NDHYme SEE NEXT CRD"
"Jones, Iredell","e 6th 16:C Jones, Iredelle Papers, eee (Card 2)  a student at SeCe College and a member of a volunteer group concerned with abolitione In all of the letters he wrote with a terse style, relating news and eventse He includes detailed accounts of the military activities surrounding Charleston and Fort Susgter, such as iron-clad battles, bosbardment of Sumter and hand to hand: combate Letters of family members, including his brother Cadwallader (Waddy) Jonesy, also give vivid pictures of the military and social aspects of the war in a broad area of the Southe There is an account of the June 1862 twelve-— day forced ma rceh to Fredericksburge Other corres pondence reflects  25 JUN 98 398353019 NDHYme SEE NEXT CRD"
"Jones, Iredell","e 6th 16:C Jones, Iredelle Papers, cece (Card 3) Jones's courtship and marriage to Elten Adamse He was probably a member of the Ku Klux Klan and letters tell of his arrést and imprisonment in 1871-e Other items include legal papers, miscellany such as an unidentified photograph, and papers concerning the United Confederate Veterans, including data on many veteranse Part of the Harry Le and Mary Ke Dalton Collectione Unprocessed collectione Cataloged from accession recorde  *lcos  25 JUN 98 39353019 NDHYme SEE NEXT CRED"
"Jones, Iredell","e 6th 16:C Jones, Iredell.  Papers, eee (Card 4)  le Jones, Iredelle 2- South Carolina Coltlege--Studentse 3. United Confederate Veteranse 4. Soldiers— Confederate States of America—— Correspondencee Se Courtship~-Southern States--History—-19th centurye 66 Naval battles-—-United Statese Te United States-——-History--Civil War, 1861-1865. S86 United States—-History-—- Civil War, 1861-1865—Campaignse Qe Charleston (SeCe )—-History—-Civil War, 1861-1865- 10. Fredericksburg (Vase )-- History--Civil War, 1861-1865. ite Fort Sumter (Charlestony SeCe )-—— History—Civi Ll War, 1861-1865¢«¢ 126 Genre: Legal documentse Ie Jones, Cadwallader.  25 JUN 98 39353019 NDHYme"
"Jones, Isaac Dashiell","Jones, Isaac Dashiell Papers, [181] [Washington, D. C.]  Section A 1 item  10-31-60"
"Jones, Isaac Dashiell","Jones, Isaac Dashiell. Papers, [181]. (Washington, D. C. Sketch. 1 item     I. D. Jones writes from the House of Repre- sentatives on August 29, [181] concerning the fate of the Tariff bill. which had been passed in the House. He ajl&o discusses the vacancy in the assistant's, department ah Washington Academy in Princess Anne, Md."
"Jones, J. F.","Jones, J. F. Papers, 1860-1865  Iredell co., N. C.  Section A 3 items 1 item added 5-13-57 1947"
"Jones, J. F Guide","JONES, J. F GUIDE Letters & Papers, 1860-68. Iredell Co.N.C,  & pieces, Cab. & Sketch,     Contracts to pay J. F. Jones for teaching letters, spelling, reading, writing, arith- metic and grammer; also directions for making brilliant white wash,  l item added 5-13-57 is a love letter of 1865 from Jones to an unidentified girl.  He evidently joined the C. S. A. Army late  in the war."
"Jones, J. Howard","Jones, J. Howard Papers, 1879-1888 Thomasville, Davidson Co., N. G.  Section A ol items  8-21-59"
"Jones, J. Howard","Jones, Je Howarde  Papers, 1879-1888-  31 itemse  Thomasville (Davidson Coe), NeCe residente  Collection contains bills, receipts, and letters of Jones, concerning business affairs and legal matters,  including Jones's divorcee Also contains: payrolls of the Rich Fork Copper Minee  Cataloged from Guidee  *lcs  25 JUN 98 39353040 NDHYme SEE NEXT CED"
"Jones, J. Howard","Jones, Je Howarde Papers, ece (Card 2)  ie Jones; Je Howarde 2e Rich Fork Copper Minee 3e Business records-—- North Carolina-—-Davidson Countye Di vorce-—-North Carolina--Historye Thomasville (NeCe )—-—Historye 66 Legal documentse 7e Genre: Payrollse  25 JUN 98 39353040 NDHYme"
"Jones, J. Howard","Jones, J, Howard. Papers, 1879-1888. Thomas- Ville, Davidson Co., N. C. 31 items. Sketch. ostly 8 and receipts and personal an business letters relating to Capt. J. Howard Jones. Pay rolls and other items pertain to the Rich Fork Copper Mine, in which he was in- terested. Other subjects mentioned in the col-  lection include Jones' divorce, legal affairs, and Frederick H, Stith. There is a letter of Mar, 30, 1888, by W. H. Bailey, Sr.  See also the following collections in this dept.: (1) Frederick H. Stith and Alberta B. (Stith) Jones ., and_(2) William Henry"
"Jones, J. Howard Bailey","Jones, J. Howard Bailey, Sr. ."
"Jones, Howard Mumford","Jones, Howard Mumford (1892-1980) Papers, 1915-1980 Cambridge, Middlesex Co., Mass. 855 SHELF-LIST 105 items & 1 vol.  Part of the Jay B. Hubbell Center Collection  8-9-8 2"
"Jones, Howard Mumford","Jones, Howard Mumford (1892-1980). Papers. Cambridge, Middlesex Co., Mass.     Howard Mumford Jones, educator, writer, lec- turer, was born in Saginaw, Michigan, April 16, 1892, but received his basic education in La- Crosse, Wisconsin. After graduating from high school Jones entered the new normal school in LaCrosse and in 1912 entered as a junior the University of Wisconsin. There he studied American literature under Norman Foerster. He received his A.B. degree in the spring of 1914"
"Jones, Howard Mumford","Jones, Howard Mumford (1892-1980)  and that fall enrolled in the University of Chicago graduate school. A year later he ob- tained his M.A. He began his teaching career in the fall of 1915 at Chicago and also began working on a doctorate. After two years of study and teaching freshman English he accepted     a position at the University of Texas, Austin, replacing Stark Young who was leaving for New York. Because of an acute shortage of funds at Texas Jones went to the University of Mon- tana, Missoula, in 1917. Two years later he"
"Jones, Howard Mumford","Jones, Howard Mumford (1892-1980) 3     returned to Texas. In 1925 Jones asked for a leave of absence to complete his doctoral work. After cramming as many courses into the time he had and writing an acceptable thesis, Jones was denied his degree on the grounds that he had not taken enough courses.  In the meantime Jones' job at Texas had been  abolished so upon leaving Chicago, he accepted a position at the University of North Carolina, Chapel Hill. While in Chapel Hill Jones was the prime mover in the establishment of the"
"Jones, Howard Mumford","Jones, Howard Mumford (1892-1980)     Bull's Head Bookshop. In 1930 Jones went to the University of Michigan where he remained until 1936 when he was offered a position at Harvard University, Cambridge, Massachusetts. Cambridge became his permanent home.  During his career Jones was a prolific wri-  ter of articles and books. Among the books he wrote are O Strange New World (1964), Revolu- tion and Romanticism (1974), and The Age of  Energy (1971), all published after his retire-  ment."
"Jones, Howard Mumford","Jones, Howard Mumford (1892-1980) 5  The Howard Mumford Jones papers consist of 74 articles and reviews written by Jones for periodical or pamphlet publication, clippings of reviews of his book The Age of Energy and two brochures. The complete collection of Jones' papers is in the Archives at Harvard     University. In the first box of the collection is an inventory of the articles and reviews included.  An addition made in 1982 to the Howard Mum- ford Jones papers contains one volume, The"
"Jones, Howard Mumford","Jones, Howard Mumford (1892-1980)  Pursuit of Happiness, 12 addresses, 5 articles, and two poems."
"Jones, J. Ll","Jones, J. LL.  FOR INFORMATION ABOUT THIS COLLECTION OR ADDITIONS TO THIS COLLECTION, PLEASE ASK A STAFF MEMBER TO CONSULT THE ACCESSION RECORDS."
"Jones, J W","127 Jones, J Ww  Diary. 1859-1860, Utica, New York  176 p. Boards, 16 x 20 cm, June 11, 1937,"
"Jones, J W","JONES, J W Diary. 1859-1860, Utica New York, 1_vol, Sketch,        This is the diary of J.W. Jones, the purser's clerk on board the U.S. Steamer, Mystic. The vessel patrolled the African coast to capture Slavers. The Mystic stopped at St. Helena, Loundo, Fernando, and the Congo River, The dia includes an excellent description of Napoleon's old tomb on St. Helena."
"Jones, Jeremiah T.","Jones, Jeremiah T. Papers, 1841-1878 Chesterfield County, Virginia  2-G 5 items and 5 vols.  6-19-58  Recataloged, 5-23-78"
"Jones, Jeremiah T.","Jones, Jeremiah T. Papers. Chesterfield Co. Virginia     Jeremiah T. Jones appears to have been an official, and perhaps one of the owners, of one or more coal mines in Chesterfield County, Virginia. The location of the mines is not pre- cisely known, but they were apparently at or  near Midlothian which was a terminus of the Chesterfield Railroad built between that town and Manchester in order to ship coal. This  railroad, the first in Virginia, began opera- tion in 1831. The coal company's accounts in-"
"Jones, Jeremiah T.","Jones, Jeremiah T. 2 clude numerous references to shipments by rail- road cars in the 1840's. Two of the account books were labeled as belonging to Jones, and others relate to him. The name of the coal company was, at least for part of the period covered, David Watkins & Company.     The Account Book, 1841-1853, dates almost entirely from the 1840's and is extensive. The frequent entries for David Watkins & Co. iden- tify it as the coal mining firm. Special accounts for J. T. Jones, David Watkins’ Howell D, Watkins, and a we suggest that they"
"Jones, Jeremiah T.","Jones, Jeremiah T, 3 may have been owners and/or officials of the company. In 1849 there are a few accounts for the Gowrie Mines in Chesterfield County. Ac- counts for hired labor are extensive, and en- tries for slave labor are numerous. There  are accounts for goods purchased and sold, coal, blacksmith work, expenses, shipments, etc.     The other volumes are relatively small. The one labeled ""Jeremiah T. Jones' Account Book,"" 1853-1854 includes: figures and specifications for mine shafts and machinery; and accounts for"
"Jones, Jeremiah T.","Jones, Jeremiah T,. 4 workers and possibly other individuals for food and clothing, blacksmith work, coal sent on  the railroad, etc.  J. T. Jones' Account Book, 1865-1867, con- tains accounts for clothing, food, coke, and individuals and also some figures on coal and slate deposits.     The Shoe and Clothing Account Book, 1854- 1857, also belonged to the company's operations since the handwriting and the names of the workers are similar to those in Jones' Account"
"Jones, Jeremiah T.","Jones, Jeremiah T, | 5 Book, 1853-1854.  The relationship of the Account Book, 1877- 1878, to the other volume is unclear. It came with them and has been kept with them. It records the sale of food and mercantile goods. Since the customers’ names are limited in number and repetitive, those people may have been  workers buying from a company store,  The financial papers include a list of hands in Jan., 1853. The miscellany contains a drawing, a plan of a mine, These items were found inside Jones' Account Book, 1853-1854."
"Jones, John","=e tise ——-xChapel  “Jones, John  Receipt Books. 1797-1820 Liberty County, Georgia  2 vols.  { See folllwing cards for seperate items]"
"Jones, John","3~ mey  Jones, John  Receipt book (Sheriff), 1797-1804 Liberty County, Georgia  74 pp. Boards 12 x 19 cm.  (Includes folded letters of Andrew Maybank  probably should be dismantled)  OCT 3 4949 ‘2"
"Jones, John","Tre asure Roem  Jones, John Receipt Book, 1799-1820 Liberty County, Georgia 74 pp. Calf 10 x 17 cn.  (Probably should be dismantled)  QOGI 3 1944 ="
"Jones, John","Jones, John Papers, 1778-1870  Griffin, Spalding Co., Ga.  Section A 1-23-57  GUIDE"
"Jones, John","Jones, John. Papers, 1778-1870. Griffin, Ga. 5 items. Sketch.  Business accounts of the large importing firm of John Jones andCo. of Ga. and S. C. in the Revolutionary period, and miscellaneous letters, including one from Charles West in 1855 which shows a Georgian's attitude to his slaves.  From the Marmaduke Floyd Collection."
"Jones, John Robert","Jones, John Robert Papers, 1847-1851 Harrisonburg, Rockingham Co., Va.  12-15-69 1 vol."
"Jones, John Robert","Jones, John Robert. Papers. Harrisonburg, Rockingham Co., Va,     John Robert Jones (1827-1901) was born in Harrisonburg, Va., and educated at Virginia Military Institute. After his graduation, he taught school in Florida and Maryland. He re- turned to Harrisonburg at the outbreak of the  Civil War. He was appointed a brigadier general in 1862, but his rank was never confirmed by  the Confederate Senate. Jones had left his command during the Battle of Chancellorsville"
"Jones, John Robert","Jones, John Robert 2 because of an illness, and this action ruined his military career. No attempt was made to effect his release or exchange after his capture by U. S. forces in Tennessee in 1863. His life following the war was spent in Harrisonburg where he engaged in business and was appointed commissioner in chancery of the circuit court.     The volume comprising the Jones Papers is a scrapbook begun by him during his last year at V. M. I. Many pages are missing from this volume, the largest gap occurring between pages"
"Jones, John Robert","Jones, John Robert a 168 and 217. The first part of the scrapbook contains extracts from Shakespeare, fragments of poems, and other miscellaneous jottings by Jones. The latter portion contains clippings of poetry and newspaper articles, many of which are humorous comments on courtship and romance, Page 275 contains a short resumé of his activities from January 1 to 1l, 1848."
"Jones, John Wesley","Jones, John Wesley Papers, 1868 Tarboro, Edgecombe Co., N. C.  Josiah C. Trent Collection in the 1 item History of Medicine--. Div.  4-8-860"
"Jones, John Wesley","Jones, John Wesley. Papers, 1868. Tarboro, N.C. litem. Sketch.  John Wesley Jones, president of the N. C. Medical Society and of the State Board of Health receives a letter on stones after vesico-vaginal fistula operations from Thomas Addis Emmet (1828 1919), specialist in diseases of women."
"Jones, Joseph","Jones, Joseph Papers, 1885 New Orleans, Orleans Parrish, Louisiana.  Josiah C. Trent Collection in the 1 item History of Medicine=--. Div.  4-8-60"
"Jones, Joseph","Jones, Joseph, 1749-1824.  Family papers, 1681-1895, bulk 1794- 1842.  700 itemse  Landholder, merchant, customs collector, military officer, from Petersburg, Vae  Correspondence, legal and financial papers, customs collector files, and other papers, chiefly 1794-1842, of three generations of the nome fo | of Joseph JonesSe Includes materia relating to land holdngs in Virginia,y Kentucky, Ohio, North Carolina, and Tennessee; Jones’ military service with the Viginia Militia in the Whiskey Rebellion; Jo nes' service as collector of @ *- port of Petersburg; a nd miscellaneous  12 FEB 88 17469094 NDHYme SEE NEXT CRD"
"Jones, Joseph","qa LXHN FHS @BAHGN PE0G9IPLT 88 dad TT  *AJORFSOGeT UT AJOAUCSAUT *eseuor svewouL yO eF Fa SSeuU0Lf UVOUMEN ATOM OF ZEYROUG pue efTUuUsItA Worsy ssezsu0D Fo sEequew £u03MeN AQGEN011LIA YF FA GOUEPUOdS eaI09 egos sepnyzouy *AINzZUSS UZEGT eur Buyanp wewom FO SuOTZFPUOD 7eF90S pure ‘ZCA LFAFO 84} BuTsnp As,LUCFUYLT CTuTpsasta 430% 943 YFA SGOFAGSOS 4ARVeUL s,Ave 0} UOFPOVSeT OM1OUF SOFAGO. seEuRO *SHBuTp 10y S@A81S OF FUF2V197 SZUSeMNSOOp swOoOS BatpnzouT *‘sseutsnq A1}fwey pue 1eUuOsSued (Z Pteo) ere Hin *SE8T-T89T *‘saeded A471 ;wWeq *PTSI-GPLI *4udesor ‘seuor"
"Jones, Joseph","Jones, Joseph, 1749-1824. Family papers, 1681-1895, bulk see (Card 3)  le Virginiae Militiae 2+ Customs administration--Virginia-~—Petersburee. 3- Land grantse 4+. Whiskey Insurrection, 1794. 5s Confederate States of Americae Armye Virginia Infantry Regiment, 40th» 6+ Newton, Willoughby, 1802-1874. 7. Jay's treaty, 1794. 8+ Women--Social conditionse Qe Slave recordse Ie Place: Virginia--Dinwiddie County-- Petersburge  12 FEB 88 17469094 NDHYme"
"Jones, Joseph","Jones, Joseph  Section A"
"Jones, Joseph","Abraham H. Bennett and his wife Joseph Jones and Scofield Seely psibah, to Joseph Jones,"
"Jones, Joseph","Jones, Joseph §S,  Daybook, 1893-1896  Panther Creek, Yadkin Co., N. C. 100 pp. Cloth 32 x 20 cm. 7-5-61"
"Jones, Kate","Jones, Kate  Copybook, 1861  Bethania, Forsyth Co., N. C., Section A 1 vol.  1-18-60"
"Jones, Kate","Jones, Kate. Copybook, 1861. Bethania, Forsyth Co., N. C. 1 vol. Sketch.  Kate Jones' school copy book of 1861 contains a number of interesting and well written essays and poems, some of which seem to be original. She discusses Benjamin Disraeli, astronomy, the trans-Atlantic cable, fond memories, William Shakespeare, the French Academy, etc."
"Jones, Kimbrough","Jones, Kimbrough Letters. 1800-1869. Wake County, North Carolina  Section A 36 pieces Oct. 22. 1935."
"Jones, Kimbrough","Jones, Kimbrough Sketch Wake county, N. C. , Crabtree creek,  Family Letters 1800-1869 38 pieces Kimbrough Jones of Crabtree creek near Morrisville in Wake county, N. C. was the son of Nathaniel Jones and (Kimbrough) Jones. It is very probable that Nathaniel     Jones was first cousin to Willie and Allen Jones of Halifax county, N. C. 3: before 1801 he had been a member of both houses of  the N. C. General Assembly. Kimbrough Jones was a member of the N. C. Constitutional"
"Jones, Kimbrough","JONES, Kimbrough. Sketch, (2) onvention of 1835. In so far as the collection  reveals, Kimbrough Jones owned cotton land in Marengo Co., Ala., and probably held interests in tracts of land in Tenn. and Ark. It seems quite probable that one of his daughters married Brian Green. At any rate there are several of Brian Green's letters to his wife, Martha, and  there seems to be a connection with the Jones family.  The collection _ : _ shows the typical role played by the Jones family in settling the Southwest."
"Jones, Lewis J","Jones, Lewis J Letters. 1862 - 1864 [Kentucky]  Section A 7? pieces  JUN 16 1941"
"Jones, Lewis J","JONES, Lewis J Letters 1862 - 1864 [Kentucky] 7 pieces Sketch     Jones was apparently a private in the Union army. He was stationed in east Tennessee, and was probably a native of that state or of Ken- tucky. The letters are addressed to Anna (Gree Jones, his wife. Jones was almost illiterate,  but was apparently a close observer, and so described troop movements and the country thro- ugh which he marched, with considerable accur- acy. He comments further on the welfare of the family, crops at home, and his need for  clothing. es"
"Jones, Lloyd","Jones, Lloyd Papers, 1862 London, England 34-B 1 item  3-10-70  Part of the William B. Hamilton Collection"
"Jones, Lloyd","Jones, Lloyd. Papers. London, England     Lloyd Jones (1811-1886), British advocate of co-operation, was one of the closest friends and associates of John Malcolm Forbes Ludlow, the social reformer. Jones, a fustian-cutter by trade, was a member of the working class.  On April 29, 1862, Ludlow wrote about: the  American Civil War and its influence on liberal- ism in Europe; the Tory reaction in Britain and the state of liberalism there; Robert Buchanan;  The Beehive; and censorship of Jones's news- paper articles."
"Jones, M.","Treesure Room  Jones, M. Account Book 1856 - 1859 Near Wilmington, N.C.  82 pp. Calf 12 x 19 cm.  This volume is chiefly devoted to the accounts of a turpentine and rosin business.  JUN 11 1937 é"
"Jones, Margaret (Stephenson)","Jones, Margaret (Stephenson)  FOR INFORMATION ABOUT THIS COLLECTION OR ADDITIONS TO THIS COLLECTION, PLEASE ASK A STAFF MEMBER TO CONSULT THE ACCESSION  RECORDS."
"Jones, Martha M.","Jones, Martha M. Papers, 1840-1904  Tuscaloosa co., Ala.  Cab. 45 113 items 1947"
"Jones, Martha M.","JONES, Martha M, CUINE a3 Letters & Papers: 1840-1904, Tudcaiovean  County, te Y 113 _ pieces b Sk  Letters written to Mrs. Martha M, Ward Jones by her sisters, cousins and in-laws,  from various parts of Alabama, Mississippi and Texas. She names Ward, Rhea, Jones, Tem- pletan, Thomas and Claybrooks appear often,"
"Jones, Martha M.","— Martha M, Sketch (2)rv y far the great part ofletters is from  Margaret C. Templeton, Mrs. Jone*s’ sister, living in Texas, Wennsborogh, Huntsville, Pine Tree, Titus County. The Templeton family  moved from one town to another and finally settled in Huntsville. The letters describe Texas, its terrain, customs, crops, condit-  ions during the Civil War, diseases, relig- lous development and educational facilites, They urge Martha Jones and her husband, Sam"
"Jones, Martha M.","JONES, Marthe M, Sketeh (5).> Jones, to move to Texas, There is an letter 10/24/1904, giving dates of deaths & births of members of the Ward family.  There is some connection between this  and the Fletcher Jones collection, in so far as Kinship is concerned,"
"Jones, Matthias","Jones, Matthias Papers, 1836 Ridge Spring, Ss. C.  Section A 1947  GUIDE"
"Jones, Matthias","JONES Matthias GUIDE  Account of sales of Personal E,tate, 1836 Ridge Spring, South C,rolina,  1 piece Cab, ¥, Ske teh  An account of sales inciuding furniture, land, farm implements, live stock and negroes"
"Jones, Meriwether","Jones, Meriwether Papers, 1817-1921 Richmond, Virginia  2-F & 6925-6934 3273 items & 15 vols. & 6902 4-4-74  (See also bound vol. cards)"
"Jones, Meriwether","Jones, Meriwether. Papers. Richmond, Virginia     Meriwether Jones (1853-1936), mining enginee, was educated at the Virginia Military Institute (class of 1874). During 1874-1875 he taught at the Southern Female College in Petersburg and at V.M.I. He then established himself in Richmond as a chemist. At some time he became connected with the Princess and Crozier fur- naces. He invested in the furnace at Iron Gate and became the manager of the Alleghany Iron Company that operated it, a furnace at Buena Vista, and ore mines in several counties."
"Jones, Meriwether","Jones, Meriwether 2     Jones also managed coal mines in Chesterfield County, and he was the author of A Report on the Richmond Coal Field (Richmond, TO1e)- “Tn     8 he resigned from the iron business, and in about 1913 he retired into commercial busi- ness except for acting as a consulting engineer During 1914-1920 he was proprietor of the Old  Dominion Tobacco Warehouse in Richmond. Jones recounted his career in a letter to the super- intendent of V.M.I. on Nov. 14, 1916. He is  also noted in that school's Register of Former"
"Jones, Meriwether","Jones, Meriwether 5 3 Cadets (Roanoke, 1939) and by Lewis Hampton Jones in Captain Roger Jones, of London and Virginia, Some of His Antecedents and Descen- dants (Albany, N. Y., I891), p. 88 (with a portrait).  In both the coal and iron businesses Jones was associated with Ferral C. Dininny, Jr., of              New York City who was president of the Alleghan Iron Company during the 1890's, The firm oper- ated pig iron furnaces and iron ore mines in Alleghany and adjacent counties of western Va."
"Jones, Meriwether","Jones, Meriwether 4  In the early 1890's he was also president of the Richmond and Tidewater Coal and Railroad Company. Sometime during the decade the name of his coal enterprise became F. C. Dininny, Jr. The mines were located at Winterpock, Chester- field County, Virginia. The city directories for New York and Richmond list these companies,     but between 1901 and 1905 they disappear from the Richmond Directory. The Directory of Directors in the City of New York, 6 lists Dininny as president and director of the Ameri-"
"Jones, Meriwether","Jones, Meriwether 5 can Match Manufacturing Company and of the Ridgway Belt Conveyor Company. His office was in New York City.  The collection during the 1890's represents Dininny's iron and coal interests in Virginia of which Meriwether Jones was general manager. There are extensive records from the Alleghany Iron Company, 1892-1900, and a less complete set from the coal mines at Winterpock, 1892- 1899. After 1900 the papers are those of Meriwether Jones who was in coal mining and later in the tobacco warehouse business."
"Jones, Meriwether","Jones, Meriwether Alleghany Iron Company        The Alleghany Iron Company, manufacturer of pig iron, operated furnaces at Iron Gate and Buena Vista, Virginia, and ore mines in the counties nearby during the 1890's and possibly  before and after that decade. Iron Gate Furnace was the production center, and the company leased the furnace at Buena Vista in 1897. There were ore mines in Alleghany, Rockbridge, and Botetourt, and possibly other counties,"
"Jones, Meriwether","Jones, Meriwether 7 The office of Meriwether Jones, the general manager, was in Richmond. Thomas Catesby Jones the superintendent, operated the mines and furnaces. He was a brother of Meriwether Jones The correspondence is extensive during 1892- 1900 and includes seven letterpress books and several hundred unbound letters and documents.     The principal writer is Thomas C. Jones. Since he had to communicate with his superiors at Richmond and New York City, his letters are  especially descriptive and constitute a rich"
