Name,Text
"Shepherd, Abraham, Jr. and James H.
","Shepher@, Sbrahem, Jr., and James H,. 3 married there. Henry was running a sugar plantation for James H. in 1830. The latter died in ‘ttre 1836+s, and4@aid not marryea’  20 items added 1-2-58. These are busi- ness letters of Henry ‘Shepherd, Jr., of New Orleans and Wild Goose Farm, Shepherds- town, W.Va. See chart with the letters,     The James H. Shepherd mentioned in these later letters is probably Henry's first cousin. Uneles Rezin and James H. had been in busimess before 1807. Henry, Jr., had gone to New Urleans to enter the husiness in the 1840's, . net ears neither  uncle had a male hei Henry, Jr., in-"
"Shepherd, Abraham, Jr. and James H.
","Shepherd, Abraham, Jr., and James Henry im herited the business interests of Uncle Rezin, who finally died in 1865. In April, 1861, Henry, Jr., begins & series of letters to Cousin James H. with enthusiastic comments  on secession and scorn for Black Republicans in Virginia. The 1863 letters cover La. in the Civil War, with short notes on Benjamin     Butler, Nathaniel P. Banks, and economic conditions. Henry Shepherd married Azemia McLean of New Orleans, @aughterrof Wm.J,. McLean of New Orleans. The panic of 1873 is reflected in depressed money conditions in  1875. , See also the 2.5 Gers . and the Damske Dandridge . in this department."
"Shepherd, James E.","e 2nd 84:L3; Room 001 (92-110) Shepherd, James Ee (James Edward), 1847-1910. Papers, 1869-18936 35 itemse Confederate telegraph operator, judge of Beaufort County (NeCe) Superior Court, 1882-1893, chief justice of the North Carolina Supreme Court, 1893- 1897, and Lawyer, of Raleigh, NeCe Correspondence, business and legal papers, and some printed sattere ‘Unprocessed collectione Cataloged from accession recordse  Addition to James Ee Shepherd Papers, 1892-1907.  *hab =  19981201 #40422011 NDHYme SEE NEXT CRD"
"Shepherd, James E.","e 2nd 842L3; Room 001 (92-110) Shepherd, James Ee (James Edward), 1847-1910. Papers, eco (Card 2)  1e Judges--North Carolinae 2e Lawyers~--Correspondencee Je Lawyers--— North Carolina——Raleighe  19$81201 #40422011 NDHYme"
"Shepherd, James Edward","Shepherd, James Edward Letters. 1892-1907. Raleigh, North Carolina 1 box. cab. 42%. ) 155 pieces March 10, 1939."
"Shepherd, James Edward","Shepherd, James Edward. Papers, 1869-1893. Addition, 35 item. (.1 lin.  ft.)  Chief Justice of the N.C. Supreme Court -- Correspondence, business and legal papers, and some printed matter.  Gift: 12/14/92  Accessioned: 1/7/93  Acc. No.: 92-110"
"Shepherd, James Edward","SHEPHERD, James Edward. Letters. 1892-1907. Raleich, North Carolina. 155 pieces. Sketch  James Edward Shepherd, son of Thomas 8S. and Ann Eliza (Brown) Shepherd, was born near Suffol Va., July 26, 1847. Left an orphan at the age o two, he was cared for by his elder brother, Wil- liam, who moved in 1859 to Murfreesboro,N.C. and  became a druggist. Early in 1861, following the example of his brother, James joined the 16th Va Regiment, but was discharged because of his age  after a few months service. He then learned tel egraphy and was assigned to duty in W. Va. under General Sam Jones PI QP o-srecken at the head-  quarters of General J C.Breckenridge."
"Shepherd, James Edward","SHEPHERD, James Edward, Sketch, (2 After the War James became telegraph operator  at Wilson, N.C. Thrown on his own resources by the loss of his brother during the War, James be gan the study of law. He entered the University of N.C., studied under Judge Battle, was admitte to the bar in 1868, and began practice at Wilson In 1871 he moved to Washington, N.C.,and entered a partnership with Thomas Sparrow. The latter was interested and active in politics, and Shep= herd was elected to represent Pamlico and Bem- fort counties in the Constitutional convention of 1875 and served in the Comittee on the Judici ary and was chairman of the Committtee on Mn- nicipal Corporations."
"Shepherd, James Edward
","- SHEPHERD, James Edward. Sketch. (3)  He became chairman of the Inferior Court of Beaufort in 1876 end in 1882 was made Judge of the Superior Court. Six years later he was nomi nated for the position of Justice of the Supreme Court. On the death of Chief Justice Merrimon in 1893 Shepherd was elevated to that position which he occupied with distinction and credit un     til 1897. His decisions received unqualified co commendation among members of the bar. On his return to the bar, Shepherd practiced law in Raleigh.  This collection concerning the period from"
"Shepherd, James Edward","SHEPHERD, James Edward, Sketch, (4)     1892 to 1907 contains the legal correspondence of James E. Shepherd, Thére is much routine co respondence, and the letters show that his opin- ion was sought after and his judgment respected by other lawyers. There is no continuity in the material, but it would be of supplementary value in a study of James E. Shepherd."
"Shepherd, James E. Common Place  Richmond","Shepherd, James E. Common Place Book  Richmond, Va.  315 pp. Boards & Calf. 25 x 19 cm.  AUG 3 0 1940"
"Sheppard, J. C.","Sheppard, J. C.  See: Sheppard Brothers  Letterpress Books, 1879-1883"
"Sheppard, James","Sheppard, James Letters and Papers. 1830-1889,  Hanover County, Virginia  5 boxes. cab. 68. 1523 pieces  <p 1S 1 4-47-92  1 "" transf. Feb. 22, 1938 3—-3~52"
"Sheppard, James","SHEPPARD, James. Letters and Papers. 1830-1899 Hanover County, Virginia. 1539 pieces. Sketch  James (c.1816-1870), son of Joseph M. and Eli zabeth (Pollard) Sheppard of Hanover Co.,Va.,was educated at William and Mary College (1834-1836) His father, a physician and planter, was heavily involved in the Fredericksburg, Richmond, and     Petersburg Railroad, and numerous other projects In order to relieve the financial stress, James undertook the management of his father's farm i Copiah Co., Miss., about 1838. On Sept.30,1847, James married Kate, daughter of Adam (President  of William and “oo and Ann Eliza"
"Sheppard, James","SHEPPARD, James. Sketch. (2) Wright) Empie. The young bride tired of plan- tation life in Miss., and returned to Va. in the  spring of 1848, where she remained for a year and a half.  James' younger brother, John William, attended William and Mary in 1840-41. Unable to find a promising opening in business, he read law in  the office of Seddon and Morson in Richmond,and from 1847 until 1850 managed the Va.plantations of his father. John William and his father dis- agreed seriously in business matters and the young man joined his brother in Miss. in 1850. The Sheppards then “6 extensive lands in"
"Sheppard, James
","SHEPPARD, James. Sk (3 Jefferson Co., Ark. John William died in 1851. About 1853 James moved to Ark.,where he was very successful. The tax beturns for 1859 show that he owned around 2,000 acres of land and 64 slaves in Ark.,which were valued at $45,000. In 1860 James negotiated for the purchase of additional lands valued at $86,000. The correspondence cov ering the following decade is sparse. The claim filed against the federal government for proper- ty destroyed during the war indicates that Shep- pard's losses were heavy. After James' death in 1870, his family removed to Richmond.  The collection of er and letters"
"Sheppard, James","SHEPPARD, James. Sketch. (4) contains interesting and valuable material. Be- yond determing the fact that the Sheppards were Whigs there is no indication that they were acti vely interested in politics. The accounts of Dr Joseph M.Sheppard and the medical accounts for the Miss. and Ark.plantations reveal something about medical practice of the time. The most valuable letters are those written to Sheppard by the New Orleans and Memphis merchants and those of the overseers written while he was vis- teens Va. The former indicate prices,the condi- on of the cot amount of profit or loss weeh ican Se aes Ay cater, the quan- tity and quality of oods bought by the far Mer."
"Sheppard, James","SHEPPARD, James. Sketch. (5) They also show the close relations between the New Orleans cotton market and the situation in England and Europe. The election of Louis Napo- leon and the Russo-Turkish War were vitally in- teresting to Southern planters. Overseers wrote of weather, the health and behavior of the slave and whether the crops were meeting expectations. The collection is valuable for information about the Sheppard and Empie families, social condi- tions in Va.,and economic and social matters on a Miss.and Ark.plantation priot to the Civil War The numerous Prices current in this collection  are exceptionally “é in themselves."
"Sheppard, James","Sheppard, James     1 item transf. from the Misc. File on 3-352. Tchis is a letter (mar. 1841) by J.S. Copland which deals only with personal and family matters, but it is written on ""Log Cabin and Hard Cider Campaign"" stationery."
"Sheppard, Samuel","Sheppard, Samuel  Papers, 1600's  England  18 - H 2 items 10-5-67"
"Sheppard, Samuel","Sheppard, Samuel. Papers, 1600's. England.     Photostatic copy of the manuscript of Samuel Sheppard's ""The Faerie King Fashioning Love and Honour"" that is in the Bodleian Li- brary; also a transcript of this work by the late Dr. Roberta Florence Brinkley."
Sheppard Brothers,"M-se97-5se99  Sheppard Brothers — Letterpress Books, 1879-1883 Edgefield, Edgefield Co., S. C.  5-17-58 3 vols.  (See also bound vol. cards)"
Sheppard Brothers,"Sheppard Brothers Letterpress Book, 1879-1880 Edgefield, Edgefield Co., S. C. 96 pp. Boards 21 1-2 x 26 cm. 5-17-58"
Sheppard Brothers,"Sheppard Brothers Letterpress Book, 1880-1881 Edgefield, Edgefield Co., Ss. C. 94 pp. Boards 21 1-2 x 26 cm. 5-17-58"
Sheppard Brothers,"Sheppard Brothers Letterpress Book, 1883 Edgefield, Edgefield Co., S. C. 52 pp. Boards 21 1-2 x 27 cm. 5-17-58"
Sheppard Brothers,"Shepperd, Augustine Henry  Papers, ca. 1824-1850  Surry Co., N. C. and Washington, D. C.  Section A 3 items  3-7-58"
"Shepperd, Augustine Henry","Shepperd, Augustine Henry. Papers, ca. 1824- 1850. Surry Co., N. C. and Washington, D. GC. @ items. Sketch.  This collection contains business letters by Augustine Henry Shepperd (1792-1864), N. C. Representative and U. S. Representative from N. C. The first. is an appeal for re-     election to the N. C. House of Representatives. The second, May 25, 1850, discusses patents and mentions a Prof. Rogers:of the Smithsonian  Institute."
"Sheridan, Philip Henry","Sheridan, Philip Henry  Papers, 1867  V. p. Section A  10-7-69"
"Sheridan, Philip Henry","Sheridan, Philip Henry. Papers. v. p.     Philip Henry Sheridan (1831-1888) was graduated from West Point in 1853 and spent his entire career in the U. S. Army. After his reputation was established during the Civil War, he held several positions and in 1884 succeeded William T. Sherman as commanding general of the  Army.  The letter comprising this collection was written by Sheridan during his tenure as commanding general of the Fifth Military"
"Sheridan, Philip Henry","Sheridan, Philip Henry 2 District in 1867. He wrote to recommend James McCulloch for a job in the quartermaster's department in San Antonio, Texas."
"Sheridan, Richard Brinsley","Sheridan, Richard Brinsley, 1751-1816.  Papers, 1783-1788 and nede  39 itemse  Dramatist and parliamentary oratore  NoteS, notebooks, and printed material with marginalia regarding the administration of Warren Hastings as governor-general of India and his subsequent impeachmente Most material is undated, and many items are fragmentarye Many pages are written in Sheridan's hand, including some bearing the heading, ""My Speeche"" Frequent reference is made to the Begums and the Nabob of Oude in preparation for Sheridan's parliamentary speeches against Hasti ngse Numerous notes written by Sh eridan in the margins of letters an da ezin tes cherace"
"Sheridan, Richard Brinsley","Sheridan, Richard Brinsley, 1751-1816.4  Papers, eee (Card 2) reveal his arguments against Hastings and his treatment of the Begumse  le Hastings, Warren, 1732-1818. 2. Political oratory--Great Britain-- History--18th centurye 3e India-- History--British occupation, 1765-1947~-  4-e Colonial administrators—-India-—- History--i8th centurye 5e Great Britain-—-Colonies——-Administration-- History--18th centurye  i4 NOV 91 24778371 NDHYme"
"Sherman, John","Sherman, John  Papers, 1860-1880  Mansfield, Richland Co., Ohio Section A 3 items  2 items added, 3-31-67 2-29-60"
"Sherman, John","Sherman, John. Papers, 1860-1880. Mansfield, Richland Co., Ohio     This collection contains two letters by John Sherman about politics; and a newspaper clipping of a letter by Jeannette P. Nichols of the Library of Congress about the Sherman collection  there.  Sherman writes from Washington, D.C. on Dec. 26, 1860, about Abraham Lincoln, A.H. Stephens, and the political situation. He says that he objects to the addressee's plan of having the presidency alternate between the North and the South. If the right Ye secession is ever"
"Sherman, John","Sherman, John 2 established, our nationality will be destroyed, If the Southern states run from a constitution- al victory, a civil war will result. Souther- ners demand that conservative Republicans sur- render their honor, a thing Sherman would never do. Ipncoln was barely elected. He must be the President of all the U. 8., unless the people acquiesce in peaceable separation, or war will ensue,  On the back of this letter is a note of Dec, 51, 1860, by C. Dz Meigs, to whom the letter is addressed, He may be Charles Delucena Meigs"
"Sherman, John","Sherman, John 3 T1752-1669), NH. -D. See D. A. B., XIT, BO03- 002,  He explains that he had not proposed the select- ion of presidents from alternate:isections, He had wanted to know if Sherman would offer to accept a nomination of Stephens for 1864. Sherman writes on June 12, 1880, to W. L.  Ferrald about the conduct of the Va. delegates to the Republican National Convention of that year.  2 items added, 3-31-67: A list of the founders of the Metropolitan Club of Washington"
"Sherman, John","Sherman, John 4 DeC., and a letter of Nov. 6, 1580, from Sherma to Attorney General Charles Devens concerning  the closing hours maintained in the Treasury Department building."
"Sherman, William T.","e Secte  Ay  OCsIIsi, 6th 16:C, 6th 17:c (12-5-80) Sherman, William Te (William Tecumseh), 1820-1891.  Letter, 18756  i iteme  UeSe Army generale  Letter from Sherman to’ General Orville Elias Babcock, Secretary to President Grant, regarding Sister Angela Gillespie and her request to President Grant to be in charge of ""the Hospital at Chicagoe""  Unprocessed collectione Cataloged from accession recordse  Addition to William Te Sherman Papers, 1861-18884  ee  . 18981201 #40421933 NDHYme SEE NEXT CRD"
"Sherman, William T.","e Secte  As  OCSIIs1l,y 6th 16°C, 6th 172C ( 12—5-80) Sherman, William Te (William Tecumseh), 1820-1891. Letter, eco (Card 2)  le Sherman, William Te (William  Zeoungeh je 1820-10 * 2e Babcock,  Crville Elias, 1835-1884-e J. Gillespie, Angela, 1824-1887. 4e Grant, Ulysses Se (Ulysses Simpson), 1822-1885e Se United Statese Army-- Officers-——-Correspondencee 6¢e United States—-History-—-Civil War, 1861-1&65--  Hospitalse cs  19981201 #40421933 NDHYme"
"Sherman, William Tecumseh","Sherman, William Tecumseh Papers, 1861-1888 CP New York, N.Y.  Section A; 9 Picture File SE SHEF L “AF LIST 1  3-15-52  ] Following See also LOld VW LELS  sketch  items  item added, 4-21-52  item added, 8-12-57  item added, 10-23-57 item added, 12-3-57  items added, 2-7-64"
"Sherman, William Tecumseh","Sherman, William Tecumseh Papers, 1861-1898  New York, N.Y. Section A}3 1 item added, 3-31-67 Picture File 1 item added, 1-25-73 SEESHELFLIST 1 item added, 12-3-73 3-15-52 3 items added, 3-13-75  Shermen ketch."
"Sherman, William Tecumseh","Sherman, William Tecumseh. Perners, 1864-1888 New York, N.Y... -°     contain a photostat of the telegram from Sher- man to Lincoln presenting him Savannah as a Christmas gift in 1864; a photostat of Lin- coln's reply to that telegram in which he does  not neglect to mention the contribution of Gen. George H. Thomas to Sherman's success in Ga.3;:a letter of 1875 by Sherman giving per- mission for his name to be used by the Wesh- ing National Monument Association; a letter from Sherman to Gen. W.S."
"Sherman, William Tecumseh","Sherman, William Tecumseh. 2 Hancock in 1878 expressing regret that Hancock cannot accompany him and others to West Point; and a-letter of 1888 from Sherman to Leighton, perhaps Geo. E., in which he states that in 1843-44 he was stationed at the U.S. arsenal in Augusta, defends his policy toward the     South during the Civil War, and places the en- tire blame for the war on. that section, but wishes the ""new generation"" of Southerners  all the happiness possible ""in their new and  improved condition."""
"Sherman, William Tecumseh","Sherman, William Tecumseh 3 l item added 4-21-52. This is a letter from Sherman to Henry L. Shepard stating that  he has no intention of writing or helping  write a history of the Civil War. item added 8-12-57--certificate of member-  ship of Major Samuel J. Wilson, who had served with the 10th Ill. Vol. Infantry during the Civil War, in the Society of the Army of the Tennessee, which was organized in Raleigh, N. C., April 25, 1865. This appointment was made on Oct. 15, 1874 by Wm. T. Sherman, president of the society. Missing C-R-8"
"Sherman, William Tecumseh","Sherman, William Tecumseh x     1 item added 10-23-57 is an order of Sept. 11, 1864, to various engineers concerning the defenses around Atlanta, Ga.  l item added 12-3-57: A certificate on Gen. Sherman's commutation of quarters and fuel.  2 items added 21-7-6), pertain to Captain William Emerson Strong of the 2nd Wisconsin, (afberwards the lron Brigade) in 1861, when he was serving in W.T. Sherman's brigades the 3rd. brégade, Tyler's Division. Missing , 68-87"
"Sherman, William Tecumseh","Sherman, William Tecumseh be  Ll item added, 3-31-67: A list of officers whose quarters and fuel were commuted (Feb. 28, 1869). Sherman's name heads this list.  1 item added, 1-25-73: Letter dated July 6, 1885, from Sherman to his former aide, Col. John Eaton Tourtellotte, In it he discussed his brother John's role in politics, a family     reunion, and a reunion of the Sherman Brigade. 1 item added, 12-3-73: Letter of Mar. 27,  1869, addressed to Benjamin Hazard Field of New  York in response to Field sending him a check"
"Sherman, William Tecumseh","Sherman, William Tecumseh  for $37,000. Sherman says this is the most money he has ever possessed, although he has handled vast sums of money that belonged to others. He mentions that his family will not be in New York until near the end of April.  3 items added, 3-13-75. One item of Decem- ber 24, 1864, signed by Sherman's aide-de-camp is a pass for a clerk at the headquarters of the Military Division of the Mississippi in Savannah to move freely through the city until further orders, On January 10, 1886, Sherman wrote to"
"Sherman, William Tecumseh","Sherman, William Tecumseh 7 William Scoville Case and denied having writ- ten any poetry, but revealed an interest in it, In a letter of July 22, 1889, to John Eaton Tourtellotte, Sherman mentioned a recent visit to Denver for a Fourth of July celebration and plans to attend an upcoming meeting of the Army of the Tennessee in Cincinnati, although he was becoming weary of all these annual reunions of Civil War organizations from com- pany right on up to corps."
"Sherman, William Tecumseh","Sherman, William Tecumseh  FOR INFORMATION ABOUT THIS COLLECTION OR ADDITIONS TO THIS COLLECTION, PLEASE ASK A STAFF MEMBER TO CONSULT THE ACCESSION RECORDS."
"Sherman, William Tecumseh","Sherman, William Tecumseh Papers, 1863-1869 New York, New York Co., N. Y.  Dalton Cab. 1 5 items and 1 volume  Part of the Harry L. and Mary K. Dalton Collection  11-15-83  ‘ Pe ee aiS¢"
"Sherman, William Tecumseh","Sherman, William Tecumseh. Papers. New York, New York     The first letter in this collection was written by General William T. Sherman to Confederate General William H. Jackson from camp at Jackson, Miss., on July 20, 1863. General Jackson was near Brandon, Miss. The  letter outlines the procedure for exchanging prisoners between their two commands. It also reveals a gentlemanly attitude by Sherman to- ward the Confederate General."
Sheffield Manor,"Sheffield Manor Records, 1667-1808 Sussex, England  18-H  6-4-54  rowsfetred te tre Eo  Olice wm Eralas }"
Sheffield Manor,"Sheffield Manor. Records, 1667-1808. Sussex County, England, 4 vols, Sketch  This is a collection of court and survey records of the Manor of Sheffield in Sussex County, England. The first and third volumes are transeripts of the proceedings of the Courts Baron held in this Manor from 1667 to 1803. These records are in Latin down to 1731     and in English thereafter. The fourth volume is a transcript of a survey of the Manor of Sheffield.  Volume two is an index to the records from 1667 to 1775 in volume one. Volume three from  2 Collection tranate ried,"
Sheffield Manor,"Sheffield Manor, 2 1775 to 1803 has its own index in the back of the volume. These indices furnish a good indi- cation of the subject matter of the many legal dacuments and reports in the record books:  the registration of a death, orphans committed to guardianship, the inheritance of property, estates and their settlement, the transfer of     property by ""surrender"" and ""alienation,"" land grants from the lord, the admission of new citizens to the Manor, the settlement of rents to be paid, alienment by marriage, warrant to  = (sllection +ransKerred-"
Sheffield Manor,"Sheffield Manor 2 vacate conditional surrender, apportionment of quit rents, permission to enclose the lord's waste and fines for enclosing it without per- mission, prosecution for incroachment, de- faults in labor, acknowledgment of payment of debts, and licenses to cut timber, to carry and take hay and straw, to let, and to repair a house. Most of the proceedings deal with the transfer of property.  Volume four is a Survey of the Manor of Sheffield. This volume is a copy made in 1808  @~ (Collection transfetted"
Sheffield Manor,"Sheffield Manor  of a survey which was made between 1571 and 1618 while the manor was owned by Lord Buck- hurst. The introduction to the survey includes a brief-history of the manor. The survey shows the amount of land belonging to each free- holder and each copyholder by parishes and the amount of tax paid per year. It also describes several larger estates called ""Gemeanes"" which are leased by the owner of the manor over a period of years; these brought in most of the revenue. There is a description of the parson- age and glebe lands of the Rectorie of Fletch-     Collect Len Leanstes red,"
Sheffield Manor,"Sheffield Manor Bis inge with the annual rent. The last few pages  of the Survey cover royalties, customs, and privileges of the manor. A rough computation of the survey shows that there were about 2500 acres in the manor as described inthe Survey and the annual income from this land was 180     pounds.  This collection is of particular interest to the student of English history, especially as it relates to the manorial system, to the student of English law as it developed in the Courts Baron, and to the person interested in  e Collection Lronsecred,"
Sheffield Manor,Sheifield Manor 6 English genealogy. The indices and the Survey have special interest as they provide infor-  mation on various genealogies in this particu- lar county.     @ Collection transe  ferred.
"Sherman, William Tecumseh","Sherman, William Tecumseh Zz     Sherman's draft of Special Field Order No. 13, sets forth seven rules for trade between the people of the South and the U. S. Army. Trade, he said, would be ""confined to barter and sale proportioned to the necessary wants of the Army and of the Inhabitants dependent on us for the nessaries of Life."" He names the  towns where trade stores will be permitted and gives specific instructions about trading in cotton. His Special Order No. 65, issued at Raleigh, N. C., on Apr. 27, 1865, announces"
"Sherman, William Tecumseh","Sherman, William Tecumseh     ""a further suspension of hostilities and a final agreement with General Johnston which terminates the war as to the Armies under his command and the country east of the Chatta- hooche.""'’ His instructions to commanders in his army contain stipulations requiring ""scrupulous fidelity"" to the terms of the agreement and acts of magnimity toward the conquered in- habitants.  On Aug. 1, 1865, Sherman writes to a friend he calls Charley that he will help him all he can to secure a place in the Regular Army, the"
"Sherman, William Tecumseh","Sherman, William Tecumseh     reorganization of which awaits the action of Congress. The last letter, Apr. 23, 1869, is an acceptance by Sherman of the invitation to deliver the commencement address at the U. S. Military Academy the following July. Sherman says he will break his rule of ""absolute Silence"" and deliver the address.  The volume in this collection contains a holograph copy (28 pp.) of Sherman's address to the graduating class at the U. S. Military Academy in July, 1869. He stresses the need"
"Sherman, William Tecumseh","Sherman, William Tecumseh 5     for officers to possess the highest ideals of manhood, courage, and dedication to their chosen profession. He gives his view of the requirements for advancement in the U. S. Army, and of how an officer gains the knowledge of men and of how to organize, provision, adminis- ter, and lead an army that is essential for  success in battle. He covers geographically much of the United States in describing the  training grounds for officers, stressing the need for physical as well as moral and mental  fitness."
