Name,Text
"Harden, Edward","Harden, Edward \. Harden, Edward  nae”     Account Book, 1826-1828, Athens, Georgia  81 p, Boards and Calf. 12 x 19 cm, June 14, 1939,"
"Harden, Edward","Treasure Koom  Harden, Edward Harden, Edward     Account Book, 1831 - 1864 ) Athens, Ga.  88 pp. Boards 40x16 cm.  JUL 7 1941"
"Harden, Edward","Harden, Edward     Harden, -Edward Account book. 1837-1841. Athens, Georgia  MAY 2 In"
"Harden, Rdward Harden","Harden, Rdward Harden, Edward     Account Book, 1843 Athens, Ga.  25 pp. Paper 19 x 12 cn,  Also contains accounts (in pencil) of Mary Harden to 1876.  7-21-58  w tt ~~ GUIDE"
"Harden, Edward","Harden, Edward     Harden, kdward  Bank Book, 1830  Athens, Clarke Co., Ga.  2 pp. Paper 7-21-58  GUIDE  16 x 10 cm."
"Harden, Edward","Harden, Edward  Harden, Edward     Catalogue of Law books Athens, Georgia. November 1, 1834.  a ev  MAY 23 1934"
"Harden, Edward","te jObe~ reassure \"""""" Haraen, Hawara )\- 1637 Harden, Edward lg     Commonplace Book. 1843-1887, Athens, Georgia  280 pp. Boards & C  AUG 3 0 1940"
"Harden, Edward","Treasure R oom Harden, Edward  Harden, Edward     Commonplace Book, n.d. Athens, Ga.  34 pp. - Paper 30x20 cm.  JUL 7 YU"
"Harden, Edward","yarden, Edward ws Harden, Edward     Diary. 1835, Athens, Georgia  93 p. Boards and leather, June 14, 1939,"
"Haruei ,","Haruei, baward Harden, Edward     Diary, 1839, Athens, Georgia  116 p. Boards and calf. 10 x 15 cm, June 14, 1939,"
"Harden, Edward","Harden, Edward Harden, Edward     Diary and Account Book, 1834, Athens, Georgia  67 p. Boards and Calf. 16 x 19 cm, June 14, 1939,"
"Harden, Edward","Bressae Room arden, Edward     Harden, Edward, Diary and account book.  Athens, Georgia. 1834-1849  MAY 29 1934"
"Harden, Edward","Treasure Koom c Harden, Edward  Harden, Edward     Diary and account book.  Athens, Georgia. 1835-1836  MAY 23 1994"
"Harden, Edward","A Harden, Edward  Harden, Edward     Diary, accounts, and notes.  Washington, D. 0., 1844.  MAY 23 1934"
"Harden, Edward","Harden, Edward     Harden, Mary Elisa Greenhill Diary, 1853-1883  Athens, Ga.  224pp. Boards 25 x 19 cm.  (used slightly as a commonplace also)  8-9-46 ®"
"Harden, Edward","parden, Hdward     Harden, Edward Legal notebook. 1843  Athens, Georgia  MAY 23 1934"
"Harden, Edward","Harden, Edward ( Harden, Edward     Legal notebook calso other notes,!''’) 1883-18843.  Athens, Georgia. 1842.  3  MAY 28 193"
"Harden, Edward","aareten R°-REward — Harden, Edward     Notebook [Legal]. 1831 Athens, Ga.  23 pp. Paper 32x20 cm.  JUL 7 1941"
"Harden, Edward","Harden, Edward M~ 5328     cHarden, Mary;  Notebook, 1837  Athens, Georgia 59 pp. Boards 26 x 15 cm, 10-11-54  GUIDE"
"Harden, Edward","Harden, Edward     Harden, Mary Elisa Greenhill Notebook, n. d.  Athens, Ga.  158 pp. 32 x 20 cm.  7-7-41"
"Harden, Edward","Harden, Edward     Harden, Mary Elisa Greenhill  Notebook (music, etc.), ca. 1840  Athens, Ga.  5-23-34"
"Harden, Edward","Harden, Edward     [-1652 Harden, William Preston (1821-1885)  Ledger, 1846-1847*  Watkinsville, Georgia[?] *Scattered settlements of later dates. Part of the Edward Harden Papers  8-9-46 Recataloged, 9-14-71 &"
"Harden, Edward","Harden, Edward     Jackson, Asbury Hull  Cashbook, 1868-1872 Cotton Accounts, 1868-1876  Clarke County, Ga. 4O pp. Boards  5-23-34 11-14-63  30 x 19 cm."
"Harden, Edward","Harden, Edward     Jackson, Asbury Hull Commissary Account Book, 4th, 12th, 21st, & 44th Georgia Regiments, Doles' Brigade, 1864-1865  Virginia  112 pp. Boards 14 x.82 cm.  5-23-34 11-14-63"
"Harden, Edward","Harden, “dward Harden, Edward     Receipt Book, 1807-1810  Savannah, Ga.  7L DP. Calf 10 x 15 cm.  AUG 9 ""46  GUIDE"
"Harden, Edward Jenkins","Harden, Edward Jenkins  Papers, 1840-1885  Savannah, Chatham Co., Georgia Cab. 47 99 items 3-19-70"
"Harden, Edward Jenkins","Harden, Edward Jenkins. Papers. Savannah, Chatham Co., Georgia     Edward Jenkins Harden, Savannah attorney and jurist, was born in Bryan County, Ga., in 1813. He read law in Savannah and was admitted to the bar in 1837. From 1845 to 1847 he served as judge of the city court, and from 1861 to 1865  he sat on the Confederate state district court for Georgia. At the time of his death, on April 19, 1873, he was city attorney for Savannah. He is the author of The Life of"
"Harden, Edward Jenkins","Harden, Edward Jenkins  George M, Troup (Savannah, 1859). His son, William Harden, was librarian of Savannah and of the Georgia Historical Society and author of A History of Savannah and South Georgia (2 vols; Chicago and New York, 1913), which contains biographical inf ormation on various members of the Harden family (see vol. 2, p. 1085).  This collection consists of correspondence and legal and financial papers dealing almost entirely with the family's financial affairs and with the settlement of two estates. The"
"Harden, Edward Jenkins","Harden, Edward Jenkins     correspondence from 1840 to 1859 is that of Matilda A. Harden, mother of Edward Jenkins Harden, who became the executor of her estate at her death in 1863. These letters concern attempts to collect debts owed to her and to her estate. Most of the letters after 1860 involve the settlement of the estate of Miss  Mary E. Demeré of Savannah; Thomas H. Harden, brother of Edward Jenkins, was the executor of this estate. Letters for 1840, 1846, and 1863 mention sale and manumission of slaves."
Harden Family,"Harden Family Papers, 1772-1940.  See  Harden, Edward"
"Harden, Sarah P","HARDEN, Sarah P et. al. Letters, 1868-1879,  Henry County, Indiana,  Section A  WAR 1 1 194]"
"Harden, Sarah P","HARDEN, Sarah P Letters 1868-1879 Henry Co,, Indiana Sketch 9 pieces     These are letters from Sarah, John, Mary and Ann Harden of Henry County, Indiana, They are written to their aunt and unde, Sarah and John Hackett, who live somewhere in one of the Caro- linas. Seemingly Sarah, John and Mary are bro- ther and sisters, and Ann is a sister-in-law. The family 1s of the Quaker persuasion,"
"Hardesty, William G","Hardesty, William G, {?- 6444 . Ledger, 1845-1857 Clear Brook, Frederick County (7), Va. 139pp. Boards 314 x 20 cm,  Part of this work was converted into a scrapbook,  9-22-54"
"Hardin, William D.","Hardin, William D, Papers, 1838 (1870-1900) 1946  Fentriss, Pleasant Garden, and v. p. in Guilford Co., N. C.  XIV - E 894 items and 11 vols. 9-9-59"
"Hardin, William D.","Hardin, William D. Papers, 1838 (1870-1900) 1946. Fentriss, Pleasant Garden, and v. p. in Guilford.Co., N. C. 894 items and 11 vols. Sketch.  Mainly business and personal letters, bills, and receipts relating to the business and per- sonal affairs of William D. Hardin and his fami ly, and to the business affairs Of his friend, William Henry Ragan. Actually, most of this collection deals with local matters in Guilford County.  Hardin was Justice of the Peace in Guilford County during much, perhaps all, of the time . from 1878 to 1901. e: he was chairman of"
"Hardin, William D.","2a     mnaroain, Willian D.  The J. P. 's. An active Methodist layman, he served as a church seeretary and as a chairman of a church board in 1895, and was on a commit- tee of the Guilford County Sabbath School Associ ation. Hardin scem for a time to have served on a school board and to have operated retail stores off and on. He was a Masonic Lodge sec-  retary in 1872 and 1875 and perhaps at other times as well. In 1896 and 1898 he was a taxic- list taker in Fentriss, N. C., and was a regis- ter for political elections (time and place unknown). In 1891 and 1895;ihe,was vice-president of the Pleasant Gardens rmer’ s Alliance, No."
"Hardin, William D.","iam Dp. 2b e195, of Guilford County. He was er ee of t the Julian Milling Company of Julian, N. C., in 1899-1900."
"Hardin, William D.","Hardin, William D. rs) G., in 1899-1900. Some correspondence relates to his nephew J. Ernest Hardin, who was secre- tary and treasurer of the same company in 1898. W. D. Hardin's papers reflect his interest in legal affairs, retail merchandising, education, religion, politics, Masonry, flour milling, and farming. Many papers pertain to W. H. Ragan     and Company located in Greensboro, High Point, and elsewhere. Ragan was very active in various business enterprises. His biographical sketch is in the History of North Carolina (1919), VI, 552,  Commodity prices “4 discussed in a number"
"Hardin, William D.","Hardin, William Db, 4 of letters to W. D. Hardin and W. H. Ragan from wholesale merchants and manufacturers in Rich- mond, Washington, Baltimore, Philadelphia, New York, and Boston. A good deal of correspondece mostly business but some personal and Masonic, is exchanged between Hardin and Ragan. The Armfield, Coble, Kirkman, McPherson, Murrow, and Raganfémilies figure in the letters and other papers. Some letters are by Abel G, Kirkman, Guilford County register of deeds,”  In 1859 Hardin writes about his life as a student in the Yadkin Institute (see letter of  May 20, 1874). A mw te Ca. 1864-73; to Lt."
"Hardin, William D.","Hardin, William D. 5 W. D. Hardin of the Confederate Army deals with recruiting teenagers. His brother, C. H. Har- din, of the 5th Regt.of N. C. Cav. writes on Mar. 27, 1865, about the Battle of Hatcher's Run two days previously; Confederate prisoners, horses, and deserters; Federal prisoners; and Gen, U. S. Grant.     Teaching and intoxication, both in N, C., are discussed on April 3, 1870. A letter of Dec, 22 discusses the doings of W. D. Hardin and W. H. Ragan and the excitement about elect- ing a state senator from Guilford and Alamance  counties,"
"Hardin, William D.","Hardin, William D. 6 Ragan writes from New York City on Mar. 16, 1871 about commodity prices there. On May 30 he advises Hardin to sellalarge volume of goods at low prices, On June 28 and at other times he discusses commodity prices in N. C. He seems to have been in the grocery business. in 1871. Several letters deal with Masonic affairs,     randy’ Nov, 14, 1871; Aug. 1, 1872; June l, T874; and July 3, 1880.  Danbury, N. C., is described on Aug. 23, 1873.  Ragan writes writes to Hardin on Dec. 3,  1876, that Sameul J. the Democratic"
"Hardin, William D.","Hardin, William D, 7 Poresidential candidate, has beyond doubt been elected,  A school in Julian, N. 0., is discussed on Mar. 28, 1889.  ‘J. 8. Carr, Sr., president of the Greensboro Female College (now Greensboro College) Associ- ation, writes on July 9, 1890 about the death     of F,. M. Jones, the late college president and his successor, B. F. Dixon,  +he Rev. Mr. J. L. Michaux, a Methodist clergyman, writes on Dec. 19, 1894 about a pro- posed history of his church,  A letter of May, ‘6 lists school book"
"Hardin, William D.","Hardin, William D. 8 prices. Hardin apparently sold such items.  W. C. Smith, Sr. writes on Aug. 13, 1896, to Hardin, applying for a teaching job and furnish: ing the following names as references: E. A. Alderman, K. P. Battle, Sr., C. D. McIver, and G. T. Winston. See also letters by W. C. Rankin (Sept. 7, 1896) and J. L. Burgess (June     30, 1897) dealing with teachers and teaching in N. 6. ‘  N. C. politics is discussed on Oct. 29, 1896 Alfred Moore Scales (1870-1940) writes to Hardin ca. Aug. 30, 1898¢73 about a legal matte relating to the — He discusses on Oct"
"Hardin, William D.","Hardin, William D, 9 I3 and 20 the coming Nov. elections. Hardin is appointed to the committee on challenging for the Plesant Garden precinct. Scales stresses the importance of preventing illegal voting.  J. S. Carr, Sr. writes to Hardin on Sept. 25, 1900, enclosing an announcement of Aug. 25. Carr asks for support in his campaign for the U. S, Senate,  There is a — of an anonymous letter to the Henderson, N. C., Evening Herald of Oct. 1, 1900, relating to J. s- Carr, Sr., the “machine, "" and Marion Butler, Sr.  F, M. Simmons = to Hardin on Oct. 26,"
"Hardin, William D.","Hardin, William D. 10 asking for support in his campaign for the U. 5. Senate,  Dr. T. C. Amick, president: of Liberty Normal College in Liberty, N. C., expounds upon the merits of his school in a letter of Aug. 26, 1902.  Student life in the Oak Ridge Institute (now     the Oak Ridge Military Institute) is discussed on Nov. 9, 1902 and Feb. 21, 1903. The first letter mentions an election at which a Negro was at the polls.  A letter of Aug. 14, ‘discusses student life  in the Undversity of e"
"Hardin, William D.","Hardin, William D. 11  A letter of Sept. 4, 1912, together with its enclosures, deals with motorcycles.  Many of the bills and receipts deal with the merchandising and manufacturing firms with whick W. D. Hardin and W. H. Ragan were connected. They bought much from merchants in Richmond and northward, A number of items deal with guano imported from Peru. There are bills from Liberty Normal College to John Hardin on Oct. 6 and Dec. 1, 1902.  the prices airrent bulletins largely from commission merchants, are from Richmond, Nash-  ville, Baltimore, “oer New York, Cin-"
"Hardin, William D.","Hardin, William D, 12 Cinnati, and Raleigh and Wilmington, WN. GL  The legal papers, running from 1863 to 1920, consist mainly of J. P. summonses; affidavits; executions of judgment; powers of attorney; indentures; contracts to build and repair a stock fence between Randolph and Guilford coun- ties, N. c.; and deeds. A legal paper of July 2, 1901, together with several undated items, relates to an alleged assault upon a Negro.  The eight election papers deal with miscel- laneous election matters. An item of ca. 1884 c?, lists congressional and other candidates.  The 15 items of “oe matter include an"
"Hardin, William D.","Hardin, William D. 15 T6870 circular of the New Garden Boarding School, New Garden, N. C.; and 1882 notice of a Guilford County Republican meeting; an 1889 act of the N. C. Gen. Assesibly to incorporate the Farmers' State Alliance of N. C. and sub-alliances; an 1894 program of the Guilford County Sabbath School Association; a pamphlet on tuberculosis by Drs. G. G. Thomas and R. H. Lewis, Jr. (ca. 1900-73); and an undated pamphlet, - ""Working Bulletin for Alliances,"" by S. B. Alexander, president of the Farmers’ State Alliance of N. C.     The 11 bound a ar from 1879 to"
"Hardin, William D.","Hardin, William D. 14 1924. Four are registers for common school districts in Guilford County (1879-1895). John Hardin and Anna E, Hardin each has a school notebook in the collection. There is a minute book (1891-1892) of the Pleasant Garden Farm- ers' Alliance, No. 2195, of Guilford County, together with 13 related items.     A poll book (1924) for Fentriss Precinct, Guilford County, contains some related items. A miscellaneous volume contains a list of names. An undated notebook contains a list of books. There is another volume (1886-1889) used as a daybook and time |"
"Hardin, William D.","Hardin, William D. 15 The miscellaneous items include an essay on advice to the young; several poems, oneof which is a song; a list of students; and two undated arguments for woman's rights. Some Civil War items show that C. H. Hardin was employed in the manufacture of arms in the Alamance Armory, Guilford County, and was thus exempt, for a     time, from service in the Confederate Army. An item of Mar. 20, 1870 deals with the proposed building of a Masonic hall."
"Hardin, George W.","Hardin, George We, de 1922  Papers, 19 2-1924 and nede  47 itemse  President, Johnson City [Tenne] Shale Brick Corporatione  Chiefly Letters and telegrams of condolence to Hardin's wife Nola upon his death on May 19, 1922. Correspondence from Church of Christ  and Christian Church ministers, business and professional men, officers of religious organizations, friends, relatives, and the President of Milligan Colleges HeJe Derthick, all  reflect Hardin's devotion to the Christian Church in Johnson City» Tenney, and to Milligan Collegee An unsigned iett® er in 1922 concerns Derthick's wo rk at the College and 20 ocT 90 22540403 NDHYme SEE NEXT CRD"
"Hardin, George W.","Hardin, George We, de 1922  Papers, eee (Card 2) the effect of Hardin's death on ite Also includes a resolution and clipping about Hardin's deathe  ile Milligan Collegee 2+ Christian Church (Disciples of Christ)-- Tennesseee 3e Christian lifee 4-6 Sympat hy-——Religious aspects-- Christianitye 5e Commitment to the churche 6e Derthick, Henry Je  20 OCT 90 22540403 NDHYme"
"Harding, Ezekiah And John","HARDING, Ezekiah and John  Letters and Papers, 1852-68  Clover Depot, Virginia  Section A 40 pieces"
"Harding, Ezekiah And John","HARDING, E, and J. Pagers 1852-68 Clover Depot, Halifax County, Va; 40 pieces Business letters of the mercantile firm of E, & J. Harding of Clover Depot, Va., and of its branch firms or business interests at Dantille, Pleasant Grove (Lunenburg County) and Moore's Ordinary, Va. All transactions seem to have been on a 3mall scale. Included are invoices     for liquor bought by the Harding firm, a few dealers' circulars, and a Gonfederate soldier's letter (apparently not from a member of the Har- ding family) dated Jan. 17, 1865, mentioning  scarcity of food, low morale of the soldiers,"
"Harding, Ezekiah And John","HARDING -2- and their hope that the fall of Fort Fisher would soon end the war,"
"Harding, Samuel","Harding, Samuele Outlines of sermons, 1855-1857. i item (272 De )e Texts of sermons written in shorthande Topics, scriptural texts, and locations written in standard _. Englishe  Primitive Methodist clergyman in Englande  Sermons delivered during Harding's service with the Chatham Mission, 1855- 1856, and the Ramsgate Mission, - 1857, both in Kent, Englande Locations mentioned include Milton Regis, Chatham, Babchild, Barrow Greeny, Chestnut Ste, Rainham, Ramsgate, London, North wood, and Birchingtone  Sermon htt as Ss vary and include preaching revivals and love  28 MAR 89 {5465129 NDHYme SEE NEXT CRD"
"Harding, Samuel","Harding, Samuele Outlines of sermons, eee (Card 2) feastse  1e' Primitive . Methodist Church (Great Britain )-—-Sermonse 2+ Love feastsSe Je Revivals--Englande 4. Kent ( England )--— Church historye  28.MAR 89 19465129 NDHYme"
"Hardy, A. J., and William B. King","118 Hardy, A. J., and William B. King Letterbook. 1834-1843  Turner's Cross Roads, Bertie county, North Carolina  NOV5 1933  (Haray and King were merchants, }"
"Hardy, Sir Gathorne Gathorne-, First Earl of Cranbrook","Hardy, Sir Gathorne Gathorne-, First Earl of Cranbrook  See Gathorne-Hardy, Sir Gathorne, First Earl of Cranbrook"
"Hardy, George C.","Hardy, George Ce  Memorandum Book, 18706  1 iteme  Plantation memorandum book containing records of the planting and harvesting of vegetables and the picking and sorting of cottone Lists of names of plantation hands and extra hands are included along with the weights of cotton they pickede  1e Agriculture-—History--1 9th centurye 2. Agriculture--Labor productivity. 3e Plantation workerse 4. Cotton growing--Southern Statese  15 JAN 93 27257296 NDHYme"
"Hardy, Haywood And W. D.","Hardy, Haywood and Pavers, 1862 Martinsburg, Virginia  Section A 2 items"
"Hardy, Haywood And W. D.","Hardy, Haywood and W. D.. Papers, Martinsburg, Virginia. 2 items,     Letters of Haywood and W. D. Hardy, both tf the Confederate army, to their father. Other than local gossip, one letter concerns feeling at home over re-enlisting; the other is written after the battle of Sharpsburg."
"Hardy, Thomas","Hardy, Thomas Papers, 1904-1929 Dorsetshire, England  18-E 2 items 1 item added, 10-21-71 9-11-35"
"Hardy, Thomas","Hardy, Thomas. Papers. Dorsetshire, England     Thomas Hardy (1840-1928), English novelist and poet, was born near Dorchester, Wessex, England. His father was a stonemason and not able to send Hardy to a university. Hence he was placed with an architect in 1856, and con- tinued in this occupation for several years.  From 1872 to 1895 his novels were written. Af- ter that he devoted himself to drama and poetry. He was the recipient of many honors and was buried in Westminster Abbey."
"Hardy, Thomas","Hardy, Thomas 2 “Notes on ‘The Dynasts’ in four lettets to Edward Clodd"" are the proof sheets of a pri- vate edition of twenty copies printed fon Thomas J. Wise, and contains various comments by Hardy on his composition of that drama, over a period of years. The autograph letter to Edward Clodd comments on the first days of the First World War. 1 item added, 10-21-71: On Oct. 29, 1904, Edmund Gosse wrote about the death of poetess Laurence Hope and noted Sir Frederick John"
"Hardy, Thomas","Hardy, Thomas 3 Pollock, Fourth Baronet, and his article on ""The Dynasts,"" and the death of a Mr. Gifford."
"Hardy, William E.","Hardy, William E., Papers, 1783-1894  whint MT ehh a ayointon, ewoerry  Section A GUIDE 62 «2 Atems added 11-5-51"
"Hardy, William E.","Hardy, William E, Papers, 1783-1894. May= binton, Newberry District, S.C. 62 items     Papers of William E, Hardy, Maybinton, S.C., including indentures, personal letters, an account book, bills, Civil War letters, busi- ness letters, notes from militia, laws of N.C., and 4 broadsides. Included is one letter from Ebenezer Academy, S. C., 1823, and one from Salem, 1850. The Civil War letters are written from camps around Richmond and Petersburg, Va.  2 items added 11-5-51. These are contracts between Wm. E. Hardy and some freedmen,"
"Hare, Robert","Hare, Robert Papers, 1825-1851 Philadelphia, Philadelphia Co., Pennsylvania  Josiah C. Trent Collection in the 5 items History of Medicine--. Div.  4-8-60"
"Hare, Robert","Hare, Robert Papers, 1825-1851. Philadelphia, Philadelphia Co., Pennsylvania. 5 items, Sketch Robert Rare (1781-1858), was an eminent  American pioneer chemist, professor, and writer on scientific and moral subjects. A clipping from the Philadelphia North American, May 18, 1859, summarizes his scientific career and his interest in spiritualism. An 1825 letter refers        to the sudden death in Providence, R. I., of the Philadelphia writer Robert Waln (1794-1825), He refers in 1851 to his various works and “cutts"" for them. See Nicholas Biddle Papers for additional Hare letters."
"Hare, Robert Hugh","e 2nd 642A Hareyg Robert CS peg | hla  Diaries, 1891-1896  6 volse  Lieutenant in the British Royal Artillery serving in Indiae  Diaries kept by a British Lieutenant during 6 years of active duty on the North West Frontier of Indiae The author recorded routines of military life, route marches, shooting matches, gymkhanas, dances, hunting; and social engagementse He also kept notes on expenditures and Lists of letters sent and receivede Many entries mention theatrical productions in which Hare participatede The diaries are recorded in 6 volumes of Letts's Pocket Diary and 48 anac for respective yearse The 895 volume includes  OS APR 98 $s529396 NDHYme SEE NEXT CRD"
,"SUXHOGN 9G6E6TEBE 86 adv 60  ®@st1 AZCUEL a) FN-——AlI2017F2IV  FO ZUSwBTBeW 1eAOR CAWSY CUTLRTIG }BOTD  °L esetsetTd sesuep °9 °4£529117F24V  FO yzVUeWTSey 71VAOY eAUTY CUTER FIG  3eeTD °S *SE6RIT ‘uatedwea 1°33T4D  —-AJOZSTH—-—OFPUL °F *szoedse y4}1eeq——  LOUGTI-SOLT *UoTzednov0 YsSTt}tTyq——AJ034STH  —-BTPUL °— “*LPGE-SILT ‘Uotzedns90  4S 3 F2qg—-—AJO3RSTH-——UTPUy °F esmozSsno pue est 1eFI0Sg-—eTpuy ut ate rr - pra@sx  eAZeZUSeSAP pue SJeAaeZ FO S3zNnoq peprsooes esse seftszue 1es8eAeS UI e809303 FOET1WAEA 1°32 TUOD 94? YREM SITAJSS S,eseH SuTsnp Us}, ,TIM SOTs US FoTFuq (t Pte) eee SseTseTC *OSGT-LO8T ‘usnH z4eqoy Seseg Vi~9 PUT °SSN"
"Harel du Tancrel, Augustin","Harel du Tancrel, Augustin Papers, Bn. a. Paris, France  Josiah C. Treht Collection in the 1 item History of Medicine--M8S. Div.  4-8-8680"
"Hargadine, Robert W.","Hargadine, Robert W. Pspers, 1867-69 Philadelphia, Pa"
"Hargadine, Robert W.","Hargadine, Robe W Papers, 1867-69. Philadelphia, E 13 items, Sketch     Letters and papers of Robert W. Hargadine, physician ef Philadelphia, Pa., containing ""The rough notes of a thesis presented to the facul- ty of the University of Pennsylvania for the degree of Doctor of Medicine,"" March 1, 18  67 . OUT ys Hargadine's appointment as a resident physician, ary oe Hospital, Philadelphia, 1867; the informative letters from his class- the Univ. of Pennsylvania, Dr. William"
"Hargadine, Robert W.","et Scene Robert W Sy h. 2  We &     M. Nickerson, now an assista 3ureZeo  on on the U. g., } Pensacola; le rs fron his rother,  Robert Hargadine in St.-Louis issouri; and from his young cousi writing from Berlin European tour.     Hargadine,  1 in 1869 describing her"
"Hargrave, J.H.","= 1654. 1668 * Chapel  Hargrave, J H &  Accounts and Day books. 1852-1892 Pittsylvania County, Virginia June 14, 1939. 15 vols.  [See following cards for seperate items. ] Records of a general merchant and manufact-  urer of plug tobacco. Records show shipments  of various brands."
"Hargrave, J.H.","Chanel HARGRAVE,J.H.  Day Book 1859-1869 Pittsyivania county Va.  507 pp Calf and Boards 22 x 32 cm. General Merchant's accounts.  jun 14 1939"
"Hargrave, J.H.",": * HARGRAVE,J.H. Day Book 1860-1862  Pittsylvania county Va.  4  569 pp Calf 26 x 39 1-2 cm. (General Merchant's accounts)  accessioned  MAR 17 1939"
"Hargrave, J.H.",": [ HARGRAVES,J.H.] Day Bowk 1860-1865 Pittsyluania county Virginia  412 pp Calf and Boards 17 1-2 x 28 e¢ (General merchant's Accounts)  accessioned MAR 17 1939"
"Hargrave, J.H.","""Chapel: EF HARGRAVE,J.H.  Day Book 1880 county Va. and Boards 25 XxX $5 1-2 cm.  Acoounts.  JUN 14 1939"
"Hargrave, J.H.","‘Chapel HARGRAVE, JH.  Day Book 1884-1886  Chatham, Pittsylvania county Va.  rm eae and Calf 20 x rchant's account.)"
"Hargrave, J.H.","- HARGRAVE , J .H. Dey Book 1888-1892 Chetham Pittsylvania county Virgt  432 pp Boards and Cloth 23 x 36 (Tobacco merchant's accounts: )  F_1bs9  nia  CMe  JUN 14 1939"
"Hargrave, J.H.",HARGPAV  Pittsylvania cunty Virginia Calf and Boards 21 x accounts. )  JUN 14 1939
