Name,Text
"Alderetis, Doctor","Alderetis, » Doctor. Anotationes, Anothomia Mundini, Apr.18,153  Holo. Contemp. Copy. 150 pp.  Bound with Arnaldus de Villa Nova, Ano-  thomia Mundini, 1531.     Josiah C. Trent Collecfion in the History of Medicine- MS.Div.  4-8-60"
"Alderman, Jacob O.","Alderman, Jacob Oc  Papers, 1884-1906.  29 itemse  Clergyman and college professore  Chiefly correspondence, 1889-1906, between Alderman and his wife, Mary Me Aldermane Letters mention family and church topics and were written from various locations in North Carolina, including Cooper, Raleighy Dunn, Durham, Hendersonville, Concord, Graham, Hillsboro, Edenton, and Durhame Included also is a brief journal for July 1904, which Alderman sent to his wifee  1. Family Life--North Carolinae 2e Baptists-- Clergye 3. Occupation: C lergy--North Carolinas  02 APR 87 15477081 NDHYme"
"Alderman, William","Alderman, William  Papers, 1853-1864  Cumberland Co., N. ¥.  Section A  4-21-62"
"Alderman, William","Alderman, William. Papers, 1853-1864. Cumberland Co., N. C.     This collection contains three legal papers relating to the purchase of slaves by William Alderman. One of these purchases was a transaction between Alderman and John G. Gilmore, also of Cumberland Co., N.C.  There is a receipt for taxes paid by Alderman to the Confederate States Tax Office, 22nd District, North Carolina (Oct. 22, 1864).  In an undated letter to Alderman, William Vink discusses the progress of his process"
"Alderman, William","Alderman, William rt     for making paper from palmetto wood. Vink, writing from Ellicotts City, Md., states that he has convinced some manufacturers of the merits of his process and must only determine the extent of the probable supply of palmetto wood before he sells his patent and production of the paper is begun."
"Aldrich, Perlsy Dunn","Aldrich, Perlsy Dunn, 1863-1933.  Letters, 1914-1922.  37 items.  Vocal teacher and author, Lived in Philadelphia, Pas  Chiefly from Leopold Stokowski, conductor of the Philadelphia Orchestra, these Letters document the development of the orchestra chorus, the Stokowski Medal, and sarly vocal recordings with the Victor Talking Machine Coe  20 JAN 88 17363906 NDHYme SEE NEXT CRD"
"Aldrich, Perlsy Dunn","Aldrich, Pertey Dunn, 1863-1933. Letters, 1914-19226. see (Card 2).  1e Conductors (Music )-- Correspondence s 2»e Symphony orchestras —--Pennsylvaniae 3s Philadelphia Orchestrae 4- Victor Talking Machine Companys 5-e Choirs (Music )-- Pennsylvaniaece Ie Stokowski, Leopold, 1882-1977. IIe Place: Pennsylvania-- Philadelphia County-—Phi ladel phia.  20 JAN 88 17363906 NDHYme"
"Alexander, Adam Leopold","Alexander, Adam Leopold  Papers, 1785-1909  Washington, Wilkes Co., Georgia Cab. 81 361 items  1940"
"Alexander, Adam Leopold","ALEXANDER, Adam Leopold. 1785-1909.Letters and , Papers. HesSinuhon, Georgia Sketch 361 pieces Dr. am Alexander (1758-1812), was born at Inverness, Scotland. He was educated at the University of Edinburgh; studied medécine;  migrated to America and served as surgeon in the Continental army. In 1802 he married Louisa  Frederika (1777-1846), daughter of Egydius Heinrich Schmidt of Stuttgardt who was engaged in the cotton business in Charleston."
"Alexander, Adam Leopold",". Alexander, Adam Leopold (2) Adam Leopold Alexander (1803-1882), was born  at Sunbirry, Ga. He attended Yale(1818-1821) and momentarily considered studying medicine, but for some reason decided onz law although he apparently never practiced. While at Yale, Alexander met Sarah Hillhouse, orphan daughter of Felix and Sarah (Hillhouse) Gilbert, who was then a student at Hadley, Mass. Immedtately after their marriage in 1823, Adam L. Alexander | and his wife lived at SunbéPry. However, within"
"Alexander, Adam Leopold","Alexander, Adam Leopold (3) a a short time they moved to Wilkes county, Ga, to @ large plantation which his wife inherited from her father and lived there for the remainder of their lives. Adam L. Alexander never entered public life. He was primarily engaged. in farming although he was interested in and held stock in several banks, railroads, and mercantile houses. Adam and Sarah Alexander were survived by ten children. Louisa Frederika (1824-1895), married Jerémy Teavers Gilmer, who was graduated from  CeRneis"
"Alexander, Adam Leopold","Alexander, Adam Leopold (4) West Point in 1839; fought in the Mexican war; was made Lieutenant Colonel C.S.A. in 1861 and Chief Engineer of the Confederate States in 1862 After the war he was conneeted with the Mutual Life Insurance. Co.  Sarah Gilbert (1826-1897), married Alexander Robert Lawton in 1845. Lawton was educated at     West Point but resigned in 1841 to join the Savannah bar. In 1861 he was commissioned Brig. General and became Quartermaster General 1863-"
"Alexander, Adam Leopold","Alexander, Adam Leopold (5) ney 865. After the war he was a member of the law  firm of Jackson, Lawton, and Basinger of Savan- nah. He was appointed minister to Austria 1887- 1889.  Edward Porter (1835- ) was graduated from West Point. He resigned from the Engineer corps to enter the Confederate service as Captain of     Engineers. He served in the Army of Northern Virginia until the surrender at Appomattox as chief of Ordnance, Brigadier Gneral of Artillery"
"Alexander, Adam Leopold","lexander, Adam Leopold (6) and Chief of Artillery in Longstreet's Corp. He  was professor of Mathematics and Engineering at the University of South Carolina, 1866-1870. Later he and his father were interested in the cotton oil business, in cotton manufacturing, and in railroads. Edward Porter was general Manager and president of several. railroads inc-  luding the Louisville and Nashville and Central of Georgia and Government director of the Union Pacific railroad. From 1902-1905 he was engineer"
"Alexander, Adam Leopold","&lexander, Adam Leopold (7)  arbitrator of the boundary survery between Nicaragua and Costa Rica. Edward Pobter married first, Betty Jacqueline, daughter of A.H.Mason, and second, Mary Landon, daughter of Augustine 8S. Mason.  Charles Atwood (1838-1907), was educated at the University of Virginia. He took over the management of his father's Liberty county farm in 1859. With the outbreak of the war he entered the ""Liberty Troop"", was commissmgioned captain  and served to the end of the war."
"Alexander, Adam Leopold","Alexander, Adam Leopold (@) After the war he continued farming and on his  father's death in 1882, the Wilke's county plantation came intom his possession, probably due to the fact that he was less encumbered than the other children. Charles Atwood was Married in 1862 to Ida Calhoun and in 1880 to her sister Rosa.     James Hillhouse (1840-1902), was educated at the University of Virginia. Engering the Confed- erate army in 1861, he was commissioned captain  of the signal corps in 1862."
"Alexander, Adam Leopold","Alexander, Adam Leopold (9) During the following year he was transferred to  the Engineers and commissioned Major. After the war he was owner of a drug store in Augusta, Ga. Marion Brackett(1842-1901), married William Ellison Beggs, D.D. The youngest daughter, Alice Van Yeverin (1848-1902), married Alexander Cheves Haskell... Haskell enlisted as a private  in the Confederate army and rose to the rank of Assistant-Adjutant General and Chief of Staff to Brig. Gen. Gregg. After the war he was. a member  of the law firm of Pope and Haskell of Columbia,  s.Cc."
"Alexander, Adam Leopold","Alexander, Adam Leopold (10) . s collection contains a valuable basis  for the family history of the Alexanders. The colkction begins the papers of William and Felix Gilbert, who amassed a considerable fortune in slaves and in. land in Wilkes county, Ga. The correspondence of Adam L. Alexander, while a student at Yale and immediately following those  years, reveal a great deal about college life. They are also the letters of young men entering maturity. The correspondence covering the period"
"Alexander, Adam Leopold","Alexander, Adam Leopold (11) me  830-1840 and 1850 consist mainly of letters of the Alexander children at school in Washington, Ga., in New England finishing schools, at Yale, and at the University of Virginia, and of lett- ers from the children who had married and est- ablished homes in Savannah and elsewhere. The outbreak of the War was.a serious event for the  Alexander family. Two sons-in-law and three sons, followed by a fourth in 1862, enlisted in 1861. The letters do not reveal a great deal"
"Alexander, Adam Leopold","Alexander, Adam Leopold (12)  About military movements, but.a vivid picture of a soldipt's life is obtained. Charles was stat- ioned in Georgia for a long time and his letters give excellent. descriptions of conditions there. One, dated Nov. 26, 1864, gives some idea of the terror of Sherman's march to Savannah. Edward Porter in Virginia and James Hillhouse in North     Carolina, South Carolina and Virginia give interesting accounts of events. there. The letters following the war tell of the"
Adam Leopold,"- Alexander, Adam Leopold (13) bie fortitude of men attempting to re-enter civil life. Some of those who had been trained in law were forced to turn to business which was none too profitable. It was time of trial and error and many attempts had to be made - which were not encouraging for those accustomed to considerable wealth and ease.     The death of Adam Leopild Alexander necessi- tated the settlement of his estate which evident ly offered some serious difficulties. The letter"
Adam Leopold,"- ALEXANDER, Adam Leopold. Sketch. (14)  of this time are pathetic and amusing. It seems that Charles Atwood was left with the land while the other children expressed wishes for furni- ture, stocks,end bonds. However they went throu the matter with,any serious family rupture.  The letters covering the years 1890-1909 tell of the declining health and the deaths of Adam and Sarah H. Alexander.  The collection is valuable. It covers a long period of time- three generations. It gives in- sight into social and economic conditions before and after the War, (See; The Alexander Le 1.783*1900. Baldwin, ee“ 1916)."
"Alexander, Bettie","OclLe lec CHL Bs Alexander, Bettie C  Letters. 1860 - 19863. Monroe County, Virginia [now W. Va.]  Section A 9 pieces,  JUL 14 104]"
"Alexander, Bettie","Alexander, Bettie. Letters, 1860 - 1863, Monroe County, Va. [now W. Va.] Sketch 9 pieces     Bettie Alexander was a young girl apparently still in school in 1860. The letters are add- ressed chiefly to her married sister who lived in Fincastle, Va. Family affairs and local gossip are the chief subjects. Bettie mentioned  that her father had gone to Texas (1860) and that her mother was weaving blankets. Her bro- ther John was in the Confederate army, e to have feeble health. There is freouent men- tion of soldiers who were wounded, sick or killed"
"Alexander, Bettie","ALEXANDER; Bettie. Sketch, 2  and of Negroes running off to the Federal lines. The merits of rye coffee are variously discussed while maple sugar was extensively made in that area. In 1863 the Alexanders made 587 lbs of Sugar and 30 gallons of molasses. Federal troog were often rather close. The correspondence stopps before the affects of the war on the family can be seen."
"Alexander, Bettie","ALEXANDER, Bettie Sketch, (3) (For biographical information see Oren F. Morton's Hist. of Monroe County, W. Va.)"
"Alexander, Edna Whitfield","Alexander, Edna(Whitfield)  FOR INFORMATION ABOUT THIS COLLECTION OR ADDITIONS TO THIS COLLECTION, PLEASE ASK A STAFF MEMBER TO CONSULT THE ACCESSION RECORDS."
"Alexander, Edna Whitfield","Alexander, Edna Whitfield, b. 1906.  Papers, ca. 1833-1985. -- ca. 1000 items. (2.3 linear ft.)  Jackson, Hinds County, Mississippi     Shelf location: 55-C  Civic and social leader. Born Edna Earle Elizabeth Whitfield. Married Henry Artz Alexander, (d. 1965). Resident of Grenada, Miss., 1933-1967, and recently, Jackson, Miss. -- Correspondence, speeches, printed ma- terial, notes, photographs, memorabilia, etc., centering"
"Alexander, Edna Whitfield","Alexander, Edna Whitfield, b. 1906. (card 2) Papers, ca. 1833-1985,     on the life and interests of Mrs. Alexander. Topics include: support of South Africa and trips there, especially in the 1960s and 1970s; anti-communism  and related public advocacy; work as a prominent member of the Daughters of the American Revolution; husband  Henry Artz Alexander, and his ancestors, including photographs of Buffalo Bill (Wm. F. Cody); family ge- nealogy, letters, and other material as early as 1833; publications and other material about late 19th century and early 20th century schools: Industrial Institute"
"Alexander, Edna Whitfield","Alexander, Edna Whitfield, b. 1906 (card 3) Papers, ca. 1833-1985.     and College of Mississippi, Gulf Park College, Mississippi Normal College at Houston, Houston Normal College, and Mississippi Normal Institute at Sherman; and Davis family letters and genealogy.  Gifts, 2-15-82; 2-3-83; 5-16-84  Accessioned 1-21-87"
"Alexander, Edward Porter","Alexander, Edward Porter  Papers, 1863-1905 Georgetown, S. C. Section A 8-4-49  item  item added, 1-17-51 item added, 4-20-65 item added, 6-2-72"
"Alexander, Edward Porter","Alexander, Edward Porter. Papers, 1863-1902. Georgetown, S. C. 3 items. Sketch.  Letter from E. P. Alexander (1835-1910) to some general, inquiring as to the losses of the Confederates in Virginia from May, 1864 to April, 1865,  Added 1-17-51 a list of the artillery of     the Army of Northern Virginia, copied by Alexander from general orders, no. 20, Head- quarters Army Northern Virginia, Feb. 15, 1863,  1 item added, 4-20-65: Letterpress copy of a business letter of Feb. 17, 1881, by E. P."
"Alexander, Edward Porter","Alexander, Edward Porter _2 Alexander. Filed with this letter is a copy of one in the Wendell H. Stephenson Papers which gives the source of Alexander's letter.  1 item added, 6-2-72: A letter from Alex- ander declining an invitation to attend a re- union of Confederate Veterans (June 3, 1905)."
"Alexander, Ethel","Alexander, Ethel  Papers, 1962 New York, N. Y. Section A 12-9-70"
"Alexander, Ethel","Alexander, Ethel. Papers. New York, N. Y.     In a copy of a play entitled A Soldier and Mr. Lincoln acquired by the Duke University Tibrary, there was found a letter addressed to Miss Alexander from Alexander T. Case, one of the authors of this play. Writing in January, 1962, Case discussed the production of his play     and enclosed a copy of the prologue which he wrote but did not use when the play was first  performed. The letter and the prologue comprise the Ethel Alexander Papers.  No biographical information on Ethel Alexan-"
"Alexander, Ethel","Alexander, Ethel 2  der could be found when this collection was  cataloged."
"Alexander, Henry M.","Alexander, Henry M.  Scrapbook, 1857-1860 New York, N. Y. 180 pp. Cloth 25 x 31 1-4 cm.  5-31-58 Genera] Se ra. bbook ‘  GUIDE"
"Alexander, James H.","Alexander, James H, Diary, 1862 Centreville, Fairfax Co., Va. 51 pp. Boards & Calf 20 x 24 ecm,  A copy of this diary is available on . 6-11-37  [ Cong ederate Diary]"
"Alexander, James H.","Alexander, James H. Diary, 1862. Centreville, Virginia. Sketch. 1 vol.     James H. Alexander was from Wilkes Co., Ga. He was a member of the Irwin Artillery, origi- nally Company A, 9th Georgia Infantry, afterward Company E and later Company C, Sumter (11th)  Battalion, GeorgiaArtillery. Alexander's Diary, January-March, 1862, records part of his service with the Irwin Artillery in Virginia.  Alexander makes the usual comments about camp life, food, rumors about the progress of the war,"
"Alexander, James H.","Alexander, James H. z     and describes the camp (Camp Norman) during winter quarters. He makes brief references to receiving northern newspapers by the underground railroad.  Pages 10-14, 18, 22, 42, refer to a disagree- ment with William Nelson Pendleton about the building of a church and attending services; pp. 18-20 the leaving of Beauregard for Kentucky and the Powhatan Troop; and pp. 44-51 describe the break up of winter camp at Centreville and the march to Orange Court House. Mention is also"
"Alexander, James H.","Alexander, James H. 3 made throughout about the Irwin Artillery and the 9th Ga. Regiment."
"Alexander, James H.","Alexander, James H, Diary, 1862 Centreville, Fairfax Co., Virginia  1 Reel Negative  Copy of diary in the Manuscript Department, Reel also includes William G. and J. S, Agnew Papers, 1861-1864,  3-5-79 S"
"Alexander, Miller","Alexander, Miller Papers, 1850-1900  St. Louis, St. Louis Co., Mo., and v. p. in Miss. and Ky.  23 - H 211 items 6-18-57  GUIDE"
"Alexander, Miller","Alexander, Miller. Papers, 1850-1900. St. Louis, Mo., & v. p. in Miss. & Ky. 311 items. Sketch     This collection pertains chiefly to the following subjects (excluding personal affairs and religion) in ascending order of importance: 1) land sales in Miss.; 2) tobacco culture in Ky.; and 3) tobacco culture and marketing in Mo.  Other subjects mentioned include the Young Ladies' Seminary, Steubenville, Jefferson Co., Ohio; travels of various persons in Ark., Ky., Mo., Ia.; Miss., Tex., Ohio, Utah, and Washing- ton (State or Berritory ?); U. S. Presidents Andrew Johnson, Abraham_Lincoln, and Ulysses"
"Alexander, Miller","Alexander, Miller  Simpson Grant; business affairs; personal debts; commodity, particularly tobacco, prices in vari- ous places, especially Mo. and Ky.; land rents, sales, and taxes in Mo., Ky., Ia., Miss., etc.; railroads; Negroes; murder; illness; preachers and preaching; teachers and teaching; westward     migration; and the Democratic Party National Convention of 1888 in St. Louis.  The material from 1850 to 1860 consists mostly of business letters addressed to Reuben Alexander, Marrow Bone, Cumberland Co., Ky., dealing chiefly with ® Sales in Miss., but"
"Alexander, Miller","Alexander, Miller 3 also with land taxes and personal debts. These letters are largely from Alexander's land agent, H. Craft, Holly Springs, Marshall Co., Miss. Richard N. Venable (1828- ), M. D., of Holly Springs, is mentioned in a letter of July 22, 1858.     Most of the rest of the collection consists of personal letters by Miller Alexander, who may have been the son of Reuben Alexander. From 1864-1900 Miller Alexander wrote a number of personal letters, along with a few business  letters and papers, “6 relatives, notably to"
"Alexander, Miller","Alexander, Miller 4  his brother, Fontaine Alexander, who seems to have lived in Ky., perhaps Horse Cave, Hart Co., or Knob Lick, Metcalfe Co., or both. Miller Alexander is pro-Abolitionist and anti-Confeder- ate. He frequently discusses personal, busi- ness, and religious matters, often employing     Biblical phraseology. He is buying tobacco as early as 1866 and seems most interested in it even when he is a general merchant, He is a general commission merchant in St. Louis in the late 1860's and early 1870's; and some sort of merchant there till “6 From then till 1887"
"Alexander, Miller","Alexander, Miller 5 he is a leaf tobacco commission merchant. in a St. Louis warehouse co. From 1887 on he writes -increasingly of his alternating employment and unemployment; personal debts; ideas (unfilled as of Feb. 22, 1900, the date of his, and the collection's, last dated item) of moving to the     South, Southwest, or West; the declining plant- ing, sale, and manufacture of tobacco in Mo.; and his ill health and infirmities of age. Consciously assuming the role of prophet in a letter of July 17, 1865;-?;, Miller Alex- ander declares that ‘¢ is to be a grand and"
"Alexander, Miller","Alexander, Miller } terrible upheaval in the political and religious elements of this country, nearly at hand say, within five years."" He discusses the ""Copper- heads,"" Catholics, ""Rebels,"" Protestants, Re- publicans, Negroes, Irish, etc. He is anti- Catholic, anti-""Rebel,"" anti-""Copperhead,"" and     anti-Irish. He does not seem to be in favor of anything except perhaps the Republicans and the Protestants. He has opinions on many subjects. He writes from Louisville, Jefferson Co., Ky., on Aug. 12, 1866, ""I am now boarding with a family. They are 7.) refugees, from Frank-"
"Alexander, Miller","Alexander, Miller     lin Tenn. But a most excellent people.""  A letter of Nov. 10, 1866, by Alexander mentions the Congressional elections of that year; U. S. President Andrew Johnson's ""foolish war upon Congress, and the good will of the Copperhead party;"" the South's hopelessness; et  A letter of Apr. 30, 1870, mentions ""Elder Earl, a man of great celebrity among the Bap- tists, as an evangelist;"" a Baptist revival in St. Louis; and ""the aweful crust of worldliness and formalism that has grown up in our City  churches."" @"
"Alexander, Miller","Alexander, Miller 8 A letter of Oct. 30, 1874, by Miller Alexander mentions big tobacco sales and pros-  pects for a profit of over $100,000.00, ""if the Lord will.""  Alexander writes from St. Louis on Nov. 12, 1874, that ""The City is full of dirty, lazy,     wretched Negroes, as it is of white people of the same sort... .""  Alexanders letter of Nov. 23, 1876, mentims Miss. land and probably relates to matters covered in letters to Reuben Alexander from 1850-1860; and he _ \ to ""join the univer-"
"Alexander, Miller","Alexander, Miller 9 Sal complaint against the -U. S.; government."" He mentions the presidential election of 1876;  U. S. President Abraham Lincoln's first electio in 1860; and his want of faith in the Democratic and Republican Parties. He says, ""I have no  doubt Tilden is elected, if a fair Count could     be had; and I wanted Grant and that hord of thieves around him ousted, any how. a""  Alexander discusses his business ups and downs in various letters; e.g., that of Jan. 11,  1877. In a letter of “‘~ 11, 1875, he discusses"
"Alexander, Miller","Alexander, Miller 10  the prospects for running some Negroes off  Paul's (Paul Alexander's ?) place, ""unless they  go to work and pay a fair rent for the place....! On May 5, 1879, he discusses Congress;  U. S. Representative John Griffin Carlisle from  Ky. (1877-1890); and the San Antonio & Rio     Grande R. R. project. Miss., says Alexander, “is very much excited over the exodus of the Negroes North. At least eight thousand have been landed here ,-St. Louis; en route for Kansas.""  In a letter “oe 13, 1879, he again"
"Alexander, Miller","Alexander, Miller 11  mentions Congress and the San Antonio & Rio Grande R. R. project. He has received a letter, dated May 10, 1879, from ""Genl Barnes the mana- ger of the business at Washington,"" who may be Joseph K. Barnes, U. S. Army Surgeon-Gen.; and ""Congressman Caldwell,"" who may be U. S. Repre-     sentative John William Caldwell (1837-1903) of Ky. (1877-1883). Alexander's suggestion that ""Congressman Caldwell"" might belong to ""the old Geo. Alfred family"" is probably a reference to George Alfred Caldwell (1814-1866), U. S. Re-"
"Alexander, Miller","Alexander, Miller 12 presentative from Ky. (1843-1845 and 1849-1651). Alexander speaks of the Democratic Party's debt to him (Alexander); Isaac Caldwell of Louisville and his unsuccessful attempt to get elected to the U. S. Senate a few years previously; Judge Sam. Bowles; and Preston H. Leslie.     Alexander writes from St. Louis on Sept. 15 ¢?,, 1880, mentioning the visit to that city of former Gov. Leslie.  He mentions white burley tobacco in various letters; i.e., that of Mar. 28, 1881. He wants the planting of that oe” of the weed intro-"
"Alexander, Miller","Alexander, Miller 13 duced into Mo. His letters of 1881-1887 have  the most to say about the tobacco business in St. Louis.  On Jan. 4, 1882, he discusses the possi- bility of having a reliable class of people from Ky. to emigrate to Southwestern Mo. and     Northwestern Ark. to raise tobacco. His letter of June 20, 1882, says there are fine limestone and bluegrass lands in those places. On Apr. 22, 1883, he mentions a trip to the Ozarks ""to discover a new field for tobracc;0. growth as nearly all the old “@ Mo. is abandoning it"
"Alexander, Miller","Alexander, Miller 14  for grain and stock. I found the finest lands for it...The climate is delightful and the wate the purest in the world. It is however the home of Cyclones and terrr;ific thunder storms...and immigration to the country is greatly retarded by a dread of these."" He prédicts the country     ""will soon be full of People."" He denounces ""the vanities, and vices, and shams that char- acterise City life. The Preachers are frauds, the Churches are shams, society a Sodomitic league and covenant with hell... .""  On Sept. 19, ~“~@ says that his daughte"
"Alexander, Miller","Alexander, Miller 15 has graduated from high school, ""and has entered the Normal School: a branch of the System here in which they train their own teachers.""  A letter of Jan. 20, 1885 .?;, mentions various things in Washington Territory, includ- ing the temperance cause; women's rights; the     Republican Party; railroads; agriculture; com- modity prices; a gardener's fair; etc. The writer says, ""...the school and Rail Road lands takes up half of this country The Northern Paci- fic Road is a Monopoly Freights are high All our Surplus grain is ¢e East to St Paul,"
"Alexander, Miller","Alexander, Miller 16 MAMls cae «""  The same correspondent writes on Jan. 18, 1886, mentioning commodity prices in Washington Territory; railroads; gold mines; lumber; the rapid improvement of the Territory; land; natur- al resources; etc. He says that good men are     needed ""here to fight Sectarianism Catholosism Spiritualist and Ifidels.""  Alexander writes on July 5, 1886, saying that his daughter, Katie, is teaching. He men- tions his other daughter's, Anne's, ambition to  teach. S"
