Name,Text
"Daniel, Harriet Bailey (Bullock)","Daniel, Harriet Bailey (Bullock) 10 guide to Arkansas and a book of ""Arkansas Facts” from the 1920's. Also, there is a newspaper clipping of unknown date or newspaper relating very briefly the history of First Church (Pres- byterian), Arkadelphia, Arkansas, possibly one of the churches described by Harriet B. Daniel in her letters. A bound volume, entitled A     Brief Sketch of the History of the Protestant Episcopal Church in the Missionary District of Western Texas, gives brief histories of the churches in the area encompassing San Antonio,"
"Daniel, Harriet Bailey (Bullock)","Daniel, Harriet Bailey (Bullock) 11 Brownsville, and Laredo, from their origins in the 1850's to the time the sketch was authored by the Reverend W. R. Richardson in 1902. The last item of printed material is the Bicenten- nial Anniversary Program of the Nut Bush Pres- byterian Church in Townsville, Vance County, North Carolina. The celebration of that     church's bicentennial took place in 1957. The  program contains lists of the present and past  pastors, elders, and deacons of the church. The pictures include fourteen loose items"
"Daniel, Harriet Bailey (Bullock)","Daniel, Harriet Bailey (Bullock) 12 and one volume. Two of the loose items are photographs of the courthouse. square in San Marcos, Texas. One photo shows the courthouse with the square virtually deserted. The other photo is of a reunion of Confederate veterans held in the square. Also from San Marcos is a picture of the Raynolds and Daniel Drugstore in which Samuel Venable Daniel was a partner. One picture is a photo of a reunion of Confederate veterans in front of the Granville County, North Carolina,courthouse in 1900. Also there is a"
"Daniel, Harriet Bailey (Bullock)","Daniel, Harriet Bailey (Bullock) 13     postcard containing a photo of Sarah Bernhardt taken about 1906.  The volume is the photo album of Lucy E. Daniel (b. 1884), the daughter of Samuel Venable Daniel of San Marcos, Texas. The photos are not identified, but they appear to be of the family or friends of Lucy E. Daniel. The photos date from the early part of the 20th century.  17 items added, 8-29-75; Genealogical notes and a few letters about the Daniel and other  families, ®"
"Daniel, Harriet Bailey Bullock","Daniel, Harriet Bailey Bullock, 1849-  Resident of Granville Coe, NCe  Cotlection consists of writings, copies of land grants, notes, and photographse The writings are  and notes created from 1929 to 1930 by Alice Ge Daniel, daughter of Harriet Daniele They contain Harriet Daniel's reminiscences about Living on an Arkansas plantatione They were also used by Margaret Jones Bolsterli in A REMEMBRANCE OF EDEN: HARRIET BAILEY BULLOCK DANIEL*S MEMORIES OF A FRONTIER PLANTATION IN ARKANSASe  Cataloged f rom accession recorde Unprocessed c otlectione  03 .MAY 95 32410200 NDHYme SEE NEXT CRD"
"Daniel, Harriet Bailey (Bullock)","sentes Harriet Bailey Bullock, 1849-  es  Papers, eee (Card 2)  Addition to Harriet Bailey Bullock Daniel papers, 1753-1957 (bulk 1857- 1933 )e  * Lbp  Publications: Bolsterli, Margaret Jonese A Remembrance of Eden: Harriet Bailey Bullock Daniel's Memories of a saeetter Plantation in Arkansas, 1849-  le Plantation Life-——Arkansas-—- History-——-19th centurye 2+ Slavery-—- Arkansase 3e Arkansas-—History-—— Personal narrativese 4e Arkansas-— Social Life - customse  03 MAY 95 32410200 NDHYme"
"Daniel, J.H .","Daniel, J eHe Letters. 1850-4856. Congtoe, Edgecombe County, N.C.  Section A 2 pieces  NOV5 1933  NOV 13 1934 ="
"Daniel, J.H .","Daniel, J.H. . 1850-1856 Conetoe, Edgecombe Co., N.C.  Personal letters. Emphasis on religion."
"Daniel, John Reeves Jones","Daniel, John Reeves Jones Letters. 1841-1856 Halifax, North Carolina  Section A 2 pieces.  MAY 30 1941"
"Daniel, John Reeves Jones","DANIEL, John Reeves Jones Letters, 1841-1856 Halifax, N.C. 2 pieces     John Reeves Jones Damiel was a member of the United State Housé of Representatives from 1841 to 1853.  He was born in Halifax, North Carolina in 1802. He graduated from the University of North Carolina in 1821, was admitted to the bar in 1823, and was a member of the State house of Go- mmons from 1832 to 1834. In 1834 he became att- orney general of North Car@lina and in 1841 he was elected as a democrat<«-to the United States Congress where he re oe"" for six terms"
"Daniel, John Reeves Jones","DANIEL, John Reeves Jones Sketch. 2 Fe until 1853. He then resumed his practice of law and was also engaged in planting until his death ih Shreveport, Louisiana in 1868,  The first letter, in this set of two, is dat- ed June 12, 1841 and is converned with the app- lication of Jerome B. Zollifoffer for eonsidera- tion as a midshipman in the naval academy. It     is addressed to secretary of the Navy, George Edmund Badger. A letter of September 30, 1856 to John Cook Rives is concerned with the sale of  a warrant."
"Daniel, John Warwick","Daniel, John Warwick  Papers, 1849 (1876-1909) 1910  Lynchburg, Campbell Co., Va.  22-6 6 items 1 item added, 7-42 476 items added, 12-15-52 3 items added, 5-23-57 2 items added, 5-30-68"
"Daniel, John Warwick","Daniel, John Warwick  FOR INFORMATION ABOUT THIS COLLECTION OR ADDITIONS TO THIS COLLECTION, PLEASE ASK A STAFF MEMBER TO CONSULT THE ACCESSION  RECORDS."
"Daniel, John Warwick","DANIEL, John Warwick. Letters. 1849-1910 Lynchburg, Va. Sketch.  eae GR Sosy     John W. Daniel(1842-1910), was born and ed- ucated at Lynchburg, Va., served in the Confed. army; took up the study of law at the Univ. of Va. after the war, and began practice at Lynch- burg. He published various legal works and was  active in Va. politics. He was defeated for gov- ernor in 1881, served as a Democrat in congress 1885-1887;and as U.&.Senator, 1887-1910. He died  at Lynchburg."
"Daniel, John Warwick","Daniel, John Warwick. (2)     The correspondence is routine and trivial, consisting chiefly of acknowledgements of small services, comments on his health; and one state- ment of his terms of service in Congress.  476 items added 12-15-52, These contain many letters by ex-officers of the Confederate  Army commenting on battles and leaders of the Civil War, principally of the war in Va. The papers include: A testimony of 1849 signed by James A, Seddon and three other men concerning an article Judge Wm. Daniel had denied writing"
"Daniel, John Warwick","|} Waniel, Jonn warwick. >)     for the Lynchburg (Va.) Republican; letter of 1863 from Gen. J.A. Early notifying Daniel of his appointment as Asst. Adjt. General with  the rank of major; incomplete copies of reports from Robt. D. Johnston relative to the opera- tions of his brigade in the battles of Belle Grove or Cedar Creek and the Wilderness; parole certificate from U.S. Grant to John 8S. Mp,sby; letter written by Gen. Early from Toronto on Feb. 17, 1867 expressing his unreconstructed attitude toward living again under Federal authority and rede e ed ng Daniel to get together all the papers he éen on Early' war career and"
"Daniel, John Warwick","Daniel, John Warwick     send them to him to use in writing the story of his campaigns; letter of 1873 from John 8. Mosby criticizing James L. Kemper, former gov. of Va., for his failure to cooperate with him in trying to influence Grant to oppose the Civi Rights Bill; Gen. £.R. Trimble to Daniel correcting him on the role Pender's div. phayed in Pickett's charge at Gettysburg; letter of 1876 from Sen. R,E. Withers mentioning a bill introduced by James G. Blaine and the latter's Opposition to the General Amnesty Bill; letter from Geo, F. Holmes in 1876 to Daniel stating that the Univ. of V,. a in ""bitter need"" of"
"Daniel, John Warwick","Vaniel, John Warwick 5 additional funds; letter from Cadmus M. Wilcox to Daniel correcting his statement regarding the location of Sickles' corps at Gettysburg and reminding him of the attack made by Perry and Wilcom's brigades against Sickles; letter of Withers on Jan. 27, 1876 about Sen. Morton's speech proposing to send an investigating com-     mittee to Miss., partially to try to prevent the seating of Senator-elect L.Q.C. Lamar; letters congratulating Daniel in 1876 on his book about Fiegotiable instruments; Sen. Thos. F. Bayard wrote in July 1876 his views on the pwestid@ential  Campaign; copy of a ry of Dec. 11, 1676"
"Daniel, John Warwick","Daniel, Jonn Warwick 6 from Wade Hampton to John 5. Mosby stating that peace will follow his @nauguration as Gov. (Mosby has a note attached to this saying Ham- pton had treated him unfairly after he had gone to see Grant at his suggestion to appeal for a more lenient policy toward S.C. and that a bill to remove the political disability of Souther-     ners was passed in the Senate during Sumner's absence); letter of Joseph E. Johnston in Nov. 1878 thanking Daniel for his congratulations on his election to Congress and saying that the Greenback vote was very small; letter of May 18- 80 from Wade Hampton to_Daniel, who had beén"
"Daniel, John Warwick","Daniel, Jonn Warwick  elected as a delegate to the National Democratic Convention, offering him advice and suggesting that Thos. F. Bayard, Sr. was the strongest man for the nomination; letter of Wm. Smith of May 1880 giving his opinion of Winfield S. Hancock and Samuel J. Tkidén; letter of G. C. Walker stating that he is sure the Republicans will nominate Grant and mentioning possible candi- dates for the Democratic nomination; W. 5. Hancock to Daniel expressing gratification that the Va. delegation was satisfied with his nomination; letter of Now. 6, 1880 from Geo Hoadly manifesting pleasure that Wm. Mahone"
"Daniel, John Warwick","Daniel, Jonn Warwick % 8 had been defeated; Letter of Mar. 16601 from L.Q.C. Lamar to Daniel defending his, Lamar's, vote for retiring Grant with rank and pay and asserting that he followed the interests of the Southern people regardless of the consequences to himself; letter from W. H. Payne in April 1881 attacking Manone and other Va. politicans; other letters in 1881 relative to Mahone; M.C. Butler to Daniel in 1881 saying that the policy of the Democrats in the Senate had been to widen the breech between Conkling and Garfield's admin, (He went on to state that Conkling was"
"Daniel, John Warwick","Vaniel, Jonn Warwick 9 the most dangerous and most vindictive man in the Republican Party); Jefferson Davis to Daniel on July 9, 1883 revealing his attitude toward Gen. Lee, of the close accord between them during the Civil War, and the circumstances surrounding an appointment of G. W. C. Lee; letter of Dec, 21, 1885 from Wade Hampton speaking briefly of his son-in-law, John C, Haskell; letter of Feb. 1892 from Jno. 5, Mosby to Daniel giving his opinion of the Battle of Gettysburg;,letter of Carter Glass on Aug. 18, 1893 cued the free coinage of silver;"
"Daniel, John Warwick","Daniel, John Warwick     Insert on p. 9  account of action during Second Bull Run, Aug. 30, 1862, by the 44th Virginia Regt. of Early's Brigade, Wm. E. Starke's Brigade, and J. R. Jones' Brigade written by Bradley Tyler Johnson, Get s—9;—1862; Od), ¥, 1892,"
"Daniel, John Warwick","Daniel, Jonn Warwick  Tetters of Feb. and Mar. 1694 commenting.on the illness and character of Gen. Early; Thos. H, Carter to Daniel on Nov. 19, 1894 mentioning Early, the battles of Winchester and Cedar Creek and Sheridan's reported number of men in the former battle; letters of Thos. H. Carter on Nov. 28, 1894 describing the Battle of Winches-     ter, and on Dec. 18 about Early and the Vglley Campaign; letter of Dabney H. Maury relating  to the battles of Gettysburg and Bentonville. (Many of these letters to Daniel giving opinions on battles and leaders of the Civil War were written after Daniel eo an address on"
"Daniel, John Warwick","Daniel, Jonn Warwick  _ ai Gen. Early); letter of Aug. 6, 1895 describing the Battle of Spottsylvania Court House; letter of Fitzhugh Lee of Mar. 14, 1896 pointing eut the adverse criticism of Early in Longstreet's book; Mosby on Apr. 26, 1896 commenting on the 7Battle of Chambersburg; letters of 1896 which speak favorably of Bryan as a presidential candidate; correspondence of Mosby in Jan, 1897 about various battles of the Uivil War and accounts that had been written about them; letter by Consul Fitzhugh Lee protesting again- st Spanish authorities holding U.B. citizens in Cuba ""incommunicade"" (Om Mar. 17 Lee again     /  KOCS OLE Chd AA il in, ‘4 -bu te {) Lat 4 64 bat £ é oy « if Py  grok"
"Daniel, John Warwick","Daniel, John Warwick     mentioned the strained relations between the U.S. and Cuba); Clement A. Evans wrote Daniel on Sept. 17, 1897 regarding his part in the Battle of Lynchburg; letter of Jno. Mosby of Mar. 20, 1898 eriticizing some of Gen. Lee's reports; letters of Thos. L. Rosser in 1898 criticizing the administration for not enlist-  ing more men for the Spanish-American War,  making reference to Gm. Joseph Wheeler in Cuba, the role he thought the U.S. should play in the Caribbean and Pacific, and asking Daniel to use his influence to see if he could get the presi- dent to consent to “oer a corps (Rosser"
"Daniel, John Warwick","Daniel, John Warwick 13s     received his commission and then wrote from Camp Geo. H. Thomas wanting supplies and John W. Daniel, Jr. to join his brigade, which  Jonf Jr. later did.); Sen. G. F. Hoar wrote Daniel concerning rumors that he, Hoar, was being considered for the ambassadorship to Britain; letter of Mosby in Dec. 1898 criticiz- ing Bryan and J. W. Bailey for what he said was a reversal of their stand on the Spanish-Ameri- can War and accusing McKinley of stealing their ideas about expansion; letter of Jan. 20, 1899 from Thos. L. Rosser giving the number of colored and white regts, furnished by Va. for"
"Daniel, John Warwick","Daniel, John Warwick ©  the war with Spain; letter of Jan. 25, Nicol Kingswill of Toronto to Sir Louis Davies concerning the claim of a British family against the U.8. Govt. for the illegal seizing of the Lord Nelson a few days before the War of 1812 was declared; letter of Jan. 27, 1899 mention- ing Capt. 8S. B. Davis as the Confederate used        to communicate with Jacob Thompson and Clement Clay in Canada dnd the Confederate agents throughout the North, and was tried as a spy; letters by Mosby criticizing Sena. Platt and Hoar's stand on expansion, the attitude of some toward Samoa, and the ee Act, and giving"
"Daniel, John Warwick","Daniel, John Warwick 15     views on the treaty with Spain; Letter from Rosser on Mar. 15, 1899 at Havana describing his observations on Cuba, letter of June 19 from Mrs. Jefferson Davis requesting an @épitaph for her husband's ttomb; Marcus J. Wright wrote to Daniel asking for a letter of recommendation for a position an the Shiloh Park Commission;  letter of J. Hoge Tyler to Daniel on April 19, 1900 opposing a constitutional convention in Va. at that time to try to bring about reformp letters commenting on the presidential campaign of 1900; letter by Ed. Atkinson relating to tariffs; letter from r on Jan. 27, 1901"
"Daniel, John Warwick","Daniel, Jonn Warwick L6 commenting on Sen. Cusnman K. Davis; letters of Mosby attacking Fitzhugh Lee and Wm. Waller; letters of 1903-1904 which deal with the battles of Gettysburg and Appomattox; Wm. Mahone, Gens. Lee, Early and Gordon, Valley campafgn in Va., battles of Chancellorsville, Spottsylvania U.H., and Cedar Creek; and the presidéntial campaign of 1904; letters of 1905 commenting on the battles of Appomattox, Five Forks, Cedar Creek, ""Bloody Angle"", regulation of railroad rates, significance of the salt works in Va,, Fitzhugh Lee,Rosser; Letters of 1906-1910 regarding the battles of a jai Appomattox,"
"Daniel, John Warwick","Daniel, Jonn Warwick 1? Cedar Creek, Chancellorsville, Wm, McKinley,  | Andrew Johnson, Fitzhugh Lee, Geo. E. Pickett, Rosser, MeK,ynley, Andrew Johnson, Wm. J. Bryan, presidential campaign of 1908, E. P. Alexander and his book on the Civil War, Roosevelt, Francis R. Lassiter, R. M. LaFollette, Sr.,  A bill introduced in the Senate to establish a     foundation for the promotion of industrial peacg¢ railroad rates, and a letter from Mabel L. Boardman inviting Sen. Daniel to her house to hear Pres. Taft speak on problems of the Negro race. The undated material contains data on the"
"Daniel, John Warwick","Daniel, Jonn Warwick  18     Valley campaign.  The correspondents include:  /Adams, Chas. F. Alger, Russell A. Anderson, Archer Anderson, Wm, A. Atkinson, Edward  vAycock, Chas. B. Bacon, Robt. Bagby, Geo. W. Barbour, Jas. A. Bayard, Thos. F. Behrman, Martin  Benjamin, Judah P. Blackburn, J.C.S. Blackford, Chas. M. Bland, Richard P, Boardman, Mabel L. Brown, John Y.  vBryan, Wm. J.  Buck, 5.0.  Butler, Matthew C. Cameron, Wm.E. Campbell, Jas."
"Daniel, John Warwick","Daniel, Jonn Warwick ig Candler, Allen D. Devens, Chas. dr. Carter, Thos. H. Dillon, John F, Carter, Wm. Page Early, Jubal A, Conrad, Holmes Elkins, Stephen B. Cortes, Enrique Evans, Clement A, Cox, Samuel 8. Evarts, Wm. M.  Cox, Wm. R. Fairbanks, Chas. W. Crothers, Austin L. Faulkner, Chas. J. vDaniel, John W. Flood, Henry D. Davis, Henry G. Flynn, Frank 5. / Davis, Jefferson Francis, David R. Davis, Varina H. Frazier, Jas. B, Denny; Geo. H, v Glass, Carter"
"Daniel, John Warwick","Daniel, John Warwick     Goode, John  Gordon, John B. Grant, Ulysses 8S. vHalsey, Stephen P.  - Hampton, Wade IIT ‘Hancock, Winfield S. Hansbrough, Henry C. Haskell, John ©. Hay, John Milton Henderson, W. A. Herbert, Hilary A. Hoadly, Geo.  Hoar, Geo. F.  Holliday, Fred. W.M. Holmes, Geo. F. Hughes, Robt. W, Hunton, Eppa, Sr. Johnson, Bradley T. Johnston, John W.  ‘Johnston, Joseph E,  Johnston, Robt. D. Jones, James K. Jones, Thos. G. Jones, Wesley L. Keith, James Kendall, E. W."
"Daniel, John Warwick","Vaniel,  Jonn Warwick     King, Horatio ©. Kingswill, Nicol Knox, v Lamar, L.Q.C. Lamont, Daniel 8, Langhorne, M.S. Langley, “Lee, Fitzhugh Lee, Ellen B. F. Lee, Geo. W. C., Lee, Stephen D. Lee, W.H.F. Lomax, Lunford L.  Philander C,  Samuel P.  Long, John D. McCabe, Wm. G. MeGee, Jas. M. McKinney, Philip W.  ‘Mahone, Wm.  Mallett, John W. Maftin, Thos. 8. Maury, Dabney H. Mickle, Wm. E, Minor, | John B, Montagne, Andrew J. Moorman, Geo. Morgan, John T."
"Daniel, John Warwick","Daniel, Jonn Warwick 22  Morrill, Justin 95. ‘Parker, Alton 5. Morton, Paul Paul, John  Mosby, John 8. Pauncefote, Julian Mulholland, St. Clair A. Payne, John Barton Munford, Thos, T. Payne, Wm. H., Myer, Gobl Penrose, Boies Nettleton, Alvred B. - Platt, Thos. C, Nichols, Edward W. Preston, John 8S.     Alney, Richard /Quay, Matthew 8.  - Overman, Lee 8. Randall, Samuel J. Owen, Robt. L. Rayner, Isidore Page, Carrol 8S. Reagan, John H. Parker, Alton B. Rhea, Ellen Lee"
"Daniel, John Warwick","Daniel, Jonn Warwick Roller, Jonn E, Stribling, Robt. M. v Roosevelt, Theodore Swanson, Claude A, - Root, Elihu Taliaferro, Jas. P. Rosser, Thos. L. Thurman, Allen G,. Ryan, Thos. Fortune yTillman, Benj. R. Seddon, James A, Tremain, Henry E, Simmons, Furnifold M. Trimble, Isaac R.     Simonton, Chas. H. Tucker, Henry §8. Smith, Francis H. Tucker, John R. Smith, Wm. Tyler, Jas H. Stevenson, Adlai E. Tyler, Lyon G. Stewart, Wm. M Voorhees, Daniel W. Straus, Oscar 5, Waite, M. R,  g Walcott, Chas. D."
"Daniel, John Warwick","Daniel, John Warwick ra Walker, G. Irvine White, Stephen M. Walker, Gilbert C. Whittle, Stafford G. Watterson, Henry Wilcox, Cadmus M, Wetmore, Geo. P. Willard, Joseph E, Wharton, G. OC, Williams, John 5. Whitaker, Eqward W. Withers, Robt. E.  White, Elijah V. Wright, Mareus J. This collection is part of the Don Preston  Peters Collection. Three items added on 5-33-57. John Warwick Daniel: writes to Thomas L. Walker, M. D., on Oct. 9, 1874, mentioning U. S. Senator Allen Granberry Tiarman of Ohio and fromer Con- federate Maj. Thomas Jellis Kirkpatrick."
"Daniel, John Warwick","Daniel, John Warwick 29 Daniel writes to Walker on Apr. 21, 1877,  discussing real estate. The third item is a fragmentary letter dated ca. 1900-1910, from Thomas Lafayette Rosser to Daniel, mentioning U. S. Senators Knute Nelson of Minn., Charles  Allen Culberson of Tex., and John Coit Spooner of Wis.     These three items were originally in the Don  t t t ie wet tat te eee F  a letter from Daniel to William T. Boogher and contains genealogical information about Mrs.  the first item is"
"Daniel, John Warwick","Daniel, John Warwick, Papers. 26 Daniel (Feb. 16, 1897). The second is also a letter from Daniel, this one to W.S. McKean. It includes a short comment by him on +homas Jefferson. (Dec. 12, 1902)."
"Daniell, William C.","Daniell, William C. Papers, 1859-1864 Savannah, Ga. XVIII-A 35 items 1 item added 5-15-57 1-15-57  GUIDE"
"Daniell, William C.","Daniell, William C. Papers, 1859-1864. Sa- Vannah, Ga, 36 items _ Sketch     Records, 1859-1864, are legal papers of William C. Daniell, Confederate Receiver of Alien Property for southern Ga., and deal chiefly with answers to questionaires sent out by the Confederate eourt on ‘Alien proper-  ty held by southern business agents, such as Gazaway B. Lamar and Robert Habersham. Bank- er Gazaway B. Lamar is also involved in this sequestration of northern property in Ga. From the Marmaduke Floyd Collection."
"Daniell, William C.","Daniell, William C.  l item added 5-15-57; a legal document signed by Daniell which concerns several firms that had failed to pay the C. S. A. Govt. for the partners who had gone North."
"Daniels, Henry","130 ? FF 7# Daniels, Henry a  Record of Freedman's Bureau. 1865. Lawrenceville, Virginia  68 pp. Boards. 55 x 20 cm.  AUG 3 6 i940"
"Daniels, Josephus","Daniels, Josephus, 1862-1948.  Papers, 1904-1954, bulk 1913-1942.  22,300 itemse  Secretary of the Navy, Ambassador to Mexico, Newspaper Editor  Official lLetterbooks, telegrams, and pressbooks, covering the period Daniels was Secretary of the Navy (1913-1921) comprise the bulk of the collection. Included is information relating to the unrest in Mexico, which led to the occupation of Veracruz in 1914 and the build-up of personnel, ships, weapons, and equipment in the United States Navy during the Wilson administratione Routinely discussed are appointments to the United St ates Naval Academy, information a @ es: naval shipyards throughout th e United States, and  20 JAN 88 17364626 NDHYme SEE NEXT CRD"
"Daniels, Josephus","Daniels, Josephus, 1862-1948.  Papers, 1904-1954, bulk 1913-1942. eee (Card 2) various aspects of militry life. Other topics include: information about naval oil reserves and the investigation which led to the uncovering of the Teapot Dome Scandals the relationship between the United States and Mexico} and the management of the Raleigh News and Observer, which Daniels edited for many yearse Daniels frequently corresponded with President Wilson, Joseph Pe Tumulty, Newton De Baker, and Benjamin Re Tillmane Other correspondents consisted of a wide range of publ ic and elected officials, in @ civsing governors, congressmen,  cabinet members, naval 20 JAN 88 17364626 NDHYme SEE NEXT CRD"
"Daniels, Josephus","Daniels, Josephus, 1862-1948.  Papers, 1904-1954, bulk 1913-1942. ees (Card 3) officers, and newspaper editors.  Inventory in repositorye  i.e United Statese Navye 2.2 Navy- yards and naval stations--United Statese 3e Shipbuilding--United Statese 4. Wilson, Woodrow, 1856-1924. 5e Tumulty, Joseph Patrick, 1879-1954. 6. United Statese Navy--Military life. 7. United ste @ ies: Navy-~-Equipment.  8.2 United Sta tese Navy-—-Recruiting, enlistment, e 9. United States». 20 JAN 88 17364626 NDHYme SEE NEXT CRD"
"Daniels, Josephus","Daniels, Josephus, 1862-1948.  Papers, 1904-1954, bulk 1913-1942. eee (Card 4) Navy-—Appointments and retirsementss 10. United Statese Navy--Weapons systemse 11. United States Naval Academye 12+ Baker, Newton De (Newton Diehl), 1871-19374 13-6 Tillman, Benjamin Ryan, 1847-1918.  14. Petroleum—--United States--Reservese 15+ Teapot Dome Scandal, 1921-1924.  16. The News and Observers 17. United States--Foreign relations——-Msxicos  18. Mexico--Forsign relations—--Unitsed States» 19-6 Veracruz Llave ( Mexico)-—- History-—-American occupation, 1914.  20 JAN 88 17364626 NDHYme"
"Daniels, Thomas Cowper","Daniels, Thomas Cowper Papers, 1889 (1889-1894) 1933  New Bern, Craven Co,, and Durham, Durham Co., N. C.  XVII-A 2 vols, 7=-9-59"
"Daniels, Thomas Cowper","Daniels, Thomas Cowper. Papers, 1889 (1889- 1894) 1933. New Bern, Craven Co., and Durhan, Durham Co., N. C. 2 vols. Sketch.  This collection consists of two volumes per- taining to Thomas Cowper Daniels of the Trinity College class of 1891.  One volume is Daniels senior thesis on ""Should the U. 8S. Government Control the Rail-     roads?"" He argues the affirmative side of the query. %  The second volume is a scrapbook containing mostly newspaper clippings about athletics at Trinity College, where Daniels was a member of Includes Ist Mabama- e* Fook «ff ¢4 we,  1F93,"
"Daniels, Thomas Cowper","Daniels, Thomas Cowper 2 the football and track teams. For photographs and additional biographical  information about Daniels, see Duke University Archives."
"Danielson, Joseph","Danielson, Joseph. Papers, 1861 , Mass.  Josiah C. lrent Collection in the 1 item. History of Medicine--. Div.  4-8-60"
"Danne, Jacques","Danne, Jacques Papers, 1904 Paris, France  Josiah CC. Trent Collection in the History of Medicine--. Div.  4-8-60"
"Danne, Jacques","Danne, Jacques, Papers, 1904. Paris, France. litem. Sketch,  Jacques Danne (1882-1919), French radiologist and editor of Le Radium, writes to an American collaborator concerning the influence of radi- ation on crystals and precious stones."
"Danner, Jacob S.","Danner, Jacob 8S. 6356 - 6361  Ledgers, 1833 - 1869 <—  Middleburg, Loudoun Co., Va.  6 vols."
