Name,Text
Methodist Episcopal Church,"Methodist Episcopal Church, Southe North Carolina Conferencee eenpe ty College Districte Randolph Circus  Church register, 1885-1899 (bulk  1886-1895 )e  1 iteme The original register is in the custody of the Mte Vernon United  Methodist Church, Trinity, North  Carolinae  Facsimile of ""The Complete Church  Register, Randolph Circuit, Trinity  College, North Carolina Conference""  containing the names of members, often  with dates of when they were received into the churches as well as disposals of some membe rs (deaths, dismissals, ¢ ransfers, and  withdrawals )e  The register 29 JUL 93 28534405 NDHYme SEE NEXT CRD"
Methodist Episcopal Church,"Methodist Episcopal Church, Southe North Carolina te Rondulph © Trinity College Districte bh Greus  Church register, eee (Card 2) pertains to Trinity Church and other churches in the circuite Registers of births, deaths, and marriages are also includede Near the front of the register is a list of pastors who were  appointed to the circuit between 1886  and 1899.  le Methodist Episcopal Church,  Southe--North Carolina-—Randolph  Circuite 2e Trinity Church (Trinity,  NeCe)e 3e Methodist Episcopal Church,  South--Clergye 4ce Church records and  registers-—-No rth Carolina——Randolph  Countye 5e me 2 enre: Church  registerse  29 JUL 93 28534405 NDHYme"
Methodist Episcopal Church,"M-2 871 Methodist Episcopal Church, South. N. CG.’ Conference, TRINITY COLLEGE District, N. C, RANDOLPH Circuit Quarterly Conference Minutes, 1888-1892 Randolph co., N, C,  Nov, 5, 1933"
Methodist Episcopal Church,"Methodist Episcopal Church, South. N. C. Conference, TRINITY COLLEGE District, N. C. RANDOLPH Circuit  See also  Methodist Episcopal Gyureh, South. Western  N. C. Conferen@e, GREENSB  A © District, N. C. RANDOLPH Circu&t  and Methodist Episcopal Church, South. N. C. Conference, GREENSBOR District, N. C. RANDOLPH Circuit"
Methodist Episcopal Church,"XVII-E Methodist Episcopal Church, South. North Carolina Conference. TVrinity College District. South Guilford Circuit* Quarterly Conference Minutes, 1863-1865 *Includes Trinity College Circuit, 1863.  11-5-33 Recataloged, 11-30-67"
Methodist Episcopal Church,"Cab. 81 Methodist Episcopal Church, South. North Carolina Conference. Trinity College and Greensboro Districts. Randolph Circuit  Quarterly Conference Minutes, 1875-1887 Folder of Papers, 1881-1899 & Undated  Randolph County, North Carolina  11..5-33 28 items & 1 vol. Recataloged, 9-28-77"
Methodist Episcopal Church,"M- 2882 Methodist Episcopal Church, South. N. C- Conference. Warrenton District  Quarterly Conference Minutes, 1913-1914 North Carolina 317 pp. Leather 21 x 13 cm.  1-21-42 Recataloged, 7-22-66"
Methodist Episcopal Church,"- 2881 Methodist Episcopal Church, South. N. C. Conference. Warrenton District Quarterly Conference Minutes, 1914-1915 North Carolina 337 pp. Leather 20 x 13 cm.  1-21-42 Recataloged, 7-22-66"
Methodist Episcopal Church,"F-24905  Methodist Episcopal Church, South, N. C. 2. Conference, WASHINGTON District, N. C, ,  District Conference Minutes, 1896-1910 Washington, N. C.  S32 pp. Calf 24 x 36 cm, June 11, 1937"
Methodist Episcopal Church,"M-2906  Methodist Episcopal Church, South. N, C. <; Conference, WASHINGTON District, N, 6,  Quarterly Conference Minutes, 1907  Washington, N. C, Apr. 7, 1938"
Methodist Episcopal Church,"M- 2407  Methodist Episcopal Church, South. N. C. 2. Conference, WASHINGTON District, N. ©, ""  Quarterly Conference Minutes of Presiding Elder, 1907-1908  Washington, N, C, Apr. 7, 1938"
Methodist Episcopal Church,"F- 23892  Methodist Episcopal Church, South. WN. 0, ©” Conference, WASHINGTON District, N. C, BATH Circuit  Chureh Records, 1860-1902 Bath, N, C,  Nov. 5, 1933"
Methodist Episcopal Church,"F- 2895 ~p.> Methodist Episcopal Church, South. N. C. Conference, WASHINGTON District, N. C. BATH Ciréuit. Quarterly Conference Minutes, 1849-1891  Bath, N. C.  Nov. 5, 1933"
Methodist Episcopal Church,"M-29493  Methodist Episcopal Church, South. N, 6, 0° Conference, WASHINGTON, District, N. C, BATH Charge  Quarterly Conference Minutes, 1891-1894  Washington, N. C, Apr. 7, 1938"
Methodist Episcopal Church,"M-2 846  Methodist Episcopal Church, South. N. C.0.5. Conference, WASHINGTON District, N. ©. COLUMBIA Circuit  Quarterly Conference Records, 1892-1895 Columbia, N. C. 108 pp. Boards 26 x 18 cm,  Jan 21, 1942"
Methodist Episcopal Church,"F j M-2949 Methodist Episcopal Church, South. North Carolina Conference. Washington District.  Dare Circuit  Quarterly Conference Minutes, 1889-1891  North Carolina  Circuit in N.C. Conference & Washington District in 1891. Records include Roanoke Island and Dare Circuit, 1888.  4-7-38 Recataloged, 9-10-84"
Methodist Episcopal Church,"M-2$97 Methodist EpBscopal Church, South,  nN. c, DS. Conference, WASHINGTON,District, N. C, DARE Circuit  Quarterly Conference Minutes, 1892-1895 Washington, N. C, Apr. 7, 1938"
Methodist Episcopal Church,"M- 2992  Methodist Episcopal Church, South. N, ©, © Conference, WASHINGTON District, N. 0, % 5S,  FIRST METHODIST Church  Quarterly Conference Minutes, 1911-1913  Washington, N, C, Apr. 7¥ 1938"
Methodist Episcopal Church,"; ; M-2899 Methodist Episcopal Church, South. North  Carolina Conference. Washington District. Hatteras Circuit  Quarterly Conference Minutes, 1887-1890  100 pp. Boards 27 x 20 cm. 7-8-41"
Methodist Episcopal Church,"M-2940 Methodist Episcopal Church, South. North  Carolina Conference. Washington District. Kitt Hawk Mission  Quarterly Conference Minutes, 1888-1891  North Carolina"
Methodist Episcopal Church,"Methodist Episcopal Church, South. worthn-’ 2°  Carolina Conference. Washington District. Ocracoke and Hatteras Circuit  Quarterly Conference Minutes, 1892-1895  North Carolina  4-7-38"
Methodist Episcopal Church,"M=2900 Methodist Episcopal Church, South. North  Carolina Conference. Washington District. Roanoke Island Circuit  Quarterly Conference Minutes, 1892-1895  North Carolina  4-7-38"
Methodist Episcopal Church,"M-2903 Methodist Episcopal Church,South. North  Carolina Conference. Washington District. Washington Station  Church Conference Minutes, 1891-1911 Washington, North Carolina  4-7-38"
Methodist Episcopal Church,"M-240)  Methodist Episcopal Ynurch, South. N.Y. | Conference, WASHINGTON District, N. ¢C, -  WASHINGTON Station Church Register, 1887-1893 Washington, N, C,  Apr. 7, 1938"
Methodist Episcopal Church,"M2402 Methodist Episcopal “nurch, South, N. 0, ~ Conference, WASHINGTON District, N. C, iP WASHINGTON Station v  Quarterly Conference Minutes, 189191894  Washington, N, C, Apr. 7, 1938"
Methodist Episcopal Church,"M-2904 Methodist Episcopal Church, South. North  Carolina Conference. Washington District. Washington Station  Quarterly Conference Minutes, 1911-1914  Washington, North Carolina  4-7-38"
Methodist Episcopal Church,"#-24908 Methodist Episcopal Church, South. N.C. ~'  Conference, WILMINGTON Districts N. C. e  District Conference Records, 1866-1897 * Wilmington, N. C. 575 pp. Calf 24 x 35 cm, This is a very full and carefully kept record  with many references to the need for public educ&tion,.  June 11, 1937 * See note over."
Methodist Episcopal Church,"Methodist Episcopal Church, South. North Carolina Conference. Wilmington District. Elizabeth Circuit  Church Register, No. 1, 1888-1903"
Methodist Episcopal Church,"4-F Methodist Episcopal Church, South. North  Carolina Conference. Wilmington District. Elizabeth Circuit  Church Register, No. 2, 1898-1930  Circuit in Wilmington District through 1904."
Methodist Episcopal Church,"M-2413  Methodist Episcopal Church, South, N. co, ) Conference. WILMINGTON District, N. C. ELIZABETH Circuit  Quarterly Conference Minutes, 1875-1887 Bladen co., N. C.  Nov. 5, 1933"
Methodist Episcopal Church,"M-2 919  Methodist Episcopal Church, South. WN. G. ~ Conference, WILMINGTON District, N. Cc. * ELIZABETH Circuit  Quarterly Conference Minutes, 1887-1891 Bladen co., N. C. Nov. 5, 1933"
Methodist Episcopal Church,"M- A914 Methodist Episcopal Church, South, N. 6.”  Conference, WILMINGTON District, N. C. _ ELIZABETH Circuit  Quarterly Conference Minutes, 1892-1895 Bladen co., N. C.  Nov, 5, 1933"
Methodist Episcopal Church,"M-Aqis Methodist Episcopal Church, South, N. C  Conference. WILMINGTON District, N. G. 2” ELIZABETH Circuit  Quarterly Conference Minutes, 1896-1899 Bladen co., N. C. Nov. 5, 1933"
Methodist Episcopal Church,"M-A4 Ile  Methodist Episcopal Church, South. N. 0. 2%, Conference. WILMINGTON District, N. C. ELIZABETH Circuit  Quarterly Conference Minutes, 1900-1903 Bladen co., Ni C.  Nov. 5, 1933"
Methodist Episcopal Church,"M-2917 Methodist Episcopal Church, South. North  Carolina Conference. Wilmington District. Elizabeth Circuit  Quarterly Conference Minutes, 1904-1907  Circuit in Wilmington District in 1904  L1-5~33  Recataloged, 3-13-86"
Methodist Episcopal Church,"Methodist Episcopal Church, South. North  Carolina Conference. Wilmington District. Elizabeth Circuit  Quarterly Conference Minutes, 1931-1933  Circuit in Wilmington District From 1932"
Methodist Episcopal Church,"Methodist Episcopal Church, South. North Carolina Conference. Wilmington District. Elizabeth Circuit  Quarterly Conference Minutes, 1945-1949"
Methodist Episcopal Church,"M- 4293 Methodist Episcopal Church, South. N. OC.  Conference. WILMINGTON District, N.C. 25 Elizabeth Charge. Singletary Church  Quarterly Conference Minutes, 1895-1905  cBladen Co.  154 pp. Boards 26 x 20 cm."
Methodist Episcopal Church,"M-2925 Methodist Episcopal Church, South. N. C. Conference. WILMINGTON District. Fifth Street Church Church Register, 1851-1884 Wilmington, N. C. Nov. 5, 1933  Recataloged, 6-18-65"
Methodist Episcopal Church,"M-29 24  Methodist Episcopal Church, South, WN, C0.7<¢ Conference, WILMINGTON,District, N. 6, FIFTH STREET Statioh  Church Register, 1885-1888 Wilmington, N, C, Apr. 7, 1938"
Methodist Episcopal Church,"M-2912 Methodist Episcopal Church, South. N.C. Conference. WILMINGTON District. Fifth Street Church Church Conference Minutes, 1903-1905 Wilmington, N. C. Nov. 5, 1933  Cataloged, 6-18-65"
Methodist Episcopal Church,"M-2419 Methodist Episcopal Church, South, N. C.  sree caeet. a District, N, ©, 29, Records, 1844-1870 Wilmingtonp N. C,  97 pp. Boards & Calf 24 x 33 cm,  June 11, 1937"
Methodist Episcopal Church,"M-2920 ,. Methodist Episcopal Church, South. N. C. Conference. WILMINGTON District. Fifth Street Church  Quarterly Conference Minutes, 1873-1880 Wilmington, N. C.  April 7, 1938  Recataloged, 6-18-65"
Methodist Episcopal Church,"M-2909 Methodist Episcopal Church, South. N. C. at Conference. WILMINGTON District. Pifth Street Church Quarterly Conference Minutes, 1880-1888 Wilmington, N. C. Nov. 5, 1933  Recataloged, 6-18-65"
Methodist Episcopal Church,"“\- 2910 Methodist Episcopal Church, South, N. C. Conference, WILMINGTON District. Fifth Street Church Quarterly Conference Minutes, 1888-1892 Wilmington, N. C, Nov. 5, 1933  Recataloged, 6-18-65"
Methodist Episcopal Church,"M-2922 Dio»  Methodist Episcopal Church, South. N. C. Conference. WILMINGTON District. Fifth Street Church Quarterly Conference Minutes, 1892-1896 Wilmington, N. C. April 7, 1938  Recataloged, 6-18-65"
Methodist Episcopal Church,"M-2911 Methodist Episcopal Church, South. N. C. Conference. WILMINGTON District. Fifth Street Church Quarterly Conference Minutes, 1896-1900 Wilmington, N. C. Nov. 5, 1933  Recataloged, 6-18-65"
Methodist Episcopal Church,"“-2923 Methodist Episcopal Church, South, N. C. Conference. WILMINGTON District. Fifth Street Church  Quarterly Conference Minutes, 1900-1904  Wilmington, N. C. April 7, 1938"
Methodiét Episcopal Churc,"2424 Methodiét Episcopal Church, Soyth, N. 6,25  Conference, WILMIN@TON District, N. C, WILMINGTON Church  Board of Stewards' Records, 1880-1888  Wilmington, N. C. Nov. 5, 1933  : A> oe eT AoA. rg Ke/o-S/3 \"
Methodist Episcopal Church,"F-2926 Methodist Episcopal Church, South. North  Carolina Conference. Wilson District. District Conference Minutes, 1892-1894  Wilson, North Carolina"
Methodist Episcopal Church,"L-2706 Methodist Episcopal Church, South. North  Georgia Conference. Dahlonega District. Dahlonega and Auraria Station  Quarterly Conference Minutes, 1867-1868  District in North Georgia Conference from 1866. Records include Dahlonega Station, 1861-1863,  Dahlonega Circuit, 1866, Dahlonega Station & Mission, 1869-1870, Dahlonega Circuit, 1871- 1873, Dahlonega & Jones Chapel, 1874-1878  12-14-84"
Methodist Episcopal Church,", L-2706 Methodist Episcopal Church, South. North  Georgia Conference. Dahlonega District. Dahlonega and Jones Chapel  Quarterly Conference Minutes, 1874-1878  District in North Georgia Conference from 1866. Churches in Dahlonega District except during  1874-1875. Records include Dahlonega Station, 1861-1863, Dahlonega Circuit, 1866, Dahlonega  & Auraria Station, 1867-1868, Dahlonega Station & Mission, 1869-1870, Dahlonega Circuit, 1871- 1873  12-14-84 coe"
Methodist Episcopal Church,"L-2706 Methodist Episcopal Church, South. North  Georgia Conference. Dahlonega District. Dahlonega Station and Mission  Quarterly Conference Minutes, 1869-1870  District in North Georgia Conference from 1866.  Records include Dahlonega Station, 1861-1863, Dahlonega Circuit, 1866, Dahlonega & Auraria Station, 1867-1868, Dahlonega Circuit, 1871- 1873, Dahlonega & Jones Chapel, 1874-1878  12-14-84"
Methodist Episcopal Church,": : L-2706 Methodist Episcopal Church, South. North  Georgia Conference. Gainesville District. Dahlonega and Jones Chapel  Quarterly Conference Minutes, 1874-1878  Churches in Gainesville District, 1874-1875. Records include Dahlonega Station, 1861-1863,  Dahlonega Circuit, 1866, Dahlonega & Auraria Station, 1867-1868, Dahlonega Station & Mission, 1869-1870, Dahlonega Circuit, 1871-1873  12-14-84"
Methodist Episcopal Church,"-27 Methodist Episcopal Church, South. North / ic  Georgia Conference. Dahlonega District. Dahlonega Circuit  Quarterly Conference Minutes, 1871-1873  District in North Georgia Conference from 1866. Records include Dahlonega Station, 1861-1863,  Dahlonega Circuit, 1866, Dahlonega & Auraria Station, 1867-1868, Dahlonega Station & Mission, 1869-1870, Dahlonega & Jones Chapel, 1874-1878  12-14-84"
Methodist Episcopal Church,"Cab. 87 Methodist Episcopal Church. South Carolina  Conference. Camden District. Montgomery Circuit  Quarterly Conference Minutes, 1808 North Carolina  Records include Rocky River Circuit, 1807-1819.  12-6-65"
Methodist Episcopal Church,"Cab. 87  Methodist Episcopal Church. South Carolina Conference. Camden District. Rocky River Circuit  Quarterly Conference Minutes, 1807-1819  North Carolina Circuit in Camden District until 1809. Records include Montgomery Circuit, 1808.  12-6-65"
Methodist Episcopal Church,"XVII-B Methodist Episcopal Church, South. South Carolina Conference. Catawba District. Lincolnton Circuit  Quarterly Conference Minutes, 1828-1867 North Carolina  Circuit in Catawba Dist. in 1863. Records include Rock Spring Circuit, 1868-1876.  ~1- 21-42 Recataloged, 4-21-69"
Methodist Episcopal Church,"Cab. 87 Methodist Episcopal Church. South Carolina Conference. Catawba District. Rocky River Circuit Quarterly Conference Minutes, 1807-1819  North Carolina  Circuit in Catawba District from 1810. Records include Montgomery Circuit, 1808.  12-6-65"
Methodist Episcopal Church,"Cab. 87-Box III Methodist Episcopal Church, South. South Carolina Conference. Cheraw District. Wadesboro Circuit  Quarterly Conference Minutes, 1845 & 1849  North Carolina Circuit in Cheraw District until 1847.  Methodist Church .  12-6-65"
Methodist Episcopal Church,"Cab. 87-Box III Methodist Episcopal Church, South. South Carolina Conference. Fayetteville District. Wadesboro Circuit Quarterly Conference Minutes, 1845 & 1849 North Carolina Circuit in Fayetteville Dist. from 1847.  Methodist Church .  12-6-65"
Methodist Episcopal Church,"XVII-B Methodist Episcopal Church, South. South  Carolina Conference. Lincolnton District. Lincolnton Circuit  Quarterly Conference Minutes, 1828-1867 North Carolina  Circuit in Lincolnton Dist. until 1852 and  1860-1862. Records include Rock Spring Circuit, 1868-1876.  1-21-42 Recataloged, 4-21-69"
Methodist Episcopal Church,"L-5704 Methodist Episcopal Church, South. S.C.  Conference. Marion District. Bennettsville Circuit  Quarterly Conference Minutes & Stewards' Meetings Minutes, 1846-1873  South Carolina  200 pp. Boards 31 1-2 x 20 cm.  6-1-57 Recataloged, 11-3-84"
Methodist Episcopal Church,"Chapa of” cab, Se. M.E. CHURCH, SOUTH. South Carolina Conferéntd  Shelby District Conference Minutes, 1867-1879,  North Carolina 1 vol. and 11lloose  Gift of: papers. R. L. Durham Buena Vista, Va.  GUIDE @  JUN 21 46"
Methodist Episcopal Church,"XVII-B Methodist Episcopal Church, South. South Carolina Conference. Shelby District. Lincolnton Circuit  Quarterly Conference Minutes, 1828-1867 North Carolina Circuit in Shelby Dist. during 1855-1859,  1864-1867. Records include Rock Spring Circuit, 1868-1876.  1-21-42 Recataloged, 4-21-69"
Methodist Episcopal Church,"XVII-B Methodist Episcopal Church, South. South Carolina Conference. Shelby District. Lincolnton Circuit  Quarterly Conference Minutes, 1869-1881 North Carolina District in S.C. Conference until 1870. Records include Lincolnton Sta., 1864-1868,  Gaston Circuit, 1882-1889, & Stanley Creek Circuit, 1890.  12-10-54 @ Recataloged 4-21-69"
Methodist Episcopal Church,"XVII-B Methodist Episcopal Church, South. South Carolina Conference. Shelby District. Lincolnton Station  Quarterly Conference Minutes, 1864-1868 Lincolnton, N.C. Records include Lincolnton Circuit, 1869-1881,  Gaston Circuit, 1882-1889, & Stanley Creek Circuit, 1890.  12-10-54 Recataloged, 4-21-69"
Methodist Episcopal Church,"Methodist Bpiscopal Church, South. South Carolina Conference. Shelby District. Mor- ganton Circuit. Brindletown Church  See Methodist Episcopal Church, South. North Carolina Conference. Shelby District. Morganton Circuit.. Brindletown Church"
Methodist Episcopal Church,"XVII-B Methodist Episcopal Church, South. South Carolina Conference. Spartanburg District. Lincolnton Circuit  Quarterly Conference Minutes, 1828-1867 North Carolina  Circuit in Spartanburg Dist. during 1853-1854. Records include Rock Spring Circuit, 1868-1876.  1-21-42 Recataloged, 4-21-69"
Methodist Episcopal Church,"F- 2705 Methodist Episcopal Church  East Tennessee Annual Conference  Minutes, 1880-1885  @. Greenville, Greene Co., Tennessee  86 pp. Boards 36 x 22 cm.  Contains frequent mention of aid to freedmen.  5-27-43 @"
Methodist Episcopal Church,"$s-y1 2982 Methodist Episcopal Church, South, Publishing House ), Report on Condition, April 9, 1917  Nashville, Tennessee  Nov. 5, 1933"
Methodist Episcopal Church,"Methodist Episcopal Churche Virginia Conferencee  Autobiographical collection, 1822- 1871.  50 itemse  Holograph autobiographical sketches, 1822-1844, of 46 Methodist ministers from the Virginia Conferencee Also includes typescripts of two of the sketches, a: typed List entitled ""Autobiographical Materials-—-Virginia Conference,"" and another typed document entitled ""Virginia Conference Ministers of the Methodist Episcopal Church South appointed to seve within the bounds of the Balitimore Conference of the Methodist Epi scopal Church.""  ia gy  13 MAY 92 25806090 NDHYme SEE NEXT CRD"
Methodist Episcopal Church,"Methodist Episcopal Churche Virginia  Cenferencee Autobiographical collectiony eee (Card 2)  1. Methodist Episcopal Church-—- Virginia--Clergye 2e Methodist Episcopal Church-—Clergy--Biographye ge. Methodist Episcopal Church, Southe Virginia Conference--Clergye Ie Title  13.MAY 92 25806090 NDHYme"
Methodist Episcopal Church,"Methodist Episcopal Church. Virginia Conference  Recording Steward's Book, 1815-1844  Recataloged as:  Methodist Episcopal Church. Virginia and North Carolina Conferences. Newbern and Neuse Districts. New River, Newport, and Trent Circuits  Quarterly Conference Minutes, 1805-1844"
Methodist Episcopal Church,"M~2927   G5;  Methodist Episcopal Church, South, VIRGINIA Conference. Board of Education,  Minutes, 1902-1910,  Ve De  Sept a 24, 1934,"
Methodist Episcopal Church,"— 2880 Methodist Episcopal Church. Virginia Confer- ence. Danville District. Chatham Circuit  Register and Quarterly Conference Minutes, 1833-1841  North Carolina  District in Virginia Conference until 1838. Circuit in Danville Dist. until 1838. Re- cords include Franklinsville Circuit, 1849- 1871, South Guilford Circuit, 1862, Guilford Mission, 1867, & Franklinsville and Cedar Falls Station, 1872  11-5-33 & Recataloged, 12-15-65"
Methodist Episcopal Church,"M-2929 Methodist Episcopal Church, South. Virginia  Conference. Fredericksburg District. Loudoun Circuit  Quarterly Conference Minutes, 1850-1858 Circuit in Fredericksburg Dist., 1850-1852. 5-23-34  Recataloged, 9-17-84"
Methodist Episcopal Church,"L-5005 Methodist Episcopal Church, South. Virginia  Conference. Murfreesboro District District Conference Minutes, 1873-1889  North Carolina and Virginia  2-12-51  Recataloged, 9-12-84"
Methodist Episcopal Church,"I-D Methodist Episcopal Church, South. Virginia Conference, Murfreesboro District, Camden Circuit Quarterly Conference Minutes, 1877-1885  North Carolina  11-5-33  Recataloged, 9-17-84"
Methodist Episcopal Church,"M-2931 Methodist Episcopal Church, South. Virginia  Conference. Murfreesboro District, Camden Circuit  Quarterly Conference Minutes, 1886-1889  North Carolina  4-7-38  Recataloged, 9-17-84"
Methodist Episcopal Church,"M-2932 Methodist Episcopal Church, South. Virginia Conference. Murfreesboro District. Camden Circuit Quarterly Conference Minutes, 1890-1893 North Carolina  Circuit in Murfreesboro Dist. in 1890.  4-7-38 Recataloged, 9-17-84"
Methodist Episcopal Church,"M-2934 Methodist Episcopal Church, South. Virginia  Conference. Murfreesboro District. Currituck Circuit and Mission  Quarterly Conference Minutes, 1859-1860 & 1867-1870  North Carolina  Circuit in Murfreesboro District, 1867-1870. Records include Dare Mission and Circuit, 1871- 1878.  11-5-33 a | 9-17-84"
Methodist Episcopal Church,"Methodist Episcopal Church, South. virginhis?*9  Conference. Murfreesboro District. Dare Circuit Quarterly Conference Minutes, 1889-1891  North Carolina  Circuit in Virginia Conference & Murfreesboro District through 1890. Records include Roanoke Island & Dare Circuit, 1888.  4-7-38 Recataloged, 9-17-84"
Methodist Episcopal Church,"7 M-2934 Methodist Episcopal Church, South. Virginia  Conference. Murfreesboro District. Dare Mission and Circuit  Quarterly Conference Minutes, 1871-1878  North Carolina  Circuit in Murfreesboro District, 1871 & 1873- 1878. Records include Currituck Circuit and Mission, 1859-1870.  11-5-33 Recataloged, 9-17-84"
Methodist Episcopal Church,"F-2936 Methodist Episcopal Church, South. Virginia Conference. Murfreesboro District. Gates Circuit Quarterly Conference Minutes, 1872-1891  North Carolina  L1-5=-33  Recataloged, 9-17-84"
Methodist Episcopal Church,"Methodist Episcopal Church--Virginia Conference-- Murfreesboro District--Gates Circuit.  Recording Steward’s Book, 1825-1872 (Financial Reports to Quarterly Conferences)  North Carolina  Circuit in Murfreesboro District during 1855-1856 & 1866-1872. Records include Bertie Circuit, 1817-1822, Gates & Edenton Circuit, 1822-1824, Murfreesboro & Gates Circuit, 1824-1825, & Gates & Bertie Circuit, 1830-1831.  6/11/37 Recataloged 1/11/84"
Methodist Episcopal Church,"F-2836 Methodist Episcopal Church, South. Virginia  Conference. Murfreesboro District. Hertford Circuit Quarterly Conference Minutes, 1874-1891  North Carolina  11-5-33 Recataloged, 11-8-84"
Methodist Episcopal Church,"M-2940 Methodist Episcopal Church, South. Virginia  Conference. Murfreesboro District. Kitty Hawk Mission Quarterly Conference Minutes, 1888-1891 North Carolina  In Virginia Conference & Murfreesboro Dist., 1888-1890,  4-7-38 Recataloged, r"
Methodist Episcopal Church,"M-2941 Methodist Episcopal Church, South. Virginia  Conference, Murfreesboro District. North Gates Circuit  Quarterly Conference Minutes, 1888-1892  North Carolina  Circuit in Murfreesboro District, 1888-1890  4-7-38 Recataloged, 9-17-84"
Methodist Episcopal Church,"M-2944 Methodist Episcopal Church, South. Virginia  Conference. Murfreesboro District. Pasquotank Circuit Quarterly Conference Minutes, 1854-1858 North Carolina  Circuit in Murfreesboro Dist., 1855-1856  6-11-37 Recataloged, 9-17-84"
Methodist Episcopal Church,"M-2945 Methodist Episcopal Church, South. Virginia  Conference, Murfreesboro District. Pasquotank Circuit  Quarterly Conference Minutes, 1883-1887  North Carolina  4-7-38  Recataloged, 9-17-84"
Methodist Episcopal Church,"M-2949 Methodist Episcopal Church, South. Virginia  Conference. Murfreesboro District. Roanoke Island and Dare Circuit  Quarterly Conference Minutes, 1888  North Carolina Records include Dare Circuit, 1889-1891.  4-7-38  Recataloged, 9-17-84"
Methodist Episcopal Church,"Methodist Episcopal Church, Southe Virginia Conferencee Pasquotank Circuite Quarterly Conferencee  Minute book, 1852-1883.  1 item (cae 274 pe)e  Circuit transferred to North Carolina Conference, 1894.  Minutes, including some financial records, of circuit located in Pasquotank, Perquimans, and Camden counties, NeCe Includes McBrides, Newland, Newbegun, Union, Mte Hermon, Halls Creek, Oak Grove, New Hope » Concord, Providence, Mte Zion, and Woodville churchese 5  07 JUL 88 18182843 NDHYme SEE NEXT CRD"
Methodist Episcopal Church,"Methodist Episcopal Church, Southe Virginia Conferencee Pasquotank Circuite Quarterly Conferencee  Minute book, 1852-18836 eee (Card 2)  le Pasquotank County (NeCe )—-Church historye 2+ Perquimans County ( NeCe )-—— Church historye 3e Camden County (NeCe )-——-Church historye 4-e Methodists  --North Carolinae  07 JUL 88 18182843 NDHYme"
