Name,Text
"Gerard, Son of Jacobus","Gerard, Son of Jacobus  FOR INFORMATION ABOUT THIS COLLECTION OR ADDITIONS TO THIS COLLECTION, PLEASE ASK A STAFF MEMBER TO CONSULT THE ACCESSION  RECORDS."
Gerbier,"Gerbier,     Papers, 1792 Paris, France  Josiah C. Trent Collection in the History of Medicine--s. Div.  4-8-60"
"Gerhardt, William","Gerhardt, William Papers, 1832-1909 Martinsburg, Berkeley Co., W. Vae  Section A 34 items l item added,  8~3-66 9-5-67"
"Gerhardt, William","Gerhardt, William. Papers, 1832-1909 Martinsburg, Berkeley Co., We Va.     William Gerhardt was born in 1817 in Germany and moved with his family to Pa. After being graduated from Gettysburg College in 1841, he attended Gettysburg Seminary for one year. He served as a clergyman, teacher, and school  administrator at various places in Pa., Md., N. C.e,,and W. Vas He was the first professor at the“ western Carolina Male Academy founded in 1855 at Mt. Pleasant, N. C. He remained in"
"Gerhardt, William","Gerhardt, William 2     N. C. until 1863 at which time he moved to Martinsburg where he lived until his death in 1917.  Among the more notable items in this collection are a series of contracts whereby a William Gearhart agreed to teach in several towns in Pa. and Md. from 1833 to 1843.  Items from Gerhardt's residence in N. C. include two programs for Examination Day exercises and a schedule for classes at the Western Carolina Male Academy (1855-1857)."
"Gerhardt, William","Gerhardt, William 3     Other papers of interest are genealogical material and a list of contributors to a fund to liquidate the debts of a German church in the U. S.  Several letters in this collection were written in German in a small, almost illegible script. An index to some family papers is  written on an envelope and possibly identifies these remaining items.  A short biographical sketch of Gerhardt can be found in Willis F. Evans, History of"
"Gerhardt, William","Gerhardt, William Berkeley County, West Virginia, p. 168. For additional biographical information, see Clyde B. Stover and Charles W. Beachen, Alumni Records of Gettysburg -Colleze, 1832- 1932, p. 10d.  l item added, 9-5-67: A notice from Gerhardt to S. A. Grabill concerning dues owed to the Knights of Pythias, Sept. 3, 1909."
"Germain, George Sackville, First Viscount Sackville","Germain, George Sackville, First Viscount Sackville  Papers, 1779  London, England  XVIII-E 10-27-59"
"Germain, George Sackville, First Viscount Sackville","Germain, George Sackville, First Viscount Sackville. Papers, 1779. London, England.     George Sackville Germain, First Viscount Sackville (1716-1785) was known as such from 1770-1782, as Lord George Sackville from 1720 to 1770, and as George Sackville Germain, First Viscount Sackville from 1782 to 1785. This  collection contains a letter of December 13, 1779, to Lord George. Germain, then British Sec- retary of State for the colonies, from Gen.  Sir Henry Clinton, Sr., then commander of the  British forces in the U.S. Clinton discusses  the"
"Germain, George Sackville, First Viscount Sackville","Germain, George Sackville, First Viscount Sack- ville 2 unsuccessful Siege of Savannah (Sept.-Oct., 1779) by French and American forces under the commands of Count D'Estaing of France and U. 8. Gen. Benjamin Lincoln, Jr. (1733-1810); praises the gallantry of the British resistance; and     seconds Gen. Augustine Prevost's recommendation to reward Capt. James Moncrieff,  Clinton reports the loss of the British war- ship, Experiment, together with 30,000 pounds, Which he had sent in that ship with Gen. Garth; but Gen. Leslie arrived_safely with 15,000"
"Germain, George Sackville, First Viscount Sackville","Germain, George Sackville, First Viscount Sack- ville 5 pounds, Gen. McLean cAllan MacLean’; 1s to write to Lord George Germain by the frigate which Admiral Sir George Collier sent to England with the dccount of the complete destruction of the American Naval Squadron in the unsuccessful     Penobacot Expedition (June-Aug., 1779). Lt. Ca (later Gen,) Robert Donkin has sailed with some troops to reinforce thé Bermuda Garrison, which seems to have been one of the objects of > ' D'Estaing's visit to the coast.  Accompanying the letter is a schedule of en-"
"Germain, George Sackville, First Viscount Sackville","Germain, George Sackville, First Viscount Sack- ville 4 closures to the letter, but the enclosures them- selves are not included in the collection. Most of the items are letters among several of the aforementioned persons. One item listed is a Casualty return for the siege; another, a list of French ships under Count D'Estaing off the coast of Ga."
"Germain, Lord George","GERMAIN, LORD GEORGE (1716-1785)  See: Germain, George Sackville, First Vis-  count Sackville"
German Scrapbooks on the Imperial Family,German Scrapbooks on the Imperial Family  1888-1898  Germany 3065-3066 & 6-7-71  See also bound volume cards  41 items & 2 vols.
German Scrapbooks on the Imperial Family,"German Scrapbooks on the Imperial Family. Germany     The two scrapbooks and the loose clippings found within them include newspaper cuttings, broadsides, pamphlets, announcements, special issues of publications, etc., about the German imperial family during 1888-1898. The two  volumes almost entirely concern the death and funeral of Kaiser Wilhelm I in 1888. The loose clippings of 1890-1898 include items about the death of the Kaiserin Augusta, wife of Wilhelm I, in 1890, the centenary in 1897 of the birth of Wilhelm I (a few 6} are at the end of"
German Scrapbooks on the Imperial Family,"German Scrapbooks on the Imperial Family one of the scrapbooks), and other matters. Some of the publications are illustrated."
German Scrapbooks on the Imperial Family,"German Scrapbooks on the Imperial Family     German Scrapbook on the Imperial t- 3065 Family, 1888 —--"
German Scrapbooks on the Imperial Family,"German Scrapbooks on the Imperial Family     Geman Scrapbook on the Imperial F- 3066 Family, 1888-1897"
German-American Mutual Loan And Bldg. Association,"GERMAN-AMERICAN MUTUAL LOAN AND BLDG. ASSOC, <& Papers, 1886-1893  Qa  Savannah, Ga,  Section A, 23 pieces  (Taken from coll. accessioned Panegs)"
German-American Mutual Loan And Bldg. Association,"GERMAN-AMERICAN MUTUAL LOAN AND BLDG. ASSOC, Papers, 1886-93 Savannah, Ga, 23 pieces     Cancelled stock certificates in the German- American Mutual Loan and Bldg. Association,"
"Germanisches Nationalmuseum, Nuremberg","Germanisches Nationalmuseum, Nuremberg  See Nuremberg. Germanisches Nationalmuseum"
Germany,"Germany  FOR INFORMATION ABOUT THIS COLLECTION OR ADDITIONS TO THIS COLLECTION, PLEASE ASK  A STAFF MEMBER TO CONSULT THE ACCESSION RECORDS."
"Germany, Air Ministry",Germany. Air Ministry  See Germany. Reichluftfahrtministerium
"Germany, Army High Command",Germany. Army. High Command.  See Germany. Wehrmacht. Oberkommando
"Germany, Auswartiges Amt. Archivkommission","Germany. Auswartiges Amt. Archivkommission Papers, 1835-1905 Berlin, Germany  SEE SHELF LIST 317 items 8-20-82"
"Germany, Auswartiges Amt. Archivkommission","Germany. Auswartiges Amt. Archivkommission. Papers. Berlin, Germany     This collection is a group of Bismarck docu- ments in facsimile published by the Auswdrtiges Amts. According to the description of the docu- ments by Professor Frederic B. M. Hollyday they as a group give great insight into the way  Chancellor Otto von Bismarck ran the foreign service of Germany. Matters of form in drafting documents was very important to him. This in- terest even when he was immersed in die grosse  Politik is revealed in the documents in this"
"Germany, Auswartiges Amt. Archivkommission","Germany. Auswartiges Amt. Archivkommission. 2 ° collection. It is also valuable for showing Bismarck's relationships with others, particu- larly, Emperor William I."
"Germany, Auswartiges Amt. Archivkommission","MARHSSCREPTS tn Nel S papers ana Germany. Auswartiges Amt WMevAsns  German Foreign Ministry Archives, 1867- 1920, Whaddon Hall, England. ed by General Library, University of California, Berkeley.  433 Reels (Series T-149) 35 mm.  6-22-65"
"Germany, Auswartiges Amt. Archivkommission","Germany. Auswartiges Amt. German Foreign Ministry Archives, 1867-1920  The contents of each reel are described in California, University, Library, An Index of     German Foreign Ministry Archives, 1867-1920. ed at Whaddon Hall for the General Li- brary, University of California, Berkeley (Ber- keley, 1957).  The library has the following reels: Series I: Reels: 91, Parts 1-3; 99, Pts. 1-2; 106- 108, 137-141, 154, 158, 167, 256, 262, 273, 275, 292, 312, 321, j¢4 yg"
"Germany, Auswartiges Amt. Archivkommission","fr New a . » yo 07.,  Lep?.  Germany. Ausw¥rtiges Amt  Papers on Karl Radek, 1917-1920 1 reel Positive  3-11-71"
"Germany, Auswartiges Amt. Archivkommission","Germany. AuswHrtiges Amt. Papers on Karl Radek     Karl Radek (1885-19397), Soviet propagandist, went to Russia with Lenin, took part in the Brest-Litovsk peace negotiations, and was active in Germany during 1918-1919. He was imprisoned there in February-December, 1919."
"Germany, Auswartiges Amt. Archivkommission","7 pyre  Germany. Auswartiges Amt. (ire tilons [Records of the German Foreign Office received by Dept. of State] London, Foreign Office/State Department German War Documents  Project, 1945?- 80 reels. (National Archives Microcopy No. T-120) Library has: (See card 3)   copy (negative) of a collectiond records, corresvondence, etc, made by"
"Germany, Auswartiges Amt. Archivkommission","2  Germany. Auswartiges Amt. [Records of the German Foreign Office received by Dept. of State]... 1945?-  National Archives  Publications. For a discussion of the methods by which the documents for filming were chosen and a  translation into English of documents for the period 1918-1945, see: Germany. Auswartiges Amt. Documents on German foreign policy, 1918-1945. Washington, 1949-"
"Germany, Auswartiges Amt. Archivkommission","Germany. Auswartiges Amt. 3  Reels 1313-14, 1340-42, 1388, 1492-93, 1538- 39, 1554-57, 1560, 1564, 1567, 1578-79, 1591-93, 1683-86, 1708-11, 1779-83, 2293-95, 2378-80, 2383, 2419, 2581, 2673, 2676, 2682, 2760, 2810- 11, 2903, 2999, 3002-5, 3026, 3221, 3251, 3255- 58, 3269, 3280, 3283-86, 3313, 3422-28, 3495, 3519, 3631, 3663, 3944-45, 4777  — Quel Name sreo autdletonafp tele  =); VY ra? Por ee F . = CE Neco =” gil celal ~ Lenot MM, 2 podiins hem  Lalit Dottin go . @"
"Germany, Foreign Office",Germany. Foreign Office  See Germany. Auswdrtiges Amt.
"Germany, Nuremberg","Germany. Nuremberg  FOR INFORMATION ABOUT THIS COLLECTION OR ADDITIONS TO THIS COLLECTION, PLEASE ASK  A STAFF MEMBER TO CONSULT THE ACCESSION RECORDS."
Germany Posters,"Germany  Posters  Vault, Bak ‘  These 25 posters contain examples of Nazi Realism, primarily of medieval and World War One subjects. Also included are World War Two compaign maps and a print of Adolf  Hitler."
"Germany, Reichsluftfahrtministerium","Ps)  wanuseREans Aaespapes Sing  Germany. Reichs luftfahrtministerium, “74s Records of the Reich Air Ministry (Reichs- luftfahrtministerium) 1928-1945. Washington, American Historical Association, American Com mittee for the Study of War Documents, 1959. 52 reels. (National Archives Microcopy No. T-177) Library has: reel 4   copy (positive) of a collection of books, folders, correspondence, etc. made by National Archives  Publications."
"Germany, Wehrmacht Oberkommando","sf > s ee  if SGt Vows PETS C  Aan  Germany. Wehrmacht, Oberkommando. MYzvtles  Records of headquarters, German Armed Forces High Command. (Oberkommando @er Wehrmacht/OKW) Washington, American Historia Association, American Committee for the Stud of War Documents, 1956.  15 reels. (National Archives Microcopy No. T-77) Library has: Reels 18, 70, 86, 102 109-119.   copy (positive) of a collection"
"Germany, Wehrmacht Oberkommando","2 Germany. Wehrmacht. Oherkommando. Records of headquarters ... 1956.  of books, folders, reports, correspondence, etc, made by National Archives  Publications."
"Germino, Antonio Francesco","e 6th 17:B (5-21-77; 4-4-80) Germino, Antonio Francescoe Papers, 1976 and nede 3 itemse Accomplished musician and designer and producer of tools and wrought iron designs who founded the Southern Tool Manufacturing Companye A music manuscript, statement identifying the manuscript, and composition and arrangement booke According to the statement, the manuscript consists of copies of operatic arias and other selections made for his personal use by Antonio Francesco Germinoe Unprocessed collectione Cataloged from accessio@= recordse  *hab 19980923 #39920245 NDHYme SEE NEXT CRD"
"Germino, Antonio Francesco","e 6th 17°:B (5-21-77; 4-4-80) Germino, Antonio Francescoe Papers, eece (Card 2)  1. Germino, Antonio Francescoe 2. Musicianse  19980923 #39920245 NDHYme"
"Germino, Dante J.",".- 6th 17:B  (3-14-84) Germino, Dante Je  Brothers of the Brush Register, 1953-6  1 iteme  Chairman of The Durham Centennial and Historical Commission Beard Committeee  This volume is a register kept of the ""Brothers of the Brushe""™ The names and addresses of 3093 residents of Durham appear in the registere Each of the Brothers paid a membership fee of $1200, received a button, and agreed his civic duty to ""grow a moustache, full beard, goat-tee, or side-burns, a part of the Centennial celebration be held from April 26th to May 2nd, this year, 19 53 AeDe""™  Unprocessed @ collectione Cataloged from accessio n recordse  NcD 19980923 #39920137 NDHYme SEE NEXT CRD"
"Germino, Dante J.","e 6th 17°:B (3-14-84) Germino; Dante Je Brothers of the Brush Register, cece (Card 2)     *hab  1. Durham Centennial and Historical Commission Beard Committeee 2e Durham CNeCe )--Historye  19980923 #39920137 NDHYme"
"Gerock, Charles","Gerock, Charles Papers, 1832-1877  Palo Alto, North Carolina  Cab. 43 32 items  2-7-56  GUIDE"
"Gerock, Charles","Gerock, Charles. Papers, 1832-1877. Palo Alto, N. C. 32 items Sketch     The bulk of this collection consists of lawyers' letters (1862-77) to Charles Gerock relating to the case of the State of Mississip- piv. N. G. Nye, in which Gerock had brought suit against said Nye for the recovery of a considerable sum of money. The Case, which was argued for years before the state circuit court at Yazoo, Miss., was put by Gerock into the,hands of four successive Miss. lawyers -  R. S. Holt, A. M. Harlow, D. Jones, and J. H.  Holf€."
"Gerock, Charles","Gerock 2 The remaining two items in the collection  are petitions by a resident of N. C. fora  military pension (according to act of Congress,  June 7, 1832) for services rendered as a  soldier in the Continental Army, 1776-77,  Both petitions are dated 1832."
"Gerson, Irving B.","e Hartman Center Collection (97-016) Gerson, Irving Be Papers, 1940-1995. 55 itemse Co-founder of the Gerson, Howe & Johnson advertising agencye Consists of diskettes of his 1994- 1995 journal, , a video tape, a report on United Airlines role in the airport industry, a manuscript (fundamentally detailing the building of a small agency) concerning the beginning of Gerson; Howe & Johnson, and other short writingse Unprocessed collectione Cataloged tres accession recordse hab  19980923 #39920238 NDHYme SEE NEXT CRD"
"Gerson, Irving B.","e Hartman Center Collection (97-016 ) Gerson, Irving Be Papers, eee (Card 2)  1. Gerson, Howey and Johnsone 2-6 United Air Lines, ince 3¢ Airlines-—- United States-—-Historye  19980923 #39920238 NDHYme"
"Gerstman, Louis","Gerstman, Louis Papers, 1874-1897  Selma, Dallas Co., Ala.  8-19-58  6005-6025"
"Gerstman, Louis","6005-6025  When the first letter book was started on Oct, 19, 1874, Simon Gerstman was general agent and Louis Gerstman special agent for the Protection Life Insurance Company of Chicago. By May l, 1875, Louis was in partnership with one McCormico  They were agents of at least three insurance com- panies, the Royal Canadian Insurance Co., the Amazon Insurance Co, of Cincinnati, and the Pro- tection Life Insurance Co. The Canadian Co."
"Gerstman, Louis","Gerstman, Louis 2     dealt in fire insurance and the Amazon Co, in marine insurance. By the time the third letter book was started, July 4, 1879, Louis was opera~ ting independently. He represented the Royal Insurance Co. of Liverpool and also the London and Lancashire Fire Insurance Co. of Liverpool. Careful reading of the letterpress volumes would perhaps reveal that during the years that fol- lowed he came to represent a number of other in- surance companies."
"Gerstman, Louis","6005-6025 Ga  Gerstman, Louis  Letter Books, 1874, Oct. 19 - 1897, Feb. 3;  Policy Memorandum Book, 1886, May 1 - 1888, Oct. 18  Selma, Dallas Co., Ala.  8-19-58 el vols.  GUIDE"
"Gerstman, Louis",")M\- 6005 Gerstman, Louis  Letter Book, 1874, Oct. 19 - 1876, July 31 Selma, Dallas Co., Ala. 393 pp. Boards 27? x 25 1-2 cm.  8-19-58"
"Gerstman, Louis","i. - 6006 Gerstman, Louis  Letter Book, 1876, Aug. 12 - 1878, Mar. 18 Selma, Dallas Co., Ala.  Boards 28 1-4 x 23 om."
"Gerstman, Louis","|. ~ 5007 Gerstman, Louis  Letter Book, 1879, July 4 - 1880, Aug. l Selma, Dallas Co., Ala. 504 pp. Boards - 28 x 25 cm. 8-19-58"
"Gerstman, Louis","|. - 6008 Gerstman, Louis  Letter Book, 1880, Aug. 3 - 1881, Oct. 12 Selma, Dallas Co., Ala. 497 pp. Boards 28 x 25 cm,  8-19-58"
"Gerstman, Louis","(_ - 6009 Gerstman, Louis  Letter Book, 1881, Oct. 14 - 1882, Sept. 26 Selma, Dallas Co.,. Ala. 495 pp. Boards 30 x 24 cm.  8-19-58"
"Gerstman, Louis","L- 6010 Gerstman, Louis  Letter Book, 1882, Sept. 30 - 1883, Aug. 12 Selma, Dallas Co., Ala. 498 pp. Boards  8-19-58"
"Gerstman, Louis","L- 6011 Gerstman, Louis  Letter Book, 1883, Sept. 1 - 1884, Aug. 10 Selma, Dallas Co., Ala. 600 pp. Boards 30 1-4 x 24 5-4 cm.  8-19-58"
"Gerstman, Louis","[.- 6012 Gerstman, Louis  Letter Book, 1885, Oct. 3 - 1887, Jan. 7 Selma, Dallas Co., Ala. 674 pp. Boards 30 1-4 x 24 3-4 cn.  8-19-58"
"Gerstman, Louis","[_- 6015 Gerstman, Louis  Letter Book, 1887, Jan. 11 - 1888, Feb. 1 Selma, Dallas Co., Ala. 700 pp. Boards 50 1-2 x 24 5-4 com. 8-19-58"
"Gerstman, Louis","[_- 6014 Gerstman, Louis  Letter Book, 1889, Jan. 1 - Sept. 20 Selma, Dallas Co., Ala. 989 pp. Boards 50 1-2 x 25 com.  8-19-58"
"Gerstman, Louis","Gerstman, Louis Letter Book, 1892, Feb. 7 - June 8 Selma, Dallas Co., Ala.  498 pp. Boards ol 1-2 x 26 cm.  8-19-58"
"Gerstman, Louis","|_- 6016 Gerstman, Louis  Letter Book, 1892, Sept. 1 - Oct. 8% Selma, Dallas Co., Ala. 295 pp. Boards oO 1-4 x 24 1-2 cm. 8-19-58"
"Gerstman, Louis","L- 6017 Gerstman, Louis  Letter Book, 1892, Oct. 30 - 1893, Jan, 11 Selma, Dallas Co., Ala. 497 pp. Boards  8-19-58"
"Gerstman, Louis","{.- 6018 Gerstman, Louis  Letter Book, 18935, Jan. 11 - May 6 Selma, Dallas Co., Ala. 499 pp. Boards Sl x 25 1-2 cm.  8-19-58"
"Gerstman, Louis","Gerstman, Louis Letter Book, 1893, May 6 - Oct. .9 Selma, Dallas Co., Ala. 500 pp. Boards ol 1-4 x 25 cm. 8-19-58"
"Gerstman, Louis","[_- 6020 Gerstman, Louis  Letter Book, 1893, Oct. 15 - 1894, July 14 Selma, Dallas Co., Ala. 993 pp. Boards ol x 26 cn, 8-19-58"
"Gerstman, Louis","|. - 6021 Gerstman, Louis  Letter Book, 1894, July 14 - Sept. 23 Selma, Dallas Co., Ala. 300 pp. Boards 30 1-4 x 24 1-4 om.  8-19-58"
"Gerstman, Louis","[~ 6022 Gerstman, Louis  Letter Book, 1894, Sept. 24 - Dec. 18 Selma, Dallas Co., Ala. S02 pp. Boards 50 1-4 x 25 1-2 cm.  8-19-58"
"Gerstman, Louis","| - 6023 Gerstman, Louis  Letter Book, 1895, June 20 - 1896, Apr. 13 Selma, Dallas Co., Ala. 986 pp. Boards 50 1-4 x 24 1-4 cm.  8-19-58"
"Gerstman, Louis","Gerstman, Louis Letter Book, 1896, Apr. 20 - 1897, Feb. 3 Selma, Dallas Co., Ala.  696 pp. Boards 60 1-4 x 25 1-2 cm.  8-19-58"
"Gerstman, Louis","F- 6025 Gerstman, Louis  Policy Memorandum Book, 1886, May l - 1888, Oct. 18  Selma, Dallas Co., Ala. 287 pp. Boards 55 1-2 x 25 cm.  8-19-58"
"Gholson, Thomas Saunders","Gholson, Thomas Saunders  Papers, 1818-1860  Petersburg, Dinwiddie Co., Va.  XVIII-A 48 items 10-15-56 4 i | ij .1  bette Cece Ih Bhd Bedl"
"Gholson, Thomas Saunders","Gholson, Thomas Saunders. Papers, 1816-1860. Petersburg, Va. 48 items, Sketch  Thomas S. Gholson (1808-1868), jurist and statesman, was born in Gholsonville Co., Va. He attended secondary school at Oxford, N. C., graduating from the Univ. of Va. in 1827. He became a speaker of unusual elo- quence and moved to Petersburg, Va., in 1840,     where he formed a law partnership with his brother James Hubbard Gholson. He later form- ed a partnership with James Alfred Jones of Mecklenburg Co. and Richmond. He was a judge of the 5th judicial 6"" in Va., 1859-1863,"
"Gholson, Thomas Saunders","Gholson, Thomas Saunders  and a member of the Second Confederate Con- gress. After the war he formed a cotton and tobacco commission house in Liverpool, Eng. These papers are largely those of his law firm dealing with rather local cases in- volving people of little prominence. There is  a deed for the gift of a slave by Stephen W. Willis to his niece Letitia Harriett McGee in 1830 accompanied by a statement of Apr. 8, 1858, that this slave has been received by Letitia and her husband James C. Fou but is under contract to “oe N. C. Lipscombe"
"Gholson, Thomas Saunders","Gholson, Thomas Saunders a for the year for 85 dollars.  A letter of 1846, J. D. Massinburg to William Thornton, says that Thorton as exe- cutor of the Murdaugh estate hired out most of  tUs-slaves and sold three of them before the « estate suit was settled. An anonymous letter     to Gordon Branch in 1850 mentions a runaway slave, Ellis, and a lawcsuit. There is a letter from James Gresham to Edwin Fraser in 1850 wherein Gresham is bringing a deposition from John Hargraves to establish ownership to Slaves left him by eo. Judge George"
"Gholson, Thomas Saunders","Gholson, Thomas Saunders Edmond Badger, and Governors David L. Swain. and William A. Graham of N. C. have advised Gresham to¥this action.  A letter from M. D. Powell to Gholson in 1850 discusses rebuying slaves belonging to his mother's estate. A letter from Wm. 5S.     Hill to James P. Harrison in 1850 relates to selling slaves in Va. and Ga. There is a sales record of the sake of 4 slaves for $1550 in a letter of 1852 from Nath. Henry Rowe to James Alfred James. A letter of 1853 to the Gholson firm discusses a lawcosuit in-"
"Gholson, Thomas Saunders","Gholson, Thomas Saunders 5  volving the Negro Celia, given or loaned to R. S. Parham and figuring in a will.  There is a letter from James E. Caldwell to Messers. Gholson, Jones and Watkins in 1849 relating, possibly, to William Ransom Johnson, who owes Caldwell money. It is accompanied by a sworn deposition to a justice     of the peace that Col. Johnson's bill is un- paid since Jan. 1, 1846.  Two of the leading correspondents in the collection are Benjamin Watkins Leigh and William Giles Jones."
"Giannone, Pietro","Giannone, Pietro (1676-1748)  Papers, 18th Century  Naples, Italy  Cab. 66 6-27-72"
"Giannone, Pietro","Giannone, Pietro (1676-1748). Papers. Naples, Italy     Pietro Giannone (1676-1748), Italian histori an, published his Istoria civile del Regno di Napoli in 1723. In this polemical survey o Neapolitan history he took the side of the civil power in its disputes with the Roman     Catholic hierarchy. Giannone was excommunica- ted, and his book was put on the Index.  A manuscript volume (281 ff.) contains Gian- none's response to his excommunication and to"
"Giannone, Pietro","Giannone, Pietro (1676-1748)  the prohibition of his book. This work is entitled: ""Trattato de' Rimedj contro le Scommuniche invalide, e proibizioni de' Libri, che si decretano da Roma Scritto da Pietro Giannone Giureconsulto, ed Avvocato Napoletano Coll' occasione Dell' invalida Censura contro di lui fulminata dal Vicario di Napoli per     aver fatto quivi imprimere i Libri della Storia Civile di quel Regno senza una Licenza e della proibizione de Medesimi decretata da Roma il di. . . Luglio 1723."" The manuscript is not"
"Giannone, Pietro","Giannone, Pietro (1676-1748) 3 signed or dated and is presumably a copy."
"Gibbens, Gordon Butcher","Gibbens, Gordon Butcher  Papers, 1884-1904  Parkersburg, Wood County, West Virginia 2-F 412 items  152 items added, 2-18-75 1-29-75"
"Gibbens, Gordon Butcher","Gibbens, Gordon Butcher. Papers. Parkersburg, Wood County, West Virginia     Gordon Butcher Gibbens (1842-19 ?) was a printer, engraver, merchant of paper goods, and staunch Republican politician in Parkersburg, West Virginia. His firm was the Globe Printing and Binding Works, which according to his let-  terhead stationery. dealt in ""Blank Books, Prin- ting, Legal Blanks, and Paper Goods.'' Gibbens was a figure in the politics of Wood County and West Virginia for over twenty years. A"
"Gibbens, Gordon Butcher","Gibbens, Gordon Butcher  biographical sketch from 1890 (in George W. Atkinson and Alvaro F, Gibbens, Prominent Men of West Virginia) reveals that he was born in Parkersburg in 1842 and ""received a fair English education in the select schools of the period, and a practical business training in the storeo his father."" He married Florence Blair of           Parkersburg in 1867. In the early days of the Civil War, Gibbens was a scout for the Union Army. After the war, still in his early career, he was editor of the local newspapers, the"
"Gibbens, Gordon Butcher","Gibbens, Gordon Butcher 3 Gazette and the Daily Times. For six years he was editor, publisher, and co-proprietor of the Educational Monthly Magazine. He was for a time treasurer of the Wood County Building Associa- tion and also one of the directors of a local railroad company. Gibbens was Chief Deputy and Cashier under Colonel George W. Patton, U. S.           Marshal for the West Virginia District (1877- 1881), and also under Patton's successor George W. Atkinson (1881-1885), Then he became Deputy Collector of Internal Revenue under General"
