Name,Text
"Dow, George Francis","Dow, George. Francis  FOR INFORMATION ABOUT THIS COLLECTION OR ADDITIONS TO THIS COLLECTION, PLEASE ASK  A STAFF MEMBER TO CONSULT THE ACCESSION RECORDS."
"Dow, Neal","e Sece A, 6th 17:2B Dow, Neale Letter, 1896. 1 iteme Portland (Cumberland Coe), Mee residente Collection consists of a letter concerning the ""Maine Law"" and temperance reforme Cataloged from Guidee *les  1e Temperance--Mainee 2e Portland (Mee )—-—-Historye  11 MAY 98 39100430 NDHYme"
"Dow, Neal","Dow, Neal. Papers. Portland, Cumberland Co., Me,     Neal Dow was born in 1804 in Portland, Maine where he eventually became a partner in his father's tanning business. After establishing himself as one of the city's leading business- men, he entered politics and was elected mayor.  During his incumbency, he conducted a vigorous campaign to restrict the sale and use of alco- holic beverages. He was instrumental in the  passage of the “Maine Law,"" legislation de- signed to facilitate temperance reform. Dow"
"Dow, Neal","Dow, Neal 2 became one of the nation's leading prohibition- ists. He also served as a brigadier general  of volunteers in the Union Army, though he was dismissed from the Society of Friends for his military involvement. After the Civil War, he resumed his crusade for temperance reform and in 1880 ran for the Presidency as the candidate     of the Prohibition Party. He continued as an active reformer until his death in 1897.  In a letter of March 13, 1896, Dow cites the ""Maine Law"" as a ""great power for good"" and one"
"Dow, Neal","Dow, Neal 3 of the principal reasons for this state's rapid social and economic progress."
"Dowd, A.J.","Dowd, A J {Raleigh?], North Carolina  Section A 5 pieces  NOV5 1999  Nov e 20, 1934,"
"Dowd, A.J.","Dowd, A.J.s . 1864-1865 North Sarolina  The collection contains 5 Civil War let— ters. Dowd was a private the in North Carolina Confederate forces. The letters are typical of  the semi-illiterate soldier who was more con- cerned with family affairs at home and what was to become of him when the war was over than he was in campaigns and strategy."
Down family,"Down familye  Letters, 1797-1803-  7 itemse  Chiefly Letters to Captain Down in England, from a few men in Charleston, SeCe, who were evidently employed to assist in settling a dispute involving We Je Somers's estatee Somers was Down's father-in-law and Lived in the Charleston areae There is also information relating to Down's brother, who was Living in South Carolina, and a letter from one of Down's nieces to her aunt in Englande  10 MAY 93 28081359 NDHYme SEE NEXT CRD"
Down family,"Down familye Letters, eee (Card 2)  1. Real property——-South Carolina-—- Charlestone e Inheritance and succession-—-South Carolina--Charlestone  Se Somers; We Je—-Wille 4e British-—- South Carolinae Ie Down, Edwarde  10 MAY 93 28081359 NDHYme"
"Downes, Edward","Downes, Edward Papers, 1775-1784 Queen Annes County, Maryland  Cab. 81 6 items & 1 vol.  2-14-84"
"Downes, Edward","Downes, Edward. Papers, 1775-1784. Queen Annes County, Maryland     Edward Downes was a planter and prominent citizen of Queen Annes County, Maryland. Since hewas a vestryman of St. Paul's Parish, he probably lived within the vicinity of the church, then Old Chester Church that was located off the road between Centreville and Queenstown. He farmed, owned several plantations some of which were rented, and apparently operated a store. There are a number of references to"
"Downes, Edward","Downes, Edward     him in Frederic Emory's Queen Anne's County, Maryland, Its Early History and Development (Baltimore, 1950). These references indicate that he was a student at Queen Annes Free School (1725); a private in the Queen Annes Company of minutemen commanded by Capt. James        Kent that fought against Lord Dunmore in Virginia in 1776; vestryman of St. Paul's (1780); register of Queen Annes County School (1781); a justice of the Orphan's Court (1782); and a trustee of the poor (1794)."
"Downes, Edward","Downes, Edward     Ledger A, 1775-1783 (90ff.), is a fine, detailed accounting of his personal, family, and business expenses during those years. This volume is not labeled with his name, but loose sheets of accounts found within it identify it as his. One sheet is Coursey Wright's account with Edward Downes, and transactions listed in  it also are entered in Coursey's account in the ledger (f. 85). Because many accounts are noted as continued in ""Liber B,"" this volume must be Ledger A. There is no index for this ledger."
"Downes, Edward","Downes, Edward 4 Downes' early work as a storekeeper and book- keeper noted in entries on f. 4 suggest that he was trained as a mercantile clerk. Clerks of that period were trained in fine handwriting, and his ledger is finely written as well as being an example of careful, detailed accounts. Farming was Downes' principal financial     interest, and corn, wheat, oats, and beans were the main crops. There are also numerous entries for tobacco. The value of these crops and"
"Downes, Edward","Downes, Edward 5 Downes' financial activity were especially large during the late 1770's as compared to that evi- dent in the earlier and later years recorded in this ledger. The balance of his Farm Expenses account was &% 12,400 in 1779, a year in which his Corn, Wheat, Oats, & Beans Account totaled %# 10,993. A year later his Farm Expenses Account balanced at #% 16,851. This elevated activity is noticeable in many lesser accounts  as well. Depreciation of the continental currency in these years was probably responsi-"
"Downes, Edward","Downes, Edward ble for these inflated accounts. Both continental and state currency are noted. Entries for the purchase of goods from a general store pervade the accounts with many persons, a good indication that Downes operated the store. The many interesting accounts and trans- actions in this ledger include: wages for     working in James Anderson's store (f. 3); account with a postrider (f. 4); wages for posting Colin Campbell's account books (f. 4); plantation rental (ff. 5, 7, 19, 39); hiring of slaves"
"Downes, Edward","Downes, Edward 7     (ff. 8, 11, 45, 55, 72, 77, etc.); his father's estate (f. 8); money due for 2 months and 17 days service in the ""Minute Company Acting in Virginia"" commanded by Capt. James Kent in 1776 (£. 11); cash account including expenses for military and recruiting service in 1777 (ff. 13- 15); expenses for prizing, cooperage, carriage,  and inspection of tobacco (f. 19); Recruiting Expenses Account, 1777, including cockades, drummers, and fifes (f. 20); accounts for Capt. John Combs and Peter Freneau for recruiting"
"Downes, Edward","Downes, Edward 8 and other military expenses including bounties paid to named recruits one of whom was French (ff. 21-22); example of family expenses in- cluding all sorts of goods and housewares (f. 27); use of midwife for a slave (ff. 28, 72) and account with a midwife (f. 72); hiring a mili- tary substitute (ff. 40-41, 43); salary as     register of Queen Annes County School (f. 56); accounts with a wheelwright and tanner (f. 63), there being entries for various kinds of arti- sans scattered through the accounts; account"
"Downes, Edward","Downes, Edward 9     with a shoemaker (f. 77); attendance at court  as a magistrate (f. 78); expenses for making bricks and for building a house (f. 87); his accounts with the Collector of the Tax including his remuneration as a juror, magistrate, and clerk to the Commissioners of the Tax for the county (ff. 62, 75); entries for lumber scatter-  ed through the volume; etc. Additional references to some of these topics may be found by a careful scrutiny of the accounts. Accounts involving sizeable amounts of money include"
"Downes, Edward","Downes, Edward 10     those for Robert Clogg, Francis Baker, Capt. William Emory, William Emory, Charles Murphey, merchant Robert Anderson, Capt. John Combs, and various members of the Downes family.  The Financial Papers, 1779-1784, contain six items, among them: one identifying Downes as the owner of property known as ""Fairplay;"" one  with notations on the harvest of 1784 including references to slaves; and a long account for Slave hire in Feb., 1781."
"Downey, Samuel Smith","Downey, Samuel Smith Papers, 1762 (1800-1900) 1965 Granville Co., N.C.  14-D 3202 items and 2 vols. 12 items and 1 vol.  9-29-49 added, 6-26-64  (See also bound 62 items transferred  vol. cards) from W. H. Gregory ., 8-24-64  transferred to  Jonathan K. Smith   & ca. 6-10-73"
"Downey, Samuel Smith","Downey,- Samuel Smith. Papers, 1762 (1800-1900) 1965. Granville Co., N. C.     Although predominately the papers of Samuel S. Downey, the first WSS. belong to Ephraim Macquillen, a Richmond, Va. merchant. The latter part is comprised largely of the papers of Isaac H. Davis, the son-in-law of S. S. Downey.  The Macquillen . are mainly letters, bills, and receipts from business firms in New York, Philadelphia, and Boston to which he sold his tobacco and flour and from which he bought"
"Downey, Samuel Smith","Downey, Samuel Smith 2     supplies. Many of the letters contain reports of the state of the market for flour, tobacco, and other commodities, and of the condition of Macquillen's flour and tobacco upon their arrival in those cities. Papers concern the loss of the Fox, attempts to collect insurance on its lost cargo, and the bankruptcy of Thomas Hooper.  Macquillen's wife and children came over from Ireland in 1801. News reached N. Y. on the evening of Nov. 20, 1801, that the preliminaries"
"Downey, Samuel Smith","Downey, Samuel Smith     of peace were signed on Oct. 1 in London between England and France. Samuel Hicks in 1803 wrote that war would be resumed between England and France and that every preparation possible was being made in London for it.  A letter from Thomas Jefferson, probably written to Dr. Benjamin Rush, gives Jefferson's views on Christianity. This is a copy.  In that portion of the collection principally S. S. Downey's correspondence are aisé papers of Jas. Webb Alexander, John Granville Smith, and"
"Downey, Samuel Smith","Downey, Samuel Smith 4 Thos. and Jas. Downey. S. S. Downey was John G. Smith's favorite nephew and executor. John G., unmarried, left considerable property over which there was lengthy litigation, and a great many of the Downey  deal with suits by Smith's heirs. ‘  S. S. Downey, who had moved from Mississippi, returned to Granville County, N. C., but he continued to hold his plantation in Mississippi. He owned quite a number of slaves, twenty-seven of whom he hired to work on the construction of"
"Downey, Samuel Smith","Downey, Samuel Smith  a railroad from Natchez to Jackson. These Slaves, along with those of three other Granville County men, Dr. Jonn R. Hicks, Joseph Amis (d. Aug. 3, 1840), brothers-in-law of S. S. Downey, and Flemming Beasley, were under the supervision of Dr. Joseph Hicks, the brother of John Hicks and thse agent of Downey.     The letters of Joseph Hicks to Downey and Jonn R. Hicks contain accounts of illness and a few deaths among the slaves. After a contract between Downey and Welman and Mills expired,"
"Downey, Samuel Smith","Downey, Samuel Smith 6     Hicks worked the Negroes for a short time near Jackson, then for a little while with Judge  Jack of Pa. in a partnership with Major Arnold. The slaves worked on the Natchez to Jackson R. R. Hicks and Arnold became deeply indebted to Downey tor the hire of his slaves; and after  the death of Hicks, Downey instituted suits  against the executors of Hicks and against Arnold.  Overseers were in charge of Downey's Missis- sippi plantation until his son James went out to"
"Downey, Samuel Smith","Downey, Samuel Smith 7     take it over. Both Downey and his two sons made a number of trips to Mississippi to look after affairs before James settled there. Letters  to Downey from his overseers and his lawyer,  A. Burwell of Vicksburg, report on conditions on his plantation. While Downey was in Missis- sippi in the spring of 1837 he wrote from Jack- son that his Negroes were not paying expenses. Since the legislature of Mississippi had passed a law prohibiting the bringing of Negroes into the state for hire or sale, he did not know"
"Downey, Samuel Smith","Downey, Samuel Smith 8     what to do with his. Also in May, 183% Josepn Hicks wrote that he had received orders’to discontinue work on the railroad in Hinds County, Mississippi, and that the people of that county had deposed their sheriff.  Letters in 1837 and 1838 reveal some effects of the depression; one by S. S. Downey from  Mississippi in 1837 comments on the scarcity of money there and about the advisability of re- chartering the U. S. Bank. The next year Wm. Ford referred in one of his letters to the plight of commercial men in Richmond, and Joseph"
"Downey, Samuel Smith","Downey, Samuel Smith  Hicks listed in one of his letters several types of Mississippi bank notes that were no good.  The bank of the Natchez R. R. Co. became insolvent, and S. S. Downey instituted a suit against it to collect the money due him. According to J. F. H. Claiborne in his life of John A. Quitman, the Legislature of Mississippi     ""conferred banking privileges on the Natchez and other railway companies, most of which, losing sight of the design of their charters, became monstrous swindling concerns, and robbed"
"Downey, Samuel Smith","Downey, Samuel Smith 10     whenever they had the opportunity.""  S- S- Downey sent his tobacco produced in Granville County by wagon to merchants in Petersburg, where it was reshipped to Wm. Ford in Richmond. Letters from Ford and factors in Petersburg relate to the marketing of Downey's tobacco and to goods which they purchased for him. In 1848 Downey corresponded with merchants in Charleston, S. C., about selling manufactured tobacco in that city.  S.- S. Downey married at least twice. The"
"Downey, Samuel Smith","Downey, Samuel Smith 11     first of these two wives was named Jane, and she died at the age of thirty-six after bearing him two sons, James W. and John Alexander, and a daughter, Jane E. S. The other wife, whom he also survived, was Sally Smith, daughter of Alexander Smith. Their only child was Ann.  Both of his sons attended the Univ. of N. C.;,  and his daughter Ann went to Salem Female Academy. As already stated, James and John both made trips to their father's plantation in Mississippi before James finally settled there."
"Downey, Samuel Smith","Downey, Samuel Smith     In 1545, John was in the Wisconsin Territory.  By 1862 he had moved to Hardeman County, Tenn., but he also owned property in Floyd County, Ga. which was supervised by Lewis D. Burwell. After the retreat of the Confederates from Corinth, John described their march in a letter in which he complained of the burning and confiscation of property and the tracking down of Union men by Secessionists. Around this time Lewis Burwell wrote him about the Confederate Army's consumption of food, corn, etc. as it passed"
"Downey, Samuel Smith","Downey, Samuel Smith 13     from Tupelo through Rome to Chattanooga.  In Feb., 1863, John Downey became disillusioned and wrote from Homer, Claiborne Parish, Louisiana, to Burwell depicting the trials of Federal rule in Tennessee, his flight to Texas, and the sale there of his slaves who had not deserted to the Federals. In 1884 he was still  in Galveston, Texas, supporting Cleveland in the presidential race.  Ann Downey married Isaac H. Davis, a tobacco and cotton farmer who sold his crops through"
"Downey, Samuel Smith","Downey, Samuel Smith     commission merchants in Petersburg and Norfolk and through Cooper, Blackwell, and Co. and Reams's warehouse in Durham.  Jane Downey drops out of the picture before her father's death. There is a statement of the division of the slaves of the late S. S. Downey in Hinds County, Mississippi, among his sons and his daughter Ann. In writing ta Ann about buying her share of the Negroes, James speaks of the sadness among them over the prospect of being separated.  The collection also contains land deeds and"
"Downey, Samuel Smith","Downey, Samuel Smith 15     other legal papers of Granville County; deeds for slaves purchased; brief diary of a boat  trip made by John G. Smith in 1827 from Nashville to New Orleans and back; papers concerned with the estate of Alexander Smith; will of John G. Smith of Granville County and papers concerning the settling of his estate; will of Jas. Downey;  broadsides relating to the Shiloh Sabbath School; temperance; Caldwell Institute at Greensboro, N. C.3; Maryland Lotteries; Peterson's Magazine, or Ladies’ National; the Harrison"
"Downey, Samuel Smith","Downey, Samuel Smith 16     family in America; sewing machines; and Radical ""Reliables"" by Spier Whitaker, chairman of the N. C. Democratic State Executive Committee (1888); handbill entitled Our Living and Our Dead; fire insurance policies with the Liverpool and Loudon and Glove Insurance Co., the Imperial Fire Insurance Co. of London, the N. Cc. Mutual Home Insurance Co., and Old North State Insurame Co.; shorthand book and pamphlets; New Orleans Price-Current, Commercial Intelligencer and  Merchants’ Transcript, Oct. 5, 1850; contract"
"Downey, Samuel Smith","Downey, Samuel Smith 17     between S. S. Downey and Robt. D. Wade of  Hinds County, Mississippi, providing that the latter would take charge of Downey's plantation and slaves; letters relative to the Southern Temperance Convention to be held in Fayetteville, N. C. in Nov., 1835; the feeding of Downey's mares by John Randolph of Roanoke; the recom-  mendation made to Downey that he return Abolition papers to their editor to keep down suspicion; the N. C. Mutual Insurance Co.; and the merits of Heebner's improved horse mowers"
"Downey, Samuel Smith","Downey, Samuel Smith 18     and threshing machines; contract for hiring the slaves of Downey to work on the Natchez ‘to Jackson Re R.3; resolution adopted by the board of directors of the Raleigh and Gaston R. R.3 papers pertaining to the suits in which Downey was involved, some of those suits being: Heirs of John G. Smith vs. Downey, Downey vs. Arnold  of Pittsburg, Pa. who formed a partnership with Hicks to work Downey's slaves on the Natchez to Jackson R. Re, Downey vs. the Natchez R. Re. Co-, and Downey vs. Benj. J. Hicks, executor, and"
"Downey, Samuel Smith","Downey, Samuel Smith 19     Mary Hicks, executrix, of Joseph T. Hicks.  Some other subjects treated in this/ collection are: A project for clearing the Roanoke River; incorrigibility of slaves; Methodists and Episcopalians in Jackson County, Tenn.; a camp meeting in Kentucky; religious matters at Union Theological Seminary, Prince Edward County, Va. as viewed by a student; runaway slaves; purchase of slaves for gold mining in Granville County; victory of the Whigs in that-county; depredationg  of Confederates."
"Downey, Samuel Smith","Downey, Samuel Smith 20     The two bound vols. are: A ledger of John Ge Smith of Granville Co., 1798-1803 - included in it is a daybook (1887-1901) of Ann A. Davis, and ledger of S. S. Downey, 1828-1874.  Samuel S. Downey was the son of James and Elizabeth (Smith) Downey. His grandfather, Samuel Smith, migrated from Essex County, Va.,  in the early 1760's to occupy a grant of land from the Earl of Granville in Granville County, N. Ce. James Downey, father of Samuel S., was born in Essex County, Va,"
"Downey, Samuel Smith","Downey, Samuel Smith 21     Samuel S. Downey married Jane Harrison in 1812. She died in 1827, having borne him three children: John Alexander (A. B., U. N. Cy, 1836, and M. D. from_U. of Pa. Medical School, 1839); James Webb (A. B., U. N. C., 1843); and Jane E. S. (in school in Chapel Hill in 1843). S. S. Downey married Sarah (Sally)  Pomfret Smith (1814-1831), his first cousin, in 1829. She bore him one daughter; Anne (1830-1914).  Downey served as deputy sheriff in 1812,"
"Downey, Samuel Smith","Downey, Samuel Smith Ze     became justice of the’ peace, and was postmaster of ""Abram's Plains"" from 1841 until at least 1847. He died in 1851. His name was given as a ""reference"" in an advertisement of the Shiloh Classical School in The Raleigh Register, July 6, 1839.  John R. Hicks received his medical degree from the U. of Pa. Medical School in 1825.  Benjamin Hicks received his medical degree from U. of Pa. in 1834.  (See A. J. Webb, Our Webb Kin in Dixie,"
"Downey, Samuel Smith","Downey, Samuel Smith 23     Oxtord, N. C.).  The following death notices appear in The Raleigh Register and North Carolina State Gazette, 1546-1555: Samuel Smith Downey died May 17, 1851; Jane S. Downey died in July, 1846; and James Downey died in September, 1846.  Supplementary material to the Downey Papers can be found in the William Williamson Papers in the Presbyterian Historical Society, Philadelphia, Pa."
"Downey, Samuel Smith","Downey, Samuel Smith 24 12 items and 1 volume, added 6-26-64, are the gift of Mr. Jonathan K. Smith of Memphis, Tennes see. The papers are copies of inventories and wills of Samuel Smith (1816), Alexander Smith (1828); John G. Smith (Feb., 1829); Anne Alexan- der Smith (1829); Anne Smith (1833); Samuel G. Smith (Jan. 6, 1836); Samuel Smith Downey (May 14, 1842); James Webb Smith (1854); Amy W. Smith (1863); and M. T. Smith (1863) together with a copy of a printed page of the family Bible of  James Downey Smith of ""Beech Hill,"" Tennessee."
"Downey, Samuel Smith","Downey, Samuel Smith 24A The volume, added on 6-26-64, is a green leather album containing pictures of various  (Continued on next card)"
"Downey, Samuel Smith","Downey, Samuel Smith 25     members of the Smith-Downey family, their homes and graves, as well as genealogical data. The Arkansas-Tennessee branch of the family is well represented. *  8-24-64: 62 items transferred from the Wm. H. Gregory Papers are correspondence of the Colonel Samuel Smith family and their relatives,  1762-1830, which center entirely on this family and seem originally to have been the property of S. S. Downey of “Abram's Plains,"" according to present-day members of the family. Included *Transferred to Jonathan K, Smith Papers."
"Downey, Samuel Smith","Downey, Samuel Smith 26 are the silhouettes of Colonel Samuel and  Mary (Webb) Smith and the history of the Grassy Creek Presbyterian Church, this latter being a copy of a letter written in January, 1833,  by James Smith. Smith had witnessed the founding of the church and lists its early ministers, 1760-1768. Mention is made of the     holding ""by invitation"" of the first quarterly Methodist conference at this Presbyterian church, with Bishop Thomas Coke and a number of his pious followers in the pulpit together"
"Downey, Samuel Smith","Downey, Samuel Smith 27 with the venerable Henry Pattillo, the Grassy Creek Church minister.  According to this narrative the Grassy Creek Church went out of existence some time before 1830. By 1833 the Shiloh Church in the same section came into existence.  The Printed Material includes an eight-page     undated article by Jonathan K. Smith entitled ""Grassy Creek and Nutbush Congregations, Gran- ville County, N.c.""  The eighteenth century letters are largely from Sally (Pomfret) Beasley of King William"
"Downey, Samuel Smith","Downey, Samuel Smith 28 County, Va., with relatives and friends prior to her marriage to Stephen Beasley in 1786. Her relatives are in the Smith-Downey group in Granville County, N.C."
"Downey, Samuel Smith","Downey, Samuel Smith     Smith, John G. Ledger, 1798-1803  Granville County, N. C.  262 pp. Boards 20 x 17 cm. (Included also is a daybook of Ann A. Davis, 1887-1901.)  5-24-50"
"Downey, Samuel Smith","Downey, Samuel Smith Ledger, 182851874  Granville co., N. ©,  412 pp. Boards Sox20 cm,  The main part of this ledger was kept by a blacksmith. The section dated 1869-1874 ap- pears to have been kept by both a blacksmith and a merchant,  SEP 29 “49 CL I] )"
"Downing, Samuel","Downing, Samuel Papers, 1814-1889 Lancaster, Virginia Cab. 45 22 items  37 items added, 1-4-38 10-22-37 80 items added, 7-20-62"
"Downing, Samuel","Downing, Samuel Letters 1814- 1889 Lancaster, Va. Sketch 139 pieces  This set contains a miscellaneous collection of personal and business letters of the Downing family.of Lancaster, Va. One brother moved to Missouri in 1850 and was so pleased with the country that he wished his relatives to follow. Samuel Downing: Jr. attended Randolph-Macon College in 1859, but for some reason transferred to the Virginia Military Institute in 1860. Downing was evidently a lawyer and a man of some  local importance, although it is impossible OCT 22 1937 @"
"Downing, Samuel","Downing, Samuel (2) Sketch from the paucity of information contain- ed in this small collection his exact position is difficult to determine. The collection is small and not exceptionally valuable     80 items added, 7-20-62. Personal, business, and legal papers (1817-1889) of Col. Samuel Downing and others in  OCT 22 1937"
"Downing, Samuel","Downing, Samuel 3 Lancaster County, Virginia. Several letters from Harris Co., Texas, refer to Republicans,  freedmen, crop failure (1874), and the hurrican of 1875.     40 /"
"Downman, Hugh","Downman, Hugh Papers, 1773 Exeter, England  Josiah C, Trent Collection in the History of Medicine--. Div.  4-8-60  2 items"
"Downman, Hugh","Downman, Hugh. Papers, 1773. Exeter, England. 2 items. Sketch.  Hugh Downman (1740-1809), English physician and poet, writes to his publisher in Edinburgh in 1773 concerning his first poem, The Land of the Muses, which had been published in 1766. A brief biographical note accompanies the letter. See Trent Collection Picture File for an engrav- ing of Downman."
"Downman, Robert","Downman, Robert Account Book, 1802-1846 Petersburg, Dinwiddie Co., Va. 78 pp. Boards 20 x 16 om. 8-5-58  GUIDE"
