Name,Text
Methodist Episcopal Church,"M279 Methodist Episcopal Church, South, N. 6, /)..  Conference, DURHAM District, N. C, LEASBURG Circuit  Quarterly Conference Minutes, 1907-1910 Durham, N. C.  107 pp. Boards & Calf 20 x 27 cm. Nov. 5, 1933"
Methodist Episcopal Church,"M-2746  iy, Methodist Episcopal Church, South. N. 0. on DURHAM District, N. C. LEASBURG rcu  Quarterly Conference Minutes, 1911-1914 Durham, N. C, 111 pp. Boards & Calf 20 x 27 cm, Nov, 5, 1933"
Methodist Episcopal Church,"M- 4793?  Methodist Episcopal Church, South. N. 0. Conference, DURHAM District, N. ©. LEASBURG Circuit  Quarterly Conference Minutes, 1923-1926 Durham, N. C. 59 pp. Boards & Calf 22 x 28 om. Nov. 5, 1933"
Methodist Episcopal Church,"M-279¢  Methodist Episcopal Church, South, N. co, D5, Conference, DURHAM District, N. C. LEASBURG Circuit  Quarterly Conference Minutes, 1926-1930 Durham, N. C. 106 pp. Boards & Calf 22 x 28 on, Mar, 17, 1939"
Methodist Episcopal Church,"“-27 40 Methodist Episcopal Church, South. North Carolina Conference. Durham District, Leasburg Circuit. Bethany Church  Church Conference Minutes, 1885-1886 (Combined minutes of Leasburg and Bethany churches)  7 pp. Boards 27 x 20 cm.  3-17-39 Recataloged, 4-1)-65"
Methodist Episcopal Church,"M-2748 Methodist Episcopal Church, South. North Carolina Conference. Durham District. Leasburg Circuit. Leasburg Church  Church Conference Minutes, 1885-1902 Caswell County, North Carolina 115 pp. Boards 27 x 20 cm.  3-17-39 Recataloged, 4-1)-65"
Methodist Episcopal Church,"“-2789 Methodist Episcopal Church, South. North Carolina Conference. Durham District. Leasburg Circuit. Union Church  Church Conference Minutes, 1885-190) North Carolina h6 pp. Boards 27 x 20 cm.  ani Recataloged, 4-14-65"
Methodist Episcopal Church,"Methodist Episcopal Church, South. Conference, DURHAM District, N. C. Circuit ror Charge;  See also Methodist noe al ee South,  Conference, SBORO District, Ni C, BURG Circuit"
Methodist Episcopal Church,"Methodist Episcopal Church, South. N. C. Conference. Durham District, N. C. Main Street Church  See also Methodist Episcopal Church, South. N. C. Conference. Durham District, N. C. Duke Memorial Church"
Methodist Episcopal Church,"L- 2vo/ Methodist Episcopal Church, South, N. 9, |)”  Conference, D District, N. C, MAIN STREET Church  Church Assessments, 1900  Durham, N. C, Nov. 5, 1933"
Methodist Episcopal Church,"\“-2751 Methodist Episcopal Church, South. North Carolina Conference, Durham District. Main Street Charge  Quarterly Conference Minutes, 1890-1893  Durham, N.C.  11-5-33 Recataloged, 4-13-65"
Methodist Episcopal Church,"M2752 Methodist Episcopal Church, South. North Carolina Conference. Durham District. Main Street Charge  Quarterly Conference Minutes, 1894-1898 Durham, N.C.  11-5-33 Recataloged, 4-13-65"
Methodist Episcopal Church,"M-28d0  Methodist Episcopal Church, South. N. C.,  Conference,  D District, N. ©, MAIN STREET Church  Board of Stewards' Record of Proceedings, 1891-1908  Durham, N. ©, Noy. 5, 1933"
Methodist Episcopal Church,"M-4 Bo¢  N. 6, Do» GC, MAIN  Methodist Episcopal Church, South.  Conference, DURHAM District, N. STREET Yhurch,  Register of Members, 1890  Durham, N. C. Nov. 5, 1933"
Methodist Episcopal Church,"F~ 2.963 N. GC, f MAIN  Methodist Episcopal Church, South, DURHAM District, N. C,  Conference, STREET Church  Register of Members, 1885-1909 Durham, N. ©.  Nov. 5, 1933"
Methodist Episcopal Church,"Cab. 81 Methodist Episcopal Church, South. North Carolina Conference. Durham District. Main Street Church. Bethany Sunday School  Records, 1891-1896 Durham, N. C.  11-5-78 6 items &1 vol. Recataloged, 11-22-78"
Methodist Episcopal Church,"M- 2754 Methodist Episcopal Church, South. North Carolina Conference. Durham District. Main Street Charge  Quarterly Conference Minutes, 1899-1902  Durham, N.C.  11~-5-33 Recataloged, 4-13-65"
Methodist Episcopal Church,", M- 2755 Methodist Episcopal Church, South. North Carolina Conference. Durham District. Main Street Charge  Quarterly Conference Minutes, 1903-1906  Durham, N.C.  11-5-33 Recataloged, 4-13-65"
Methodist Episcopal Church,"M- Aver  Methodist Episcopal Church, South. N. 6,4 Conference, DURHAM District, N. C. MAIN STREET Charge  Quarterly Conference Records, 1906-1910 Durhan, N. C.  144 pp. Boards 27 x 20 cm, Jan. 4, 1941"
Methodist Episcopal Church,"M-2805 Methodist Episcopal Church, South. North Carolina Conference. Durham District. Milton Circuit  Quarterly Conference Minutes, 1894-1897  Caswell Co., N.C.  L1=-5=33"
Methodist Episcopal Church,"M2866 Methodist Episcopal Church, South, N. C6, /'%  Conference. DURHAM District, N. C. MILTON Circuit  Quarterly Conference Minutes, 1898-1901 Caswell co;, N. C. Nov. 5, 1933"
Methodist Episcopal Church,"M-2814 Methodist Episcopal Church, South. North  Carolina Conference. Durham District. Milton Circuit Quarterly Conference Minutes, 1906-1908  North Carolina  Records include Woodsdale Circuit, 1902-1903.  11-5-33 Recataloged, 9-20-84"
Methodist Episcopal Church,"f- 2BO7  Methodist Episcopal Church, South. N. C, | Conference, DURHAM District, N. ©, PITTS- BORO Circuit  Church Register, 1894-1901  Pittsboro, N. C. 76 pp. Boards 36 x 25 om, Aug. 9, 1946  MTTITAL 4 24  bette “Nn! B Thet"
Methodist Episcopal Church,"F- 2864 Methodist Episcopal Church, South. North Carolina Conference. Durham District. Pittsboro Circuit  Quarterly Conference Minutes, 1868-1887 North Carolina  Circuit in Durham Dist. from 1884. Records include Haw River Circuit, 1854-1868  8-9-46 Recataloged, 9-11-80"
Methodist Episcopal Church,"M-2so¢  Methodist Episcopal Church, South, N. 0. 0». Conference, DURHAM District, N. S, PITTS- BORO Circuit  Quarterly Conference Records, 1888-1891 Chatham co., N. 6, 110 pp. Boards 27 x 20 com, Aug. 9, 1946  GUiDE"
Methodist Episcopal Church,"M-2869 Methodist Episcopal Church, South. N. C.  Conference, DURHAM District, N. C. PITTS- BORO Circuit  Quarterly Conference Records, 1892-1894 Chatham co., N. OC, 84 pp. Boards 26 x 20 cn. Aug. 9, 1946"
Methodist Episcopal Church,"M- 2870 Methodist Episcopal Church, South. N. ¢. |  Conference, DURHAM District, N. ©. PITTS- BORO Circuit  Quarterly Conference Minutes, 1926-1930 Pittsboro, Ni C.  198 pp. Boards 22 x 27 cn."
Methodist Episcopal Church,": L-2811 Methodist Episcopal Church, South. North  Carolina Conference. Durham District. Pittsboro Circuit  Quarterly Conference Minutes, 1935-1938  Pittsboro, N.C.  8-30-40"
Methodist Episcopal Church,"M-2812 Methodist Episcopal Church, South. North  Carolina Conference. Durham District. Pittsboro Circuit  Quarterly Conference Records, 1939-1943  8-9-46"
Methodist Episcopal Church,"L- 2813 Methodist Episcopal Church, South. N. ©,  Conference, DURHAM District, N. ©, PITTS- BORO Circuit  Sunday School Conference Record, 1918-1920 Chatham co., N. C.  6 pp. Paper 29 x 18 cm, Aug. 9, 1946  GUIDE"
Methodist Episcopal Church,"Methodist Episcopal Church, South, N. ©, Conference, DURHAM District, N. ©, PITTS- BORO Circuit for Charge)  See also  Methodist Episcopal Church, South, N. g. Conference, FAYETTEVILLE District, N.Y, PITTSBORO Circuit jor Charge]"
Methodist Episcopal Church,"M-2814 Methodist Episcopal Church, South. North  Carolina Conference. Durham District. Woodsdale Circuit Quarterly Conference Minutes, 1902-1903  North Carolina  Records include Milton Circuit, 1906-1908.  11-5-33 Recataloged, 9-20-84"
Methodist Episcopal Church,"M-2815 Methodist Episcopal Church, South. North  Carolina Conference. Durham District, Yanceyville Circuit  Quarterly Conference Minutes, 1891-1894  Caswell Co., N.C.  8=-3=-36"
Methodist Episcopal Church,"M-2816 Methodist Episcopal Church, South, North  Carolina Conference. Durham District. Yanceyville Circuit  Quarterly Conference Minutes, 1895-1899  Caswell Co., N.C.  8-3-36"
Methodist Episcopal Church,"M-2817 Methodist Episcopal Church, South. North Carolina Conference. Durham District. Yanceyville Circuit  Quarterly Conference Minutes, 1899-1902  Caswell Co., N.C.  8-3-36"
Methodist Episcopal Church,"M-2708 Methodist Episcopal Church, South. North Carolina Conference, Elizabeth City District Quarterly Conference Minutes, 1911-1912 North Carolina ca. 500 pp. Boards 21 Xx 13g¢em. 11-5-33 Recataloged, 4-13-65"
Methodist Episcopal Church,"Methodist Episcopal Church, South. wae  Carolina Conference. Elizabeth City District Quarterly Conference Minutes, 1912-1913 North Carolina  503 pp. Boards 2k x 13cm,  11-5-33  Recataloged, 4-13-65"
Methodist Episcopal Church,"M-2711 Methodist Episcopal Church, South. North Carolina Conference. Elizabeth City District Quarterly Conference Minutes, 1913-1914 North Carolina 503 pp. Boards 21 x 13cm. 11-5233  Recataloged, 4-13-65"
Methodist Episcopal Church,"M- 2746 Methodist Episcopal Church, South. North Carolina Conference. Elizabeth City District  Quarterly Conference Minutes, 1919  Recataloged, 6-12-74"
Methodist Episcopal Church,"M- 2821 Methodist Episcopal Church, South. North Carolina Conference. Elizabeth City District. Quarterly Conference Minutes, 1919-1920  North Carolina  246 pp. Leather 21x 13 om.  1-21-42 Recataloged, 2-3-75"
Methodist Episcopal Church,"M-2747 Methodist Episcopal Church, South. North Carolina Conference. Elizabeth City District  Quarterly Conference Minutes, 1921  Recataloged, 6-12-74"
Methodist Episcopal Church,"M- 2822 Methodist Episcopal Church, South, N.C.  Conference, Elizabeth City District  Quarterly Conference Minutes, 1921-1922  201 pp. Leather  1-21-42 Recataloged, 11-6-79"
Methodist Episcopal Church,"M-2933 Methodist Episcopal Church, South. North  Carolina Conference. Elizabeth City District. Camden Circuit  Quarterly Conference Minutes, 1893-1897  North Carolina  In N.C. Conference & Elizabeth City Dist., 1895- 1897.  11-5-33 Recataloged, 9-17-84"
Methodist Episcopal Church,"M-2818 Methodist Episcopal Church, South. North Carolina Conference. Elizabeth City District. Camden Circuit  Quarterly Conference Minutes, 1898-1901  North Carolina  4-7-38"
Methodist Episcopal Church,": : M-2819 Methodist Episcopal Church, South. North  Carolina Conference. Elizabeth City District. Camden Circuit  Quarterly Conference Minutes, 1901-1905  North Carolina  4-7-38"
Methodist Episcopal Church,"Methodist Episcopal Church, South. Nort? 820  Carolina Conference. Elizabeth City District. Camden Circuit  Quarterly Conference Minutes, 1905-1909  North Carolina  i1=5~33"
Methodist Episcopal Church,"‘ ‘ M~2823 Methodist Episcopal Church, South. North  Carolina Conference. Elizabeth City District. Chowan Circuit  Quarterly Conference Minutes, 1896-1897  North Carolina  4-7-38"
Methodist Episcopal Church,"; : M~-2824 Methodist Episcopal Church, South. North  Carolina Conference. Elizabeth City District. Columbia Circuit  Quarterly Conference Minutes, 1900-1903 North Carolina  120 pp. Boards 26 x 19 cm. 1-21-42"
Methodist Episcopal Church,"Methodist Episcopal Church, South. NortH""2825  Carolina Conference. Elizabeth City District. Columbia Circuit Quarterly Conference Minutes, 1908-1911 North Carolina  120 pp. Boards 26 x I9 cm. 1-21-42"
Methodist Episcopal Church,": : M2826 Methodist Episcopal Church, South. North  Carolina Conference, Elizabeth City District. Dare Circuit  Quarterly Conference Minutes, 1896-1899  North: ‘Carolina  4-7-38"
Methodist Episcopal Church,"M-2827 Methodist Episcopal Church, South. North Caro-  lina Conference. Elizabeth City District. Dare Circuit  Quarterly Conference Minutes, 1900-1903  North Carolina  4-7-38"
Methodist Episcopal Church,"M-2937 Methodist Episcopal Church, South. North  Carolina Conference, Elizabeth City District. Gates Circuit  Quarterly Conference Minutes, 1891-1895  North Carolina  In N.C. Conference & Elizabeth City Dist., 1895  4-7-38 Recataloged, 9-17-84"
Methodist Episcopal Church,"M-2828 Methodist Episcopal Church, South. North  Carolina Conference, Elizabeth City District, Gates Circuit  Quarterly Conference Minutes, 1896-1899  Gates Co., N.C.  li-5=33"
Methodist Episcopal Church,"M=-2829 Methodist Episcopal Church, South. North  Carolina Conference. Elizabeth City District. Gates Circuit  Quarterly Conference Minutes, 1900-1903  North Carolina  4=7=-38"
Methodist Episcopal Church,": M-2830 Methodist Episcopal Church, South. North  Carolina Conference. Elizabeth City District. Gates Circuit  Quarterly Conference Minutes, 1904-1907  Gates Co., North Carolina  11-5-33"
Methodist Episcopal Church,": "" M-2831 Methodist Episcopal Church, South. North  Carolina Conference. Elizabeth City District. Gates Circuit  Quarterly Conference Minutes, 1908-1911  North Carolina  4-7-38"
Methodist Episcopal Church,", 4 M-2832 Methodist Episcopal Church, South. North  Carolina Conference. Elizabeth City District. Hatteras Circuit  Quarterly Conference Minutes, 1896-1899  North Carolina  4-7-38"
Methodist Episcopal Church,": ; M-2833 Methodist Episcopal Church, South. North  Carolina Conference. Elizabeth City District. Hatteras Circuit  Quarterly Conference Minutes, 1900-1903  North Carolina  4-7-38"
Methodist Episcopal Church,": . M-2834 Methodist Episcopal Church, South. North  Carolina Conference. Elizabeth City District. Hatteras Circuit  Quarterly Conference Minutes, 1904-1907  North Carolina  4-8-38"
Methodist Episcopal Church,": ; M-2835 Methodist Episcopal Church, South. North  Carolina Conference. Elizabeth City District. Hatteras Circuit  Quarterly Conference Minutes, 1908-1911  North Carolina  4-7-38"
Methodist Episcopal Church,"M-2837 Methodist Episcopal Church, South. North  Carolina Conference. Elizabeth City District, Hertford Circuit  Quarterly Conference Minutes, 1894-1897  North Carolina  4-7-38"
Methodist Episcopal Church,"Methodist Episcopal Church, South, Conference, ELIZABETH CITY District, N. C, HERTFORD Circuit  Quarterly Conference Minutes, 1898  Hertford co., N, C, Nov. 5, 1933"
Methodist Episcopal Church,"‘ : M-2839 Methodist Episcopal Church, South. North  Carolina Conference. Elizabeth City District. Hertford Circuit  Quarterly Conference Minutes, 1899-1902  North Carolina  4-7-38"
Methodist Episcopal Church,"Methodist Episcopal Church, South, North-""*""°  Carolina Conference. Elizabeth City District. Hertford Circuit  Quarterly Conference Minutes, 1902-1904  North Carolina  4-7-38"
Methodist Episcopal Church,"M-ag 4  Methodist Episcopal Church, South. WN. CG, Conference, ELIZABETH CITY District, N. C. HERTFORD Church  Sunday School Record Book, 1904-1905 Hertford, Perquimans co., N. C. Nov. 5, 1933"
Methodist Episcopal Church,"P : -2842 Methodist Episcopal Church, South. North Carolina Conference. Elizabeth City District. Kittrell's Church  Church Conference Minutes, 1898-1904  North Carolina  4-7-38"
Methodist Episcopal Church,"M-2843 Methodist Episcopal Church, South. North  Carolina Conference. Elizabeth City District. Kitty Hawk Circuit  Quarterly Conference Minutes, 1896-1899  North Carolina  4-7-38"
Methodist Episcopal Church,"M-2844 Methodist Episcopal Church, South. North  Carolina Conference. Elizabeth City District, Kitty Hawk Circuit  Quarterly Conference Minutes, 1904-1907  North Carolina  4-7-38"
Methodist Episcopal Church,"M-2845 Methodist Episcopal Church, South. North  Carolina Conference. Elizabeth City District. Kitty Hawk Circuit  Quarterly Conference Minutes, 1908-1911  North Carolina  4-7-38"
Methodist Episcopal Church,". p M-2846 Methodist Episcopal Church, South. North  Carolina Conference. Elizabeth City District. Moyock Circuit  Quarterly Conference Minutes, 1907-1910  Currituck Co., North Carolina  Li-5=-33"
Methodist Episcopal Church,"F-5013 Methodist Episcopal Church, South. North  Carolina Conference. Elizabeth City & Other Districts. North Gates Circuit Church Register, 1884-1937  North Carolina  In N.C. Conference from 1895  9-14-51 Recataloged, 9-17-84"
Methodist Episcopal Church,"1-D Methodist Episcopal Church, South. North Carolina Conference. Elizabeth City District. North Gates Circuit  Quarterly Conference Minutes, 1892-1895  North Carolina  Circuit in N.C. Conference & Elizabeth City Dist., 1895  11-5-33 21 items & 1 vol. Recataloged, 9-17-84 ®@"
Methodist Episcopal Church,"; : M-2848 Methodist Episcopal Church, South. North  Carolina Conference. Elizabeth City District. North Gates Circuit  Quarterly Conference Minutes, 1895-1898 Gates ,Co., North Carolina  11=5-33"
Methodist Episcopal Church,"Methodist Episcopal Church, South. North 2849 Carolina Conference. Elizabeth City District. North Gates Circuit  Quarterly Conference Minutes, 1898-1902  Gates Co., North Carolina  4-7-38"
Methodist Episcopal Church,"‘ : M- Methodist Episcopal Church, South. North A784 Carolina Conference. Elizabeth City District. North Gates Circuit  Quarterly Conference Minutes, 1907-1910  North Carolina  L1-5=33  Recataloged, 9-17-84"
Methodist Episcopal Church,"M-2847 Methodist Episcopal Church, South. North Carolina Conference. Elizabeth City District. Pantego Circuit  Quarterly Conference Minutes, 1896-1898  North Carolina  4-7-38"
Methodist Episcopal Church,"1=-D Methodist Episcopal Church, South. North Carolina Conference, Elizabeth City District, Pasquotank Circuit Quarterly Conference Minutes, 1896-1899 North Carolina  11-5-33 5 items & 1 vol.  Recataloged, 9-19-84"
Methodist Episcopal Church,"1-D Methodist Episcopal Church, South. North  Carolina Conference. Elizabeth City District, Pasquotank Circuit  Quarterly Conference Minutes, 1903-1906 (Including some reports from 1902)  North Carolina 11-5-33 3 items & 1 vol.  Recataloged, 9-19-84"
Methodist Episcopal Church,"1-D Methodist Episcopal Church, South. North Carolina Conference. Elizabeth City District. Perquimans Circuit  Quarterly Conference Minutes, 1894-1895  North Carolina  Circuit in N.C. Conference & Elizabeth City District in 1895,  11-5-33 Recataloged, 9-19-84"
Methodist Episcopal Church,"‘ : ~2852 Methodist Episcopal Church, South. North Carolina Conference. Elizabeth City District. Perquimans Circuit  Quarterly Conference Minutes, 1895-1898  Perquimans Co., North Carolina  11-5=33"
Methodist Episcopal Church,": : M-2853 Methodist Episcopal Church, South. North  Carolina Conference. Elizabeth City District. Perquimans Circuit  Quarterly Conference Minutes, 1898-1902  Perquimans Co., North Carolina  Li=-5-33"
Methodist Episcopal Church,"-2854 Methodist Episcopal Church, South. North i  Carolina Conference. Elizabeth City District. Perquimans Circuit  Quarterly Conference Minutes, 1902-1906  Perquimans Co., North Carolina  11=-5=33"
Methodist Episcopal Church,": J M-2855 Methodist Episcopal Church, South. North  Carolina Conference. Elizabeth City District. Perquimans Circuit  Quarterly Conference Minutes, 1906-1910  Perquimans Co., North Carolina  11-5=33"
Methodist Episcopal Church,"Methodist Episcopal Church, South. North """"""""  Carolina Conference. Elizabeth City District. Perquimans Circuit  Quarterly Conference Minutes, 1910-1914  Perguimans Co., North Carolina  1i=5=33"
Methodist Episcopal Church,"M-2857 Methodist Episcopal Church, South. North  Carolina Conference. Elizabeth City District. Perquimans Circuit  Quarterly Conference Minutes, 1914-1918  Perquimans Co., North Carolina  Ll=5=33"
Methodist Episcopal Church,": . M-2858 Methodist Episcopal Church, South. North  Carolina Conference. Elizabeth City District. Roanoke Island Circuit  Quarterly Conference Minutes, 1896-1899  North Carolina  4-7-38"
Methodist Episcopal Church,"M=-2859 Methodist Episcopal Church, South. North  Carolina Conference. Elizabeth City District. Roanoke Island Circuit  Quarterly Conference Minutes, 1900-1903  North Carolina  4-7-38"
Methodist Episcopal Church,"3 a M-2860 Methodist Episcopal Church, South. North  Carolina Conference, Elizabeth City District, Roanoke Island Circuit  Quarterly Conference Minutes, 1904-1907  North Carolina  4-7-38"
Methodist Episcopal Church,": M-2861 Methodist Episcopal Church, South. North  Carolina Conference. Elizabeth City District. Roanoke Island Circuit  Quarterly Conference Minutes, 1908-1911  North Carolina  4-7-38"
Methodist Episcopal Church,"M-2862 Methodist Episcopal Church, South. North  Carolina Conference. Elizabeth City District. South Camden Circuit  Quarterly Conference Minutes, 1899-1902  Camden Co., North Carolina  l1-5-33"
Methodist Episcopal Church,"- 2863 Methodist Episcopal Church, South. N. C. Conference. Fayetteville District  Quarterly Conference Minutes, 1922-1923  201 pp. Leather 21 x 13 cm.  1-21-42 Recataloged, 6-4-74"
Methodist Episcopal Church,"4-F Methodist Episcopal Church, South. North Carolina Conference. Fayetteville District. Elizabeth Circuit  Church Register, No. 2, 1898-1930  Circuit in Fayetteville District from 1922."
Methodist Episcopal Church,"4-F Methodist Episcopal Church, South. North  Carolina Conference. Fayetteville District. Elizabeth Circuit  Quarterly Conference Minutes, 1920-1923  Circuit in Fayetteville District from 1922."
Methodist Episcopal Church,": ‘ 4-F Methodist Episcopal Church, South. North  Carolina Conference. Fayetteville District. Elizabeth Circuit  Quarterly Conference Minutes, 1924-1927"
Methodist Episcopal Church,"4-F Methodist Episcopal Church, South. North Carolina Conference. Fayetteville District. Elizabeth Circuit  Quarterly Conference Minutes, 1928-1930"
Methodist Episcopal Church,"Methodist Episcopal Church, South. North  Carolina Conference. Fayetteville District. Elizabeth Circuit  Quarterly Conference Minutes, 1931-1933  Circuit in Fayetteville District through 1931."
Methodist Episcopal Church,"Methodist Episcopal Church, South. North Carolina Conference. Fayetteville District. Fayetteville and Cumberland Circuits  Quarterly Conference Minutes listed as being in this library in Franklin Grill's Method-  ism in the Upper Cape Fear were actually in  private hands when he wrote the book and are not part of our collections.  6-26-74"
Methodist Episcopal Church,"F- 2864 Methodist Episcopal Church, South. North  Carolina Conference. Fayetteville District. Haw River Circuit  Quarterly Conference Minutes, 1854-1868  North Carolina  Circuit in Fayetteville District during 1859-  1866. Records include Pittsboro Circuit, 1868-1887.  8-9-46 Recataloged, 9-11-80"
Methodist Episcopal Church,"Methodist Episcopal Church, South, Carolina Conference,  Jonesboro Circuit  North Fayetteville District.  Quarterly Conference Minutes listed as being in this library in Franklin Grill's Method- ism in the Upper Cape Fear were actually in        private hands when he wrote the book and are  not part of our collections. 6-26-74"
Methodist Episcopal Church,"$-2722 Methodist Episcopal Church, South. North  Carolina Conference, Fayetteville District. Montgomery Circuit. Mt. Olivet Church  Class Book, 1854-1880  Near Erect, Randolph County, N.C.  Circuit in Fayetteville District from 1858.  4-11-50 Recataloged, 9-9-82"
Methodist Episcopal Church,"Methodist Episcopal Church, South. N.C. Con- ference. Fayetteville Dist. Montgomery Cir- cuit. Mt. Olivet Church     The records in this Class Book, 1854-1880, from Mt. Olivet Church date mostly from the middle and later 1850's and 1871. There are scattered notations both earlier and later, the  latest being 1880 and the earliest 1802.  This volume was used much earlier than the 1850's, and many pages have apparently not survived. The front cover has two titles, one written over the other: ""Class Book for 1802"
Methodist Episcopal Church,"Methodist Episcopal Church, South. N.C. Conference. Fayetteville Dist. Montgomery Circuit. Mt. Olivet Church     for Mt. Olivet"" and ""A Class Book for Mt. Olivet Society May 31 the 1834.""  The names of the black members of this churc are also listed in its Class Book.  The records are on 19 pages and on the cover of the volume."
Methodist Episcopal Church,"Methodist Episcopal Church, South, N. 6, v5 Conference, FAYETTEVILLE District, N. C, PITTSBORO Circuit  Quarterly Conference Records, 1895-1898  Chatham co., N. C. 110 pp. Boards 20 x 20 cn,  Aug. 9, 1946"
Methodist Episcopal Church,"M-Avee  Methodist Episcopal Church, South. N. C6, 2.5, Conference, FAYETTEVILLE District, N. C. PITTSBORO Charge  Quarterly Cohference Records, 1899-1902 Pittsboro, N. C. 110 pp. Boards 27 x 20 om, Aug. 9, 1946  : cu7* CY ig"
Methodist Episcopal Church,"™M-2$ 6?  odi Episcopal Church, South, N.C. RPepahse PAS TTEVILLE District, N.C.’ 5  PITTSBORO hcaune Quarterly Conference Records, 190961906  Pittsboro, N. C. 110 pp. Boards 26 x 20 om,  Aug. 9, 1946  oak  UIDE"
Methodist Episcopal Church,"Methodist Episcopal Church, South, *) Ganterence FAYETTEVILLE District, N. C. » PITTSBORO Cireuit Quarterly Conference Records, 1907-1910 Pittsboro, N. C, 110 pp. Boards 26 x 20 om,  Aug. 9, 1946  CLUDE GUIDE  WBA J i."
Methodist Episcopal Church,"Satereace,” PiebPtavitte District, H: 8: Ss PITTSBORO Charge  Quarterly Conference Records, 1911-1914 Chatham co,, N. C. 110 pp. Boards 26 x 20 cm. Aug. 9, 1946"
Methodist Episcopal Church,"\-2% 6  Methodist Episcopal Church, South. N. 0. Conference, FAYETTEVILLE District, N. C. PITTSBORO Charge Quarterly Conference Minutes, 1915-1918 Pittsboro, N. ©, 72 pp. Boards 26 x 20 om,  Aug. 9, 1946"
Methodist Episcopal Church,"M-2971 ethodist Episcopal Church, South, N. C6, ©. CORRENERR’D, <A TEVILLE District, N.C.” * Quarterly Conference Minutes, 1919-1922 Fayetteville, N. C.  Mar. 24, 1934"
Methodist Episcopal Church,"M-2gvI72z Methodist Episcopal Church, South. N. C. “> Conference, FAYETTEVILLE bistrict, N. ©. ~ PITTSBORO Circuit Quarterly Conference Minutes, 1923-1927 Fayetteville, N. C,  Mar, 24, 1934"
Methodist Episcopal Church,"™- 2A$735 Methodist Rei srcues ct ee South, N. G. 4%:  Conference TEVILLE District, N. 6, ~  PITTSBORO erie Quarterly Conference Minutes, 1930-1934 Chatham co., N. C,  138 pp. Boards 22 x 28 cm.  June 11, 1937"
