Name,Text
"Dromgoole, George Coke and Richard B. Robinson","“ Dromgoole, George C. and Richard B. Robinson latter half of the nineteenth century, and  sometime lawyer at South Gaston, N.C. The letters and papers give an excellent account of plantation life and management just pre- vious to and following the Civil War in Va., dealing mainly with such matters as the settl- ement of accounts and notes, the sale offlaves  and cotton, the production of such crops as cotton, corn, and tobacco, land tenure, land drainage, labor agreements, etc. A large number of the letters to Dromgoole following the Civil War are from his land tenants, whic"
"Dromgoole, George Coke and Richard B. Robinson","5  Dromgoole, George C. and Richard B. Robinson discuss in great detail the problems of plant- ation management. A few plantation account sheets and Dromgoole's daybook showing plant- ation expenses (1892-93) are included.  A few letters from M. M. Harrison, a stud- ent at Virginia Military Institute during the     1870's, to Dromgoole, his guardian, give much information on V. M. I. am gme account of the death and funeral of Commodore Matthew Fontaine Maury, a professor at the Institute, in 1873.  Also included in the collection are bonds"
"Dromgoole, George Coke and Richard B. Robinson","6 Dromgoole, George C. and Richard B. Robinson  and obligations; land deeds; Justice of the Peace, County, and Circuit Court minutes, orders, summonses, warrants, and depositions of Brunswick County; articles of agreement for land tenure and labor on Dromgoole's plantat- ions; various obituaries; land plats; the will  of James Ledbetter of Brunswick County (Dec. 1820); advertisements; numerous bills and re- ceipts; promissory notes; and a memorandum book.  An item of especial interest in the collec ion is a copy of “oe for exemption"
"Dromgoole, George Coke and Richard B. Robinson","9 Dromgoole, George C. and Richard B. Robinson from Confederate military service made by Dromgoole in 1864, in which he discusses the size and importance of the plantation under his management, both those of his own and of his wards.  3 items and 1 vol. added, 6-21-62: Two per- sonal letters and an undated fragment of     another and a daybook. The daybook runs from 1847 to 1869 and includes records for the hiring of slaves and freedmen.  4 items andl vol. added, 6-1-68: A"
"Dromgoole, George Coke and Richard B. Robinson","Dromgoole, George Coke and Richard B. 8 Robinson  promissory note, three letters, and a small vol- ume.  The promissory note concerns the estate of Edward Dromgoole (Nov. 5, 1840).  Two of the letters pertain to business affairs (Nov. 7, 1848 and Feb. 15, 1861), while the third letter contains references to Brigham young and mining in Utah. This last item has been partially destroyed, making it difficult to understand these references.  The volume includes a list of the birth"
"Dromgoole, George Coke and Richard B. Robinson","Dromgoole, George Coke and Richard B. Robinson :  aates and other data concerning slaves. [It appears to have been kept by various members of the Robinson family during the years 1843-1865.  1 item added, 7-5-68: A promissory note signed by Richard B. Robinson for the payment of fees for the stud service of a stallion (Aug. 7, 1862).  2 items added, 1-24-72: A letter of Jan- uary 5, 1972, from Mr. and Mrs. Dromgoole Heath to relatives, giving a brief summary of"
"Dromgoole, George Coke and Richard B. Robinson","Dromgoole, George Coke and Richard B. 10 Robinson  the genealogical research work they have done. There is also a notebook entitled ""Canaan,"" which was the home of Edward Dromgoole. It includes pictures and a description of the house, and information on Edward Dromgoole and his children.     1 volume added, 8-5-74: ""Dromgoole Memorial Service,"" a description of a service held on April 28, 1974, at the Dromgoole family ceme-  tery in Brunswick Co., Va. This volume was prepared by Mr. and Mrs. V. Dromgoole Heath and"
"Dromgoole, George Coke and Richard B. Robinson","11  Dromgoole, George Coke and Richard B.  Robinson their daughter Mary Heath after returning from the service to their home in Richmond, Cal."
"Dromgoole, George Coke and Richard B. Robinson","Dromgoole, George Coke and Richard B, Robinson     Dromgoole, Edward  Plantation Book, 1854-1921"
"Dromgoole, George Coke and Richard B. Robinson","M-924 Dromgoole, George Coke and Richard B. Robinson     Dromgoole, Edward Plantation Book, 1853-1865"
"Dromgoole, George Coke and Richard B. Robinson","Dromgoole, George Coke and Richard B, Robinson     Dromgoole, Edward  Plantation Book, 1861-1865 89 pp. Boards 16 x 19 cm, 6-11-37"
"Dromgoole, George Coke and Richard B. Robinson","M-926 Dromgoole, George Coke and Richard B. Robinson     Dromgoole, Edward Receipt Book, 1847-1852  124 pp. Boards 15 x 19 cm, 3-17-39"
"Dromgoole, George Coke and Richard B. Robinson","|M-5885  Dromgoole, George Coke and Richard B. Robinson     Robinson, Richard B.  Daybook, 1847-1869  132 pp. Boards 19 1-4 x 16 ecm,  6-21-62"
"Dromgoole, George Coke and Richard B. Robinson","Dromgoole, George Coke B. Robinson  Es 5928 and Richard     Dromgoole, Edward Ledger, 1849-1862  197 pp. Boards  8-5-58  30 x 19 1-4 cm."
"Drug, Store","Drug Store  FOR INFORMATION ABOUT THIS COLLECTION OR ADDITIONS TO THIS COLLECTION, PLEASE ASK A STAFF MEMBER TO CONSULT THE ACCESSION RECORDS."
"Drummond, Henry Home","Drummond, Henry Home  Papers, 1826  Blair Drummond, Perthshire, Scotland XVIII-£ l item 12-13-67"
"Drummond, Henry Home","Drummond, Henry Home. Papers, 1826. Blair Drummond, Perthshire, Scotland  Henry Home Drummond (1783-1867), British politician, was M.P, for Stirlingshire, 1821- 1831, and for Perthshire, 1840-1852,  On Dec. 5, 1826, Alexander Macfarlane of Thornhill, Stirlingshire, forwarded a memorial     from a group of shipowners on the subject of free trade. The memorial is no longer with the letter, but its contents were summarized on  page four,"
"Drummond, Joseph A.","Drummond, Joseph Ae Letters. 186-1863. South Carolina, /%  Section.A 8 pieces NOV 9 1934 | a DE*4 »  NOV 20 1934 &  added #-/+-¥)"
"Drummond, Joseph A.","Drummond, Jos <i Ae  « anew  D-  24 items added 4514-49. Most of these are letters written by Joseph A. Drummond to his wife Martha while he was on James Island, S. C. There is some mention of military activities in that  vicinity, but in the main these letters deal with"
"Drummond, Joseph A.","Drummond, Joseph A. 2 his concern about his family and affairs at home. A letter from Thomas Branch and Sons, brokers and commission merchants of Petersburg, Va.,to D. A, Davis of Salisbury, N. C. stating that they would like to exchange more North Carolina 8 per cent bonds for bank notes and would pay 5 per cent premium if necessary."
"Drury, Thomas Wortley","Drury, Thomas Wortley  Papers, 1904 London, England XVIII-E 9-2-54"
"Drury, Thomas Wortley","Drury, Thomas Wortley. Papers, 1904. London, England, 2 items. Sketch     Thomas Wortley Drury was born on the Isle of Man on Sept. 12, 1847. He died on Feb. 12, 1926 at St. Catherine's Lodge, Cambridge, Eng. His father was a Manx incumbent. He was edu- cated at King William's College and Christ's  College, Cambridge. For some twenty years he did pastoral work on the Isle of Man. In 1882 he became principal of the college at Islington where he remained for fifteen years. He later was made a principal of Ridley Hall and a mem- ber of the ee oer’ on Confession"
"Drury, Thomas Wortley","Drury, Thomas Wortley. 2 at Fulham Palace. In 1904 Mr. Balfour appoint- ed him to the Royal Commission on Ecclesiasti- cal Discipline.  He was married and had two daughters and One son. This sketch is from his obituary in the London Times. The two items comprising     this collection are letters from churchmen after Drury was appointed to the Royal Commiss- ion. They deal solely with ecclesiastical  matters."
"Duane, John H.","Duane, John H. Papers, 1916-1919  Ford, Dinwiddie Co., Va.  Section A 9 items & 4 vols.  5-19-85  (See also bound vol. cards)"
"Duane, John H.","Duane, John H. Papers. Ford, Dinwiddie Co., Virginia     John H. Duane, dealer in general merchandise Operated a general store at Ford, a village on the Norfolk and Western Railroad in northern Dinwiddie County, Virginia. He is probably the J. H. Duane who was superintendent of  schools during 1917-1923; see Dinwiddie County, ""The Countrey of the Apamatica"" (Richmond, 1942), p. 248. This collection consists of four account books from his general store and some miscel-"
"Duane, John H.","Duane, John H. 2     laneous letters and accounts found inside the volumes. The account books are:  Ledger B, 1916  Daybook: 1916, March 25-March 24, 1917 Daybook: 1917, March 24-Dec. 3 Daybook: 1918, Sept. 20-Oct. 9, 1919.  Some of the miscellaneous letters and accounts concern the collection of bad debts."
"Duane, John H.","Duane, John H.     Duane, John H. Ledger B of General Store, 1916  Ford, Dinwiddie Co., Va.  5-19-83"
"Duane, John H.","Duane, John H.     Duane, John H.  Daybook of General Store: 1916, March 25-March 24, 1917  Ford, Dinwiddie Co., Va.  a7 19-83"
"Duane, John H.","Duane, John H.     Duane, John H,.  Daybook of General Store: 1917, March 24-Dec. 3  Ford, Dinwiddie Co., Va.  5-19-83"
"Duane, John H.","Duane, John H.     Duane, John H.  Daybook of General Store: 1918, Sept. 20-Oct. 9, 1919  Ford, Dinwiddie Co., Va.  5-19-83"
"Dubois, A.","Dubois, A. Papers, 1843  n. Dp.  Josiah C, Trent Collection in the History of Medicine--. Div.  4-8-60"
"Dubois, Baron Antoine","Dubois, Baron Antoine Papers, 1821-1843 Paris, France  Josiah C,. Trent Collection in the 2 items History of Medicine--. Div.  4-8-60"
"Dubois, Baron Antoine","Dubois, Baron Antoine. Papers, 1821-1843. Paris, France, 2 items. Sketch.  Baron Antoine Dubois (1756-1837), was chier surgeon to Napoleon I and accoucheur to the Empress Marie Louise. His papers contain two short letters of a casual nature. See Trent Collection Picture File for an engraving of Dubois. Dubois was the greatest French physi- cian of his day,"
"Du Bois, Egbert","Du Bois, Egbert Papers, 1860 (1866-91) 1901  Bluffton, Beaufort co., §.¢.  VIII-¢ 2-13-52  OT Tits GUIDE  523 items"
"Du Bois, Egbert","Du Bois, Egbert Papers, 1860-1901 Bluffton, 8.C. 523 items Sketch.     After the Civil War Egbert DuBois, son of Peter K. DuBois of New York, moved to Bluffton, 8,0. There he engaged in cotton planting. He had two sons, Pierre Eugene and Pau}. Eugene entered the law firm of Edwin & Charles E, Countryman in  Albany, N.Y. Paul appears to have been®spoiled younger son.  There are letters from Wm, 0, Rahn, a very religious soldier, to his wife in which he write of desertion & the wickedness of the soldiers."
"Du Bois, Egbert","(2)     666 reports cholera in  y Rivaahah, There are “letters from merchants in N.Y. and cotton factors & commission merchants in Charleston. A letter of Sept. 20, 1870 speaks of the prosperity of Atlanta & one in Apr.1871 tells of preparations there for the Exposition. Eugene wrote home rather often. He advised re-  garding Paul's education, commented on his work, his disillusionment as a young lawyer, & politics & told of his intention to marry Elizabeth A. Bender in Oct. 1891, In 1889 the firm of Country man & Du Bois had instituted a suit against the executors & trustees ofthe estate of Samuel J."
"Du Bois, Egbert","Du Bois, E. (3)  den, which suit was still in the courts in 1896, Eugene's comments on politics include a report of the number of delegates attending the Prohibition state convention in 1889, Clevelands strength in N.Y. in 1890, and his preference for McKinley. in 1900,  There is a letter (Apr. 27, 1890) from Wm. Johnston of Charlotte, N.C. He owned lani near Bluffton. A letter from L, Fowler of Mt. Kisco, N.Y. states that the attendance by some Northern ladies of a W.C.T.U. convention in Atlanta did much to “wash out the bloody shirt."" A lynching"
"Du Bois, Egbert","White, Fla. are mentioned in a letter of Nov. 30, 1893, On Nov, 14, 1894 Geo. Cary Eggleston wrote to Du Bois inquiring as to conditions for fishing at Bluffton.  By 1900 Du Bois was Gj ig a store, His son  Poy PP st Be ag PC MERIT ites"
"Dubose, Daniel","“Chapel -  Dubose, Daniel: See: Law, William  Account books and records of a general merchant.  NOV5 1933"
"Dubose, Joel H.","DuBose, Joel H. Papers, 1895-1928  Atlanta, Fulton Co., Georgia  Section A 2 items  6-27-52  GUIDE"
"Dubose, Joel H.","DuBose, Joel H. Papers, 1895-1928. Atlanta, Fulton Co., Georgia. 2 items.     Letters to noel H. DuBose from Allen Daniel Candler, sec. of state for Georgia, and from Hoke Smith, gov. of Georgia and U. 8. Senator. The letter from ye mentions land grants  in_Wilkinson and laski counties, Georgia, From Re Marmaduke Floyd Collection."
"Dubos, Rene Jules","Dubos, Rene Jules Papers, 1948 New York, N.Y.  Trent Coll. in Hist, of Med.=--MS. Div.  7-25-64"
"Dubos, Rene Jules","Dubos, Rene Jules. Papers, 1948. New York, N.Y.     A letter by Rene Jules Dubos (1901- ), bacteriologist, dated July 1, 1948, from the Rockefellar Institute for Medical Research, concerns the chapter of Dr. Samuel Sanford Elberg in the publication, ""Bacterial and Mycotic Infections of Man."""
,"SWXHON YJITITSLIE L6 adv 9T  Sols  *espiz00ez uOoTSseo0R wos P2e301232D °U0T29971100 passes0zdun  °SWUe}ZT SNoeuez.SoOSTM wS8SyzO  pue ssseTp10S e,VJepeysuoD Wouy s3z3}7}3074  $ystTuoTsseoes }UepIe Ue WOLF J23}391 $eae 1s B Butzyonb Je330 1 $44TF Gav 1S ZJOF }dteces eb SUT ZUOD UVOT}9E1190 *szUepTsers evqzy e009 S$e11Fd °sweyT ST *“VEGT-9S8T ‘S‘suedeg eALFURVZT esogng °1199 1184S *SSN"
"Dubreuil, Joseph Villars","Dubreuil, Joseph Villars Papers, 1760-1850  Tchoupetoulas, Orleans Parish, La. & French West Indies  See 2-8 45 items & 1 vol. 1-27-44  (See also bound vol, cards)"
"Dubreuil, Joseph Villars","Dubreuil, Joseph Villars. Papers. Tchoupetou- las, Orleans Parish, La. and French West Indies     Joseph Dubreuil de Villars, Chevalier de St. Louis, occupied many important positions both in Louisiana and the French Indies. He was born in Louisiana in 1744, and was sent to France to be educated. While a pupil in the  royal corps of artillery in 1764, he was com- missioned as a second lieutenant by Louis XV in a company of cannoneers and bombardiers at Boullive-Bonneveaux in Guadaloupe. In the course of thirty years' service"
"Dubreuil, Joseph Villars","Dubreuil, Joseph Villars 2 he achieved the rank of lieutenant colonel of colonial troops stationed at Leogane in Santo Domingo. During the latter years of this per- iod Villars as an adherent of the fallen house of Bourbon, was engaged in preserving order in this disturbed island and was forcibly expelled from that place by two agents of the French Republic in 1792 or 1793.  The vessel on which he was sailing for Phila- delphia was taken by an English privateer and  Villars was landed in Kingston, Jamaica. From"
"Dubreuil, Joseph Villars","Dubreuil, Joseph Villars 3 there he helped with the organization of a group of French Royalists whose object was to restore order in Santo Domingo. There are no records of the actual attempts that were made, but it appears that they were successful in so far as to give the English troops temporary control of French Santo Domingo. Later Cheva-     lier de Villars acted as a member of the Privy Council of the English government at Port-au- Prince.  When the English left the island in 1798,"
"Dubreuil, Joseph Villars","Dubreuil, Joseph Villars 4 Dubreuil departed with them and took up his residence in Louisiana where he had relatives. —_— there until his death about 1808 or 1809.  He was succeeded by a long line of Villars and Dubreuils whose exact relationships are difficult to trace because of the apparent in-     consistent use of the two names. The family seems always to have been of considerable means, most of its members being cane and cotton plant  ers. Members of the family married into the"
"Dubreuil, Joseph Villars","Dubreuvil, Joseph Villars ° 5 Trudeau, Lassise, and Gaston families. (For more detailed biographical information see typed sheet ""Dubreuil de Villars family"" placed at the beginning of the collection. )  The manuscript material includes one sheet of genealogical information on the Villars family (dated 1768) and a sketch of the Trudeau and Lassise families (undated).  There are three letters from the early years of the first Villars' life. Ome concerns a  claim which he held against the estate of one"
"Dubreuil, Joseph Villars","Dubreuil, Joseph Villars 6 Brosset and Toutant-Beauregard. The other two concern his military rank and transfer to San- to Domingo.  One letter to Villars in Santo Domingo is interesting for its remark that conditions in Santo Domingo were preferable to those in Europe where war and anarchy ruled. Also con- tains family news. There are also several family letters of the Villars in‘the set.  Various receipts and business letters  prior to 1798 indicate that Villars was handling"
"Dubreuil, Joseph Villars","Dubreuil, Joseph Villars ss in Santo Domingo the business affairs of the | Viscount de Kercado (London) and of aM. de la Rue. Papers include property lists and fre- quent references to the sale of sugar. See also account book of Viscount de Kercado, placed at end of collection.  Several pieces bear on the business transac-     tions of the Villars family in Louisiana. There are a number of letters concerning the settlement of the Trudeau estate, and a deed  to land signed Mar. 16, 1857, by Louis Joseph"
"Dubreuil, Joseph Villars","Dubreuil, Joseph Villars 8 Didier Villars.  Perhaps the most valuable portion of the col lection is a number of papers of a public or political nature. These include a letter, June 2, 1804, about Louisiana's relations with the Federal government, including a bitter attack o C, C, Claiborne; a census of the Territory of     Orleans for 1806; reports on the status of the Louisiana Treasury covering the years 1806- 1809; a letter (Jan. 13, 1813) from Thomas But- ler to Rene Trudeau concerning a slave uprising;"
"Dubreuil, Joseph Villars","Dubreuil, Joseph Villars 9 petition of the State of Louisiana to the Con- gress of the U. S. protesting the military acti vities of General Wilkinson and his attempts to have the writ of Habeas Corpus suspended (h.d.); a copy of a speech made in the legislature on the low state of morals in Louisiana (n. d.); memoranda for proposed changes in civil law  (n. d.); a petition to the legislature from At- takapas Co. about land titles and registration, use of cypress groves, and proposed legislative action on several matters (n. d.); proposed acts for the compensation of members of the"
"Dubreuil, Joseph Villars","Dubreuil, Joseph Villars 10 legislative councils (n. d.); ""Notes from the Committee of instructions of the Territorial Assembly"" (n. d.); and recommendations to the City Council of New Orleans.  Miscellaneous material in the collection in- cludes notes on the English police system; notes on ""Principles of conduct for married people""; a patriotic song; an historical sketch of Louis XV and Louis XVI; one copybook of maxims on legislation and politics with notes on the  commercial code; one commonplace book containing"
"Dubreuil, Joseph Villars","Dubreuil, Joseph Villars 11     poems, a play, story, and a song. There is also one bound volume containing bits of  French verse, A number of the longer papers in this set  have typed translations."
"Dubreuil, Joseph Villars","Dubreuil, Joseph Villars  Commonplace Book, 1796 Tchoupitoulas, Louisiana  10 pp. Calf 41x26 cm.  3-17-41"
"Duc, Henry A., Sr. and Jr.","Papers, 1840-1909  Charleston, S. C.  items items added, 3-4-56  item added, 12-26-58 items added, 7-31-63 items and 1 vol. added, 7-21-66"
"Duc, Henry A., Sr. and Jr.","DUC, H. A. Letters & Papers 18401909 Charleston, S.C. 3%  H. A. Duc was a Charleston tin and sheet iron merchant. He bought most of his supplies from Phelps, Dodge & Co. of New York and their bills and invoices, of which there are a number in this collection, are good indices to prices of these commodities in the 1840's and 1850's,     Duc had several sons among whom were H. A, (""Archie"") Duc, Jr., Edward, Charles, and Lau- rence, (It is rather difficult to tell from the  letters whether some of these were sons or sons- in-law). Archie seems to have been the only"
"Duc, Henry A., Sr. and Jr.","bis Who followed in his father's footsteps for e was taken into partnership and the firm called - A. Guc and Son. ‘Two letters from Archie in Uctober of 1870 when he was in New York owserving the latest types of tin-working machinery reveal his enthusiasm for his profession, This interest in metal work and mechanics  seems to have continwd throughout his lifetime, for in 1906 (Mar. & Apr.) he was granted patents for a ""Marine Engine"" and an ""Elastic Fluid En-  gine."" Unfortunately no description of these Hnventoms is included in the collection."
"Duc, Henry A., Sr. and Jr.","The bulk of the collection consists of let- ters from the various other Ducs, usually con- cerned only with family matters. One, however, (July 26, 1874) from a grandson named Henry gives @ good description of the Nebraska settlers' sod houses. Another (May 20, 1878) from a friend of the Ducs in St. Augustine, Fla., describes the  town and the orange crops. Here are several interesting 1906 ff. letters from ""Julian! a nephew of the Ducs, from the U.S.  Naval Academy and later from the U.S.S. Charles-"
"Duc, Henry A., Sr. and Jr.","Near the beginning of the collection and having no apparent connection with it is a let- ter from Robert Wilson Gibbes concerned with the exorbitant prices which Saunders, an artist, charged for his miniatures. Also seemingly un- related to the set is a MS. in the undated ma- terial entitled ""Literature in Charleston."" Al-  though unsigned it apparently was written by a local Charlestonian,  With the exception of the prices of tin which  it furnishes, this set is more interesting than"
"Duc, Henry A., Sr. and Jr.","Duc, H. A. 5 24 items added, 3-4-56: Miscellaneous letters of members of the Duc family and friends. 1 item added ,12-26-58: Deed to a slave named Anthony, who was sold to Henry A. Duc at Charles ton on Aug. 16, 1853, for $700.  5 items,added 7-31-63, consist of peréeonal     letters only.  53 items and 1 vol. added, 7-21-66. The olume is the Ledger, 1843-1856, from the shop of H. A. Duc, tinsmith. The spine bears the initials ""N. D.” that cause doubt about H. A."
"Duc, Henry A., Sr. and Jr.","Duc, He As 6     Duc's ownership. However, the collection includes receipts made out to him that can be traced into the ledger's accounts.  The items are primarily bills and receipts from the business. They are useful because Duc frequently did not itemize in the ledger the goods and services that he sold to  customers. Further, the absence of posting entries suggests that he did not use a daybook that would have itemized goods."
"Duc, Henry A.","Duc, Henry A.  Ledger, 1843-1856  Charleston, South Carolina 293 pp. Leather and Boards 7-21-66  33 x 22 cm."
"Du Cane, Sir Edmund Frederick","Du Cane, Sir Edmund Frederick Papers, 1891 London, England 18-E 1 item 2-26-71"
"Du Cane, Sir Edmund Frederick","Du Cane, Sir Edmund Frederick. Papers. London, England  Sir Edmund Frederick Du Cane (1830-1903), British prison reformer and administrator, explained on Oct. 10, 1891, why the numbers of young offenders committed to reformatory and industrial schools had increased during the previous two decades."
"Duchenne de Bowlogne, Guillaume Benjamin Armand","Duchenne de Bowlogne, Guillaume Benjamin Armand Papers, 1874 Paris, France  Josiah C, Trent Collection in the “1 item History of Medicine--. Div.  4-8-60"
"Duchenne de Bowlogne, Guillaume Benjamin Armand","Duchenne de Baglogne, Guillaume Ben jamin Armand.  Papers, 1874. Paris,France. 1 item. Sketch. Guillaume Duchenne de Boulogne (1806-1876),  describes a case of Parkinson's Disease with the  therapeutics he had employed to arrest progress of the disease."
"Dudley, Benjamin Winslow","Dudley, Benjamin Winslow Papers, 1841-1870 Lexington, Ky.  Josiah C. Trent Collection in the History of Medicine--. Div.  4-8-60  2 items"
"Dudley, Benjamin Winslow","Dudley, Benjamin Winslow. Papers, 1841-1870. Lexington, Ky. 2 items, Sketch.  Benjamin Winslow Dudley (1785-1870), American surgeon and author, professor of surgery at Translyvania University, writes a recommendation to President W. H. Harrison in 1841, Included  are biographical and obituary clippings, ca. 1870,"
"Dudley, Edward Bishop Sr.","Dudley, Edward Bishop, Sr.  Papers, 1838-1846  Wilmington, New Hanover Co., N. C. Section A 3 items  2-5-41 Recatalogued, 5-18-66"
"Dudley, Edward Bishop Sr.","Dudley, Edward Bishop, Sr. Papers, 1838-1846. Wilmington, New Hanover Co., N. C.     Edward Bishop Dudley (1789-1855) was governor and U. S. representative from N. C.  A copy of a land grant from Dudley to Neill Munn of Montgomery Co. is dated Apr. 27, 1838. William Hill, Secretary of State for  N. C., certified that this was a true copy and sent it to Tristram Bostick of Richmond Co., N. C. (Apr. 9, 1848).  In Nov., 1838, Dudley wrote the Rev. Dr."
"Dudley, Edward Bishop Sr.","Edward Bishop, Sr.     William McPheeters to identify another clergyman whom Dr. McPheeters had met.  On May 17, 1838, Dudley wrote Joshua A. Pool, Sheriff of Pasquotank Co., to grant a stay of execution on the grounds of insanity to another J. A. Pool. He instructed Sheriff Pool on the official procedure to be followed in applying for such reprieves."
"Dudley, John W.","Dudley, John W.  Papers, 1816 (1852-1861) 1867 Cincinnati, Hamilton Co., Ohio  Section A ee items  5-21-57  GUIDE"
