Name,Text
Advertising Collection,"Advertising Collection 3  The Advertising Collection is composed chief- ly of material from the United States, but also contains items from foreign counties. This large group of printed material spams over a century of the promotion and sale of various products and services.  A useful bibliography is: Lawrence B.  Romaine, A Guide to American Trade Catalogs 1744-1900 (New York, — ,  (Continued on next card)  e"
Advertising Collection,"Advertising Collection  The researcher should note that trade cata- logs that are pamphlets may be found in several places in the Perkins Library: this collection individually in the stacks as fully cataloged items; or as part of groups of old pamphlets (such as the N.C. Pamphlets) for which the cataloging was by main entry only, no subject     cards having been made (see the special section for pamphlets in the main card catalog). Broadsides may also be found in the Broadsides Collection. Of course, many collections in the"
Advertising Collection,"Advertising Collection     Manuscript Department also contain printed advertising material.  In 1985 the library began to acquire Southern business trade catalogs in a more systematic way. These newly purchased catalogs are sent to the Rare Book Room where a large  collection of them will be accumulated. Some catalogs have been transferred from the Ad- vertising Collection to the Rare Book Room, and others will be transferred.  The United States section of this collection"
Advertising Collection,"Advertising Collection is divided into the following categories:     Advertising Business Airplanes  Astrology, Dreams, Magic, etc. Attorneys  Automobiles, Roads, etc. Badges, Stamps, Stickers, etc. Banks and Finance  (Continued on next card)"
Advertising Collection,"Advertising Collection     8.  9. 10. Lis 12. 13. 14, £5. 16.  Barber Shops and Beauty Parlors Bicycles  Books, Publishing & Printing  Boots and Shoes  Building Supplies  Burial  Carriages, Wagons, Harness and Gear Clothing  Commercial and Trade Organizations  16A. Computers and Automation  17.     Dance"
Advertising Collection,"Advertising Collection     18. 19. 20. 21. 22. 23.  24. 256 26. 27.     Drama  Education  Expositions, Fairs & Festivals Eyeglasses  Farm Machinery and Implements Fertilizer  Food  Furniture  Furs, Skins, etc.  Guns"
Advertising Collection,"Advertising Collection     28. 29. 30. SL 326 336  34. 35. 36. 37.     Hair Goods  Hardware  Health and Patent Medicines Heating and Fuel  Horticulture  Household Appliances, Fixtures,  Housewares, & Supplies Household Furnishings Houses and Buildings  Insecticides Insurance"
Advertising Collection,"Advertising Collection     38. 39. 40. 41. 42. 43. 44,  45. 46. 47.     Jewelry, Watches, and Clocks Lectures  Lighting  Liquor, Wine, and Spirits Livestock, Poultry, Bees, etc. Lotteries  Lumber, Woodworking, and Related Machinery  Machinery and Instruments Mercantile Business  Mining"
Advertising Collection,Advertising Collection     48. Miscellaneous  49. Moving Pictures  50. Music  51. Music Concerts  52. Musical Instruments  52A. Nuclear Power  53. Office Supplies  54. Paper and Paper Products 55. Penmanship  56. Pets  57. Photography & Projection Equipment
Advertising Collection,"Advertising Collection     58. 59. 60. 61. 62. 63.  64. 65. 66. 67.     Radio  Railroads  Real Estate  Resorts, Hotels, and Travel Rubber Goods  Sewing Equipment and Supplies Sporting Goods  Steamships  Telegraph and Telephone  Textiles"
Advertising Collection,"Advertising Collection     68. Tobacco (See the Tobacco Collection) 69. Toiletries  70. Toys  71. Utilities  The foreign advertising material is arranged  alphabetically by countries. Travel literature predominates. The countries represented are:  Albania, Austria, Belgium, Bermuda, Brazil, Canada, China, Cuba, England, Foreign Tours (more than one country), France, Germany,"
Advertising Collection,"Advertising Collection 13     Greece, Hungary, Ireland, Israel, Italy, Japan, Mexico, Monaco, The Netherlands, Philippines, Puerto Rico, Rumania, Scotland, Sweden,  Switzerland, Turkey, and Yugoslavia. South Africa."
Aegidius Corboliensis,Aegidius Corboliensis  See Thirteenth Century Medical .
"Afflaticus, Johannes (Afflacius)","Afflaticus, Johannes (Afflacius).  See Thirteenth Century Medical ."
Africa,"Africa  Papers, 1781-1958  ¥. Pp. in Africa 18-E items | items added, 2-25-60* items added, 8-22-61 item added, 9-13-61 item added, 2-1-63 item added, 9-27-63 *Transferred, 5-12-73, to South Africa Papers.  Ke Lo MRR OND  2-24-60"
Africa,"Africa Papers, 1781-1958 v. p. in Africa 18-E 1 item trans. from Negro Coll.,  7-28-69 1 item added, 8-13-69"
Africa,"Africa, Papers, 1781-1958. v. p. in Africa. 150items. Sketch.  The General Division of the African Papers, 1858-1852, contains two letters. A social note by African traveller, John Iéander, has little content, African Bishop Samuel A. Crowther male a report in 1852 on the progress of Christian     missions in the southern provinces of Nigeria. He describes the terrible havoc caused by slave traders between Badagry and Abbeokuta, where the country has been stripped of population, towns destroyed, and roads abandoned. Bishop Crowther refers to “Ce and to mission"
Africa,"Africa. Papers 2 scnools at Freetown and Abbeokuta, A new ruler at Lagos means the end of the slave trade in the Bight of Benin,  157 items added 2-25-60; These are newslet- ters of the Union of South Africa, running from Mar. 4, 1943 to Oct. 15, 1945 (Nos. 171-307),     and numbering about a thousand pages,.*  These were issued by the government and appeared weekly, but with slight irregularity. They were under the general editorship of Mr. Frank Brownlee and were issued by the Dept. of Native Affairs during World War II and for some  *Transferred, 5- e 12-73, to South Africa Papers,"
Africa,"Africa, Papers 3 time thereafter. As already shown, this collec ion does not begin until during the third year of the war. The purpose of the letters, accord- ing to a statement by the editor in the last issue, was in general to furnish reliable ""news of the war,"" but more specifically to act as a     sort of counter current against any possible Spread of subversive propaganda among the African natives. In all these letters, however, there is no trace of any disaffection or rebell- ion from any source whatsoever. But this, per- haps even to greater r is to be ascribed"
Africa,"Africae Papers 4 to the towering figure of Gen. Jan Christian Smuts, who in his threefold capacity as Premier, Mintstr of Defense, and Commander in Obtef of all the South African forces, was able, not only to inspire, but also to control and harmonize all the numerous, previously often conflicting ele-     ments in his domain. During his long career, he had fought heroically for freedom in two preceding wars; first in the Boer War, when for a short time he had imprisoned a young reporter named Winston Churchill; and again in World War I, when as Prime 6 of South Africa, and"
Africa,"Africae Papers. 5 as a personal friend of Woodrow Wison, he vigor- ously championed the cause of the League of Nations.  The information found in this collection is given in a somewhat systematic sequence of topics, the first of which deals with politics     and general affairs of state. What Gen. Smuts has been doing and saying is graphically report- , often including direct quotations from his public utterances, Of minor importance are the occasional reports of his cabinet members, one of which was J. F. “oe often mentioned as"
Africa,"Africa. Papers 6 a possible future successor to the aging Smuts. He was Minister of Finance, but also exerted considerable influence in various other fields. Anyone: interested in the following subjects might find something worthwhile in these re- ports: the conservation of natural resources,     especially the prevention of soil erosion; and the entire field of mining industries, especial- ly those of gold and diamonds, in which this nation leads the world.  The greatest value of these letters is in the light they throw Yi part South Africa"
Africa,"Africa. Papers See played during the Second World War. In 19389, as soon as England was actively involved, Gen. Smuts, by a rather small majority, defeated the incumbent Premier Gen. Hertzog, with whom he had been cooperating very effectively in the leadership of the United Party, primarily on     the issue of official and active participation in the war, together with the other members of the British Commonwealth. Gen. Hertzog's death ocurred very soon after this, but Mr. D. F. Molan, the new spokesman for the leading opposi- tion, the Nationalist 6” now, and throughout"
Africa,"Africa. Papers 8 the entire war, was constantly criticizing and dispagaging the conduct of the war, but with no sucess. In the several interim elections re- ported in these letters the ruling United party was always overwhelmingly successful,  The contribution of the famous South African     Sixth Arm@red Division, created under the guidance of Gen. Smuts, was highly acclaimed by the leaders of the victorious Allies; and even when the victory at Tunis, May 7, 1943, practically removed all serious danger from the entire African a and also about a year"
Africa,"Africas. Papers 9 later when the Allies took firm possession of the situation in Italy, the fighting Sixth Division continued in the front ranks,  What about Smuts and the A Bomb? Evidently he was quite well informed. He knew of its progress and completion, and as a recognized     scientist he was also personally acauainted wit some of the specialists working on it. He said (letter no, 304) ""it was more than a bomb,...We have taken a secret of the sun and given it to the earth!"" Whether he really approved of its use is uncertain from “yy letters; but when"
Africa,"Africa, Papers 10 this was an accomplished fact he said (letter no, 298) ""Perhaps we had to come to the utter- most limit of evil to realize that war cannot remain the arbiter of our destinies....I hope that what with the work we have done in San Francisco and the atomic bomb mankind is learn-     ing its lesson,""  Now, by way of an appendix, one more issue: may be of vital importance. In one of the last newsletters, under date of Aug. 26, 1945, Gen. Smuts is quoted as saying: ""We here in South Africa are a a a problem the whole"
Africa,"Africa. Papers 11 world is trying to solve, the problem of racial harmony. If we can solve it what a precedent that would be!---the whole future of South Africa depends on a proper harmonious develop- ment between all sections of the population, "" The reason for considering this as a real lab-     oratory test is that it actually involves at least four racial classes:  1. The whites of European descent, Dutch and English, modern intelligent people but still creating numerous problems, especially in lang- ueage usage and ee’®e the public schools;"
Africa,"Africas Papers 12 constituting about one fifth of the entire pop- ulation; they have built up the nation and con- tinue to be the ruling class.  2. The black natives, constituting about two thirdsof the population, use a multiplicity of jargans peculiar to each tribe.     5. The colored class, defined even by Webs- ter as meaning for South Africa all intermittant shades, between white and black, constitute about one tenth of the population.  4, The Indians, an Asiatic group, who came originally from a among whom Ganthi"
Africa,"Africa. Papers 13 had lived and worked for some years. These last three classes are represented in both Parliament and Senate by a few white citizens elected by each of the separate groups.  Throughout the period of World War II, Gen. Smuts and his United party came out victorious,     but less than three years later, 1948, they were defeated by the above mentioned opposition leader D. F, Molan and his Nationalist party. This was the first all-+African (of Dutch extrac ion) government to rule in South Africa. They came into power a ' on the basis of an"
Africa,"Africae Papers 14 appeal to the still slumbering aversion to the British victors in the Boer War, and on the prospect of a permanent solution of the race problem. They instituted the policy of ""apart- heid,"" a complete separation not only as before in all branches of schools, and the usual public     places but also in residential areas, calling for the moving of thousands of citizens, and other entirely new and drastic discriminations. The execution of this plan began rather slowly, but abouttwo years later, in 1950, after the death of the a Smuts, it developed"
Africa,"Africa, Papers 15 ata more rapid pace. Although the election in 1958 showed a slight check in the policy it is still in operation.  9 items added, 8-22-61. This addition has seven letters, one clipping, and one small vol- ume.     Three letters relate to ecclesiastical sub- jects. John Wilson, probably a Methodist minister, writes from Granamstown, South Africa to T. Smith, a Wesleyan preacher at Salem (n.d. He notes disorders in the country nearby. On"
Africa,"Africa, Papers. 16 March 15, 1882, Joseph A. Williams, an Anglican missionary, discusses mission work in southern Tanganyika near the Rovuma River. His station  a Mtua is on the direct route to Lake Nyasa.  On May 15, 1912, Zakaria Kizito Kisingiri writes a personal note which has the news of his mother's death and elaborate funeral. Kisingiri     was an important chieftain in Uganda and was an early convert to Christianity. Although differ- ing somewhat on the chief's exact name, two volumes contain information about him: John V. Taylor, The Growth of the Church in Buganda"
Africa,"jimi. Papers, if London, 1958); and Alfred R. Tucker, Eighteen Years in Uganda and East Africa (London, 1908), 2 vols.  Two letters relate to Egypt and the Sudan in the 1880's. On May 16, 1885, N. Abcarius writes about a plot to assassinate the Mahdi of Sudan.           Abcarius who apparently has some connection  with the British is dispatching a man who plans to poison the Mahdi. The Mahdi died in June. Conflicting reports frequently give the cause of death as disease, but there are suggestions of poisoning. Abcarius also discusses disruptions"
Africa,"Africa. Papers. 18 of commerce by Sheik Saleh, and he states that an order from Buller (Sir Redvers Henry Buller) would be sufficient to quiet the sheik. A minor British official at Cairo (Mason to Arnfeldt, Jan. 17, 1889) complains that the last four years of British action in the Sudan lacked any     solid achievement. He argues that a few steamers could have held the whole length of the Nile River.  Two items pertain to the visit of George V of England to Port Said, Egypt, while he was travelling to India. Kiamil Pasha, a Turkish"
Africa,"Africa, Papers. 19 statesman (1832-1915) who was grandvizier on several occasions, describes the recepcion which the King accorded him on the Medina at Port Said (Dec. 11, 1911). In 1936 Sir Ronald Storrs, a British official in Cairo in 1911 and later Governor of Northern Rhodesia, comments on the     goodwill which was produced by the King's cour- tesy to Kiamil Pasha (clipping).  The small volume (38 pp.) has a statistical summary of various aspects of the economic life of the Cape Colony, South Africa, from 1781 to 1803. The authorship of this book is not"
Africa,"Africa, Papers. 20 apparent. Some pages contain a watermark of 1802. The content consists of statistical tables and short notes of explanation. Inlcuded in this material are statements of taxes, revenues, expenses, imports, the currency, private debt, the mode of granting land, official salaries,     names. of public officials, population, and commodity prices. The dates which are covered by the tables vary. Britain occupied this Dutch colony from 1795-1803.  An item transferred from uncatalogued"
Africa,"Africa, Papers, 21 material is a letter of Sept. 23, 1864, in which John William Colenso, Bishop of Natal, notes the uncertainty of his career. Colenso was in London where attempts were being made to remove him from his bishopric,  1 item added, 9-13-61. Arthur D. Cushing, a     British soldier, writes about fighting the Boers near Standerton and Greylingstad, Transvaal, on July 7 and 10, 1901. He reports that his force now practices looting wherever it goes. (Trans- ferred from uncatalogued items)."
Africa,"Africa, Papers 2a  l item added, 2-1-63: This item is an en- graving of two maps, both sketches of the courses of the Nile and Niger rivers, The engraving is dated, Feb., 1821, and was made for the Calcutta Journal. The maps differ on the course of the Nile, but the discrepancy is considerable for the Niger, which on one map is joined to the Nile.     1 item added, 9-27-63: On August 1, 1849, the Rev; T. Durant Philip, a missionary in Cape Colony, South Africa, for the London Mis-' sionary Society, writes to Joseph John Freeman (1794-1857), one of his superiors. Freeman, who became the society's home secretary in 1846,"
Africa,"Africa, Papers a3 visited churches at the Cape and Mauritius in 1849-1851, and this letter is addressed to him in care of the Reverend W. Thomson at Graham's Town, Philip requests the appointment of anoth- er missionary and explains why he prefers this arrangement to the appointment of an agent for temporal affairs. He describes his duties gen-     erally and suggests how they might be divided with an associate at the mission station. Philip's address is not indicated. In 1847 and 1856 he is listed, along with an assistant mis- sionary in 1856, at Hankey, a mission station in the Cape Colony; see London Missionary Society,"
Africa,"Africa, Papers 24 ... Annual Report ..., 53rd (London, 1847), pp. 93, 96-97, and 62nd (London, 1856), pp. 50- 2  l item transferred from the Negro Collection, 7-28-69: A picture of the Rev. Dr. Paulus Moort, rector of Trinity Episcopal Church in Monrovia, Liberia. Moort was the first African        to attend a general convocation of the Protes- tant Episcopal Church in the U. S. (1889).  l item added, 8-13-69: Typescript of an article by Cyril Sofer entitled ""South Africa."""
Africa,"Africa. Papers 25 It was submitted for inclusion in Edgar T.  Thompson and Everett C. Hughes, eds., Race: Individual and Collective Behavior (1958), but was not included in that publication. Aug. 5, 1969, it was given to the Perkins Library by Professor Thompson. sofer is a native of South Africa, but is now teaching in the Tavistock Institute in London,     On"
Africa News Service,"e 7th level cagee Africa News Service (Durham, NeCe Je The LeRoy Te Walker Africa News Archive, 1967-1995 and nede 396,000 items.  News service founded in Durham, NeCey 1973_— by Serer Te Walkere 3  Resource files of newspaper clippings, articles, press releases, reports, and other printed materials assembled by the Africa News Service, an organization devoted to archiving and distributing information on current events in Africae Sub,jects cover all aspects of middle to Late twentieth century African history, with an emphasis on f oreign and internal relations, po Litical movements, the rise and fall of governments, and  22 JAN 98 38247194 NDHYme SEE NEXT CRD"
Africa News Service,"e 7th level cagee Africa News Service (Durham, NeCe )e The LeRoy Te Walker Africa News cee (Card 2) economic trendse Other topics include cultural developments, health issues, women®s issues, education, military issues, and agriculturee There are extensive files on foreign relations with the UeSe Virtually all African countries are represented; the largest section pertains to South Africae *pJj Inventory available in repositorye  le Walker, LeRoy Te 2e Africa News Service (Durh am, NeCe )--Archivese Ge Women-—-Afr ‘+ icae 4e Africa-- Civilization-—- —-20th centurye 5e 22 JAN 98 38247194 NDHYme SEE NEXT CRD"
Africa News Service,"e  7th level cagee Africa News Service (Durham, NeCe Jeo  The LeRoy Te Walker Africa News cee (Card 3) Africa--History--20th centurye 66 Africa--Social conditions--1960- Je Africa--Economic condit ions—-1960- 8e Africa--Politics and  government-—1960-— Ge Africa-- Agriculturee 10. Africa-—--Foreign relationse 1le United States--Foreign relations--Africae 12¢ Africa--Social life and customse Ie Duke Universitye Librarye LeRoy Te Walker Africa News Archivee Ile Title IIIe Title: Africa  News Archivee  22 JAN 98 38247194 NDHYme"
African travel diary,"African travel diary, 1921-1926 (bulk 1921-1922). 1 item (106 pe )e Summary: Written apparently by an Englishwoman, oviaeril? tracing her  journey through the Great Rift Valley in Africae Entries begin on October 14, 1921 when she is at Livingstone,  near Victoria Falls, and conclude on July 12, 1922 at Kasanga;, Tanzaniae Described are the flora and fauna, campsites, travel arrangements, and her encounters with the nativese She comments upon the European communities she visits, some of them missionary settlements, the social Life and customs of th e settlements, and the schools for t he aoe se childrene Also includes a few pages entered 10 SEP 91 24349246 NDHYme SEE NEXT CRD"
African travel diary,"African travel diary, 1921-1926 (bulk  1921-1922). eee (Card 2) in 1926 including miscellaneous notes on other travels and mailing addresses of individualse  1. Africa--—Description and travele 2e Great Rift Valley (Africa)-— Description and travele 3e Women-—- Diariese 4e Genre: Diariese Se British--Africae 6e Missionaries-—— Africae Ie Title  10 SEP 91 24349246 NDHYme"
African-American photograph collection,"e Snd—662) (97-033) African-American photograph collection, cae 1890-1930 and nede 50 itemse Chiefly single portraits of African- American adults, with a few images of childrene Images document African-— American Life, particularly dress and hairstyles for various time periods in American historye Includes images of women, WWI soldiers, sports groups, and aonen® picturese One item is an album pas tone cane taken at Bluefield State os ege, Bluefield, West Virginiae The photographs in accession 97-033 were collected from various places in North Carolina and Virginia but the geographical identity of the photographed subjects may be from 22 JAN 98 38247718 NDHYme SEE NEXT CRD"
African-American photograph collection,"e 2nd—66%D (97-033) V4 Wer African-American photograph collection, VO cae 1890-1830 and nede eoe (Card 2) otaee states in the UeSe pJ  le Bluefield State College (Bluefield, WeVae )—--Historye 2e Afro-  Americans--Photographse 3e Afro- Americans--Social life and customse 4e Afro-Americans-——-Familiese 5e Afro- Americans--Educatione 6¢ World Wary 1914-1918--Afro-Americanse 7e Bluefield (We Vae)—--Historye 8 Genre: Photograph albumse Q9- Genre: Photographse  22 JAN 98 38247718 NDHYme"
"Agassiz, Jean Louis Rodolphe","Agassiz, Jean Louis Rodolphe Papers, 1836-1861 Cambridge, Mass.  Josiah C. Trent Collection in the History of Medicine--, Div.  4-8-60  2 items"
"Agassiz, Jean Louis Rodolphe","Agassiz, Jean Louis Rodolphe. Papers, 1856- 1861. Cambridge, Mass, 2 items. Sketch. Louis Agassiz, American naturalist and zoologist (1807-1873), writes in 1836 (in the period when he was doing superb research on fossil fishes) to fellow zoologist Dr. Kaup of Darmstadt. He refers to Dr. Kaup's book on     fossil fish teeth, to the Museum of the Natural History Society at Neufchatal, Switzerland, and to his own work on fossil fishes,  A letter from Cambridge, Mass., in 1861, to W. G. Abel, a musician, describes the curriculum of science, literature, and history in his"
"Agassiz, Jean Louis Rodolphe","Agassiz, Jean Louis Rodolphe 2 school for girle (aged 18 to 20 years). Agassiz comments generally on music and art in the &. 8."
"Agg, John","Agg, John Papers, 1797-1846 Washington, D.C, 14-6 1-30-71  209 items & 1 vol."
"Agg, John","Agg, John. Papers. Washington, D.C.     The John Agg collection was part of the Riggs family papers from Washington, D.C. Riggs  were taken from the family mansion on I Street in the early 1930's by Mary McMullen, who had inherited the contents of the house from Miss Jane Riggs (1853-1930), whose  companion Miss McMullen had been for many years. The John Agg Papers are a distinct set of , with no other connection to the McMullen Family Papers than that they man- aged to survive with the McMullens until they"
"Agg, John","Sea John a 2 sold their papers to the Perkins Library. Evidently George Washington Riggs and John Agg both lived in New York as young men. They were both prominent in the Whig Party in Washington, D.C. Their families were neighbors and friends; both groups were members of the Catholic Church. Hannah (Murray) Blackford,  the mother of Elizabeth (Blackford) Agg, left a legacy to the two oldest Riggs children, Alice and Kate. John Agg:gnd his wife died  shortly after 1846, when Mrs. Riggs “brought home"" a trunk containing Mrs. Agg's posses~—"
"Agg, John",", John 3 sions, personal correspondence, papers, and the P.T. Weaver portrait of Alexander Hamilton. This trunk is said to have remained in its original condition until about 1930.  John Agg was born in Evesham, England, where he was apprenticed in 1797 to his father, John Agg, a printer, stationer, and bookbinder. Hannah (Murray) and Edward Blackford of Birmingham, England, migrated to the United States about 1800, settling in Newark, New Jersey. John Agg went to London, where he became known as a poet, satirist, and novelist."
