Name,Text
"Sickles, Daniel Edgar
","kles, Daniel r 10 overconfident; he underestimated his adversary; he overestimated himself and his army.""  On Aug. 20, 1903 (p. 41) Sickles writes, ""En- closed in this letter you will find a copy of one from Lieut. Genggeral Longstreet of the Confederate Army, in which you will observe he gives me credit for our success in the battle     of Gettysburg.""  On Nov. 9, 1903 (p. 70) Sickles notes the hostility toward President Roosevelt by leading capitalists and adds, ""It is not at all improb- able that from this source the Treasury of Tamm-"
"Sickles, Daniel Edgar","Sickles, Daniel Edgar 11     any Hall found means to augment its unparalled resources in the recent canvass, ""  On Nov. 16, 1903 (p. 256) Sickles writes to Roosevelt, discussing his Panama policy.  On Nov. 17, 1903 (p. 72) Sickles discusses an incident of Feb. 22, 1861, pertaining to Pres  ident James Buchanan; former President John Tyley then Presigent of the Peace Congress; Joseph Hol Secretary of War; and a military parade ordered by Gen, Winfield Scott on George Washington's  Birthday."
"Sickles, Daniel Edgar","Sickles, Daniel Edgar 12     On Feb. 23, 1904 (p. 116) Sickles discusses  Russo-American relations. In 1854 Sickles was Sec. of the U. S. Legation in London; James Buchanan was U, 8S. Ambassador to Great Britain; and Sir George William Frederick Villiers was British Secretary for Foreign Affairs. Buchanan told Lord Clarendon that Russia was ""the only power in Europe that would treat the United States fairly and impartially in any contention with another European power."" Sickles says that Buchanan's remark remained true until recent  years, @"
"Sickles, Daniel Edgar","Sickles, Daniel Edgar 13  On Mar. 3, 1904 (p. 127) Sickles comments on Roosevelt's administration.  Sickles writes to Roosevelt about politics on Mar. 15, 1904 (p. 134).  On the 19th (p. 136) Sickles says that on the third day of Gettysburg Gen. W. 8. Hancock urged Gen. G. G. Meade to attack at once; and that Gen. E, P, Alexander, Longstreet's Chief of Artillery, told him ""that if such an attack had been made on Lee's right flank by our disposable force of 25,000 men, the rebellion would have     ended in an hour, "" @"
"Sickles, Daniel Edgar","Sickles, Daniel Edgar 14     Gen. O, O, Howard writes to Sickles on June 5, 1904 (p. 172) mentioning a train trip they had recently taken with Roosevelt, and the Presi- dent’. and Sickles' remarks about pensions for disabled veterans, with particular reference to the age of 62 set by Roosevelt in his Executive  Order No. 78.  Sickles replies, defending the Order as being good and consonant with similar orders of Cleveland and McKinley, except for different age  requirements."
"Sickles, Daniel Edgar","Sickles, Daniel Edgar  On June 6, 1904 (p. 160) Sickles writes to Roosevelt, discussing the Battle of Gettysburg, Confederate Gens. J. B. Gordon and Longstreet, and Union Gen, Grant, and requesting that Roose- velt send condolences to Longstreet's widow, as he had to the family of the late J. B. Gordon,     and also to subscribe to Mrs. Longstreet's mem- Oir of her husband,  On the 14th (p.'164) Sickles writes to Mrs. Longstreet, accepting her request that he write and introduction to: her forthcoming memoir, and"
"Sickles, Daniel Edgar","Sickles, Daniel Edgar 16  discussing his visit in 1892 to Ga. and“fene— street. This letter sheds light on North-South relations at this time and ouotes Longstreet's remarks about Sickles' role in the Battle of Gettysburg.  On June 16, 1904 (p. 178) Sickles writes to     Gen. O, 0. Howard, saying that Roosevelt has written a very graceful and kind letter to Mrs. Longstreet and has subscribed for a copy of her book. On the same day (p. 180) Sickles writes to the President about pensions and Mrs. Long-  street. |"
"Sickles, Daniel Edgar","Sickles, Daniel Edgar L7.     Although Sickles was a member of the N, Y, City Board of Alderman, his letters say little about his activities in thigsregard. On June 18, 1904 (p. 181) he writes to the President about the Board's meeting in reference to the las of the excursion steamboat General Slocum.  Sickles discusses his genealogy on July 26th (p. 215). His family name was originally Van Sic kle.     On Aug. 7, 1904 (p. 226) Sickles writes to Roosevelt advising him not to send the U. §S."
"Sickles, Daniel Edgar","Sickles, Daniel Edgar 18     Fleet to turkey as a ""big stick"" diplomacy move.  A letter of Aug. 11, 1904 (p. 228) throws light upon the effective work being done by Gen. Leonard Wood in the Philippine Islands. Sickles mentions Paul Morton, U. S. Secretary of the Navy.  On the 16th (p. 234) Sickles writes to Roosevelt about the anthracite coal strike; Gen. John Moulder Wilson, one of the strike commissio ners appointed by the President; and former Judge Alton B. Parker, Democratic presidential  candidate. ;"
"Sickles, Daniel Edgar","Sickles, Daniel Edgar 19  On the 18th August (p. 243) Sickles writes to Roosevelt, expressing his fondness for the so-called ""right to work"" (strikebreaking) prin- Ciple and for veterans' preferment for public employment. Bryanism he considers to be as much a factor in the 1904 presidential campaign as in     those of 1896 and 1900. Opines Sickles, ""Al- though Bryan is not a candidate, now, he was the controlling force at the St. Louis convention, and would control a democratic congress if one  were elected, """
"Sickles, Daniel Edgar","Sickles, Daniel Edgar 20  On the 19th August (p. 247) Sickles writes that his father, Geo. Garrett Sickles, contri- buted $1,000 toward buying arms and war munitions for Texas. He also mentions Gens. Samuel Hous- ton, Mirabeau Bonaparte Lamar, Memucan Hunt, and Santa Anna.     On the 30th August (p. 260) Sickles writes to Roosevelt, denouncing the statement of W. H, Taft, Gov. of the P. I., that the U. S,. intends to give up these Islands as soon as they are Capable of self-government."
"Sickles, Daniel Edgar","Sickles, Daniel Edgar 21  On Aug. 30, 1904 (p. 262) Roosevelt replies to Sickles! letter of Aug. 30.  On Sept. 27 (p. 272) Sickles discusses tics in N, Y. and in the U. S., deprecating r tical preferment for judges, and mentioning following New Yorkers: former Chief Justice     Parker of the Court of Appeals of N. Y.; former Gov. David Bennett Hill of N. Y.; Lt. Gov. Frank Wayland Higgins of N. Y.; and Justices Edward Montgomery Cullen, Wm. Jay Gaynor, and D-Cady Herrick, all of the Supreme Court of N. Y,"
"Sickles, Daniel Edgar","Sickles, Daniel Edgar  On Nov. 5 (p. 292) Sickles writes to Roose- velt about the latter's reply to A. B. Parker, Democratic nominee for the presidency.  On Nov. 11, 1904 (p. 293) Sickles congratub ates the President upon his re@lection and makes a@ prediction which is interesting in the light     of Bryan's defeat four years thence: ""The Demo- cratic party will revert to the radical tenden- cies of 1896 and 1900, and will go further than ever in that direction in 1908, ""  On the 16th November (p. 298) he again"
"Sickles, Daniel Edgar","Sickles, Daniel Edgar 23  writes to the President, suggesting that trusts and corporations contributed to the Parker cam- paign.  On Jan. 3, 1905 (p. 331) Sickles writes to the President, requesting political preferment for his son, Stanton Sickles.     On June 10 (p. 359) Sickles writes to Roose velt, congratulating him uponhis diplomatic handling of the Russo-Japanese War settlement.  On June 11 (p. 364) Sickles praises Btry. B First Regt.@N, Y. Art., for being the first unit to fire upon ""Stonewall"" Jackson's troops in the"
"Sickles, Daniel Edgar","Sickles, Daniel Edgar 24     Battle of Chancellorsville (1863). In the Battid of Gettysburg the same battery contributed greatly toward checking Longstreet's assault until reinforcements arrived,  On Sept. 1 (p. 367) Sickles contrasts the Gettysburg addresses of Abraham Lincoln and Ed-  ward Everett, to the enhancement of the former. On May 1 and 14, 1906 (pp. 383, 384)  Sickles writes to Elihu Root, recommending his  son, Stanton Sickles, for political preferment. On Oct. 13 (p. 395) Sickles writes to Chas."
"Sickles, Daniel Edgar
","diga ints 25 discussing fraud, William Randolph -, and the Democratic Party.  On Mar. 15, 1907 (p. 401) Sickles writes to William S. Jackson, Attorney Gen. of N. Y. ¢?3, stating his opinion of a proposed merger of the  Bell and Independent Telephone companies.  Sickles' letter of Mar. 19, 1907 (p. 404) is one of his finest. He defends Gen. G. B. Mc- Clellan's leadership of the Army of the Potomac in 1861-2, including the Peninsula Campaign (1862). He says that McClellan rather than Sheridan should have been the first president of  the Society of the “6 the Potomac. He pro-"
"Sickles, Daniel Edgar
","Si iel r 26 pronounces Gen. Lee's W. Va. campaign of 1861 a failure.  Sickles in his letter of Apr. 15, 1907 (p. 408) discusses a dilemma of his. He cannot do justice to McClellan's campaigns without attack- ing his (Sickles') lifelong friend, Edwin M. Stanton,     Gen. Joseph Hooker is defended by Sickles in vrious letters as he is in one dated Aug. 1, 1908 (p. 416).  Washington and Lincoln are contrasted by Sickles on Feb. 18, 1909 (p. 422)."
"Sickles, Daniel Edgar","Sickles, Daniel Edgar 27  Among the numerous things for which S;ckles Claims credit is the informal nomination of Grant for President in N, H. in Feb., 1868, some months before the Republican National Convention nominated him, See two letters of Aug. 20, 1909 (pp. 428, 429).     In a letter of Oct. 7, 1909 (p. 433) U. 8S. Minister to Spain Sickles writes of his negotia- tions with the Spanish Prime Minister in 1869 for the acquisition of Cuba for two hundred mil- lion dollars. He points out the attitude of"
"Sickles, Daniel Edgar","Sickles, Daniel Edgar 28  Hamilton Fish, Grant, and the rest of the cabin- et toward the negotiations,  On Nov. 1, 1909 (p: 435) Sickles further discusses Spanish-American relations referring to reparations for Spain's executing Americans without trial.     On Dec. 8 (p. 440) Sickles discusses U. §. relations with Nicaragua, Hawaii, and Cuba.  He writes on the 16th December (p. 442) to the Duke of Chartres, expressing profound regret upon the death of his daughter and recalling"
"Sickles, Daniel Edgar","Sickles, Daniel EKdgar 29  with pleasure the service of the Duke and his brother, the Count of Paris, with the Army of the Potomac in 1861-1862.  On the 28th December(p. 445) Sickles recalls his days as military governor of the ‘Carolinas (1866-1867). He asserts that he re-     ceived high praise from Gen. Grant; Govs. Jas. L. Orr and Andrew G. Magrath of S. C.; and Gov. Jonathan Worth of N, OC, :  On July 22, 1910 (p. 459) Gov. Charles E. Hughes of N, Y,. writes unofficially to Sickles,"
"Sickles, Daniel Edgar","Sickles, Daniel Edgar 30  inviting him to be the N, Y. representative in the Fiftieth Anniversary of the Battle of Gettys burg Commission. Sickles writes his acceptance on the 24th (p. 460). 471  On Aug. 24 (pp.470) Sickles writes to Jos. Pulitzer and Wm, R. HeaPst, Sr., urging them to     Support Wm. Sulzer for Gov. of N. Y.  On Nov. 11 (p. 482) Sickles praises James Buchanan very highly.  On Dec. 16 (p. 503) Sickles writes to Gen. G. A, Goodale about the Battle of Gettysburg,"
"Sickles, Daniel Edgar","Sickles, Daniel Edgar 31     Claiming that Gens. Grant and Sheridan had praised his (Sickles') tactics there.  On Apr. 20, 1912 (p. 528) Sickles writes that he prefers Hughes to Roosevelt or Taft for the Republican presidential nomination.  There are dozens of prominent peopls men-  tioned other than those already discussed in the sketch, but Sickles' comments on them are not considered significant enouzh for these people to be listed in the subject index."
"Sickles, Daniel Edgar
","Sickles, Daniel Fdgar 32     l item added, 5-5-61: Telegram of May 20, 1864, to Sickles from Capt. Alexander Mosely Pennock, U. S- Ne, Commander of the Naval Base at Cairo, Ill., saying that the urgent demands of the service required every gunboat at his disposal."
"Sickles, Daniel Edgar","L- 5713 Sickles, Daniel Edgar Letterpress Book, 1899 -1912 New York, N. Y. 530 pp. Cloth 31 x 25 cm. 3-20-58 |  GUIDE"
"Sidbury, James Buren","Sidbury, James Buren (1886-1967) Papers, 1915-1967 Wilmington, New Hanover Co., N. C.  13-A 64 items and 2 volumes  2-10-71"
"Sidbury, James Buren","Sidbury, James Buren (1886-1967). Papers. Wilmington, New Hanover Co., N.C.     James Buren Sidbury (1886-1967) was a pio- neer in the field of pediatrics. After gradua- ting from Trinity College, now Duke University, and Columbia University, he began practicing as a children's specialist in 1915 in Wilmington,  N. C., and in 1920 established The Babies’ Hospi tal at Wrightsville Sound. He was-a trustee of Duke University and endowed a professorship in pediatrics in its School of Medicine.  His collection consists of miscellaneous"
"Sidbury, James Buren","Sidbury, James Buren (1886-1967) 2 correspondence, reports, brochures, and clip- pings conceming The Babies' Hospital and its allied Research Center. Several letters from Mrs. Jessie Kenan Wise indicate that she was a generous supporter of Dr. Sidbury's projects for a number of years."
"Siddall, Joseph H.","Siddall, Joseph H, Papers, 1823-1826 Philadelphia, Pennsylvania Section A 4 items  12-8-76"
"Siddall, Joseph H.","Siddall, Joseph H. Papers. Philadelphia, Pennsylvania     Joseph H. Siddall is apparently the J. H. Siddall listed in the Philadelphia city direc- tories of 1825 and 1829 where he is described as a conveyancer and surveyor, respectively.  The collection consists of two letters of 1823 and 1826 from his father James Siddall, Sr., in Pittsburgh and also of two brief manu- scripts describing trips on the rivers between Pittsburgh and New Orleans. According to  remarks in"
"Siddall, Joseph H.","Siddall, Joseph H.     both letters, James Siddall worked in some capacity on river steamboats, perhaps as a clerk.  James Siddall's letters of Sept. 23, 1823, and Feb, 8, 1826, concern personal and family matters. A son William also worked on a steam-  boat, and there were relatives in England (1826), The first and fourth pages of the letter of  1823 bear a pencilled draft of a letter to an English uncle, apparently written by Joseph Siddall. The letter concerns family matters"
"Siddall, Joseph H.
","Siddall, Joseph H.     and contains a reference to their being emi- grants from England many years earlier.  Two unsigned  of two pages each are brief descriptions of trips from Pittsburgh to New Orleans (Dec., 1823, to Jan., 1824) and from New Orleans to Pittsburgh (Jan.-Feb.,  1824). The latter manuscript begins with a few sentences about Mr. Lacroix's plantation below New Orleans. The writer was apparently James Siddall. The handwriting is not as even as in his letters, but the formation of many letters is the same,"
"Sidney, Henry Marlow","Sidney, Henry Marlow Papers, 1885  Brighton, Sussex, England  hijiee Of I6°B 1 volume  9-5-69 Part of the William B. Hamilton Collection"
"Sidney, Henry Marlow","Sidney, Henry Marlow. Papers. Brighton, Sussex, England     Henry Marlow Sidney (d. 1897), British army officer, served with the 2nd Duke of Cornwall's Light Infantry. He participated in the Sudan expeditions of 1884-1885 and 1896-1898, In August, 1897, he was killed in the battle at  Abu Hamed. At that time he was a captain (temporary major). Sidney was noted in Winston S. Churchill's The River War, An Historical Account of the Keconquest.of the Soudan"
"Sidney, Henry Marlow","Sidney, Henry Marlow 2 (London, 1699), 1, 196, 332. Biographical information may also be found in Philip Sidney, Abou-Hamed: Being Some Account of the Battle . 5 With a Memoir of Major Sidney (London, 1901).  Sidney's diary dates from January 1 to July 15, 1885. The entries are brief references to his activities and to the movements of the troops with whom he was serving. He was not involved in major engagements. On January 1 the river force was moving southward on the Nile"
"Sidney, Henry Marlow","Sidney, Henry Marlow 3 River between Dongola and Debbeh in the Sudan. It continued as far as Hebba near Berber where the mission was to punish the tribe that had killed Colonel John Stewart, General Gordon's second in command. Operations were suspended for the remainder of the hot season, and the troops returned northward at the end of     February. Sidney visited the site of Stewart's death and reported the finding of some of his papers, cards, and diary (Feb. 20-21).  Sidney became ill, went to Cairo, and"
"Sidney, Henry Marlow","Sidney, Henry Marlow 4 returned to England. During June and July he was in Brighton and in London where he attended concerts, art exhibitions, and the theater."
Sidney Knitting Mills,"Sidney Knitting Mills, Inc. Papers, 1944-1948 Graham, Alamance County, North Carolina  L2 Vols.  SEE SHELF List  4-26-66"
Sidney Knitting Mills,"Sidney Knitting Mills, Inc. Papers, 1944-1948. Graham, Alamance County, North Carolina.     Sidney Knitting Mills, Inc., manufacturers of ladies' full-fashioned silk hosiery, was a subsidiary of May McEwen Kaiser, a ladies’ hosiery manufacturer in Burlington. Sidney Mills was incorporated on Dec. 22, 1944, accord-  ing to the Biennial Reports of the Secretary of State of North Carolina, T942-1948, p. 141. In late 1948 Sidney Mills and May McEwen Kaiser were absorbed by Burlington Industries. A  collection of account books from May McEwen Kaiser is in the “se Department."
Sidney Knitting Mills,"Sidney Knitting Mills, Inc. 2     A collection of account books records the operations of Sidney Mills from its incorpor- ation in late 1944 to its absorption by Burl- ington Industries in 1948. The ledger, journals cash receipts journal, trial balances, voucher registers, and payroll summaries cover the four years, 1945-1948. There are also some check-  books, 1944-1946, and a sales journal of invoices for sales to May McEwen Kaiser, 1945- 1946.  General Accounts     Ledger, 1944-1948;"
Sidney Knitting Mills,"Sidney Knitting Mills, Inc. Journal, 1945,Feb. 1 = Oct. 2, 1948; Journal, 1948, Oct. 2-Dec. 24;     Cash Receipts Journal, 1944, Dec.-Dec., 1948; Trial Balances, 1945, Jan. 31-Dec. 31, 1948; Checkbook, 1944, Dec.-Feb., 1945;  Check dook, 1945, Jan.-Sept.;3  Checkbook, 1945, Oct.-May, 1946; Checkbook, 1946, May-June;"
Sidney Knitting Mills,"Sidney Knitting Mills, Inc.     Purchase and Receiving Records     Voucher Register, 1944, Dec.-Nov., 1947; Voucher Register, 1947, Nov.-Dec., 1948 (In same volume as Payroll Summaries, 1945-1948);  Production Records     Payroll Summaries, 1945, Jan.-Dec., 1948;  Sales Records     (Invoices from sales to May McEwen Kaiser).  Sales Journal, 1945, vr) 27-Sept. 20, 1946"
"Siebold, Eduard Caspar Jakob von","Siebold, Eduard Caspar Jakob von Papers, 1840 Goettingen, Germany  Josiah C. Trent Collection in the 1 item History of Medicine--MS. Div.  4-8-60"
"Siebold, Eduard Caspar Jakob von","Siebold, Eduard Caspar Jakob von. Papers, 1840. Goettingen, Germany     Memoir on an unnamed parasite."
"Siegling, John Jr.","SIEGLING, John Jr, Letters, 1845-1846 Charleston, S.C.  ‘Section A  FEB 19 194"
"Siegling, John Jr.","SIEGLING, Joan, Jr. Letters. 1845-1846, Charleston, South Carolina, Sketch. 3 pieces,     These three letters are those of John Siegliy Jr.,a student at Harvard Law School, to his parents in Charleston, South Carolina.  The letters describe university activities and Boston social life of the 1830's. They also mention problems of the day,such as the Oregon question and possible war with England.  In a letter dated April 6,1846,1s mention and comment on the Tirrell murder case in which Rufus Choate won 29 aq@ittal with one of his  Sreatest defenses, ez"
"Siegling, John Jr.",". Siegling, John Jr. Sketch __ (2) Siegling evidently had traveled in Europe. He was from a socially @fominent Charleston family. John Siegling, Sr. was a music publish er and seller in Charleston,"
"Siegling, Rudolph","Siegling, Rudolph  See Simons, James, Jr.; Siegling, Rudolph; and Cappelmann, John D."
"Siegerest, Henry",+ > o
"Siegerest, Henry","nse . TT olagerist, Henry. Introduction.           tebook by Dr. Sigerist on Arnoldus  (d. 1313), who p i the earliest It contains the introduction by published volume of Arnoldus de"
"Sigler, William","Sigler, Williame  Papers, 1825-1855.  cae 1300 itemse  Resident of Mount Jackson, Vae  Personal correspondence, business papers, and receipts relating to William Siglerse Some correspondence concerns local politics and economic conditionse Sigler sometimes corresponded with prominent merchants in Baltimore, Mde  Unprocessed collectione Cataloged from accession recorde  *pJ  26 JUL 95 32878782 NDHYme SEE NEXT CRD"
"Sigler, William","Sigler, Williame Papers, eee (Card 2)  ie Business records--Virginiae 2e Mer chants--Correspondencee Be Virginia--Politics and governmente 4s Virginia--Economic conditionse 5 e Virginia--—Commercee 6c¢ Mte Jackson (Vae )—--Historye 7e Baltimore (Mde )——  Commercee ®  26 JUL 95 32878782 NDHYme"
Sigma Upsilon,Sigma Upsilon  See Duke University Archives  STUENT ORGANIZATIONS REF EQ eCEe  CoLLecT\ Ou
Sigma Upsilon,"Sigma Upsilon Papers, 1913-1917  Durham, Durham Co., N. C,  Section 12  11-30-53  GUIDE"
Sigma Upsilon,"Sigma Upsilon. Papers, 1913-1917. Durham, N.C, 21 items. Sketch.     Sigma Upsilon was a literary fraternity for men. The papers in this collection in- clude sets of resolutions, minutes of meetings of the chapter at Trinity College, which was  Called the Fortnightly Club, minutes of the eighth convention that met in 1915, and let- ters from officers of the fraternity in var- ious other colleges to officers of the Trinity College chapter."
Sigma Xi,"Sigma Xi, The Scientific Research Society. Records, 19607-1980? 100,000 items (175 lin. ft.)  Shelf Location: DOSS 4’A-4/O Restricted  Contains national headquarter records including Executive Board minutes, correspondence, financial  papers, handbooks, manuals of procedure, and printed materials, as well as materials pertaining to its executive directors, annual meetings, applications for grants-in-aid research projects, and sponsorship of national lecturers panels.  (continued on next card)"
Sigma Xi,"Sigma Xi, The Scientific Research Society. (card 2)  Deposit: 2/23/90 Accessioned: 3/1/90 Acc. No.: 90-030"
"Sigman, Martin","Sigman, Martin  Ledger, 1852-1855  Wadesboro, Anson County, N.C. 497 pp. Leather & Boards 8-5-58  Recataloged, 9-14-66"
"Sigman, Martin","Sigman, Martin. Ledger, 1852-1855. Wadesboro, Anson County, North Carolina  The extensive accounts in this ledger indi- cate that Martin Sigman operated an inn, tavern, livery stable, and freight hauling business. He apparently owned slaves, for there are numerous entries for their hiring.  Sigman's name and initials appear on the     inside and outside of the front cover, but  the spelling of the last name is not clear. Identification is provided by tracing Sigman's account for Arnold and Cooley (p. 167),"
"Sigman, Martin","Sigman, Martin 2 merchants at Wadesboro, whose Ledger, 1554- 1855, is also in the Manuscript Department. Sigman recorded (p. 167) the settlement of Arnold and Cooley's account on Jan. 31, 1855, for $31.75, and the same transaction appears in their ledger (p. 537) in an account for Martin Sigman."
"Sigourney, Lydia Howard","Reten  Sigourney, Lydia Howard (Huntley) Papers, 1851 Hartford, Hartford Co., Conn. section A 1 item  1-10-58 ATTN  SaTERE VULU"
"Sigourney, Lydia Howard","Sigourney, Lydia Howard (Huntley) “Papers, 1851. Hartford, Hartford Co., Conn. 1 item. Sketch.  A statement by Mrs. Sigourney (1791-1865), relative to the death of her son Andrew, who had died several months earlier of consumption. It is possible that this item is the last part of a letter."
"Siitonen, Harry A","e 2nd 66:1 (96-015)  Siitoneny, ort Ae  Papers cae 1952-1976 Je  Cae Shot itemse  oe is of the Los Angeles and San Francisco Locals of the Socialist Party-USA during the 1950s-1970s, and active in the national Social Party-USA committee after its reconstitution in the 1970se  Materials relating to Siitonen's involvement in the Socialist Party -USA include incoming and outgoing correspondence; internal memos; meeting minutes; resolutions; position papers$ constitutions; and other records of party activit ies both at local, state, and na @ticnet levelse Includes some  printed material such 25 SEP 97 3768 7426 NDHYme SEE NEXT CRD"
"Siitonen, Harry A.","e 2nd 66:1 (96-015) Siitonen, Harry Ae Papers, cece (Card 2) as bulletins, newsletters and reriodicalse Unprocessed collectione Cataloged from accession recorde  *pJj  1e Socialist Party (Ue Se )-—-Historye 2e Socialist Party (Ue Se )--Californiae 3e Socialists-—-United States-- Correspondencee 4c¢e Socialism—--United States--Historye Se Radicaliss—--United Statese 6+ Political activists--United States--Correspondencee 7-e California --Politics and government.  25 SEP 97 37687426 NDHYme"
"Sikes, John","Sikes, John Papers, 181'7-1893 Bladen County, N. C.  Section A  1-11-58  GUIDE"
"Sikes, John","Sikes, John. Papers, 1817-1893. Bladen Co., N, ©, 25 items. Sketch,     Personal and business letters pertaining to John Sikes and others. Subjects include personal and business affairs, commodity pri- ces in Tennessee in 1839, slave sales in North Carolina in 1840 and 1843, and politics in  North Carolina.  College life and studies are discussea in an 1859 letter by James Hugh Malloy (d. 1862) of Lumber Bridge, N. C., Class of 1863, David- son College, and later member of the 24th Regt, of North Carolina, @"
"Siler, Albert","Siler, Albert Letters, 1816-1875  Franklin, Macon County, Morth Carolina  Cab. 45 67 piecés  JUL 2 194. "" added"
