Name,Text
"Harris, Thomas","Harris, Thomas Papers, 1834-1848 Philadelphia, Pennsylvania. 3 items. Sketch. Thomas Harris (1784-1861), American naval surgeon, physician and lecturer, staff member  of the Pennsylvania Hospital, writes to Commodore Jacob Jones, saying he had ""undertaken! to secure the cessation of the U. S. Naval Asylum property to the U. S. In 1848 Harris writes from the Navy Dept. Bureau of Medicine and Surgery on business accounts. See W. P. GC. Barton Papers."
"Harris, Thomas W","xe Harris, Thomas W,  Papers, 1800(1833-1860) 1887  Halifax co., N.C, Cab, 96 204 items  NOV 27 '50"
"Harris, Thomas W","Harris, Thomas W, Papers, 1800(18335-1860) 1887. Halifax co., N.C. Sketch. 204 itens     Bills; receipts, some of which are for cot ton, tobacco, and wheat sold by commission merchants, largely of Petersburg, Va.; and promissory notes,"
Harris Chair Company,"F~1771  Harris Chair Company Papers, 1908-1912 Millboro, Randolph County, North Carolina  10-9-68 1 vol."
Harris Chair Company,"Harris Chair Company. Papers. Millboro, Randolph County, N. C.     In 1908 the Harris Chair Company had an authorized capital stock of $50,000, of which $6,000 had been issued. TT. D. Harris was the agent in charge. This information appears in North Carolina, Secretary of State, Report  (1906-1908), p. 183.  The company's operations are recorded in its Journal, April, 1908-February, 1912. The name and location of the firm do not appear in the volume, and its identity was determined by"
Harris Chair Company,"Harris Chair Company  correlating entries in it for the Worth Manu- facturing Company with their counterparts in the Cashbook, 1901-1909, of Worth's Mill No. l. In the latter volume the entries were made for the ""Harris Chair Co."" TT. D. Harris's name appears often in the Journal,"
"Harrison, Benjamin","Harrison, Benjamin (17267-1791)  Letters. 1780-1785.  Charles City County, Virginia  Section A 2 pieces  CUIDNEF 2 items added -- OCT 10 1939 SUIDE thik ces l item added  5-10-58 eo"
"Harrison, Benjamin","HARRISON, Benjamin. Letters. 1780-1785, Char- les City County, Virginia. 5: pieces. Sketch     Benjamin Harrison(1726?-1791) wasborn in Charles City Co., Va., was a member of the Va. House of Burgesses, a signer of the Declaration of Independence, was active in the Revolution and in Congress, was an adviser of Washington,  and governor of Va., 1781-1784. The two letters relate to importation of salt, and the commis- sion in 1785 to regulate navigation of the Po-  tomac,"
"Harrison, Benjamin","Harrison, Benjamin. oe 2 items added 19-28-52. These are two typed copies of the will of Benjamin Harri-  son. 1 item added 5-10-58: (Transf. from the  Misc. File): .Land Grant to Robert Cunningham, 1782, signed by Harrison as Governor of Virgini"
"Harrison, Benjamin","Harrison, Benjamin (1833-1901) Papers, 1888 -1889 Indianapolis, Marion Co., Ind.  Section A 1 item  8-28-57 1 item added, 7-23-62  1 item added, 4-29-71  GUIDE"
"Harrison, Benjamin","Harrison, Benjamin. Papers, 1888-1889. Indi- anapolis, Ind.     This collection consists of one letter by ~ Benjamin Harrison to Capt. Charles Emory of a"" Carthage, Jasper Co., Mo., relative to his unit in the Civil War, the 70th Regt.of In- diana Infantry. This item was originally a  part of the Don Preston Peters Collection. 1 item added, 7-23-62; Harrison's inaug- ural address as President.  1 item added, 4-29-71: A printed souvenir"
"Harrison, Benjamin","Harrison, Benjamin 2 distributed at the ball held in conjunction with Harrison's inauguration on March 4, 1889."
"Harrison, Benjamin","An index to the  of The Papers  of Benjamin Harrison is located in the Docu- ments Department, call number LC 4.7  H 44/2 ."
"Harrison, Syrnen- Patton","Harrison, Syrnen- Patton Papers, 1928 Gulfport, Harrison Co., Miss.  Section A 4 items"
"Harrison, Byron Patton","Harrison, Byron Patton. Papers. Gulfport, Harrison Co., Miss.     Byron Patton (Pat) Harrison (1881-1941), the son of Robert and Myra Anna (Patton) Harrison, was born in Copiah County, Mississippi. Ad- mitted to the Mississippi bar in 1902, he was elected district attorney in 1906 and congress-  man in 1910. In 1918, with the endorsement of  President Woodrow Wilson, Harrison defeated the incumbent James K. Vardaman for the Democratic nomination to the U.S. Senate, where he served"
"Harrison, Byron Patton","Harrison, Byron Patton     until his death in June 1941.  During the 1920's Harrison became a leader in Democratic national party affairs. He campaign- ed for Alfred E. Smith in 1928 and was a power- ful supporter in the Senate for much New Deal legislation during the 1930's. In January, 1941 he was elected president pro tempore of the  Senate. The four items in this collection consist of  correspondence between Harrison and C.H. Thompson of Jackson, Mississippi, on two"
"Harrison, Byron Patton","Harrison, Byron Patton 3 subjects: a loan made to Harrison and the 1928 presidential election. Thompson indicates that Mississippi Democrats, especially women, are not supporting Smith because of his stance on Pro- hibition and suggests that a woman such as Mrs. Franklin Roosevelt be sent to Mississippi to speak in favor of Smith. Harrison expresses appreciation for Thompson's suggestions."
"Harrison, Charles L.","Harrison, Charles L. Papers. 1834-1845. Jackson County, Téxas  Section A 7 pieces NOV5 1933  NOV 20 1934 S&S"
"Harrison, Charles L.","Harrison, Charles L.  1834-1845 Jackson Co., Texas  Titles and deeds to Texas lands."
"Harrison, Edwin","HARRISON, Edwin Letters and Papers 1788-1928 St. Louis, Missouri 495 items, total.  Ney Cab. 52. os"
"Harrison, Edwin","Sketch 1888-1928  HARRISON, Edwin Letters and Papers St, Louis, Missouri some undated material  Several of the very earliestletters and papers in this collection are those of Edwin Harrison's father, James, who was born in Bourbon Co., Kentucky, in Oct, 1803 In 1822, he moved to Fayette, Mo., where he began a business career, later destined “to develop into one of the most outstantiag in Missouri. 4e did some trading with “ew  Orleans by flat boats, and began trade  = GUIDE"
"Harrison, Edwin","Harrison, Edwin Sketch (2) with Chihuaha, Mexico, under a partnership  with James Glasgow.  In 1840 he moved to St.Louis, shortly after which time he became-a partner in the firm of Chauteau, Harrison and Valle'. He undertook mining in the Iron Mountain, in     St. Francois County, Mo., a project which proved to be very successful. He was president of the Iron Mountain Co.; became interested in railroads, and was the origi-  ’ t ; ’ ~~ e dake WSLS te"
"Harrison, Edwin","Harrison, Eqwin Sketch (3) nator of the Iron Mt, Railroad.  Edwin Harrison (1836-19047) was born in Washington, Hempstead Co, Arkansas. He was educated at St. Genieve,Mo,, in a Frenth school, at the Jesuit College of Notre Dame de la Paix, Namur, Belgium, and in the Law- rencé.@cientific School of Havard University.     Here he studied under Agassiz and developed a great admiration for him. One of Harri- son's Glagpsmates was Fredric Ward Putnam,  who in later years was a famed archeologist"
"Harrison, Edwin","Harrison, Edwin Sketch (4)  and curator of the Boston Society of Natur- al History, ete, EHncluded are many of Put- nam's letters, to Harrison, often mention- ing Agassiz.  Having settled in St, Louis, Edwinmar- ried Laura E. Sterne from which union two children were born. He followed the busi- nesses established by his father in the com pany_of Chouteau, Harrison and Valle’; and was President of the Iron Mountain Co. & Rod  ling Mills, He was engaged in one of the"
"Harrison, Edwin","Harrison, Edwin Sketch (6) gave profusely of his money to numerous worthy causes.  In 1884 he suffered a financial revers¢ but made a come-back in 1897 with the United Lead Company of which he was President,  Edwin Harrison was an @arly member of the American Association for the Advance-     ment of Science; interested and activ ely engaged in the St. Louis, Me. atd Mo, His. torical Society; chairman of the General  wre} 4 weld,"
"Harrison, Edwin","rigon win Sketch (5 first natural gas condenser companies, and the Chester Railroad. He was President of the Board of Directors of St. bukes Hos- pital in St. Louis, having heavily endowed it; President of the Board of Trustees of Washington University to which he gave a great deal of mongy. He was one of the originators of the Manual Training School in 8,. Louis.  tte was an extremely socially minded  man, according to this collection, and"
"Harrison, Edwin","rison win Sketch (7) World's Fair Committee at St. Houis in 1902; a member of the ""Old Company A""; the Epis- copal Church and the Democratic Party.  The collection in the main consists of his business letters; some letters from personal friends; copies of poems; a few     financial statements; material concerning the Missouri Historical Society, Washington University and the American Association for the Advancement of Science."
"Harrison, Edwin","Harrison, Edwin Sketc 8  Among his correspondents are: Bent, Silas (1 letter) 072 “Bland, Richard P, (2 letters) Bryan, William engt s (2 letters) Cockrell, Francis mt letter)     Cupples, Sam@u (1-letter) Flad, Henry (1 letter)  Francis, David R, (1 letter) Harris, William T, (1 letter) Hitchcock, Henry (1 letter)"
"Harrison, Edwin","ison, Edwin ketch (9) ves, Halsey © 4 letter        Lieber, Guido N, $1 letter) Morse, Edward S. ‘1. letter) Nipher, Francis E \} letter) Noble, John W. (1 letter) O'Neil, John J. (1 caged Putnam, Fredric W. (1 letter) ‘Sherman, John ( 1 = Shields, George H. (2letters)"
"Harrison, Edwin","Harrison, Eawin. Sketch (10) Simpson, James “, (1 letter)  Wells, Erastus (1 letter) Whelpley, Henry M. (1 letter) Moodward, Galvin M; (7 letters) Among James Harrison's correspondents there are: Chouteau, Pierre (2 letters) Elkins, Stephen ¢B. (1 letter) _Pisk, James Jr. (2 letter)"
"Harrison, Edwin","Harrison, Edwin Sketch (11)        Note: A biographical sketch of both James and Edwin rrison may be found in  ae of Saint Bouis City and County by J. Thomas Scharf from which text some of  this material has been taken,"
"Harrison, George B.","Harrison, George B. Papers, 1821-1924  Boyce, Clarke Co., Va.  ee . 13,419 items &  79 vols."
"Harrison, George B.","Harrison, George B. .Papers, 1821-1924. Boyce, Va. 13,419 items & -79 vols. Sketch. pile This collection consists of the letters and other papers of George B. Harrison of Boyde; Clarke County, Virginia. Related to the prom- inent Harrison family of that state, as well as Nathaniel Burwell of ""Carter Hall)"" he attended Hampden-Sydney College before studying law at     the University of Virginia (B.L., 1872).  His sisters and brothers were Maria, Agnes, and Henry, all of whom corresponded with one another. Henry writes George g?3, December 27, 1865, a descriptive letter abolit the devastation"
"Harrison, George B.","rrison, George B. 2  and apathy in Clarke County resulting from the Civil War. Maria's letters to her brothers de- scribe social events attendaédé by upper class young people. She points out to Henry, Novem- ber 8, 1867, that croquet is becoming very pop- lar with her friends. Henry, a restless young man, took part in a filibustering expedition against Spanish Cuba in 1869-1870. Over a dozen letters relating to raising men for the expedi- tion are in this collection. Later, after doing poorly in the Lumber and sawmill business in  est Virginia, Henry moved to Florida and in the"
"Harrison, George B.","Harrison, George B. 3 late 1880's wrote many letters to George about farming and the price of land there. In the 1890's, Henry spent much time in Washington, D.C., representing the city of Canaveral, Flo- rida, which had petitioned the government to build a sea wall to protect ships from storms. Among the miscellaneous papers are three copies     of a pamphlet for a ""National Harbor Refuge"" at Canaveral. Representative Charles M. Cooper of Florida discusses this matter with Henry in a  letter dated February 22, 1896. _ George B. Harrison practiced law in Richmond"
"Harrison, George B.","Harrison, George B. 4 during the 1870's and 1880's, first as a part- ner with George H. Burwell and later with William M. Turpin. By 1890 Harrison had given up his practice in Richmond and had opened a law office in Boyce, Clarke County. Displaying an interest in civic matterg, he was treasurer of the city council,active in church work, pres-     ident of the Boyce State Bank, and wrote the  chapter on Boyce in Thomas D. Gold's Histor  of Clarke County. (Berryville, Va.,1914), 46-7).  The collection includes some family genealogy,"
"Harrison, George B.","Harrison, George B. 5     (see especially letter of Oct. 22, 1906), broadsides advertising the price of wheat and corn in Baltimore in the 1880's; a letter written by President Thomas R. Dew of William and Mary tin 1846; a statement (Dec. 13, 1878) to the subcommittee of the Finance Committee of the House of Delegates on the arrearages due the school fund by W.H. Ruffner, Supt. of Public Instruction, Richmond, Vag.; and four letters written by Harry F. Byrd of Winches- ter, Va., in 1912 and 1913. There is also an unidentified letter written from Missouri in"
"Harrison, George B.","Harrison, George B. 6 the 1850's telling of rich farm land at reason- able prices along the Missouri River. Three large volumes entitled ""Jefferson Itsurance Co! were used by the Harrison family as daybooks. In a legal document described as ""F.H. McGuire and wife vs. Bank of Virginia,"" ca. 1869, there     is mention of General Andrew W. Pickens' rela- tions with his wife's family.  On the whole, the greater part of the Hary rison material appears to be worthless, con- sisting merely of cancelled checks, bills and receipts, legal papers of no value, newspaper"
"Harrison, George B.","Harrison, George B. Clippings, and advertisements.     7  Harrison hin- self apparently had no strong interest in politics and current events."
"Harrison, George B.","Harrison, George B, Ledger, 1873-1875 Boyce, Clarke County, Va. 74pp. Boards 38 x 154 cm, 4-12-61"
"Harrison, George B.","Harrison, George B,     Jefferson Insurance Company Daybook, 1860-1869 Albemarle County, Va. [?]  Harrison, George B. Daybook, 1887-1910  Boyce, Clarke County, Va.  864 pp. Calf & Boards  4-22-61  Os x 276 cm."
"Harrison, George B.","Harrison, George B.     Jefferson Insurance Company F- 6455 Daybook, 1860-1869 Albemarle County, Va. [?]  Harrison, George B. Ledger, 1887-1916  Boyce, Clarke County, Va.  261 pp. Calf & Boards 39s x 30 cm.  422-61"
"Harrison, George B.","Harrison, George B.     Jefferson Insurance Company Daybook, 1860-1869 Albemarle County, Va. [?]  Harrison, George B, Daybook, 1901-1915 Boyce, Clarke County, Va.  960pp. Calf & Roards 355 x 225 em. (The second part of this volume is a legal daybook, )  4-20-61 4"
"Harrison, George B.","Harrison, George Paul Letters 1863 - 1889 Savannah, Georgia  Section A 2 pieces JUL 16 1940"
"Harrison, George B.","HARRISON, George Paul Letters 1863 - 1889 Savannah, Georgia. 2 pieces Sketch     The elder George Paul Harrison lived on Monteith plantation near Savannah. He served in the Georgia legislature and was a brigadier general in the Confederate army. The son was educated in Georgia and attained the same milita  ry rank, After the war he practised law in Ala. and werved in the Ala. senate and two constitu-  tional conventions,"
"Harrison, Henry","Harrison, Henry Letters 1842 - 1860 Berkely County, Virginia  Section A 16 pieces JUN 16 1941"
"Harrison, Henry","Harrison, Henrye  Papers, 1842-1860.  16 itemse  Slave owner of Berkeley Coe, WeVae  Collection contains letters chiefly concerning the settlement of Harrison's estate, including the sale of furniture and slaves; on African-American was to be freed and sent to Liberiae  Cataloged from Guidee  *lcs  ile Harrison, Henrye 2e Decedents!® estatese Ge Freedmen--Liberiae 4. Slavery—West Virginiae 5e Afro- Americans-~-Colonization-—Liberiae 66 Berkeley County (We Vae )—-Historye  02 JUL 98 39390460 NDHYme"
"Harrison, Henry","HARRISON, Henry. Letters. 1842 - 1860 Berkeley County, Virginia. 16 pieces Sketch     This collection is concerned chiefly with the settlement of the Harrison estate. There are some list of furniture and other goods with the prices for each article. ‘There are also other items discussing various questions involved in the sale of various items. Among other things mentioned is the sale of the family slaves and the arrangement for one Negro woman to be freed and sent to Liberia. Other letters comment on family matters. Mrs. Mary W. | fe) died - 1852. A lette “4 in 1828 mentees  the use of chlorof- @:= in the extraction  of a tooth."
"Harrison, Henry Sydnor","Harrison, Henry Sydnor  Papers, 1894-1958 New York, N. Y.  5 items  1157 items & 1 vol. added, 1-15-70  2-6  VEE OFELF LIST  4-16-59"
"Harrison, Henry Sydnor","Harrison, Henry Sydnor. Papers, 1907-1916. New York, N. Y. 5 items. Sketch.  Henry Sydnor Harrison (LOS0-1900) was a news-— paperman and novelist whose life was centered in New York and Richmond. His early work on the  Richmond Times-Dispatch was done in the period when he sent his ert story, ""Rhoda Gaines, M.     A.,"" to The Smart Set in 1907, Arthur Grissom, one of the original editors of this periodical, writes Harrison two letters in 1907 about the story. He states that 0. Henry made a favorable comment on Harrison's work.  In 1916 H, L. Mencken writes two letters to"
"Harrison, Henry Sydnor","Harrison, Henry Sydnor 2 Harrison as one of America’s popular and more conservative novelists. Mencken was enlisting support for the Dreiser Protest, an appeal again st the suppression of Theodore Dreiser's The Genius. Harrison had not and did not sigh the protest. Mencken gives his views on an ""exact-     ing and arbitrary censorship""with no respect for artistic value and purpose. His estimate of Dreiser, whom he knew well, reveals the novelist as an honest artist and man,  In his second letter Mencken writes of two diametrically opposite theories of life around"
"Harrison, Henry Sydnor","Harrison, Henry Sydnor 3 which ali the aatates of the world revolve, He  explains his own philosophy and analyzes Dreiser briefly from this viewpoint. He states that the Dreiser persecution was started by a ""profess- 4onal moralist,"" Anthony Yomstock (1844-1915), the founder of the Society for the Suppression  of Vice and author of the Comstock Law (1873). Mencken sees the protest as a notice by the authors of the U. 8. thas they are united again- st ""the common enemy.""  See Frank Durham, ""Mencken as Missionary, "" in American Literature, Jam. 1958, a copy of"
"Harrison, Henry Sydnor","Harrison, Henry Sydnor which has been placed with this collection.  1157 items and 1 vol. added, 1-15-70: Correspondence, numerous clippings, and miscel- laneous papers relating principally to Harrison's literary career. Many of the letters were written to him by appreciative readers of Queed,     published in 1911, and V. V.'s Eyes, published in 1913. There are also a few letters concern- ing his efforts to secure a position involved with relief work in Europe during World War I."
"Harrison, Henry Sydnor","Harrison, Henry Sydnor Several other letters were written to John Stewart Bryan after Harrison's death.  Of particular interest are the letters and poems of James Branch Cabell. Cabell was for a time romantically involved with Harrison's sister. In a long letter written probably on August 7, 1901, he discussed their love affair     and included a poem and a scenario portraying the relationship. Among the miscellaneous papers is an undated manuscript of his poem, ""A Rondel to My Mistress."""
"Harrison, Henry Sydnor","Harrison, Henry Sydnor 6  An article by Harrison in The Atlantic Month- ly in 1914 occasioned letters from sympathetic readers who joined the author in criticizing the work of the editors and readers employed by the publishing houses to evaluate the merits of  submitted for publication.  The many clippings included in the collection fall mainly into two categories: poetry and book reviews. Those dated from 1905-to 1908 are poems written by Harrison for his column, ""Rhymes for To-Day,"" which appeared in the"
"Harrison, Henry Sydnor","Harrison, Henry Sydnor 7 Richmond Times-Dispatch. A large group of un- dated clippings consists of similar items. A section from the literary pages of The Sun, a New York newspaper, dated April 15, 1916, con- tains an evaluation by Ellen Glasgow of the current state of American fiction and responses to her remarks by Harrison and a number of        other leading literary figures of that period. This large item has been placed in a picture cabinet. The remainder of the clippings is comprised primarily of book reviews which"
"Harrison, Henry Sydnor","Harrison, Henry Sydnor 8 appeared in newspapers and magazines. For the most part, they praise Harrison's work. There are also several obituary notices which appeared at his death. The volume found among these papers is a scrapbook containing reviews of The Good Hope which was published posthumously in 1931.     Among the miscellaneous papers is a typed copy of an address delivered by Harrison to the Fortnightly Club. It is entitled ""Some Aspects of Humor and Pathos"" and was probably written"
"Harrison, Henry Sydnor","Harrison, Henry Sydnor 9 in 1907. There is also a draft of his short story, ""When I Came Back,"" written in 1919."
"Harrison, James H.","Harrison, James H Letters. 1855-1864. Caswell County, North Carolina Section.A 9 pieces  NOV5 1933 Nov. 20, 1934"
"Harrison, James H.","Harrison, James H. . 1855-1864 Caswell Co., N.C.  The collection contains some Civil War letter Harrison died from ""phoid fever af¥ Richmond, Va. while in service."
"Harrison, James P.","Harrison, James P Cc  Day Bookd,Ledgers, Accounts. 1829-1867 Oak Grove, Brunswick County, Va.  16 vols.  Records of a general merchant.  [See following cards for seperate items]"
"Harrison, James P.","Cnepel Harrison, James P,  Account of Auction Sale. 1854, (Oak Grove, Brunswick County, Va.] 36 pp. Paper. 33 x 20 cm.  AUG 3 0 1940"
"Harrison, James P.","Harrison, James P,  Account of Estate. 1854-1856. Oak Grove, Brunswick County, Va.  10 pp. Boards. 38 x 15 cm.  AUG 3 0 1940"
"Harrison, James P.","Harrison, James P,  Day Book, 1844,  Oak Grove, Brunswick County, Va.  188 pp. Boards. 39 x 17 cm.  AUG 3 0 1940 e"
"Harrison, James P.","(Harrison, James P.]  Day Book. 1844-1845. [Oak Grove, Brunswick County, Va. ] 92 pp. Cloth. 354 x 21 cm.  AUG 3 0 1940"
"Harrison, James P.","Harrison, James P,  Day Book. 1845-1849, Oak Grove, Brunswick County, Va.  108 pp. Boards. 38 x 15 cm.  AUG 3 0 1940"
"Harrison, James P.","Harrison, James P,  Day Book. 1853-1855, Oak Grove, Brunswick County, Va,  231 pp, Boards, 40 x 16 cm,"
"Harrison, James P.","Harrison, James P,  Day Book. 1866-1867. Oak Grove, Brunswick County, Va,  547 pp. Boards, 40 x 17 cn.  AUG 3 6 1940  ;"
"Harrison, James P.","Harrison, James P,  Day Book. 1867. Oak Grove, Brunswick County, Va.  358 pp. Boards. 42 x 18 cn.  AUG 3 0 1940.0"
"Harrison, James P.","(Harrison, James P.}  Ledger. 1829-1865. Oak Grove, Brunswick County, Va.  17 pp. Boards, 32 x 19 cm,  AUG 3 0 1949"
"Harrison, J. And P.","Harrison, J. and P.fleasant ?]  Ledger. 1844-1848. [Oak Grove, Brunswick County, Va.] 637 pp. Calf. 39 x 26 cm."
"Harrison, J. And P.","Harrison, J. and P.[leasant ?]  Ledger. 1844-1855. [Oak Grove, Brunswick County, Va. ] 578 pp. Calf. 39 x 26 pp.  AUG 3 0 1940"
"Harrison, J. And P.","Chapa F-16696 Harrison,J. and P.[leasant ?]  Ledger. 1848-1852. [Oak Grove, Brunswick County, Va.] 506 pp. Calf. 39 x 26 cm.  AUG 3 0 1940"
"Harrison, J. And P.","Harrison, J and Pileasant ?]  Ledger. 1852-1857. [Oak Grove, Brunswick County, Va. ] 314 pp. Calf. 39 x 26 cm.  AUG 3 0 1940"
"Harrison, James P.","Harrison, James P,  Ledger, 1855-1857. Oak Grove, Brunswick County, Va.  43 pp. Boards. 31 x 19 cm. Mutilated  AUG 3 0 1340 a"
"Harrison, James P.","Harrison, James P,  Ledger. 1865-1867. Oak Grove, Brunswick County, Va.  477 pp. Boards. 38 x 16 cm.  AUG 3 0 1940"
"Harrison, James Thomas","Harrison, James Thomas  Papers. 1865. Dec. 3  Columbus, Miss.  Section A"
"Harrison, James Thomas","Harrison, James Thomas Fapers. 1865 Columbus, Miss. 1 item Sketch Harrison (1811-79) was born in Pendleton,  S. C. and @ied at his home, Columbus, Miss., where he had settled in 1836. He was a lawyer, a delagate to the southern convention at Montgomery in 1861, and had served as a men member of the Confederate Congress from 1861- 65. On the return of Mississibpi to the Union he was elected to Congress wt was never permitted to take his seat. This letter, Dec. 5, 1865 is to his wife, telling her that he will not be pnermitted to take his seat in the House of Representa é"
"Harrison, James Thomas","Harrison, James Thomas  See Magruder Drake, ""A Mississippian's Appraisal of Andrew Johnson,"" Journal of M issippi History (Jan., 1955)."
"Harrison, Jesse","Harrison, Jesse Newbern, North Carolina  Section A  Nov. 20, 1934  77 pieces"
"Harrison, Jesse","Harrison, Jesse M88. 1856-1880 Newbern, Craven Co., N.C.  The collection contains eighteen Civil War letters which afe especially interesting as they are the letters of a ""buffalo"", and were written from behind the Union lines at Washington, N.C. The remainder were written after  the War and describe the financial difficulties of the family."
"Harbison, John W.","122 Harrison, John W, Diary, 1861 [Clarksburg, Virginia] 124 pp. Leather  OCT 3 1949  Section A"
"Harbison, John W.","Harrison, John W. Diary. Clarksburg, Virginia     John W. Harrison was a member of the Third regiment Virginia Volunteers, A xerox copy of the diary is in Section A."
