Name,Text
"Jones, Thomas Thweatt","Jones, Thomas Thweatt 14     correspondence enters a new phase, as it is his immediate family group which dominates the re- mainder of the letters down to 1974. Letters of the 1930's and 1940's are relatively few. They are both to and from the young Dr. Jones and his wife, and they continue to deal for the most  part with personal matters such as news of friends and family. Down to about 1949, there also continue to be many letters written to and from R. R. Jones and his wife.  From about 1947, the correspondence is very"
"Jones, Thomas Thweatt","Jones, Thomas Thweatt 15 thick, and the emphasis in its subject matter changes from primarily personal topics to mater- ial touching on Dr. Jones' medical career, al- though letters from relatives and friends con- tinue to be present. Most of the professional correspondence deals with Jones'medical activi-     ties outside his practice. Most of the letters are to Dr. Jones, but there are also many copies of letters he sent. Letters are plentiful to  eed from Mig ge ee organizations such as the A.M.A., the North Carolina Medical Society"
"Jones, Thomas Thweatt","Jones, Thomas Thweatt 16  (especially its Committee on Mental Health), the  North Carolina Mental Hygiene Society, the  Durham-Orange County Medical Society, the Durham  Council on Alcoholism, and Alcoholics Anonymous. Many routine letters concern talks Jones  gave on alcoholism, at first mainly to local     groups, then increasingly to meetings of state and national groups - such as the New Orleans Graduate Medical Assembly, the Colorado Bar Association, the National Council on Alcoholisn, and the National Association of Municipal"
"Jones, Thomas Thweatt","Jones, Thomas Thweatt 17     Judges, Some letters comment on Jones’ publish- ed articles on such topics as alccholism and ""agathanasia"" (a term coined by Dr. Jones and Professor Loring Walton for ""a dignified death"") The letters of 1962-1965 tell the story of his  effort to build the alcoholic rehabilitation cen ter, the failure to gain financial support, and his disappointment (See especially the letter of Sept. 22, 1965). The years 1967 to 1969 seem  to have been frustrating ones for him, as he frequently complained in his letters of the"
"Jones, Thomas Thweatt","Jones, Thomas Thweatt 18 masses of paperwork which the Medicare program had brought him and also of the lack of public concern about alcoholism. In 1969, the volume of correspondence declines, probably due to Jones’ retirement from full-time practice.  While the professional correspondence clearly     dominates, the personal letters during 1947- 1974 are not without interest. From 1950 to 1951, there are many letters from friends expres  sing sympathy on the occasion of the final ill- ness and death of Robert Randolph Jones."
"Jones, Thomas Thweatt","Jones, Thomas Thweatt     Several letters between Dr. Jones and his chil- dren are notable, especially those from his sons Carter and David, who at one time was an Air Force pilot in Vietnam. Throughout the period, there are always a few letters concerning Dr, Jones’ hobbies and his activities in the First  Presbyterian Church,  The addresses and writings are divided into two sections - those by Dr. Jones himself and those by ving F3 the former being the most abun-  e  dant by far. The addresses and writings by"
"Jones, Thomas Thweatt","Jones, Thomas Thweatt __20 Jones - about forty in number - date from 1952 to 1973, and they include his major and minor articles along with several speeches and notes for speeches and informal talks which were  never published. The most frequent topic is, of course, alcoholism, There are major addresses,     such as ""Alcoholism: What It Is and Why We Are Here"" (1961) and ""The Alcoholic: Patient or Pen-  itent?"" (1961). There are also reprints of  major articles such as ""Medical Horizons Con- cerning Alcoholism"" (1963) and ""The Alcoholic"
"Jones, Thomas Thweatt","Jones, Thomas Thweatt. Offender” (1962). Jones also sometimes wrote  series of brief articles such as ""Facts About Alcohol and Alcoholism"" (1962) and ""Short Snorts on Alcoholism"" (n.d.). Among several items on agathanasia are ""Dignity in Death"" (1961), per- haps the most widely-read and controversial  article he ever wrote, and the apparently unpub- lished manuscript ""Agathanasia - Our Medical Responsibility"" (1963). Addresses and writings  on other subjects - such as heart attacks, the nervous woman, and the general practitioner -"
"Jones, Thomas Thweatt","Jones, Thomas Thweatt 22 are also present. In addition, there are many miscellaneous notes for talks on legal paper or note cards,  There are about two dozen items in the addres ses and writings by people other than Jones, which date from 1875 to 1973. Some of these     are by relatives, such as John Blackwell's ""A Study of Scripture Teaching As To the Holy Spirit"" (1875-1880), Rev. D. H. Scanlon's bio-  graphical sketch of his close friend, the reli- gious educator Dr. Aline McKenzie (1940), and"
"Jones, Thomas Thweatt","Jones, Thomas, Thweatt 23 an El Paso High School baccalaureate address probably by R. R. Jones (1943). Additional items in this , portion of the collection have to do with Jones' medical interests. Several of them are the work of experts on alcoholism, for example, There are also several papers from a     convention in Atlanta in 1959 on the training of physicians in psychiatric principles.  The abundant memoranda and reports throw much light on Dr. Jones' activities in organi- zations, and they are divided into six sections."
"Jones, Thomas Thweatt","Jones, Thomas, Thweatt 24 The first section is a general one, containing  a variety of items falling between the years 1942 and 1974, The diverse materials in this section include several memoranda and records of minutes of meetings from Jones' days in the army. There are memoranda from such organiza-~     tions as the North Carolina Medical Society and the American Academy of General Practice. Other items touch on a study done at the Univer-  sity of North Carolina concerning relations be- tween the press and the medical profession."
"Jones, Thomas Thweatt","Jones, Thomas Thweatt 25     The second section of the memoranda and reports is on alcoholism and its materials date from 1953 to 1974, The items here include memoranda, announcements, agenda, minutes, and other types of reports from the various organizations and institutions connected with alcoholism in which  Dr. Jones was active. There are, for example,  a number of bibliographies on alcoholism com-  piled by the Center for Alcohol Studies at U.N.C The third section of the memoranda and  reports concerns mental health and falls"
"Jones, Thomas Thweatt","Jones, Thomas Thweatt _ 26 between the years 1954 and 1972. There are many items concerning the subject of the training of general practitioners in the principles of psychiatry, The memoranda, minutes, and reports of such organizations as the North Carolina Mental Health Association, the North Carolina     Neuropsychiatric Association, and the state med- ical society's Committee on Mental Health are a so present,  The final three sections of the memoranda and reports are smaller than the first three. The"
"Jones, Thomas Thweatt","Jones, Thomas Thweatt 27     fourth section contains minutes, resolutions, and reports of the First Presbyterian Church of Durham during 1956-1972. The fifth section is made up of a few items of 1957-1972 dealing with Watts Hospital. The final section contains memoranda from the Duke University Medical Cen-  ter, 1964-1972.  The collection's few legal papers date from 1757 to 1974.and are for the most part of minor importance, The earliest item (1757) is a copy of the will of James Goodwin, one of Dr."
"Jones, Thomas Thweatt","Jones, Thomas Thweatt 28     Jones’ ancestors. Other items include deeds and mortgages on land in Virginia and Texas, documents conferring power of attorney, testi- monials on behalf of R. R. Jones, and proposed legislation on alcohol. There are a very few financial papers falling between 1818 and 1970.  The ones from the first half of the nineteenth century are mainly receipts and accounts relat- ing to ancestors. There are several items from  1837 relating to the estate of Samuel Bolling. Items from the 1950's give indications of Jones"
"Jones, Thomas Thweatt","Jones, Thomas Thweatt 29     personal income and there are some financial statements of the Durham Council on Alcoholism from 1959, 1961, and 1970.  The approximately one hundred items of gen- e@logy date from 1858 to 1973, The family names which are most prominent in the Jones genealogy  are Bolling, Blackwell, Randolph, Scanlon, and Gruver, with the names of Hardy, Feild, and Goodwin also much in evidence.. The earliest  item (1858) is a copy of a parish record of the  marriage of Dr. Jones’ grandfather, who was also"
"Jones, Thomas Thweatt","Jones, Thomas Thweatt _ 30 named Thomas Thweatt Jones, to Margaret A. Bolling. Other outstanding items include gen- ealogical notes from 1870 by John Blackwell and a book entitled Sketch of John Blackwell (1916) | by his daughter Sallie 0, Blackwell (Mrs. R. R. Jones), the original of which has been placed in     the — stacks; a pamphlet by Rev. D. H. Scanlon, Genealogy of the O'Scanlon Famil (1938); an a typed copy of “Genealogy of the Gruvers of Reliance, Warren County, Virginia"" (1956). There are several letters about family"
"Jones, Thomas Thweatt","Jones, Thomas Thweatt 31 history and a number of genealogical tables. There are several items containing genealogical notes, some fairly systematic and others less so.  The clippings come from the years 1887-1976, with the vast majority falling after 1958. The     earlier ones concern Dr. Jones' family, but most deal with the subjects which interested him professionally and most come from Durham  papers. Clippings on alcohol and alcoholism, death with dignity, mental health, and the"
"Jones, Thomas Thweatt","Jones, Thomas Thweatt  Medicare controversy are present. Other clip- pings deal with organizations in which Dr. Jones was active and conferences or conventions which he attended, Still others contain articles and photographs giving accounts of Jones' speeches or of interviews with him on alcoholism and its     treatment. Some items give accounts of the various community service awards Jones received for his tireless efforts on behalf of the alco-  holic. The large amount of printed material from"
"Jones, Thomas Thweatt","Jones, Thomas Thweatt     T896 to 1975 is almost entirely concerned with Dr. Jones' professional interests. It is divid- ed into three sections. The first contains items on a variety of topics such as agathanasia and geriatrics, industrial medicine and occupa- tional health, the general practitioner and  ""Family Medicine,"" Medicare and medical educa- tion, as well as printed matter from the various organizations and institutions Jones was asso- ciated with - exclusive of those promerins  mental health and treatment for alcoholism."
"Jones, Thomas Thweatt","Jones, Thomas Thweatt  The second and largest section contains severa hundred items on various aspects of alcoholism. These range from small pamphlets and tracts to full issues of periodicals or articles clipped from periodicals - some being professional jour- nals devoted entirely to alcoholism such as              Inventory: A Bivonthly Journal on Alcohol and Alcoholism, others being popular magazines dis- cussing the question in the most general terms.  The third section of the printed material is devoted to mental health and contains items on"
"Jones, Thomas Thweatt","Jones, Thomas Thweatt topics and organizations previously mentioned in that field of interest to Dr. Jones.  The Jones Collection includes a splendid group of pictures on a wide variety of subjects. Most deal with Dr. Jones and his wife and their ancestors. Old photographs or reproductions of     photographs of people with the family names of Jones, Bolling, Gruver, Blackwell, and Scanlon are present. There are some sixty-seven photo-  graphs of Robert Randolph Jones and his immedi- ate family most being from the days before his"
"Jones, Thomas Thweatt","Jones, Thomas Thweatt 36     son Thomas Jonés went off to college. in addi- tion, of course, there are a great many photo- graphs of Dr. Jones and his family during their years in Durham. Some of the pictures touch on organizations that Dr. Jones supported, such as the National Council on Alcoholism, and its  Durham branch. A photograph from 1930 shows the original staff of the Duke Schools of Medicine Nursing and Dietetics, and Duke Hospital (1930).  One of the members of this original staff was  Dr. Jones’ elder brother R. R. Jones, Jr."
"Jones, Thomas Thweatt","Jones, Thomas Thweatt 37     (1902-1941). One of the collection’s largest photographs (7 X 49 inches) provides a broad view of El Paso in 1921. There are many other pictures on other topics too numerous to mentio  and this portion of the Jones Collection may be its highlight.  The several items in the miscellany date from 1901 to 1970, most of them being completed questionnaires on alcoholism filled out by  doctors and citizens of Durham along with com-~ pilation of data from them. Other items"
"Jones, Thomas Thweatt","Jones, Thomas Thweatt me 38 include copies of the invitation to Dr. Jones’ wedding and that to his father's wedding, var- ious certificates received by Dr. Jones and his father, and school report cards and membership cards for organizations.  The sixty-two volumes are of two basic types     - personal and professional. Dr. Jones collect- ed many thick pamphlets, paperback books, and copies of magazines and journals on the topics which interested him. Most of the professional volumes are printed works concerning alcoholism,"
"Jones, Thomas Thweatt","Jones, Thomas Thweatt 39 mental health, agathanasia, and other medical subjects. Many of the seventeen personal vol- umes are unique and of great interest regarding Jones' family. Four of the volumes concern the Scanlons. there is a pamphlet im memory of Charles Scanlon (1869-1927), the uncle of Dr.     Jones' wife and, like her father, a Presbyterian minister. A pamphlet containing the sermon delivered by her father David Howard Scanlon,  entitled Thirty-Eight Years in the King's Ser- vice (1938), on the occasion of his retirement"
"Jones, Thomas Thweatt","Jones, Thomas Thweatt 40 from the ministry, 1s present. Two good travel diaries (1923 and 1926) also belonged to the Scanlons, the earlier to D. H. Scanlon, the later to his daughter Mary, the future wife of Dr. Jones. Both journeys covered basically the same ground - Portugal, Spain, Greece, Turkey, Palestine, and Egypt. Two of the volumes con-     cern R, R. Jones - one being his family Bible, which includes a bit of genealogy, the other being the memory book from his funeral in 1951.  Three volumes touch on Rev. D. H. Scanlon's"
"Jones, Thomas Thweatt","Jones, Thomas Thweatt     friend Dr. Aline McKenzie, Two of them contain typescripts of her poems - one of the volumes entitled ""Poems on Various Occasions,"" the other ""Some Occasional Verses,"" both undated. The third volume concerning Dr. McKenzie is a scrapbook. from 1948 containing pictures and  comments about her, along with some of her poems. It was apparently put together on the occasion of her death. Two volumes concern Dr.  Jones himself, one being a scrapbook of mater- ials relating to his designation as a Durham"
"Jones, Thomas Thweatt","Jones, Thomas Thweatt 42 ""Father of the Year” in 1958, the other being his personal appointment calender for 1960. The other personal volumes include three printed books of poems and three passports.  Three oversize volumes have been placed in the steel shelves. Dr. Jones' Davidson College     Scrapbook, 1924-1928, that contained many interesting pictures, letters, printed items,  and other keepsakes from his undergraduate days has been given to the Library of Davidson Col- lege. Also on the steel shelves is a nice"
"Jones, Thomas Thweatt","Jones, Thomas Thweatt 43        Scrapbook of 1956-1903 entitled “through the  Years with the Durham Council on Alcoholism."" It was presented to Dr. Jones in appreciation for his work in that organization, and it con- tains many clippings, pictures, and letters on the D.C.A., stressing Dr. Jones' personal con-  tribution. The last volume placed on the steel shelves is a scrapbook, 1860-1943, focused on the life and career of Rev. D. H. Scanlon and  made up mainly of articles on him, pictures, and letters from friends and famous people."
"Jones, Thomas Thweatt","Jones, Thomas Thweatt 44     Four items have been placed in an oversize folder in the picture cabinet. A map of Din- widdie County, Virginia, from 1878 has under- lined the home of Dr. Jones' grandfather T. T. Jones, where R, R. Jones grew up with his nine brothers and sisters. The obituary of J, Bolling Jones, Dr. Jones' uncle, in the ""Bio- graphical Information"" contains some account of the family who lived in this home. Another map, dated 1866, records the successive transfers of  a piece of land in Hampshire County, Virginia,"
"Jones, Thomas Thweatt","Jones, Thomas Thweatt 45 from 1788 to 1866. An indenture from 1794 records the transfer of the same piece of land from Ezekiel Rogers to Elizabeth Allen. The original grant of the land to Ezekiel Rogers,  made in 1788, is the final item in the oversize folder.     The Jones Collection, in sum, contains a wide variety of materials, many of them relating to personal and family matters, but the bulk of the collection portrays in great detail the idealistic, energetic professional career of Dr."
"Jones, Thomas Thweatt","Jones, Thomas Thweatt  46 Tho  mas T. Jones of Durham from about 1947 to 1974. 1 item added, 9-12-78:  This biographical sketch of Dr. Robert Ran- dolph Jones (1902-1941) by Dr. Thomas Jones is  filed among the biographical information.     See also Robert Randolph Jone Papers.  9 items added, 5-5-83: Nine photographs, 1890-1904, are of eight group pictures of fac- ulty, staff, and students at the Shenandoah Normal College located during this period suc-"
"Jones, Thomas Thweatt","Jones, Thomas Thweatt 47     cessively at Harrisonburg, Basic City (Augusta Co.), and Reliance (Warren Co.), Virginia. One view is a duplicate. The views are posed be- side the school buildings. Many persons in the pictures are identified.  Information about the school is in the pam-  phlet An Historical Sketch of Shenandoah Normal College in Virginia, Its Founder and Its Work by David H. Scanlon. He was Dr. Jones' father- in-law. Members of the Scanlon family are in           the photographs."
"Jones, Thomas Thweatt","Jones, Thomas Thweatt 48     The two photographs of 1898 and 1903-1904 by C. Fred. Barr of Winchester have additional in- terest because they illustrate the change in photography then underway in which emulsion- paper prints were replacing albumen prints. Barr's photograph of 1898 is an albumen print,  but he made an emulsion-paper print in 1903- 1904.  l item added, 5-18-84: A memoir by the Reverend George White, a Presbyterian minister of Virginia. It mentions several times the"
"Jones, Thomas Thweatt","Jones, Thomas Thweatt 49     Reverend Thomas Thweatt Jones, also a Presby- terian minister of Virginia. It was for the latter minister that his physician grandson, Dr. Thomas Thweatt Jones, was named. George White was born in 1830, and this memoir was completed in 1904, At its beginning he names his children  who he says have urged him to write the per- sonal reminiscences of his life. Many friends and acquaintances, several of them ministers, are mentioned, and most of them receive his praise. Much is written about the cordial"
"Jones, Thomas Thweatt","Jones, Thomas Thweatt 50 relationship between slaves and the families of their masters and their loyalty to their owners during the Civil War. Early’~in the memoir he describes how the Nat Turner insurrection changed the attitudes of whites in Virginia toward some of the slaves. The earlier relationship of Slaves and whites in the churches he covers.     His description of his own schoolboy experiences and the discipline and instruction in the schools of his day, along with the high-minded attitudes he and others he mentioned had toward"
"Jones, Thomas Thweatt","Jones, Thomas Thweatt ot     people of integrity and toward women in parti- cular, the interest of the people in evangelical religion, race relations in Virginia dating  back to the 1830's, the frightening experiences during the Civil War for a number of Virginians he knew, their loss of property and reduction  to poverty by the war, and his mission work in the Appalachian mountains makes this memoir a significant social document."
"Jones, Thomas Thweatt","Jones, Thomas Thweatt     Jones, Thomas Thweatt Scrapbook, 1860-1943  Durham, North Carolina"
"Jones, Thomas Thweatt","Jones, Thomas Thweatt     SS-107 Jones, Thomas Thweatt  Through the Years with the Durham Council on Alcoholism, 1956-1963  Durham, North Carolina  9-24-76"
"Jones, Thomas W.","Jones, Thomas W.  Papers, 1816-1852  Mecklenburg and Brunswick cos., Va.  Section A 20 items"
"Jones, Thomas W.","Jones, Thomas W. Papers, 1816-1852. Mecklen- burg and Brunswick cos., Va. 20 items. Sketch.     Correspondence of Thomas W. Jones, a physi-. . cian, with his wife Mary (Armistead) Jones, and his father Captain John Jones, a planter, deal- ing with medical school in Philadelphia, social life and customs, family affairs, Protestant Episcopal Bishop John Stark Ravenscroft, and the Petersburg cotton market.  Many of the letters are written by Mrs. Jones, the former Mary Armistead Goode, daughter of Col. Samuel Goode of Mecklenburg"
"Jones, Thomas W.","Jones, Thomas W. Papers, 1816-1852... County, a large planter and U.S. Congressman. Mrs. Jones was a niece of Episcopal Bishop John S. Ravenscroft whose wife Anne Spotswood Burwell was a sister of Mrs. Jones' mother."
"Jones, Waiter","Jones, Waiter Papers, 1781-1880  Washington, D.C.  in the matic Union Catalog  O al  as alt er Jones)  Cab-.77 with Catherine 135 items & 1 vol. Jones . 1 item added, 5-22-62  1-15-36"
"Jones, Walter","Jones, Walter. . Letters and Papers,  Walter Jones (Oct.7,1776 - Oct.14,1861) was born in Northumberland Co., Va. His father, Dr. Walter Jones, was an Edinburg trained physician. Gen.Walter Jones was educated by a Scotch tutor, read law under Bushrod Washington, and was ad- mitted to the Va. bar, practicing law in Loudon and fairfax counties. In 1804 Jefferson,a friend of Dr.Walter Jones, appointed him attorney for fhe District of Columbia. He resigned this position in 1821 and then, began a brilliant practice of law a a U.S. Supreme Court"
"Jones, Walter","Jones, Walter. Sketch, (2)  and other courts until his last days. He was as sociated with many notable lawyers in many fam- ous Cases, viz. Edward Livingston, Francis Scott Key, Daniel Webster, and Henry Clay.  He was active in other than the legal pro- fession,being commissioned by Pres.Monroe as brigadier-general for his part in the battle of Bladensburg. He was associated with John Ran- dolph,Bushrod Washington, Rev.Robert Finley,and Henry Clay in founding the American Colonizatio Society.  He married Ann Lucinda Lee in May,1808,and became the father of } daughters and three song,"
"Jones, Walter","Jones, Walter Sketch. (3)  [See chart with .) Of these twelve children one son,Walter,while serving on the Bartlett Boundary Commission for establishing a boundary between the U.S. and Mexico,was killed at the mouth of the Rio Brazos on March 15,1853, and Catherine became a missionary to China,where she died of smallpox on ec.8,1863. The remain-  ing daughters married as follows: Virginia to Dr.Thomas Miller; Nannetta to Dr.Robert E.Pey- ton; Rosina to Rev.Joseph Packard of the Theolo gical Seminary at Alexandria,Va.; Elizabeth to Henry T.Harrison,a lawyer in Leesburg,Va.; ahd- Harriotte to Matthew ee In addition"
"Jones, Walter","Jones, Walter, _Sketch, (4)  to Catherine,the missionary, Frances and Violet ta apparently were unmarried. Walker and Charleg were the other sons.  The letters are of little value,being chief ly the correspondence of the family,with an oc- casional letter to Walter Jones on legal busi- ness. There are many letters from Nannetta Lee     Peyton. (See also the Robert E.Peyton .). 1 item added, 5-22-62: A bill for John Turner from Dr. Walter Jones (1745-1815)."
"Jones, Walter","' Jones, Walter.’ Papers,’     JONES, Thomas Walter Diary 1851-1852 Virginia, Texas  Jones was probably member of J.ReBartglett Boundary Commissiom (Mexico-U.S. Boundary)  May 14, 1850 = Mar. 15, 1853"
"Jones, Wesley Norwood","Jones, Wesley Norwood  FOR INFORMATION ABOUT THIS COLLECTION OR ADDITIONS TO THIS COLLECTION, PLEASE ASK A STAFF MEMBER TO CONSULT THE ACCESSION RECORDS."
"Jones, William H.","Jones, William  Papers, 1838-1865  Augusta, Ga.  Section A 1947  GUIDE"
"Jones, William","JONES, William GUIDE Ceipts and Bills. 1858-1865. Augusta,Ga. = pieces. Sapa, Sketch,  Receipted bills for merchandise 1838-42; miscellaneous petitions to Inferior courts. of Wilkes County; other legal documents ad~ dressed to sheriffs of Wilkes County."
"Jones, William B.","Jones, William B.  Papers, 1785-1885  ""Birdsville"", Georgia  ta  11-30-54 Returned to the  mane Mrs. antation,  GUIRE sequest  eT weorgia,  173 items  Aon Sin LOLs  Birdsville  at her"
