Name,Text
"Duke, Robin Chandler Lynn","e 6th 24:D (98-310, 98-311), 6th 193B (98-350, ‘Duke, Robin Chandler Lynne Papers, eee (Card ie Duke, Robin Chandler Lynne 2c Duke, Angier Biddle, 1915-1995e Je National Abortion Rights Action Leaguee 4-e Population Action Internationale Se Planned Parenthood Federation of Americae 6e Draper World: Population Funde 7e National Abortion Federaticn (UeSe ) 8e United Nationse Se Birth control--United States-—-History-——-20th centurye 10- Abortion--United Statese 11e Abortion--Government policy--United Statese 12- Population: pclicye 1i3e Women's rightse Ie Population Action International e IIe: Draper World Population ru@® nde IIIe National Abortion Fede ration (UeSe) NcD 19981012 #40093308 .NDHYse"
"Duke University, Oral History Program","e 2nd 52:C, 70:D Duke Universitye Oral Biatoce Programe Collection, 1973-1978, 1992, and nede 810 itemse Oral History Program at Duke Universitye Collection containing 238 oral history interviews conducted by project participants in the years 1973-1978 and 1992. Most interviews deal with the civil rights movement in North Carolinas especially Durham, Chapel Hill, and Greensboroe Thirteen interviews deal with the Tulsa Race Riots, and fourteen cover miscellaneous North Carolina topicse Collection also includes tran scripts and research files related to the civil rights movement in N orth Carolinae 10 AUG 98 39670254 .NDHYme SEE NEXT CRD"
"Duke University, Oral History Program","e 2nd 52°C, 70:D Duke Universitye Oral History Programe Collection, eee (Card 2) Collection is arranged in three  series: Audiotapes, Transcripts, and Research Filese The Audiotapes Series consists of two identical sets of audiocassettes, one closed for preservation purposes and one open for researcherse The North Carolina Civil Rights Movement tapes, which make up the bulk of the series, include extensive interviews with Ella Baker, as well as hundreds of interviews with lesser-known but nonetheless important figures from the Local movements in Greensboro, D urham, Chapel Hill, Weldon and. Mo mroe, NeCee The Tulsa Race Riots ta pes include interviews  10 AUG 98 39670254 NDHYme SEE NEXT CRD"
"Duke University, Oral History Program","e 2nd 52:C,  70:D Duke Universitye Oral History Programe  Collection, cee (Card 3) conducted by Scott Ellsworth for his study Death in the Promised Land: the Tulsa Race Riot of 1921. The North Carolina Miscellaneous tapes include an interview with Alex Haley about his critically-acclaimed book, Roots, as well as conversations about such topics as the state's agricultural history and mountain culture in Western North Carolinae The Transcripts Series includes eighty transcripts, as well as some interview notes, corresponding to tapes dealing with the North Carolina civil rights movemente The Research File s Series contains six files of back round material  10 AUG 98 396702 NDHYme SEE NEXT CRD"
"Duke University, Oral History Program","e 2nd 52:C,  70:D Duke Universitye Oral History Programe Collection, eee (Card 4) related to the civil rights movement in North Carolina, including articles and speeches by Governor aeeee Sanford and a bibliography of material dealing with the Durham sit-ins, and one file Listing tapes and transcripts in the collectione Access is restrictede +m jd  1. Sanford, ZereTs 2067 -  Ze Baker, Ella, 1903-1 3e Ellsworth, Scotte Death in the: Promised Lande 4e Haley, Alexe Rootse 5-e Civil rights moveme @ sis kort Carolina-— Durham-—Hi sto ry--20th centurye 66  10 AUG 98 39670254 NDHYme SEE NEXT CRD"
"Duke University, Oral History Program","e 2nd 52: Ce  70:D Duke Universitye Oral History Programe  Collection, ccc (Card 5) Civil rights movements--North Carolina --Chapel Hill-——-History--20th centurye 7- Civil :rights movements-—-North Carolina--Greensboro——-History—--20th centurye 8- Civil. rights demonstrations--North Carolinae Qe Riots--Oklahoma--Tulsae 106 Agriculture--North Carolina-—Historye 11. Civil rights workers--North Carolinae 12. Afro-Americans--Civil rights--North Carolinae 13e North Carolina--Race relationse 14+ North Carolina--History-—-20th: centurye  10 AUG 98 39670254  NDHYme"
"Duke, W., Sons & Co.","Duke, W., Sons & Co, Papers, 1876-1904 Durham, Durham Co., N. C.  25 -F 3 boxegAnd 3 vols.  8-30-40; 11-6-42; 5-23-46 (s ) Legur ie 1  ‘aly and bound vol. cards)"
"Duke, W., Sons & Co.","Duke, W., Sons & Company  FOR INFORMATION ABOUT THIS COLLECTION OR ADDITIONS TO THIS COLLECTION, PLEASE ASK A STAFF MEMBER TO CONSULT THE ACCESSION RECORDS."
"Duke, W., Sons & Co.","Duke, W Sons & CO. Papers, 1880-1904,. Durham, N. GC. Sketch     This collection consists of premiums and advertising devices used during the 1880's by  eight of the tobacco manufacturing companies of N. C., Va., Md., and N. Y.  The bulk of the material is in the form of  loose premiums a according to companies  manufacturing them, then series (of which there are 93), and finally by lists on the back of  most of the individual premiums, The loose premiums are placed in envelopes marked as to"
"Duke, W., Sons & Co.","Duke, W., Sons & Co. . 2 company, ies number of premiums in the en- velope, number of duplicates to the particular series, and number needed to complete the series The duplicates are placed in a separate file  with duplicate information on their envelopes.     There are two albums of premiums of the  W. Duke Sons & Co. . The larger album contains 616 unarranged premiums of many companies and the smaller album contains 2159 of them, The premiums in the albums were firm- ly pasted down and cannot be removed for ar- rangement or trading ée as duplicates,"
"Duke, W., Sons & Co.","Duke, W.. Sons & Co, 5 How complete the collection fs cannot be judged, since there is no published list of such devices, We have 1770 loose premiums of which 1404 are W, Duke, Sons, and Co., Durhan, N. C.; 264 are Kinney Brothers, N. Y. and Richmond; 44 are William 8. Kimball and Co., Rochester, N. Y.; 24 are Goodwin and Co,, New  York; 15 are Alién and Ginter , Richmond, Va.; 7 are Lone Jack Cigarette Co., Lynchburg, Va.; 5 are 8. F, Hesse and Co.; and 6 are Marburg Bros., Baltimore, Md."
"Duke, W., Sons & Co.","Duke, W.. Sons & Co. _. cr 4  Kdded 11-26-49, six small booklets which contain histories of poor people who became famous and a volume of printed alhums advertis- ing W. Duke, Sons, and Co.'s tobacco,     Added 11-30-49 ,one copy of Tobacco Whiffs, Vol. I, No. I, published by Blackwell's Dur- ham Tobacco Co.  Advertising devices of Herbert Tareyton Cigarettes, “Henry,” filed with this collection May 8, 1951.  For aAditional infearmation about advertise"
"Duke, W., Sons & Co.","Duke Sons & Co... b ing by fackwell's Durham Tobacco Co. see a pamphlet in this library numbered 20434. It is: Garland B. Porter, ""The Saga of Reuben Rink...."" It is detached from Southern Advertising and Publishing (Atlanta, Dec. 1959), No. 35.  “Reuben Rink"" was Jules Gilmer K8rner, Sr. of Kernersville, N. C. See also: Jules G.        K8rner, Jr., Joseph of Kernersville (Durham,     ane t tene added, 6-30-64: Undated, tinted ad- vertisements of Duke Cigarettes. They exploit the female figure, and are each in a separate folder, 10 x 7 in. They were given by Mrs. 0. M. Clark of Deerfield orn Fla."
"Duke, W., Sons & Co.","Duke, W., Sons & Co, 6     The volumes are art-account—seek—and two  albums. The-aceeunt—book(1676=1884)records  purchases Of teaf—tobacce—and sutes—of_tobaceo products. The albums contain cards used as premiums in advertising cigarettes."
"Duke, W., Sons & Co.","Duke, W., Sons & Co. Album, n. d.  Durham, N. C,  236 pp. Calf 32 x 19 cm.  8-30-40 Contains cards used as premiums in adver- tising cigarettes."
"Duke, W., Sons & Co.","Duke, W., Sons & Co. Album, n. d. Durham, N. C.  19 pp. Paper 42 x 24 cm.  8-30-40  Contains cards used as premiums in adver-  tising cigarettes."
"Duke, Walter Patterson","Duke, Walter Patterson aS,  Letters and Papers. 1840-1884.  Hadensville, Goochland County, Virginia  1 box. cab. 72. 210 pieces.  Nov. 1, 1937 ¥DRA tlie catnhg 2s (Entered in the National Union Catalog of  as Duke Family Correspondence. )"
"Duke, Walter Patterson","Duke, Walter Patterson 1840-1884 Hadensville, Goochland Co., Va. 210pieces Sketch     The collection contains the letters and papers of W. P. “uke of Goochland Younty, Va. After the war the four “uke brothers moved away from Virginia to various parts of the county, except William B. who established  himself on a farm near Caledonia, Goochland County. J. E. went to Tennessee, Napoleon B. went to New York state, and Walter P. went  first to Arkansas and later to Texas. All"
"Duke, Walter Patterson","Duke, Walter Patterson (2) Sketch  were engaged in farming and the bulk of the correspondence degéal: with the condition of crops and the price of cotton and corn. There are two rather interesting letters (1868) which describe the purposes and activites of the Ku-klux-klan in Tennessee. In 1871 Walter     P, Duke returned to Goochland county and established a general store. He was agent for the Southern Fertilizing %o:, a company that  was influential’ inyAobacco culture in Virginia the development of"
"Duke, Walter Patterson","Duke, Walter Patterson (3) Sketch     after the war.  The correspondence reveals something about the social and economic conditions of the time. There is not much material of great value, but the correspondence of the four brothers living in various parts of the country is rather interesting and the business ee | per mag shows something of the economic situation in Tennessee, Arkansas, Texas, and  Virginia."
"Duke, Washington","Duke, Washington  FOR INFORMATION ABOUT THIS COLLECTION OR ADDITIONS TO THIS COLLECTION, PLEASE ASK  A STAFF MEMBER TO CONSULT THE ACCESSION RECORDS."
"Duke, Washington","Duke, WVashington Papers, 1676-1968  Durham, Durham Co., N. C.  SS-64; 285 items and 1 vol.  ; 1 item Vault* 1 item  1 item 5-7-51 1 item  —— ATT m1 tee  American Tobacco Co.  added, 9-18-51 added, 6-6-53  added, 8-11-59 added, 7-22-66  *Shingle from the @ st factory of the"
"Duke, Washington","Duke, Washington  Papers, 1676-1968  Durham, Durham Co.  SS-64;  _ Scr Suc e Lis]  Vault  > N. Cc.  item added, 8-14-66  items added, 2-27-68  item and 4 vols. added, 6-1-69  items added, 6-18-69  items & 1 vol. added,  6-23-69 ©"
"Duke, Washington","Duke, Washington  Papers, 1676-1968 Durham, Durham Co., N. C.  274 items trans., 12-5-70, to the J. B. & B. N. Duke ,  2530 items added, 12-5-70, from former Trinity College .  1 item added, 1-30-71 1 item & 1 vol. added, 7-22-72  20 items @-<< 8-23-72"
"Duke, Washington","Duke, Washington. Papers. Durham, Durham Co., N. Cc.     The papers of Washington Duke (1820-1905) have been assembled from the former Trinity College Papers and from those of his son, Benjamin Newton Duke.  The correspondence begins with two letters  (copies) in 1863, when Mr. Duke was preparing to enter the Confederate Army. He settled his business affairs by sending Jim, a Negro hand he had hired, back to Kinston, N. C."
"Duke, Washington","Duke, Washington 2 His return from the Civil War and his early  struggle to establish his tobacco business on his farm are not recorded in his correspondence, which does not resume until 1890, when Wash- ington Duke gave the money to bring Trinity College to Durham, N. C.  His early years, 1865 to 1880, as a tobacco  manufacturer, left no manuscript records, By 1890 Mr. Duke and his sons, Benjamin Newton and James Buchanan, were well established  in business in Durham, New York, and elsewhere,"
"Duke, Washington","Duke, Washington  so that his own correspondence and that of his sons reveals his interests, both financial and philanthropic. Letters come:  1. From relatives, seeking aid or sending thanks for gifts. Washington Duke helped his relatives with generosity,  2. From Methodist Episcopal Church, South, members and ministers seeking aid for church buildings, furnishings, orphans, widows, and missionaries,  3. From schools and colleges asking for aid"
"Duke, Washington","Duke, Washington a 4 or in appreciation of help given. Louisburg College, Rutherford College, Trinity College, and Kittrell College were among those institu- tions writing about finances, The colored orphanage at Oxford was supported for a number of years. Many students sought help from Mr. Duke in the way of scholarships or loans. He was generous, both to white and black applicants for educational aid. ; 4. From business associates or would-be  partners seeking financial aid and employment,"
"Duke, Washington","Duke, Washington     or reporting business transactions and profits. This correspondence largely concerns textiles and tobacco. An example is the encouragement by Washington Duke of black capitalism in the founding of the Coleman Mills at Concord, N. C.  5. From people who were ill or unlucky, many of them very impoverished.  Of the original 285 items in the Washington Duke ., 274 were transferred, 12-5-70, to the J. B. Duke or the B. N. Duke collections,  as this correspondence was addressed to the"
"Duke, Washington","Duke, Washington Duke brothers on the death of their father.  The remaining  in the collection have been added as pertinent to an understanding of Duke genealogy or to the career of Washingto  e.  1 item added, 9-18-51: a deed to land in Orange County, N. C., from Junius Class to  Washington Duke. 1 item added, 6-6-53: a mortgage of 6-18-72 on Brodie L. Duke property owned by Washington  Duke,"
"Duke, Washington","Duke, Washington BS 7  1 item added 8-11-59: Resolutions in memory of Washington Duke by the Board of Directors of the Fidelity Bank, July 28, 1905,  For picture of Duke coat-of-arms see Picture  File under: Pictures. General. 7-22-66, one item added. ‘nis is tne coat  of arms ot the Duke family. 1 item added, 8-14-66: Printed resolutions     of thanks and appreciation (Apr. 14, 1902) from the members of St. Joseph A. M. E. Church to Messrs. Washington, B. N., and J. B. Duke for their gifts toteling more than $6000 in the  previous ten years."
"Duke, Washington","&  Duke, Washington  2 items added, 2-27-68: Photostats of two records in the C. S. A. Archives in the National Archives Bldg. which concern the Civil War career of Washington Duke. One is dated Apr. 4, 1864, and is a report of Capt. George B. Baker, Assistant Quartermaster at Camp Holmes, Raleigh. This report is for CQO-A. of the Camp Guard. The gecond item is a list of men who signed up for three years of service in the Confederate Navy. Washington Duke's signature appears on both of these documents.  Articles containing information about Mr."
"Duke, Washington","Duke, Washington 9 Duke appear in the following newspapers: Durham Recorder (Apr. 16, 1900--copy in the Manuscript Department); Raleigh Morning Post (Dec. 27, 1903); and the Raleigh News and Observer (Apr. 5, 1896--copy on film in this library).  1 item and 4 volumes, added 6-1-69, are a photograph and financial records of Washington Duke.  The item, a picture of the kitchen on the old Taylor Duke farm where Washington Duke was born, was found in the attic of the Duke Univer-"
"Duke, Washington","Duke, Washington 10 | sity Medical School. It was probably made in 1930 at the time the old farm was ""rediscovered"" and described in an article in the Duke Alumni     Register (July, 1930, p. 229). Four volumes concern the financial affairs of Washington Duke and the company of W. Duke and sons. The first and oldest volume is a ledger, 1873-1877, kept at the time W. Duke and Sons moved their factory from the farm to Durham.  Even at this early day they were shipping"
"Duke, Washington","Duke, Washington Li tobacco from Maine to California. One instance is the surprising number of places in frontier Montana buying Duke tobacco.  The journal, ledger, and cashbook of Washing- ton Duke date from 1893 until 1905, the time of his death. They appear to have been the work of his private secretary, James E. Stagg.     three are parallel in content and supplement one another.  The journal, 1893-1905, indicates gifts to family, relatives, and individuals, as well as"
"Duke, Washington","Duke, Washington transactions with institutions such as the White Rock Baptist Church, St. Joseph's A.M.E. Church, Louisburg College, and the Durham Conservatory of Music. Businesses noted are the American Tobacco Company, the Virginia-Carolina Chemical Company, Cary Lumber Company, together with a number of cotton mills, railroads, and banks. The cashbook lists in more detail dividends from investments in a large number of concerns and donations to many people and institutions over a period of a decade or more. Washington"
"Duke, Washington","Duke, Washington 135     Duke was consistently generous to his immediate family and his many nieces and nephews. His tithing to the church covered gifts to the  Main Street Methodist Church, ministers, Negro churches, orphanages, and schools. With the coming of Trinity College to Durham, he made generous contributions to its finances, even  including small gifts to the baseball team and to the library for book stacks, Trinity Park Improvement Fund and High School also were  supported."
"Duke, Washington","Duke, Washington 14  The fourth volume, added 6-1-69, is a ledger containing accounts which list mills, railroads, and other property, together with rents, person- al expenses, tithes, repairs, etc. Here many local names of Durham citizens appear.  The four volumes are a sort of summary of the personal finances of Washington Duke in the last years of his life.  60 items were added 6-18-69. Of these six are copies of letters from the J. B. Duke . On May 18, 1896, Feb. 25, 1902, and Aug. 22, 1902, Washington Duke wrote concerning what he"
"Duke, Washington","Duke, Washington ~15 remembered about his family history. A copy of a letter by B. N. Duke on March 25, 1927, lists the brothers and sisters of Washington and Artelia (Roney) Duke.  The earliest date in this addition, June 29, 1676, is that of a letter by Elizabeth (Duke) Bacon, Curles Neck, Charles City County, Vir-     ginia, written during the so-called Bacon's Ke- bellion to a sister to describe conditions in the colony threatened by marauding Indians. This letter, a Xerox copy from the William and Mary Quarterly, Vol. IX (July, 1900), No. 1,        pp. 4-5, is in"
"Duke, Washington","Duke, Washington 16     original form in the Egerton . in the Public Record Office in London.  The dedication of the Duke Homestead as a National Historic Landmark on April 28, 1968, is recorded in letters, brochures, invitations to the ceremony, and addresses. Texts of addresses by Mrs. Mary Duke (Biddle) Trent Semans and Asa T. Spaulding are with the papers  Among the genealogical items added 6-18-69, for the Duke family of Suffolk, England, are charts of the English lineage from 1190 until  1732"
"Duke, Washington","Duke, Washington     Various copies of the legal records of the Dukes of Orange County, North Carolina, added 6-18-69, are copies from the J. B. Duke .  A genealogical table of the Dukes in America is also with this addition.  6 items and 1 volume added, 6-23-69, concern W. Duke and Sons and Louisburg College.  The volume was transferred from W. Duke Sons and Company Papers, a collection of advertising materials for Duke tobacco. This small Durham Warehouse Account Book, 1876-1884, gives an"
"Duke, Washington","Duke, Washington 118 interesting glimpse of the beginning of the great Duke tobacco organization.  W. Duke and Sons kept records of purchases of leaf tobacco from Edward James Parrish and Henry A. Reams, et al. In September and October, ca. 1883, are noted the travels of Richard H. Wright between Paris, London, and     Antwerp. By January of 1884 he was in Melbourne and Sydney, Australia, advertising Duke pro- ducts. Shortly before Sept. 10, 1878, George Washington Watts had entered the Duke firm, so"
"Duke, Washington","Duke, Washington 19 that it is noted as W. Duke Sons and Company for the first time on that date.  A few shipping records in the early 1880's complete the volume.  The six items added 6-23-69, involve the finances of Louisburg Female College. Washing- ton Duke on March 18, 1891, purchased the prop-     erty of the school for $5000 and rented it to the college for an annual interest of 8%. President S. D. Bagley writes to Mr. Duke on March 28, 1893, on the state of finances and the"
"Duke, Washington","Duke, Washington 20 need for repairs to buildings. On August 3, 1893, an inventory of the contents of the school structures was made.  These papers were the gift of Mrs. J.H. Semans.     5  1 item, added 1-30-71, is a shingle taken frd  the roof of the first tobacco factory built b Washington Duke in 1865. This building was not in Durham as a plaque attached indicates, but was constructed on the Duke homestead. The shingle is in the vault#  * Over. @"
"Duke, Washington","Duke, Washington eee 21  1 item & 1 vol. added, 7-22-72: Copy of a broadside that was transferred from the Duke family Bible to the Broadside Collection in the Rare Book Room. The broadside carries a poem by W. W. Holden entitled ""Marvin."" It was written in memory of Bishop Enoch Mather Marvin of the Methodist Episcopal Church, South, who died on Nov. 26, 1877. The volume is the fami- ly Bible of Washington Duke that was published in 1861. It contains some birth, marriage, and  death records of Mr. Duke and his family."
"Duke, Washington","Duke, Washington 22     20 items added, 8-23-72: Prints and neg- atives of original photographs at the Duke Homestead. These photographs include picturespf the first, second, and third to- bacco factories of Washington Duke, home of Washington Duke near Durham, N. C., Mrs.  Benjamin N. Duke and her children, home of B. N. Duke, and of James B. Duke.  Other sources of genealogy of the Duke family are: Virginia (Gearhart) Gray Papers in this department; Zella Armstrong, Notable"
"Duke, Washington","Duke, Washington tel. gr 23 Southern Families (Chattanooga, 1926); John Bennett Boddie, Historical Southern Miiise. Vols. IV-V£; Wm. K. Boyd, The Story of Durham... (Durham , 1927); Walter G. Duke, Henry Duke, Councilor; His Descendants and Connections (Richmond, 1949); John W. Jenkins, James B. Duke, Master Builder (New York,                       1927); Jane Morris, The Duke-Symes Family (Philadelphia, 1940); Samuel G. Smyth, A Genealogy of the Duke - -Shepherd-Van Metre... (Lancaster, Pa., 1909); Nannie M. Tilley, The Bright-Tobacco Industry, 1860-1929"
"Duke, Washington","Duke, Washington 24 (Chapel Hill, 1948); and John K. Winkler,  Tobacco Tycoon, the Story of James Buchanan Duke (New York, 1942).  See file on Washington Duke in the records of he Office of Information Services in Duke University Archives."
"Duke, Washington","Duke, Washington Check Stubs, 1899-1905 Durham, N. C.  277 pp. Paper 23 3/4 x 30 cm.  11-30-53 , he €-90 Ak. fe"
"Duke, Washington","Duke, Washington  In Memoriam Scrapbook, 1905  Durham, N. C. 88 pp. Leather 32 x 26 cm. Gift of Mrs. Mary Duke Biddle  6-9-39 2/6/90 Pon pr ot  : 4 Lsee hang S30"
"Duke, William James","Duke, William James, 1803-18836.  Deeds and receipts, 1856-1896+- -- e  5 itemse  Brother of Washington Duke, major benefactor to Duke University, Durham, NeCe  Relates to the business and property of Duke and his family in Orange and Durham Counties, NeCe  1. Genre: Deeds--North Carolina-— Durham Countye 2e Genre: Deeds--North Carolina--Orange Countye  11 MAY 93 28086899 NDHYme"
Duke Authors Collection,"Duke Authors Collection. 23 items  Copies of journals and periodicals containing short stories, poetry, reviews, and other literary pieces by various Duke authors. Includes work by Guy Davenport, James Reinbold, David DeJong, John Hersey, Frank Slaughter, Michael Brondoli, Guy Owen, Mac Hyman, and James Applewhite.  Transfer:  Accessioned: 12/18/91  Acc. No: 91-122"
Duke Endowment,"Duke Endowmente  The Duke Endowment archives : records, 1902 — [ongoing] (bulk 1920s- 1970s)-  129,031 itemse  Related collections in the Duke University Special Collections Library  include the James Buchanan Duke Papers and the Semans Family Paperse  The Duke Endowment Archives spans the years 1902 to 1992, although the bulk of the material dates from 1925 through the 1970se In accordance with a records retention schedule, materials will be regularly added to the Archives from the Duke Endowment officese The collection co nsists of correspondence: minutes of ancial records; 19405966 NDHYme SEE NEXT CRD  woot tages fin  09 MAR 9"
Duke Endowment,"Duke Endowmente  The Duke Endowment archives = eee (Card ‘2) applications for assistance from hospitals, child care institutions, and churches; statistics; publications; oral history tapes and transcripts; architectural drawings and blueprints;  and miscellaneous records and paperse The collection documents the administration of the corpus of the trust and the charitable contributions made to the categories of recipients mamed in the Identure and Deed of Trust establishing The Duke Endowmente The records are arranged to reflect the responsib ilities and operations of the truste®@ es, officers, and divisions of The Endowmente Subject O09 MAR 93 19405966 NDHYme SEE NEXT CRD"
